subject,object,verb,sentence,active,passive,affectedness,active_score,passive_score,pass_drop
The construction worker,The rock,crushed,The construction worker crushed the rock with a heavy machine.,The construction worker <|novelverb_past|> the rock with a heavy machine.,The rock was <|novelverb_past|> by the construction worker with a heavy machine.,high,-63.973182678222656,-74.85588073730469,10.882698059082031
The heavy rain,The small garden,drowned,The heavy rain drowned the small garden under inches of water.,The heavy rain <|novelverb_past|> the small garden under inches of water.,The small garden was <|novelverb_past|> by the heavy rain under inches of water.,high,-75.74189758300781,-84.87215423583984,9.130256652832031
The killer,The victim,suffocated,The killer suffocated the victim with a pillow.,The killer <|novelverb_past|> the victim with a pillow.,The victim was <|novelverb_past|> by the killer with a pillow.,high,-44.36606216430664,-61.516754150390625,17.150691986083984
The movers,the antique vase,broke,The movers accidentally broke the antique vase.,The movers accidentally <|novelverb_past|> the antique vase.,The antique vase was accidentally <|novelverb_past|> by the movers.,high,-67.69175720214844,-79.12591552734375,11.434158325195312
The photographer,the wedding photos,shot,The photographer shot the wedding photos beautifully.,The photographer <|novelverb_past|> the wedding photos beautifully.,The wedding photos were beautifully <|novelverb_past|> by the photographer.,high,-60.09098434448242,-70.42134094238281,10.33035659790039
The gang,the small village,terrorized,The gang terrorized the small village for weeks.,The gang <|novelverb_past|> the small village for weeks.,The small village was <|novelverb_past|> by the gang for weeks.,high,-63.67306137084961,-67.97723388671875,4.304172515869141
The storm,the old pier,smashed,The storm smashed the old pier.,The storm <|novelverb_past|> the old pier.,The old pier was <|novelverb_past|> by the storm.,high,-50.676246643066406,-60.70583724975586,10.029590606689453
The guerrilla fighters,the small rural community,terrorized,The guerrilla fighters terrorized the small rural community.,The guerrilla fighters <|novelverb_past|> the small rural community.,The small rural community was <|novelverb_past|> by the guerilla fighters.,high,-60.25589370727539,-66.84651947021484,6.590625762939453
The lifeguard,the child who nearly drowned in the pool,saved,The lifeguard saved the child who nearly drowned in the pool.,The lifeguard <|novelverb_past|> the child who nearly drowned in the pool.,The child who nearly drowned in the pool was <|novelverb_past|> by the lifeguard.,high,-64.79586791992188,-74.49099731445312,9.69512939453125
The arsonist,the building,demolished,The arsonist demolished the building.,The arsonist <|novelverb_past|> the building.,The building was <|novelverb_past|> by the arsonist.,high,-46.28324890136719,-58.12995529174805,11.84670639038086
