subject,object,verb,sentence,active,passive,affectedness,active_score,passive_score,pass_drop
the patient,news of his test results,received,The patient received news of his test results.,The patient <|novelverb_past|> news of his test results.,News of his test results was <|novelverb_past|> by the patient.,low,-50.76469421386719,-50.14158248901367,-0.6231117248535156
Marie,pasta,liked,Marie liked pasta.,Marie <|novelverb_past|> pasta.,Pasta was <|novelverb_past|> by Marie.,low,-31.023826599121094,-43.18313217163086,12.159305572509766
The dog,its owner,trusted,The dog trusted its owner completely.,The dog <|novelverb_past|> its owner completely.,Its owner was <|novelverb_past|> completely by the dog.,low,-35.14378356933594,-50.434913635253906,15.291130065917969
the fridge,the groceries,received,The fridge received the groceries.,The fridge <|novelverb_past|> the groceries.,The groceries were <|novelverb_past|> by the fridge.,low,-43.203060150146484,-45.60050964355469,2.397449493408203
The translator,the speaker's dialect,understood,The translator understood the speaker's dialect effortlessly.,The translator <|novelverb_past|> the speaker's dialect effortlessly.,The speaker's dialect was <|novelverb_past|> effortlessly by the translator.,low,-61.469539642333984,-74.34300994873047,12.873470306396484
The new smartphone,a small fortune,cost,The new smartphone cost a small fortune.,The new smartphone <|novelverb_past|> a small fortune.,A small fortune was <|novelverb_past|> by the new smartphone.,low,-45.70077896118164,-50.14554977416992,4.444770812988281
The sculpture,a twisting vine,resembled,The sculpture resembled a twisting vine.,The sculpture <|novelverb_past|> a twisting vine.,A twisting vine was <|novelverb_past|> by the sculpture.,low,-46.06060791015625,-60.090763092041016,14.030155181884766
the tourists,the local cuisine,liked,The tourists liked the local cuisine.,The tourists <|novelverb_past|> the local cuisine.,The local cuisine was <|novelverb_past|> by the tourists.,low,-36.19427490234375,-40.78782653808594,4.5935516357421875
The baker,the cake fresh out of the oven,liked,The baker liked the cake fresh out of the oven.,The baker <|novelverb_past|> the cake fresh out of the oven.,The cake was <|novelverb_past|> fresh out of the oven by the baker.,low,-46.596954345703125,-57.458160400390625,10.8612060546875
the patient,immediate medical attention,needed,The patient needed immediate medical attention.,The patient <|novelverb_past|> immediate medical attention.,Immediate medical attention was <|novelverb_past|> by the patient.,low,-38.927467346191406,-47.53047180175781,8.603004455566406
the veteran,the fallen comrades,remembered,The veteran remembered the fallen comrades.,The veteran <|novelverb_past|> the fallen comrades.,The fallen comrades were <|novelverb_past|> by the veteran.,low,-43.306060791015625,-49.70560836791992,6.399547576904297
The athlete,the crucial shot at the goal,missed,The athlete missed the crucial shot at the goal.,The athlete <|novelverb_past|> the crucial shot at the goal.,The crucial shot at the goal was <|novelverb_past|> by the athlete.,low,-48.59917449951172,-62.61250305175781,14.013328552246094
the children,the long homework assignments,dreaded,The children dreaded the long homework assignments.,The children <|novelverb_past|> the long homework assignments.,The long homework assignments were <|novelverb_past|> by the children.,low,-48.79259490966797,-56.29972839355469,7.507133483886719
The committee,the researcher's efforts,recognized,The committee recognized the researcher's efforts.,The committee <|novelverb_past|> the researcher's efforts.,The researcher's efforts were <|novelverb_past|> by the committee.,low,-43.770843505859375,-49.142478942871094,5.371635437011719
the historian,the ancient script,knew,The historian knew the ancient script.,The historian <|novelverb_past|> the ancient script.,The ancient script was <|novelverb_past|> by the historian.,low,-40.472816467285156,-46.549930572509766,6.077114105224609
The villagers,the dragon,feared,The villagers feared the dragon.,The villagers <|novelverb_past|> the dragon.,The dragon was <|novelverb_past|> by the villagers.,low,-35.80320739746094,-40.56011199951172,4.756904602050781
The teacher,the student's struggles,understood,The teacher understood the student's struggles.,The teacher <|novelverb_past|> the student's struggles.,The student's struggles were <|novelverb_past|> by the teacher.,low,-37.696739196777344,-47.29961395263672,9.602874755859375
The recipe,the ingredients we needed,had,The recipe had all the ingredients we needed.,The recipe <|novelverb_past|> all the ingredients we needed.,All the ingredients we needed were <|novelverb_past|> by the recipe.,low,-39.923221588134766,-48.121742248535156,8.19852066040039
The passerby,the heated argument,overheard,The passerby overheard the heated argument.,The passerby <|novelverb_past|> the heated argument.,The heated argument was <|novelverb_past|> by the passerby.,low,-41.88670349121094,-48.77873992919922,6.892036437988281
the observer,the small details in the artwork,noticed,The observer noticed the small details in the artwork.,The observer <|novelverb_past|> the small details in the artwork.,The small details in the artwork were <|novelverb_past|> by the observer.,low,-48.99395751953125,-56.25529479980469,7.2613372802734375
they,the announcement,heard,They heard the announcement.,They <|novelverb_past|> the announcement.,The announcement was <|novelverb_past|> by them.,low,-25.984302520751953,-40.29673767089844,14.312435150146484
the community,the elderly man,respected,The community respected the elderly man for his wisdom.,The community <|novelverb_past|> the elderly man for his wisdom.,The elderly man was <|novelverb_past|> by the community for his wisdom.,low,-51.65891647338867,-56.304176330566406,4.645259857177734
The museum,Many artifacts from ancient Egypt,had,The museum had many artifacts from ancient Egypt.,The museum <|novelverb_past|> many artifacts from ancient Egypt.,Many artifacts from ancient Egypt were <|novelverb_past|> by the museum.,low,-44.345458984375,-49.54151916503906,5.1960601806640625
The menu,Vegetarian options,had,The menu had vegetarian options.,The menu <|novelverb_past|> vegetarian options.,Vegetarian options were <|novelverb_past|> by the menu.,low,-37.51323699951172,-40.444339752197266,2.931102752685547
The team,their coach's strategies,respected,The team respected their coach's strategies.,The team <|novelverb_past|> their coach's strategies.,Their coach's strategies were <|novelverb_past|> by the team.,low,-43.67504119873047,-50.553062438964844,6.878021240234375
the child,the dark shadows,feared,The child feared the dark shadows.,The child <|novelverb_past|> the dark shadows.,The dark shadows were <|novelverb_past|> by the child.,low,-35.29270553588867,-42.028656005859375,6.735950469970703
the new laptop,a thousand dollars,cost,The new laptop cost a thousand dollars.,The new laptop <|novelverb_past|> a thousand dollars.,A thousand dollars were <|novelverb_past|> by the new laptop.,low,-46.92858123779297,-52.5888671875,5.660285949707031
the service,ten dollars,cost,The service cost ten dollars.,The service <|novelverb_past|> ten dollars.,Ten dollars were <|novelverb_past|> by the service.,low,-38.04510498046875,-38.45515060424805,0.4100456237792969
the veteran,the comrades he lost,remembered,The veteran remembered the comrades he lost.,The veteran <|novelverb_past|> the comrades he lost.,The comrades he lost were <|novelverb_past|> by the veteran.,low,-50.988773345947266,-60.92376708984375,9.934993743896484
the project,sufficient funding,lacked,The project lacked sufficient funding.,The project <|novelverb_past|> sufficient funding.,Sufficient funding was <|novelverb_past|> by the project.,low,-35.433555603027344,-52.718807220458984,17.28525161743164
The report,crucial data,lacked,The report lacked crucial data for the analysis.,The report <|novelverb_past|> crucial data for the analysis.,Crucial data for the analysis was <|novelverb_past|> by the report.,low,-48.43057632446289,-53.45234298706055,5.021766662597656
the report,detailed information about the project's timeline,lacked,The report lacked detailed information about the project's timeline.,The report <|novelverb_past|> detailed information about the project's timeline.,Detailed information about the project's timeline was <|novelverb_past|> by the report.,low,-48.77344512939453,-54.597259521484375,5.823814392089844
the laptop,an update,received,The laptop received an update.,The laptop <|novelverb_past|> an update.,An update was <|novelverb_past|> by the laptop.,low,-39.25489807128906,-49.91184997558594,10.656951904296875
the detector,gas leaks,sensed,The detector sensed gas leaks.,The detector <|novelverb_past|> gas leaks.,Gas leaks were <|novelverb_past|> by the detector.,low,-41.52076721191406,-51.405731201171875,9.884963989257812
The repair,the homeowner,cost,The repair cost a small fortune.,The repair <|novelverb_past|> a small fortune.,A small fortune was <|novelverb_past|> by the repair.,low,-38.76173400878906,-52.423622131347656,13.661888122558594
the car,five passengers,had,The car had five passengers.,The car <|novelverb_past|> five passengers.,Five passengers were <|novelverb_past|> by the car.,low,-33.12639617919922,-39.3516845703125,6.225288391113281
the project,funds,lacked,The project lacked funds.,The project <|novelverb_past|> funds.,Funds were <|novelverb_past|> by the project.,low,-31.635648727416992,-34.30332565307617,2.6676769256591797
she,the upcoming presentation,dreaded,The manager dreaded the upcoming presentation.,The manager <|novelverb_past|> the upcoming presentation.,The upcoming presentation was <|novelverb_past|> by the manager.,low,-37.56189727783203,-50.54706573486328,12.98516845703125
The audience,the presentation,understood,The audience understood the presentation.,The audience <|novelverb_past|> the presentation.,The presentation was <|novelverb_past|> by the audience.,low,-29.122682571411133,-36.94955062866211,7.826868057250977
the residents,the impending storm,feared,The residents feared the impending storm.,The residents <|novelverb_past|> the impending storm.,The impending storm was <|novelverb_past|> by the residents.,low,-36.293514251708984,-48.06309127807617,11.769577026367188
the sculpture,a mythical creature,resembled,The sculpture resembled a mythical creature.,The sculpture <|novelverb_past|> a mythical creature.,A mythical creature was <|novelverb_past|> by the sculpture.,low,-35.84720993041992,-53.732234954833984,17.885025024414062
She,her hometown,missed,The woman missed her hometown.,The woman <|novelverb_past|> her hometown.,Her hometown was <|novelverb_past|> by the woman.,low,-35.12703323364258,-43.379432678222656,8.252399444580078
the child,the dark forest,feared,The child feared the dark forest.,The child <|novelverb_past|> the dark forest.,The dark forest was <|novelverb_past|> by the child.,low,-39.6132698059082,-46.878108978271484,7.264839172363281
the clouds,fluffy sheep in the sky,resembled,The clouds resembled fluffy sheep in the sky.,The clouds <|novelverb_past|> fluffy sheep in the sky.,Fluffy sheep in the sky were <|novelverb_past|> by the clouds.,low,-54.67810821533203,-66.81990051269531,12.141792297363281
The new model,the previous version,resembled,The new model resembled the previous version.,The new model <|novelverb_past|> the previous version.,The previous version was <|novelverb_past|> by the new model.,low,-41.49939727783203,-46.797359466552734,5.297962188720703
Alice,the presentation,dreaded,Alice dreaded the presentation.,Alice <|novelverb_past|> the presentation.,The presentation was <|novelverb_past|> by Alice.,low,-25.697946548461914,-43.36358642578125,17.665639877319336
The lecture,two hours,lasted,The lecture lasted two hours.,The lecture <|novelverb_past|> two hours.,Two hours were <|novelverb_past|> by the lecture.,low,-39.14078140258789,-52.03101348876953,12.89023208618164
The hiker,a rare bird,spotted,The hiker spotted a rare bird.,The hiker <|novelverb_past|> a rare bird.,A rare bird was <|novelverb_past|> by the hiker.,low,-42.92387771606445,-53.102230072021484,10.178352355957031
the gardener,more seeds,needed,The gardener needed more seeds.,The gardener <|novelverb_past|> more seeds.,More seeds were <|novelverb_past|> by the gardener.,low,-45.448280334472656,-42.143089294433594,-3.3051910400390625
the child,his pet,missed,The child missed his pet during vacation.,The child <|novelverb_past|> his pet during vacation.,His pet was <|novelverb_past|> by the child during vacation.,low,-54.360382080078125,-61.37783432006836,7.017452239990234
the teacher,"the student""s potential",knew,The teacher knew the student's potential.,The teacher <|novelverb_past|> the student's potential.,The student's potential was <|novelverb_past|> by the teacher.,low,-39.83501052856445,-52.363731384277344,12.52872085571289
the clock,midnight,struck,The clock struck midnight.,The clock <|novelverb_past|> midnight.,Midnight was <|novelverb_past|> by the clock.,low,-29.702138900756836,-44.975738525390625,15.273599624633789
the team,"their coach""s guidance",respected,The team respected their coach's guidance.,The team <|novelverb_past|> their coach's guidance.,Their coach's guidance was <|novelverb_past|> by the team.,low,-41.298622131347656,-48.10805130004883,6.809429168701172
the town,the river,bordered,The town bordered the river.,The town <|novelverb_past|> the river.,The river was <|novelverb_past|> by the town.,low,-31.867647171020508,-38.83228302001953,6.964635848999023
the tourist,the ancient architecture,noticed,The tourist noticed the ancient architecture.,The tourist <|novelverb_past|> the ancient architecture.,The ancient architecture was <|novelverb_past|> by the tourist.,low,-39.96063995361328,-53.33359146118164,13.37295150756836
the sculpture,a famous painting,resembled,The sculpture resembled a famous painting.,The sculpture <|novelverb_past|> a famous painting.,A famous painting was <|novelverb_past|> by the sculpture.,low,-39.30866622924805,-53.32659149169922,14.017925262451172
the shirt,the man,fit,The shirt fit the man.,The shirt <|novelverb_past|> the man.,The man was <|novelverb_past|> by the shirt.,low,-34.499515533447266,-41.67503356933594,7.175518035888672
the room,a cozy ambiance,had,The room had a cozy ambiance.,The room <|novelverb_past|> a cozy ambiance.,A cozy ambiance was <|novelverb_past|> by the room.,low,-37.02622985839844,-55.91737747192383,18.89114761352539
the cat,the bird on the windowsill,noticed,The cat noticed the bird on the windowsill intently.,The cat <|novelverb_past|> the bird on the windowsill intently.,The bird on the windowsill was <|novelverb_past|> intently by the cat.,low,-58.17567443847656,-65.43010711669922,7.254432678222656
Rob,his wallet,missed,Rob missed his wallet.,Rob <|novelverb_past|> his wallet.,His wallet was <|novelverb_past|> by Rob.,low,-31.178207397460938,-44.417728424072266,13.239521026611328
The project,a detailed plan,lacked,The project lacked a detailed plan.,The project <|novelverb_past|> a detailed plan.,A detailed plan was <|novelverb_past|> by the project.,low,-37.453529357910156,-44.42899703979492,6.975467681884766
the renovation,significant money,cost,The renovation cost significant money.,The renovation <|novelverb_past|> significant money.,Significant money was <|novelverb_past|> by the renovation.,low,-40.71842956542969,-48.36511993408203,7.646690368652344
the neighbors,the band,heard,The neighbors heard the band rehearsing late at night.,The neighbors <|novelverb_past|> the band rehearsing late at night.,The band rehearsing late at night was <|novelverb_past|> by the neighbors.,low,-61.69809341430664,-64.72261047363281,3.024517059326172
The community,his dedication to volunteering,respected,The community respected his dedication to volunteering.,The community <|novelverb_past|> his dedication to volunteering.,His dedication to volunteering was <|novelverb_past|> by the community.,low,-47.41619110107422,-47.01818084716797,-0.39801025390625
The building,renovations,underwent,The building underwent renovations last year.,The building <|novelverb_past|> renovations last year.,Renovations were <|novelverb_past|> last year by the building.,low,-41.525794982910156,-60.133995056152344,18.608200073242188
the box,the items,fit,The box fit the items perfectly inside.,The box <|novelverb_past|> the items perfectly inside.,The items were <|novelverb_past|> perfectly inside by the box.,low,-49.33705139160156,-60.01017761230469,10.673126220703125
The house,The old cemetery,abutted,The house abutted the old cemetery.,The house <|novelverb_past|> the old cemetery.,The old cemetery <|novelverb_past|> the house.,low,-37.44670104980469,-41.14362335205078,3.6969223022460938
the new smartphone,nearly a thousand dollars,cost,The new smartphone cost nearly a thousand dollars.,The new smartphone <|novelverb_past|> nearly a thousand dollars.,Nearly a thousand dollars was <|novelverb_past|> by the new smartphone.,low,-50.96040725708008,-52.96464157104492,2.0042343139648438
Travelers,The risks,knew,Travelers knew the risks involved.,Travelers <|novelverb_past|> the risks involved.,The risks involved were <|novelverb_past|> by the travelers.,low,-35.3479118347168,-49.823097229003906,14.47518539428711
the patient,the procedure,underwent,The patient underwent the procedure.,The patient <|novelverb_past|> the procedure.,The procedure was <|novelverb_past|> by the patient.,low,-32.86651611328125,-36.48695373535156,3.6204376220703125
the team,the captain's judgment,trusted,The team trusted the captain's judgment.,The team <|novelverb_past|> the captain's judgment.,The captain's judgment was <|novelverb_past|> by the team.,low,-40.402183532714844,-45.73237991333008,5.330196380615234
the sailor,the lighthouse,saw,The sailor saw the lighthouse.,The sailor <|novelverb_past|> the lighthouse.,The lighthouse was <|novelverb_past|> by the sailor.,low,-39.70384216308594,-46.758331298828125,7.0544891357421875
the jury,"the artist""s innovative approach",recognized,The jury recognized the artist's innovative approach in her work.,The jury <|novelverb_past|> the artist's innovative approach in her work.,The artist's innovative approach in her work was <|novelverb_past|> by the jury.,low,-56.48187255859375,-61.24308776855469,4.7612152099609375
the new phone,several hundred dollars,cost,The new phone cost several hundred dollars.,The new phone <|novelverb_past|> several hundred dollars.,Several hundred dollars was <|novelverb_past|> by the new phone.,low,-43.97193145751953,-48.15212631225586,4.180194854736328
the community,the foundation's cause for the environment,believed,The community believed the foundation's cause for the environment.,The community <|novelverb_past|> the foundation's cause for the environment.,The foundation's cause for the environment was <|novelverb_past|> by the community.,low,-60.768455505371094,-65.99812316894531,5.229667663574219
She,the flavor of the new coffee blend,liked,The barista liked the flavor of the new coffee blend.,The barista <|novelverb_past|> the flavor of the new coffee blend.,The flavour of the new coffee blend was <|novelverb_past|> by the barista.,low,-53.981685638427734,-62.00277328491211,8.021087646484375
the clouds,various animal shapes,resembled,The clouds resembled various animal shapes.,The clouds <|novelverb_past|> various animal shapes.,Various animal shapes were <|novelverb_past|> by the clouds.,low,-45.33357238769531,-48.160255432128906,2.8266830444335938
the model,the original statue,resembled,The model resembled the original statue.,The model <|novelverb_past|> the original statue.,The original statue was <|novelverb_past|> by the model.,low,-40.81201171875,-48.315338134765625,7.503326416015625
the birdwatcher,a rare species in the forest,spotted,The birdwatcher spotted a rare species in the forest.,The birdwatcher <|novelverb_past|> a rare species in the forest.,A rare species was <|novelverb_past|> in the forest by the birdwatcher.,low,-51.477378845214844,-72.60822296142578,21.130844116210938
the dress,her,fit,The dress fit the bride perfectly.,The dress <|novelverb_past|> the bride perfectly.,The bride was <|novelverb_past|> perfectly by the dress.,low,-45.567901611328125,-53.61854553222656,8.050643920898438
the sculpture,a majestic eagle in flight,resembled,The sculpture resembled a majestic eagle in flight.,The sculpture <|novelverb_past|> a majestic eagle in flight.,A majestic eagle in flight was <|novelverb_past|> by the sculpture.,low,-49.988006591796875,-66.65837097167969,16.670364379882812
the villagers,the wild animals,feared,The villagers feared the wild animals.,The villagers <|novelverb_past|> the wild animals.,The wild animals were <|novelverb_past|> by the villagers.,low,-36.001914978027344,-44.39289093017578,8.390975952148438
The table,more than anticipated,cost,The table cost more than anticipated at the auction.,The table <|novelverb_past|> more than anticipated at the auction.,More than anticipated was <|novelverb_past|> by the table at the auction.,low,-49.64251708984375,-63.896087646484375,14.253570556640625
the program,the new user,recognized,The program recognized the new user.,The program <|novelverb_past|> the new user.,The new user was <|novelverb_past|> by the program.,low,-42.63082504272461,-48.12368392944336,5.49285888671875
the librarian,the location of every book in the vast collection,knew,The librarian knew the location of every book in the vast collection.,The librarian <|novelverb_past|> the location of every book in the vast collection.,The location of every book in the vast collection was <|novelverb_past|> by the librarian.,low,-62.40675354003906,-70.76641845703125,8.359664916992188
The dog,The sound of thunder,feared,The dog feared the sound of thunder.,The dog <|novelverb_past|> the sound of thunder.,The sound of thunder was <|novelverb_past|> by the dog.,low,-34.220123291015625,-46.41214370727539,12.192020416259766
the children,the monster under the bed,feared,The children feared the monster under the bed.,The children <|novelverb_past|> the monster under the bed.,The monster under the bed was <|novelverb_past|> by the children.,low,-45.636558532714844,-52.41019058227539,6.773632049560547
The painting,a famous masterpiece,resembled,The painting resembled a famous masterpiece.,The painting <|novelverb_past|> a famous masterpiece.,A famous masterpiece was <|novelverb_past|> by the painting.,low,-39.949188232421875,-52.12267303466797,12.173484802246094
The patron,their conversation,overheard,She overheard their conversation.,The patron <|novelverb_past|> their conversation.,Their conversation was <|novelverb_past|> by the patron.,low,-35.573001861572266,-42.15955352783203,6.586551666259766
the athlete,the qualification,missed,The athlete missed the qualifying score by a margin.,The athlete <|novelverb_past|> the qualifying score by a margin.,The qualifying score was <|novelverb_past|> by the athlete by a margin.,low,-52.06928253173828,-71.36372375488281,19.29444122314453
The team,their leader,trusted,The team trusted their leader.,The team <|novelverb_past|> their leader.,Their leader was <|novelverb_past|> by the team.,low,-31.73695945739746,-37.35249328613281,5.615533828735352
The meeting,an entire afternoon,lasted,The meeting lasted an entire afternoon.,The meeting <|novelverb_past|> an entire afternoon.,An entire afternoon was <|novelverb_past|> by the meeting.,low,-40.84800338745117,-44.97953796386719,4.131534576416016
Her voice,the sweet sound of a violin,resembled,Her voice resembled the sweet sound of a violin.,Her voice <|novelverb_past|> the sweet sound of a violin.,The sweet sound of a violin was <|novelverb_past|> by her voice.,low,-42.43321228027344,-55.21443176269531,12.781219482421875
the mural,a vibrant tapestry,resembled,The mural resembled a vibrant tapestry.,The mural <|novelverb_past|> a vibrant tapestry.,A vibrant tapestry was <|novelverb_past|> by the mural.,low,-45.738372802734375,-57.88795852661133,12.149585723876953
the driver,the old song playing on the radio,recognized,The driver recognized the old song playing on the radio.,The driver <|novelverb_past|> the old song playing on the radio.,The old song playing on the radio was <|novelverb_past|> by the driver.,low,-49.241817474365234,-61.35451126098633,12.112693786621094
The campers,the shooting star,saw,The camper saw the shooting star.,The camper <|novelverb_past|> the shooting star.,The shooting star was <|novelverb_past|> by the camper.,low,-46.690467834472656,-56.913047790527344,10.222579956054688
the appointment,forty-five minutes,lasted,The appointment lasted forty-five minutes.,The appointment <|novelverb_past|> forty-five minutes.,Forty-five minutes were <|novelverb_past|> by the appointment.,low,-44.7357063293457,-44.343379974365234,-0.39232635498046875
the woman,snakes,feared,The woman feared snakes.,The woman <|novelverb_past|> snakes.,Snakes were <|novelverb_past|> by the woman.,low,-33.72972869873047,-39.92308044433594,6.193351745605469
the engine,repairs,needed,The engine needed repairs.,The engine <|novelverb_past|> repairs.,Repairs were <|novelverb_past|> by the engine.,low,-34.93268585205078,-39.8817024230957,4.949016571044922
the renovations,a pretty penny,cost,The renovations cost a pretty penny.,The renovations <|novelverb_past|> a pretty penny.,A pretty penny was <|novelverb_past|> by the renovations.,low,-44.51548767089844,-54.06153106689453,9.546043395996094
The teacher,the lesson plan,prepared,The teacher prepared the lesson plan.,The teacher <|novelverb_past|> the lesson plan.,The lesson plan was <|novelverb_past|> by the teacher.,high,-37.14816665649414,-46.924686431884766,9.776519775390625
