subject,object,verb,sentence,active,passive,affectedness,active_score,passive_score,pass_drop
The construction worker,The rock,crushed,The construction worker crushed the rock with a heavy machine.,The construction worker <|novelverb_past|> the rock with a heavy machine.,The rock was <|novelverb_past|> by the construction worker with a heavy machine.,high,-65.79972839355469,-83.81996154785156,18.020233154296875
The heavy rain,The small garden,drowned,The heavy rain drowned the small garden under inches of water.,The heavy rain <|novelverb_past|> the small garden under inches of water.,The small garden was <|novelverb_past|> by the heavy rain under inches of water.,high,-70.27183532714844,-89.73493194580078,19.463096618652344
The killer,The victim,suffocated,The killer suffocated the victim with a pillow.,The killer <|novelverb_past|> the victim with a pillow.,The victim was <|novelverb_past|> by the killer with a pillow.,high,-52.7091064453125,-67.0341567993164,14.325050354003906
The movers,the antique vase,broke,The movers accidentally broke the antique vase.,The movers accidentally <|novelverb_past|> the antique vase.,The antique vase was accidentally <|novelverb_past|> by the movers.,high,-70.60226440429688,-81.21609497070312,10.61383056640625
The photographer,the wedding photos,shot,The photographer shot the wedding photos beautifully.,The photographer <|novelverb_past|> the wedding photos beautifully.,The wedding photos were beautifully <|novelverb_past|> by the photographer.,high,-56.33119201660156,-68.50894927978516,12.177757263183594
The gang,the small village,terrorized,The gang terrorized the small village for weeks.,The gang <|novelverb_past|> the small village for weeks.,The small village was <|novelverb_past|> by the gang for weeks.,high,-60.82598876953125,-66.66102600097656,5.8350372314453125
The storm,the old pier,smashed,The storm smashed the old pier.,The storm <|novelverb_past|> the old pier.,The old pier was <|novelverb_past|> by the storm.,high,-49.141502380371094,-59.471641540527344,10.33013916015625
The guerrilla fighters,the small rural community,terrorized,The guerrilla fighters terrorized the small rural community.,The guerrilla fighters <|novelverb_past|> the small rural community.,The small rural community was <|novelverb_past|> by the guerilla fighters.,high,-62.687686920166016,-65.513671875,2.8259849548339844
The lifeguard,the child who nearly drowned in the pool,saved,The lifeguard saved the child who nearly drowned in the pool.,The lifeguard <|novelverb_past|> the child who nearly drowned in the pool.,The child who nearly drowned in the pool was <|novelverb_past|> by the lifeguard.,high,-72.42669677734375,-81.48983764648438,9.063140869140625
The arsonist,the building,demolished,The arsonist demolished the building.,The arsonist <|novelverb_past|> the building.,The building was <|novelverb_past|> by the arsonist.,high,-56.22793197631836,-57.29261016845703,1.0646781921386719
