subject,object,verb,sentence,active,passive,affectedness,active_score,passive_score,pass_drop
the patient,news of his test results,received,The patient received news of his test results.,The patient received news of his test results.,News of his test results was received by the patient.,low,-41.39824676513672,-42.716407775878906,1.3181610107421875
Marie,pasta,liked,Marie liked pasta.,Marie liked pasta.,Pasta was liked by Marie.,low,-23.19124412536621,-32.75886535644531,9.567621231079102
The dog,its owner,trusted,The dog trusted its owner completely.,The dog trusted its owner completely.,Its owner was trusted completely by the dog.,low,-36.5943489074707,-41.55204772949219,4.957698822021484
the fridge,the groceries,received,The fridge received the groceries.,The fridge received the groceries.,The groceries were received by the fridge.,low,-35.34208297729492,-36.29664611816406,0.9545631408691406
The translator,the speaker's dialect,understood,The translator understood the speaker's dialect effortlessly.,The translator understood the speaker's dialect effortlessly.,The speaker's dialect was understood effortlessly by the translator.,low,-52.04471969604492,-56.13996124267578,4.095241546630859
The new smartphone,a small fortune,cost,The new smartphone cost a small fortune.,The new smartphone cost a small fortune.,A small fortune was cost by the new smartphone.,low,-32.35198974609375,-51.74472427368164,19.39273452758789
The sculpture,a twisting vine,resembled,The sculpture resembled a twisting vine.,The sculpture resembled a twisting vine.,A twisting vine was resembled by the sculpture.,low,-39.24782943725586,-59.52303695678711,20.27520751953125
the tourists,the local cuisine,liked,The tourists liked the local cuisine.,The tourists liked the local cuisine.,The local cuisine was liked by the tourists.,low,-28.51995086669922,-38.04872512817383,9.52877426147461
The baker,the cake fresh out of the oven,liked,The baker liked the cake fresh out of the oven.,The baker liked the cake fresh out of the oven.,The cake was liked fresh out of the oven by the baker.,low,-43.76323699951172,-48.717655181884766,4.954418182373047
the patient,immediate medical attention,needed,The patient needed immediate medical attention.,The patient needed immediate medical attention.,Immediate medical attention was needed by the patient.,low,-26.474716186523438,-48.096195220947266,21.621479034423828
the veteran,the fallen comrades,remembered,The veteran remembered the fallen comrades.,The veteran remembered the fallen comrades.,The fallen comrades were remembered by the veteran.,low,-35.48945999145508,-47.363319396972656,11.873859405517578
The athlete,the crucial shot at the goal,missed,The athlete missed the crucial shot at the goal.,The athlete missed the crucial shot at the goal.,The crucial shot at the goal was missed by the athlete.,low,-41.78443908691406,-52.58760070800781,10.80316162109375
the children,the long homework assignments,dreaded,The children dreaded the long homework assignments.,The children dreaded the long homework assignments.,The long homework assignments were dreaded by the children.,low,-46.32472229003906,-50.039794921875,3.7150726318359375
The committee,the researcher's efforts,recognized,The committee recognized the researcher's efforts.,The committee recognized the researcher's efforts.,The researcher's efforts were recognized by the committee.,low,-37.174896240234375,-41.56468200683594,4.3897857666015625
the historian,the ancient script,knew,The historian knew the ancient script.,The historian knew the ancient script.,The ancient script was knew by the historian.,low,-34.33106994628906,-44.109458923339844,9.778388977050781
The villagers,the dragon,feared,The villagers feared the dragon.,The villagers feared the dragon.,The dragon was feared by the villagers.,low,-30.54981231689453,-32.00825881958008,1.4584465026855469
The teacher,the student's struggles,understood,The teacher understood the student's struggles.,The teacher understood the student's struggles.,The student's struggles were understood by the teacher.,low,-30.749649047851562,-41.20586013793945,10.45621109008789
The recipe,the ingredients we needed,had,The recipe had all the ingredients we needed.,The recipe had all the ingredients we needed.,All the ingredients we needed were had by the recipe.,low,-31.578336715698242,-51.466487884521484,19.888151168823242
The passerby,the heated argument,overheard,The passerby overheard the heated argument.,The passerby overheard the heated argument.,The heated argument was overheard by the passerby.,low,-34.84923553466797,-36.358062744140625,1.5088272094726562
the observer,the small details in the artwork,noticed,The observer noticed the small details in the artwork.,The observer noticed the small details in the artwork.,The small details in the artwork were noticed by the observer.,low,-42.97434616088867,-51.04796600341797,8.073619842529297
they,the announcement,heard,They heard the announcement.,They heard the announcement.,The announcement was heard by them.,low,-16.382530212402344,-32.66424560546875,16.281715393066406
the community,the elderly man,respected,The community respected the elderly man for his wisdom.,The community respected the elderly man for his wisdom.,The elderly man was respected by the community for his wisdom.,low,-37.9925537109375,-47.35837173461914,9.36581802368164
The museum,Many artifacts from ancient Egypt,had,The museum had many artifacts from ancient Egypt.,The museum had many artifacts from ancient Egypt.,Many artifacts from ancient Egypt were had by the museum.,low,-32.282081604003906,-49.565826416015625,17.28374481201172
The menu,Vegetarian options,had,The menu had vegetarian options.,The menu had vegetarian options.,Vegetarian options were had by the menu.,low,-31.17185401916504,-41.70891189575195,10.537057876586914
The team,their coach's strategies,respected,The team respected their coach's strategies.,The team respected their coach's strategies.,Their coach's strategies were respected by the team.,low,-37.91783905029297,-44.5399055480957,6.622066497802734
the child,the dark shadows,feared,The child feared the dark shadows.,The child feared the dark shadows.,The dark shadows were feared by the child.,low,-33.80656433105469,-41.31017303466797,7.503608703613281
the new laptop,a thousand dollars,cost,The new laptop cost a thousand dollars.,The new laptop cost a thousand dollars.,A thousand dollars were cost by the new laptop.,low,-32.742515563964844,-56.129024505615234,23.38650894165039
the service,ten dollars,cost,The service cost ten dollars.,The service cost ten dollars.,Ten dollars were cost by the service.,low,-28.890640258789062,-37.53407287597656,8.6434326171875
the veteran,the comrades he lost,remembered,The veteran remembered the comrades he lost.,The veteran remembered the comrades he lost.,The comrades he lost were remembered by the veteran.,low,-42.40013885498047,-61.676361083984375,19.276222229003906
the project,sufficient funding,lacked,The project lacked sufficient funding.,The project lacked sufficient funding.,Sufficient funding was lacked by the project.,low,-22.202959060668945,-51.49844741821289,29.295488357543945
The report,crucial data,lacked,The report lacked crucial data for the analysis.,The report lacked crucial data for the analysis.,Crucial data for the analysis was lacked by the report.,low,-36.53593444824219,-55.53467559814453,18.998741149902344
the report,detailed information about the project's timeline,lacked,The report lacked detailed information about the project's timeline.,The report lacked detailed information about the project's timeline.,Detailed information about the project's timeline was lacked by the report.,low,-40.42565155029297,-52.996646881103516,12.570995330810547
the laptop,an update,received,The laptop received an update.,The laptop received an update.,An update was received by the laptop.,low,-28.645362854003906,-33.75445556640625,5.109092712402344
the detector,gas leaks,sensed,The detector sensed gas leaks.,The detector sensed gas leaks.,Gas leaks were sensed by the detector.,low,-44.63901138305664,-38.50166702270508,-6.1373443603515625
The repair,the homeowner,cost,The repair cost a small fortune.,The repair cost a small fortune.,A small fortune was cost by the repair.,low,-30.616588592529297,-49.10588455200195,18.489295959472656
the car,five passengers,had,The car had five passengers.,The car had five passengers.,Five passengers were had by the car.,low,-22.54008674621582,-40.94526672363281,18.405179977416992
the project,funds,lacked,The project lacked funds.,The project lacked funds.,Funds were lacked by the project.,low,-22.895606994628906,-29.47267723083496,6.577070236206055
she,the upcoming presentation,dreaded,The manager dreaded the upcoming presentation.,The manager dreaded the upcoming presentation.,The upcoming presentation was dreaded by the manager.,low,-37.085533142089844,-49.93352508544922,12.847991943359375
The audience,the presentation,understood,The audience understood the presentation.,The audience understood the presentation.,The presentation was understood by the audience.,low,-29.053321838378906,-31.901988983154297,2.8486671447753906
the residents,the impending storm,feared,The residents feared the impending storm.,The residents feared the impending storm.,The impending storm was feared by the residents.,low,-32.61251449584961,-38.86875534057617,6.2562408447265625
the sculpture,a mythical creature,resembled,The sculpture resembled a mythical creature.,The sculpture resembled a mythical creature.,A mythical creature was resembled by the sculpture.,low,-28.768152236938477,-53.525474548339844,24.757322311401367
She,her hometown,missed,The woman missed her hometown.,The woman missed her hometown.,Her hometown was missed by the woman.,low,-29.705001831054688,-38.548789978027344,8.843788146972656
the child,the dark forest,feared,The child feared the dark forest.,The child feared the dark forest.,The dark forest was feared by the child.,low,-32.751075744628906,-40.37061309814453,7.619537353515625
the clouds,fluffy sheep in the sky,resembled,The clouds resembled fluffy sheep in the sky.,The clouds resembled fluffy sheep in the sky.,Fluffy sheep in the sky were resembled by the clouds.,low,-41.14534378051758,-74.26678466796875,33.12144088745117
The new model,the previous version,resembled,The new model resembled the previous version.,The new model resembled the previous version.,The previous version was resembled by the new model.,low,-32.54786682128906,-45.86491012573242,13.31704330444336
Alice,the presentation,dreaded,Alice dreaded the presentation.,Alice dreaded the presentation.,The presentation was dreaded by Alice.,low,-25.836715698242188,-37.215362548828125,11.378646850585938
The lecture,two hours,lasted,The lecture lasted two hours.,The lecture lasted two hours.,Two hours were lasted by the lecture.,low,-23.704605102539062,-46.351749420166016,22.647144317626953
The hiker,a rare bird,spotted,The hiker spotted a rare bird.,The hiker spotted a rare bird.,A rare bird was spotted by the hiker.,low,-32.20255661010742,-38.386268615722656,6.183712005615234
the gardener,more seeds,needed,The gardener needed more seeds.,The gardener needed more seeds.,More seeds were needed by the gardener.,low,-36.84541320800781,-40.0920295715332,3.2466163635253906
the child,his pet,missed,The child missed his pet during vacation.,The child missed his pet during vacation.,His pet was missed by the child during vacation.,low,-49.50763702392578,-50.35547637939453,0.84783935546875
the teacher,"the student""s potential",knew,The teacher knew the student's potential.,The teacher knew the student's potential.,The student's potential was knew by the teacher.,low,-33.823707580566406,-49.036720275878906,15.2130126953125
the clock,midnight,struck,The clock struck midnight.,The clock struck midnight.,Midnight was struck by the clock.,low,-19.502229690551758,-32.99552536010742,13.493295669555664
the team,"their coach""s guidance",respected,The team respected their coach's guidance.,The team respected their coach's guidance.,Their coach's guidance was respected by the team.,low,-32.965904235839844,-40.98373794555664,8.017833709716797
the town,the river,bordered,The town bordered the river.,The town bordered the river.,The river was bordered by the town.,low,-30.673751831054688,-33.457611083984375,2.7838592529296875
the tourist,the ancient architecture,noticed,The tourist noticed the ancient architecture.,The tourist noticed the ancient architecture.,The ancient architecture was noticed by the tourist.,low,-37.14911651611328,-43.569908142089844,6.4207916259765625
the sculpture,a famous painting,resembled,The sculpture resembled a famous painting.,The sculpture resembled a famous painting.,A famous painting was resembled by the sculpture.,low,-31.66058921813965,-49.83023452758789,18.169645309448242
the shirt,the man,fit,The shirt fit the man.,The shirt fit the man.,The man was fit by the shirt.,low,-26.994361877441406,-36.572021484375,9.577659606933594
the room,a cozy ambiance,had,The room had a cozy ambiance.,The room had a cozy ambiance.,A cozy ambiance was had by the room.,low,-29.50625228881836,-55.324710845947266,25.818458557128906
the cat,the bird on the windowsill,noticed,The cat noticed the bird on the windowsill intently.,The cat noticed the bird on the windowsill intently.,The bird on the windowsill was noticed intently by the cat.,low,-51.966880798339844,-59.66376876831055,7.696887969970703
Rob,his wallet,missed,Rob missed his wallet.,Rob missed his wallet.,His wallet was missed by Rob.,low,-30.157020568847656,-42.19476318359375,12.037742614746094
The project,a detailed plan,lacked,The project lacked a detailed plan.,The project lacked a detailed plan.,A detailed plan was lacked by the project.,low,-29.945945739746094,-46.81333541870117,16.867389678955078
the renovation,significant money,cost,The renovation cost significant money.,The renovation cost significant money.,Significant money was cost by the renovation.,low,-34.30189514160156,-46.21391677856445,11.91202163696289
the neighbors,the band,heard,The neighbors heard the band rehearsing late at night.,The neighbors heard the band rehearsing late at night.,The band rehearsing late at night was heard by the neighbors.,low,-45.647918701171875,-61.69260787963867,16.044689178466797
The community,his dedication to volunteering,respected,The community respected his dedication to volunteering.,The community respected his dedication to volunteering.,His dedication to volunteering was respected by the community.,low,-39.90303039550781,-40.83141326904297,0.9283828735351562
The building,renovations,underwent,The building underwent renovations last year.,The building underwent renovations last year.,Renovations were underwent last year by the building.,low,-28.613525390625,-56.84261703491211,28.22909164428711
the box,the items,fit,The box fit the items perfectly inside.,The box fit the items perfectly inside.,The items were fit perfectly inside by the box.,low,-42.11006164550781,-54.03691101074219,11.926849365234375
The house,The old cemetery,abutted,The house abutted the old cemetery.,The house abutted the old cemetery.,The old cemetery abutted the house.,low,-34.320438385009766,-36.83599090576172,2.515552520751953
the new smartphone,nearly a thousand dollars,cost,The new smartphone cost nearly a thousand dollars.,The new smartphone cost nearly a thousand dollars.,Nearly a thousand dollars was cost by the new smartphone.,low,-38.971038818359375,-47.59230041503906,8.621261596679688
Travelers,The risks,knew,Travelers knew the risks involved.,Travelers knew the risks involved.,The risks involved were knew by the travelers.,low,-24.778980255126953,-48.2186164855957,23.43963623046875
the patient,the procedure,underwent,The patient underwent the procedure.,The patient underwent the procedure.,The procedure was underwent by the patient.,low,-24.981624603271484,-30.990385055541992,6.008760452270508
the team,the captain's judgment,trusted,The team trusted the captain's judgment.,The team trusted the captain's judgment.,The captain's judgment was trusted by the team.,low,-35.048465728759766,-44.69029235839844,9.641826629638672
the sailor,the lighthouse,saw,The sailor saw the lighthouse.,The sailor saw the lighthouse.,The lighthouse was saw by the sailor.,low,-34.209537506103516,-36.13142395019531,1.9218864440917969
the jury,"the artist""s innovative approach",recognized,The jury recognized the artist's innovative approach in her work.,The jury recognized the artist's innovative approach in her work.,The artist's innovative approach in her work was recognized by the jury.,low,-48.20709991455078,-58.740028381347656,10.532928466796875
the new phone,several hundred dollars,cost,The new phone cost several hundred dollars.,The new phone cost several hundred dollars.,Several hundred dollars was cost by the new phone.,low,-30.944353103637695,-46.50006866455078,15.555715560913086
the community,the foundation's cause for the environment,believed,The community believed the foundation's cause for the environment.,The community believed the foundation's cause for the environment.,The foundation's cause for the environment was believed by the community.,low,-59.671546936035156,-58.58659362792969,-1.0849533081054688
She,the flavor of the new coffee blend,liked,The barista liked the flavor of the new coffee blend.,The barista liked the flavor of the new coffee blend.,The flavour of the new coffee blend was liked by the barista.,low,-51.63827133178711,-52.94671630859375,1.3084449768066406
the clouds,various animal shapes,resembled,The clouds resembled various animal shapes.,The clouds resembled various animal shapes.,Various animal shapes were resembled by the clouds.,low,-41.5999755859375,-52.942710876464844,11.342735290527344
the model,the original statue,resembled,The model resembled the original statue.,The model resembled the original statue.,The original statue was resembled by the model.,low,-35.50831985473633,-49.917640686035156,14.409320831298828
the birdwatcher,a rare species in the forest,spotted,The birdwatcher spotted a rare species in the forest.,The birdwatcher spotted a rare species in the forest.,A rare species was spotted in the forest by the birdwatcher.,low,-36.953529357910156,-53.54837417602539,16.594844818115234
the dress,her,fit,The dress fit the bride perfectly.,The dress fit the bride perfectly.,The bride was fit perfectly by the dress.,low,-34.361351013183594,-45.6170768737793,11.255725860595703
the sculpture,a majestic eagle in flight,resembled,The sculpture resembled a majestic eagle in flight.,The sculpture resembled a majestic eagle in flight.,A majestic eagle in flight was resembled by the sculpture.,low,-37.79922103881836,-63.54924392700195,25.750022888183594
the villagers,the wild animals,feared,The villagers feared the wild animals.,The villagers feared the wild animals.,The wild animals were feared by the villagers.,low,-32.523372650146484,-37.16944885253906,4.646076202392578
The table,more than anticipated,cost,The table cost more than anticipated at the auction.,The table cost more than anticipated at the auction.,More than anticipated was cost by the table at the auction.,low,-42.93431091308594,-64.92698669433594,21.99267578125
the program,the new user,recognized,The program recognized the new user.,The program recognized the new user.,The new user was recognized by the program.,low,-34.13935089111328,-40.24089050292969,6.101539611816406
the librarian,the location of every book in the vast collection,knew,The librarian knew the location of every book in the vast collection.,The librarian knew the location of every book in the vast collection.,The location of every book in the vast collection was knew by the librarian.,low,-54.62505340576172,-65.2254638671875,10.600410461425781
The dog,The sound of thunder,feared,The dog feared the sound of thunder.,The dog feared the sound of thunder.,The sound of thunder was feared by the dog.,low,-36.53174591064453,-41.87885284423828,5.34710693359375
the children,the monster under the bed,feared,The children feared the monster under the bed.,The children feared the monster under the bed.,The monster under the bed was feared by the children.,low,-41.92670822143555,-49.84318542480469,7.916477203369141
The painting,a famous masterpiece,resembled,The painting resembled a famous masterpiece.,The painting resembled a famous masterpiece.,A famous masterpiece was resembled by the painting.,low,-33.61601638793945,-56.13654327392578,22.520526885986328
The patron,their conversation,overheard,She overheard their conversation.,The patron overheard their conversation.,Their conversation was overheard by the patron.,low,-31.033111572265625,-29.693492889404297,-1.3396186828613281
the athlete,the qualification,missed,The athlete missed the qualifying score by a margin.,The athlete missed the qualifying score by a margin.,The qualifying score was missed by the athlete by a margin.,low,-49.65850067138672,-59.721397399902344,10.062896728515625
The team,their leader,trusted,The team trusted their leader.,The team trusted their leader.,Their leader was trusted by the team.,low,-25.961528778076172,-30.61515998840332,4.653631210327148
The meeting,an entire afternoon,lasted,The meeting lasted an entire afternoon.,The meeting lasted an entire afternoon.,An entire afternoon was lasted by the meeting.,low,-28.284683227539062,-49.22250747680664,20.937824249267578
Her voice,the sweet sound of a violin,resembled,Her voice resembled the sweet sound of a violin.,Her voice resembled the sweet sound of a violin.,The sweet sound of a violin was resembled by her voice.,low,-40.70751190185547,-65.91069030761719,25.20317840576172
the mural,a vibrant tapestry,resembled,The mural resembled a vibrant tapestry.,The mural resembled a vibrant tapestry.,A vibrant tapestry was resembled by the mural.,low,-42.898624420166016,-59.055789947509766,16.15716552734375
the driver,the old song playing on the radio,recognized,The driver recognized the old song playing on the radio.,The driver recognized the old song playing on the radio.,The old song playing on the radio was recognized by the driver.,low,-42.20647430419922,-50.10881805419922,7.90234375
The campers,the shooting star,saw,The camper saw the shooting star.,The camper saw the shooting star.,The shooting star was saw by the camper.,low,-36.50307083129883,-46.36500930786133,9.8619384765625
the appointment,forty-five minutes,lasted,The appointment lasted forty-five minutes.,The appointment lasted forty-five minutes.,Forty-five minutes were lasted by the appointment.,low,-31.383546829223633,-45.44971466064453,14.066167831420898
the woman,snakes,feared,The woman feared snakes.,The woman feared snakes.,Snakes were feared by the woman.,low,-29.911540985107422,-34.27104949951172,4.359508514404297
the engine,repairs,needed,The engine needed repairs.,The engine needed repairs.,Repairs were needed by the engine.,low,-22.49897575378418,-37.99679183959961,15.49781608581543
the renovations,a pretty penny,cost,The renovations cost a pretty penny.,The renovations cost a pretty penny.,A pretty penny was cost by the renovations.,low,-32.161460876464844,-51.256988525390625,19.09552764892578
The teacher,the lesson plan,prepared,The teacher prepared the lesson plan.,The teacher prepared the lesson plan.,The lesson plan was prepared by the teacher.,high,-30.703445434570312,-38.706626892089844,8.003181457519531
The soldier,the intruder,shot,The soldier shot the intruder during a midnight raid.,The soldier shot the intruder during a midnight raid.,The intruder was shot by the soldier during a midnight raid.,high,-40.735191345214844,-43.905235290527344,3.1700439453125
the criminal,the unmanned robot,stabbed,The criminal stabbed the unmanned robot.,The criminal stabbed the unmanned robot.,"The unmanned robot was stabbed by the criminal,.",high,-43.614646911621094,-62.73500442504883,19.120357513427734
The military officer,the deserter,executed,The military officer executed the deserter.,The military officer executed the deserter.,The deserter was executed by the military officer.,high,-40.37981414794922,-41.12900924682617,0.7491950988769531
The villain,his opponent,knifed,The villain knifed his opponent in a theatrical duel.,The villain knifed his opponent in a theatrical duel.,His opponent was knifed by the villain in a theatrical duel.,high,-48.62310028076172,-56.89214324951172,8.26904296875
The haunted house actor,The guests,frightened,The haunted house actor successfully frightened the guests.,The haunted house actor successfully frightened the guests.,The guests were frightened successfully by the haunted house actor.,high,-47.797855377197266,-58.90386199951172,11.106006622314453
The firefighter,the cleared fields,burned,The firefighter burned the cleared fields to prevent a larger forest fire.,The firefighter burned the cleared fields to prevent a larger forest fire.,The cleared fields were burned by the firefighter to prevent a larger forest fire.,high,-66.53994750976562,-77.58719635009766,11.047248840332031
The hunter,the wild boar,killed,The hunter killed the wild boar in the forest.,The hunter killed the wild boar in the forest.,The wild boar was killed by the hunter in the forest.,high,-37.60306167602539,-39.67736053466797,2.074298858642578
The pest control officer,the cockroaches,exterminated,The pest control officer exterminated the cockroaches in the infested kitchen.,The pest control officer exterminated the cockroaches in the infested kitchen.,The cockroaches in the infested kitchen were exterminated by the pest control officer.,high,-47.75117874145508,-62.48017883300781,14.729000091552734
