subject,object,verb,sentence,active,passive,affectedness,active_score,passive_score,pass_drop
The pest control team,all the insects in the house,exterminated,The pest control team exterminated all the insects in the house.,The pest control team exterminated all the insects in the house.,All the insects in the house were exterminated by the pest control team.,high,-33.067893981933594,-45.97228240966797,12.904388427734375
assassin,wealthy businessman,murdered,The assassin murdered the wealthy businessman in his secluded mansion.,The assassin murdered the wealthy businessman in his secluded mansion.,The wealthy businessman was murdered by the assassin in his secluded mansion.,high,-40.25840759277344,-48.55953598022461,8.301128387451172
The prisoner,His rival inmate,knifed,The prisoner knifed his rival inmate during lunch.,The prisoner knifed his rival inmate during lunch.,His rival inmate was knifed by the prisoner during lunch.,high,-49.21458435058594,-56.18472671508789,6.970142364501953
The athlete,the world record,broke,The athlete broke the world record in the event.,The athlete broke the world record in the event.,The world record in the event was broke by the athlete.,high,-36.86806106567383,-56.10360336303711,19.23554229736328
The campfire,the stack of wood,burned,The campfire burned the stack of wood.,The campfire burned the stack of wood.,The stack of wood was burned by the campfire.,high,-37.90254211425781,-43.54323196411133,5.640689849853516
The state,the criminal,executed,The state executed the criminal at dawn.,The state executed the criminal at dawn.,The criminal was executed by the state at dawn.,high,-37.24860382080078,-39.37784957885742,2.1292457580566406
The construction worker,the concrete pillar,crushed,The construction worker crushed the concrete pillar.,The construction worker crushed the concrete pillar.,The concrete pillar was crushed by the construction worker.,high,-34.9262809753418,-42.44849395751953,7.522212982177734
The chef,The juicy steak,stabbed,The chef expertly stabbed the fork into the juicy steak.,The chef expertly stabbed the fork into the juicy steak.,The fork was stabbed expertly by the chef into the juicy steak.,high,-53.696720123291016,-72.24388122558594,18.547161102294922
the storm,dozens of houses,wrecked,The storm wrecked dozens of houses along the coastline.,The storm wrecked dozens of houses along the coastline.,Dozens of houses along the coastline were wrecked by the storm.,high,-36.10177230834961,-35.884544372558594,-0.21722793579101562
The mother,water,boiled,The mother boiled water for her child's bottle.,The mother boiled water for her child's bottle.,Water for her child's bottle was boiled by the mother.,high,-44.86142349243164,-55.53529357910156,10.673870086669922
The campers,the marshmallows,burned,The campers accidentally burned the marshmallows over the fire.,The campers accidentally burned the marshmallows over the fire.,The marshmallows were accidentally burned over the fire by the campers.,high,-54.113861083984375,-64.4558334350586,10.341972351074219
The criminal,the unsuspecting victim,knifed,The criminal knifed the unsuspecting victim in the alley.,The criminal knifed the unsuspecting victim in the alley.,The unsuspecting victim was knifed in the alley by the criminal.,high,-39.74787139892578,-45.37501525878906,5.627143859863281
The compactor,The metal cans,crushed,The compactor crushed the metal cans into cubes.,The compactor crushed the metal cans into cubes.,The metal cans were crushed into cubes by the compactor.,high,-42.28337097167969,-53.09320068359375,10.809829711914062
The thieves,the unsuspecting travelers,robbed,The thieves robbed the unsuspecting travelers at the desolate rest stop.,The thieves robbed the unsuspecting travelers at the desolate rest stop.,The unsuspecting travelers were robbed by thieves at the desolate rest stop.,high,-84.73860168457031,-80.77632141113281,-3.9622802734375
The knight,The dragon,stabbed,The knight stabbed the dragon with his enchanted sword.,The knight stabbed the dragon with his enchanted sword.,The dragon was stabbed by the knight with his enchanted sword.,high,-45.370784759521484,-53.55837631225586,8.187591552734375
The mechanic,the old car,crushed,The mechanic crushed the old car with the hydraulic press.,The mechanic crushed the old car with the hydraulic press.,The old car was crushed by the mechanic with the hydraulic press.,high,-44.481876373291016,-50.37922286987305,5.897346496582031
The political faction,the citizens,terrorized,The political faction terrorized the citizens with threats of violence.,The political faction terrorized the citizens with threats of violence.,The citizens were terrorized with threats of violence by the political faction.,high,-50.61449432373047,-62.63003158569336,12.01553726196289
The criminals,the bank,robbed,The criminals robbed the bank in broad daylight.,The criminals robbed the bank in broad daylight.,The bank was robbed by the criminals in broad daylight.,high,-29.130783081054688,-43.5633659362793,14.43258285522461
The villain,The investigator,drowned,The villain drowned the investigator by tying him to a heavy weight.,The villain drowned the investigator by tying him to a heavy weight.,The investigator was drowned by the villain by tying him to a heavy weight.,high,-58.669532775878906,-76.40515899658203,17.735626220703125
The construction company,the old building,demolished,The construction company demolished the old building.,The construction company demolished the old building.,The old building was demolished by the construction company.,high,-28.378101348876953,-31.43798065185547,3.0598793029785156
The woman,The can,crushed,The woman crushed the can with ease.,The woman crushed the can with ease.,The can was crushed by the woman with ease.,high,-36.6787223815918,-47.2824592590332,10.603736877441406
The soldiers,the prisoner,executed,The soldiers executed the prisoner at dawn.,The soldiers executed the prisoner at dawn.,The prisoner was executed by the soldiers at dawn.,high,-27.089859008789062,-35.60466384887695,8.51480484008789
The attacker,the victim,stabbed,The attacker viciously stabbed the victim in the crowded marketplace.,The attacker viciously stabbed the victim in the crowded marketplace.,The victim was viciously stabbed by the attacker in the crowded marketplace.,high,-40.39665985107422,-44.45991897583008,4.063259124755859
the villain,the spy,strangled,The villain strangled the spy in the alley.,The villain strangled the spy in the alley.,The spy was strangled by the villain in the alley.,high,-35.23303985595703,-42.004268646240234,6.771228790283203
The government,the treacherous spy,executed,The government executed the treacherous spy who had betrayed the country.,The government executed the treacherous spy who had betrayed the country.,The treacherous spy who had betrayed the country was executed by the government.,high,-56.493099212646484,-67.7618408203125,11.268741607666016
The horse,the intruder,kicked,The horse kicked the intruder with all its might.,The horse kicked the intruder with all its might.,The intruder was kicked by the horse with all its might.,high,-49.91938018798828,-58.06169509887695,8.142314910888672
The novelist,his protagonist,murdered,The novelist murdered his protagonist in the latest chapter.,The novelist murdered his protagonist in the latest chapter.,His protagonist was murdered in the latest chapter by the novelist.,high,-49.591251373291016,-52.56234359741211,2.9710922241210938
The executioner,the traitor,executed,The executioner executed the traitor at dawn.,The executioner executed the traitor at dawn.,The traitor was executed by the executioner at dawn.,high,-32.67778015136719,-38.06928253173828,5.391502380371094
The gangster,the rival leader,shot,The gangster shot the rival leader.,The gangster shot the rival leader.,The rival leader was shot by the gangster.,high,-35.59349060058594,-38.66331100463867,3.0698204040527344
The pirate,the sail,knifed,The pirate knifed the sail to bring it down quickly during the skirmish.,The pirate knifed the sail to bring it down quickly during the skirmish.,The sail was knifed by the pirate to bring it down quickly during the skirmish.,high,-75.96833038330078,-79.01010131835938,3.0417709350585938
The technician,the faulty machine,dismantled,The technician dismantled the faulty machine.,The technician dismantled the faulty machine.,The faulty machine was dismantled by the technician.,high,-32.72962188720703,-46.4327392578125,13.703117370605469
The bullet,The glass window,shattered,The bullet shattered the glass window of the abandoned car.,The bullet shattered the glass window of the abandoned car.,The glass window of the abandoned car was shattered by the bullet.,high,-36.26837158203125,-44.658538818359375,8.390167236328125
The villain,the spy,suffocated,The villain suffocated the spy with a pillow.,The villain suffocated the spy with a pillow.,The spy with a pillow was suffocated by the villain.,high,-38.26885986328125,-56.52075958251953,18.25189971923828
The chef,The vegetables,burned,The chef burned the vegetables to a crisp by accident.,The chef burned the vegetables to a crisp by accident.,The vegetables were burned to a crisp by accident by the chef.,high,-48.994632720947266,-57.397727966308594,8.403095245361328
The writer,the manuscript,completed,The writer completed the manuscript.,The writer completed the manuscript.,The manuscript was completed by the writer.,high,-27.678428649902344,-31.52056884765625,3.8421401977539062
The rogue tiger,the village,terrorized,The rogue tiger terrorized the village for weeks.,The rogue tiger terrorized the village for weeks.,The village was terrorized by the rogue tiger for weeks.,high,-44.026588439941406,-54.31418228149414,10.287593841552734
The arsonist,the building,burned,The arsonist burned the building to ashes.,The arsonist burned the building to ashes.,The building was burned to ashes by the aronist.,high,-29.45827865600586,-58.461395263671875,29.003116607666016
the thief,the glass display case,shattered,The thief shattered the glass display case to steal the jewels.,The thief shattered the glass display case to steal the jewels.,The glass display case was shattered by the thief to steal the jewels.,high,-49.23616027832031,-58.93801498413086,9.701854705810547
The monster,the village,terrorized,The monster terrorized the village.,The monster terrorized the village.,The village was terrorized by the monster.,high,-26.098756790161133,-33.428924560546875,7.330167770385742
The giant,the fallen knight,crushed,The giant crushed the fallen knight with one blow.,The giant crushed the fallen knight with one blow.,The fallen knight was crushed by the giant with one blow.,high,-45.38924789428711,-54.188167572021484,8.798919677734375
The construction crew,the unsafe structure,demolished,The construction crew demolished the unsafe structure to make way for new development.,The construction crew demolished the unsafe structure to make way for new development.,The unsafe structure was demolished by the construction crew to make way for new development,high,-55.73098373413086,-59.30970764160156,3.578723907470703
The king,the prisoner,executed,The king executed the prisoner at dawn.,The king executed the prisoner at dawn.,The prisoner was executed by the king at dawn.,high,-33.20176696777344,-37.31349182128906,4.111724853515625
the actor,the prop,knifed,The actor knifed the prop during the final act with dramatic flair.,The actor knifed the prop during the final act with dramatic flair.,The prop was knifed by the actor during the final act with dramatic flair.,high,-60.01017761230469,-71.40406036376953,11.393882751464844
The developers,The old building,demolished,The developers demolished the old building to make way for a new skyscraper.,The developers demolished the old building to make way for a new skyscraper.,The old building was demolished by the developers to make way for a new skyscraper.,high,-37.717491149902344,-39.87858963012695,2.1610984802246094
The haunted house attraction,the visitors,frightened,The haunted house attraction frightened the visitors with its sudden surprises.,The haunted house attraction frightened the visitors with its sudden surprises.,The visitors were frightened by the haunted house attraction with its sudden surprises.,high,-53.75432205200195,-69.58922576904297,15.834903717041016
The thief,the unsuspecting tourists,robbed,The thief robbed the unsuspecting tourists of their valuables.,The thief robbed the unsuspecting tourists of their valuables.,The unsuspecting tourists wer e robbed of their valuables by the thief.,high,-42.433753967285156,-76.71668243408203,34.282928466796875
The elephant,the fruit,crushed,The elephant crushed the fruit under its feet.,The elephant crushed the fruit under its feet.,The fruit under its feet was crushed by the elephant.,high,-41.67266845703125,-53.05027770996094,11.377609252929688
The chef,the potatoes,boiled,The chef boiled the potatoes in a large pot.,The chef boiled the potatoes in a large pot.,The potatoes were boiled by the chef in a large pot.,high,-37.353797912597656,-47.91842269897461,10.564624786376953
The gang,the local residents,terrorized,The gang terrorized the local residents for months.,The gang terrorized the local residents for months.,The local residents were terrorized by the gang for months.,high,-33.2052001953125,-40.703468322753906,7.498268127441406
suspect,detective,murdered,The suspect murdered the detective in his own living room.,The suspect murdered the detective in his own living room.,The detective was murdered by the suspect in his own living room.,high,-41.596805572509766,-43.015228271484375,1.4184226989746094
The lifeguard,the intruder,drowned,The lifeguard drowned the intruder during practice.,The lifeguard drowned the intruder during practice.,The intruder was drowned by the lifeguard during practice.,high,-42.98147964477539,-55.18604278564453,12.20456314086914
The pirate captain,the enemies,drowned,The pirate captain drowned the enemies in the turbulent sea.,The pirate captain drowned the enemies in the turbulent sea.,The enemies were drowned into the turbulent sea by the pirate captain.,high,-50.44320297241211,-64.0750732421875,13.63187026977539
The explosion,The old abandoned warehouse,destroyed,The explosion destroyed the old abandoned warehouse.,The explosion destroyed the old abandoned warehouse.,The old abandoned warehouse was destroyed by the explosion.,high,-32.15673065185547,-34.93168640136719,2.7749557495117188
criminal gang,local businesses,terrorized,The criminal gang terrorized the local businesses in the downtown area.,The criminal gang terrorized the local businesses in the downtown area.,The local businesses in the downtown area were terrorized by the criminal gang.,high,-41.19291687011719,-49.881805419921875,8.688888549804688
The team,the stalled car,pushed,The team pushed the stalled car to the side of the road.,The team pushed the stalled car to the side of the road.,The stalled car was pushed to the side of the road by the team.,high,-41.63968276977539,-43.17155456542969,1.5318717956542969
the hurricane,windows across the coastal town,shattered,The hurricane shattered windows across the coastal town.,The hurricane shattered windows across the coastal town.,Windows across the coastal town were shattered by the hurricane.,high,-39.70228958129883,-48.889686584472656,9.187397003173828
the movie villain,his adversary,strangled,The movie villain strangled his adversary without hesitation.,The movie villain strangled his adversary without hesitation.,His adversary was strangled without hesitation by the movie villain.,high,-46.001922607421875,-58.901851654052734,12.89992904663086
the spy,the guard,strangled,The spy strangled the guard silently in the shadows.,The spy strangled the guard silently in the shadows.,The guard was strangled silently in the shadows by the spy.,high,-40.39837646484375,-58.41387939453125,18.0155029296875
The machine,The scrap metal,crushed,The machine crushed the scrap metal into a compact cube.,The machine crushed the scrap metal into a compact cube.,The scrap metal was crushed into a compact metal cube by the machine.,high,-38.02738952636719,-49.21635055541992,11.188961029052734
The storm,The small fishing village,wrecked,The storm wrecked the small fishing village overnight.,The storm wrecked the small fishing village overnight.,The small fishing village was wrecked overnight by the storm.,high,-34.070823669433594,-38.74920654296875,4.678382873535156
the thief,the vase,broke,The thief broke the vase during the heist.,The thief broke the vase during the heist.,The vase was broke by the thief during the heist.,high,-39.19479751586914,-55.15821838378906,15.963420867919922
the angry customer,the sales clerk,pushed,The angry customer pushed the sales clerk.,The angry customer pushed the sales clerk.,The sales clerk was pushed by the angry customer.,high,-42.09130096435547,-47.269371032714844,5.178070068359375
The state,the prisoner,executed,The state officially executed the prisoner as per the court's final ruling.,The state officially executed the prisoner as per the court's final ruling.,The prisoner was officially executed by the state as per the court's final ruling.,high,-58.174739837646484,-55.613853454589844,-2.5608863830566406
The bully,the boy,pushed,The bully pushed the boy off the swing.,The bully pushed the boy off the swing.,The boy was pushed off the swing by the bully.,high,-44.86832809448242,-45.01866912841797,0.15034103393554688
The burglar,the antique vase,broke,The burglar broke the antique vase during the heist.,The burglar broke the antique vase during the heist.,The antique vase was broke by the burglar during the heist.,high,-41.95654296875,-53.00068664550781,11.044143676757812
The villain,The hostage,strangled,The villain strangled the hostage to intimidate the hero.,The villain strangled the hostage to intimidate the hero.,The hostage was strangled by the villain to intimidate the hero.,high,-49.875267028808594,-58.92823791503906,9.052970886230469
the outlaw,the sheriff,murdered,The outlaw brutally murdered the sheriff.,The outlaw brutally murdered the sheriff.,The sheriff was brutally murdered by the outlaw.,high,-34.86792755126953,-39.40215301513672,4.5342254638671875
The butler,The victim,murdered,The butler murdered the victim.,The butler murdered the victim.,The victim was murdered by the butler.,high,-27.366018295288086,-31.95235824584961,4.586339950561523
The criminal,His opponent,suffocated,The criminal suffocated his opponent with a pillow.,The criminal suffocated his opponent with a pillow.,His opponent was suffocated by the criminal with a pillow.,high,-37.11748123168945,-47.08626174926758,9.968780517578125
The pest control worker,the termites,exterminated,The pest control worker exterminated the termites in the basement.,The pest control worker exterminated the termites in the basement.,The termites in the basement were exterminated by the pest control worker.,high,-29.950225830078125,-57.2092399597168,27.259014129638672
The ghost,the children,frightened,The ghost frightened the children in the haunted house.,The ghost frightened the children in the haunted house.,The children in the haunted house were frightened by the ghost.,high,-38.02306365966797,-39.87152099609375,1.8484573364257812
The man,The pile of dry leaves,burned,The man burned the pile of dry leaves in the backyard.,The man burned the pile of dry leaves in the backyard.,The pile of dry leaves in the backyard were burned by the man.,high,-46.277809143066406,-58.63506317138672,12.357254028320312
The kidnapper,the victim,suffocated,The kidnapper suffocated the victim with a pillow.,The kidnapper suffocated the victim with a pillow.,The victim was suffocated by the kidnapper with a pillow.,high,-36.277122497558594,-45.1171875,8.840065002441406
The scientist,the experimental compound,synthesized,The scientist synthesized the experimental compound.,The scientist synthesized the experimental compound.,The experimental compound was synthesized by the scientist.,high,-39.279537200927734,-49.310298919677734,10.03076171875
knight,mythical beast,stabbed,The knight stabbed the sword into the mythical beast.,The knight stabbed the sword into the mythical beast.,The sword was stabbed by the knight into the mythical beast.,high,-52.557655334472656,-60.72764587402344,8.169990539550781
the butler,the wealthy businessman,murdered,The detective murdered the wealthy businessman.,The detective murdered the wealthy businessman.,The wealthy businessman was murdered by the detective.,high,-30.48094367980957,-37.07830047607422,6.597356796264648
The chef,a flawless soufflé,executed,The chef executed a flawless soufflé for the guests.,The chef executed a flawless soufflé for the guests.,A flawless soufflé was executed for the guests by the chef.,high,-55.45673370361328,-66.47602844238281,11.019294738769531
The firing squad,the prisoner,executed,The firing squad executed the prisoner at dawn.,The firing squad executed the prisoner at dawn.,The prisoner was executed by the firing squad at dawn.,high,-31.77967643737793,-37.19144821166992,5.411771774291992
The earthquake,the downtown skyscraper,collapsed,The earthquake collapsed the downtown skyscraper.,The earthquake collapsed the downtown skyscraper.,The downtown skyscraper was collapsed by the earthquake.,high,-42.121490478515625,-39.29494094848633,-2.826549530029297
The machine,The rocks,crushed,The machine crushed the rocks into gravel.,The machine crushed the rocks into gravel.,The rocks were crushed by the machine into gravel.,high,-29.601579666137695,-43.55404281616211,13.952463150024414
The predator,the village,terrorized,The predator terrorized the village for months.,The predator terrorized the village for months.,The village was terrorized by the predator for months.,high,-32.180355072021484,-43.816707611083984,11.6363525390625
The construction worker,The rock,crushed,The construction worker crushed the rock with a heavy machine.,The construction worker crushed the rock with a heavy machine.,The rock was crushed by the construction worker with a heavy machine.,high,-39.82810592651367,-51.319007873535156,11.490901947021484
The heavy rain,The small garden,drowned,The heavy rain drowned the small garden under inches of water.,The heavy rain drowned the small garden under inches of water.,The small garden was drowned by the heavy rain under inches of water.,high,-54.09960174560547,-67.10215759277344,13.002555847167969
The killer,The victim,suffocated,The killer suffocated the victim with a pillow.,The killer suffocated the victim with a pillow.,The victim was suffocated by the killer with a pillow.,high,-25.84893035888672,-39.094783782958984,13.245853424072266
The movers,the antique vase,broke,The movers accidentally broke the antique vase.,The movers accidentally broke the antique vase.,The antique vase was accidentally broke by the movers.,high,-48.112152099609375,-55.19163131713867,7.079479217529297
The photographer,the wedding photos,shot,The photographer shot the wedding photos beautifully.,The photographer shot the wedding photos beautifully.,The wedding photos were beautifully shot by the photographer.,high,-37.10647201538086,-41.25437545776367,4.1479034423828125
The gang,the small village,terrorized,The gang terrorized the small village for weeks.,The gang terrorized the small village for weeks.,The small village was terrorized by the gang for weeks.,high,-33.91395950317383,-43.867820739746094,9.953861236572266
The storm,the old pier,smashed,The storm smashed the old pier.,The storm smashed the old pier.,The old pier was smashed by the storm.,high,-32.879608154296875,-37.72675323486328,4.847145080566406
The guerrilla fighters,the small rural community,terrorized,The guerrilla fighters terrorized the small rural community.,The guerrilla fighters terrorized the small rural community.,The small rural community was terrorized by the guerilla fighters.,high,-40.17705535888672,-49.13314437866211,8.95608901977539
The lifeguard,the child who nearly drowned in the pool,saved,The lifeguard saved the child who nearly drowned in the pool.,The lifeguard saved the child who nearly drowned in the pool.,The child who nearly drowned in the pool was saved by the lifeguard.,high,-44.9908447265625,-47.18327331542969,2.1924285888671875
The arsonist,the building,demolished,The arsonist demolished the building.,The arsonist demolished the building.,The building was demolished by the arsonist.,high,-27.728256225585938,-33.07002258300781,5.341766357421875
