subject,object,verb,sentence,active,passive,affectedness,active_score,passive_score,pass_drop
the patient,news of his test results,received,The patient received news of his test results.,The patient received news of his test results.,News of his test results was received by the patient.,low,-41.747894287109375,-41.1965446472168,-0.5513496398925781
Marie,pasta,liked,Marie liked pasta.,Marie liked pasta.,Pasta was liked by Marie.,low,-25.03807258605957,-34.66083908081055,9.622766494750977
The dog,its owner,trusted,The dog trusted its owner completely.,The dog trusted its owner completely.,Its owner was trusted completely by the dog.,low,-33.568382263183594,-44.091915130615234,10.52353286743164
the fridge,the groceries,received,The fridge received the groceries.,The fridge received the groceries.,The groceries were received by the fridge.,low,-34.93312454223633,-39.92981719970703,4.996692657470703
The translator,the speaker's dialect,understood,The translator understood the speaker's dialect effortlessly.,The translator understood the speaker's dialect effortlessly.,The speaker's dialect was understood effortlessly by the translator.,low,-45.542999267578125,-56.33979034423828,10.796791076660156
The new smartphone,a small fortune,cost,The new smartphone cost a small fortune.,The new smartphone cost a small fortune.,A small fortune was cost by the new smartphone.,low,-34.612613677978516,-51.065120697021484,16.45250701904297
The sculpture,a twisting vine,resembled,The sculpture resembled a twisting vine.,The sculpture resembled a twisting vine.,A twisting vine was resembled by the sculpture.,low,-44.42555618286133,-60.94042205810547,16.51486587524414
the tourists,the local cuisine,liked,The tourists liked the local cuisine.,The tourists liked the local cuisine.,The local cuisine was liked by the tourists.,low,-27.356037139892578,-40.32231903076172,12.96628189086914
The baker,the cake fresh out of the oven,liked,The baker liked the cake fresh out of the oven.,The baker liked the cake fresh out of the oven.,The cake was liked fresh out of the oven by the baker.,low,-38.03430938720703,-50.452083587646484,12.417774200439453
the patient,immediate medical attention,needed,The patient needed immediate medical attention.,The patient needed immediate medical attention.,Immediate medical attention was needed by the patient.,low,-27.13140869140625,-38.0754280090332,10.944019317626953
the veteran,the fallen comrades,remembered,The veteran remembered the fallen comrades.,The veteran remembered the fallen comrades.,The fallen comrades were remembered by the veteran.,low,-39.43423080444336,-46.27872085571289,6.844490051269531
The athlete,the crucial shot at the goal,missed,The athlete missed the crucial shot at the goal.,The athlete missed the crucial shot at the goal.,The crucial shot at the goal was missed by the athlete.,low,-43.833133697509766,-50.953155517578125,7.120021820068359
the children,the long homework assignments,dreaded,The children dreaded the long homework assignments.,The children dreaded the long homework assignments.,The long homework assignments were dreaded by the children.,low,-42.193180084228516,-47.52819061279297,5.335010528564453
The committee,the researcher's efforts,recognized,The committee recognized the researcher's efforts.,The committee recognized the researcher's efforts.,The researcher's efforts were recognized by the committee.,low,-42.62824249267578,-42.27497863769531,-0.35326385498046875
the historian,the ancient script,knew,The historian knew the ancient script.,The historian knew the ancient script.,The ancient script was knew by the historian.,low,-35.511749267578125,-43.38129806518555,7.869548797607422
The villagers,the dragon,feared,The villagers feared the dragon.,The villagers feared the dragon.,The dragon was feared by the villagers.,low,-24.808563232421875,-32.90718078613281,8.098617553710938
The teacher,the student's struggles,understood,The teacher understood the student's struggles.,The teacher understood the student's struggles.,The student's struggles were understood by the teacher.,low,-33.21508026123047,-42.28683090209961,9.07175064086914
The recipe,the ingredients we needed,had,The recipe had all the ingredients we needed.,The recipe had all the ingredients we needed.,All the ingredients we needed were had by the recipe.,low,-31.33057975769043,-44.322025299072266,12.991445541381836
The passerby,the heated argument,overheard,The passerby overheard the heated argument.,The passerby overheard the heated argument.,The heated argument was overheard by the passerby.,low,-33.49660110473633,-37.950462341308594,4.453861236572266
the observer,the small details in the artwork,noticed,The observer noticed the small details in the artwork.,The observer noticed the small details in the artwork.,The small details in the artwork were noticed by the observer.,low,-40.95756912231445,-50.30040740966797,9.342838287353516
they,the announcement,heard,They heard the announcement.,They heard the announcement.,The announcement was heard by them.,low,-16.627460479736328,-28.409141540527344,11.781681060791016
the community,the elderly man,respected,The community respected the elderly man for his wisdom.,The community respected the elderly man for his wisdom.,The elderly man was respected by the community for his wisdom.,low,-38.73689270019531,-44.1795539855957,5.442661285400391
The museum,Many artifacts from ancient Egypt,had,The museum had many artifacts from ancient Egypt.,The museum had many artifacts from ancient Egypt.,Many artifacts from ancient Egypt were had by the museum.,low,-35.610382080078125,-44.78730010986328,9.176918029785156
The menu,Vegetarian options,had,The menu had vegetarian options.,The menu had vegetarian options.,Vegetarian options were had by the menu.,low,-29.644054412841797,-45.773529052734375,16.129474639892578
The team,their coach's strategies,respected,The team respected their coach's strategies.,The team respected their coach's strategies.,Their coach's strategies were respected by the team.,low,-36.83043670654297,-42.71990203857422,5.88946533203125
the child,the dark shadows,feared,The child feared the dark shadows.,The child feared the dark shadows.,The dark shadows were feared by the child.,low,-27.920520782470703,-41.69074249267578,13.770221710205078
the new laptop,a thousand dollars,cost,The new laptop cost a thousand dollars.,The new laptop cost a thousand dollars.,A thousand dollars were cost by the new laptop.,low,-31.92232894897461,-56.977481842041016,25.055152893066406
the service,ten dollars,cost,The service cost ten dollars.,The service cost ten dollars.,Ten dollars were cost by the service.,low,-27.812368392944336,-39.06779861450195,11.255430221557617
the veteran,the comrades he lost,remembered,The veteran remembered the comrades he lost.,The veteran remembered the comrades he lost.,The comrades he lost were remembered by the veteran.,low,-47.209529876708984,-59.61940002441406,12.409870147705078
the project,sufficient funding,lacked,The project lacked sufficient funding.,The project lacked sufficient funding.,Sufficient funding was lacked by the project.,low,-23.84831428527832,-49.929988861083984,26.081674575805664
The report,crucial data,lacked,The report lacked crucial data for the analysis.,The report lacked crucial data for the analysis.,Crucial data for the analysis was lacked by the report.,low,-35.47455596923828,-53.89921569824219,18.424659729003906
the report,detailed information about the project's timeline,lacked,The report lacked detailed information about the project's timeline.,The report lacked detailed information about the project's timeline.,Detailed information about the project's timeline was lacked by the report.,low,-39.31310272216797,-48.20034408569336,8.88724136352539
the laptop,an update,received,The laptop received an update.,The laptop received an update.,An update was received by the laptop.,low,-30.332813262939453,-36.22571563720703,5.892902374267578
the detector,gas leaks,sensed,The detector sensed gas leaks.,The detector sensed gas leaks.,Gas leaks were sensed by the detector.,low,-39.03350830078125,-41.70856857299805,2.675060272216797
The repair,the homeowner,cost,The repair cost a small fortune.,The repair cost a small fortune.,A small fortune was cost by the repair.,low,-29.684247970581055,-45.81953430175781,16.135286331176758
the car,five passengers,had,The car had five passengers.,The car had five passengers.,Five passengers were had by the car.,low,-26.442384719848633,-38.16013717651367,11.717752456665039
the project,funds,lacked,The project lacked funds.,The project lacked funds.,Funds were lacked by the project.,low,-24.513078689575195,-34.53423309326172,10.021154403686523
she,the upcoming presentation,dreaded,The manager dreaded the upcoming presentation.,The manager dreaded the upcoming presentation.,The upcoming presentation was dreaded by the manager.,low,-33.72673034667969,-42.183841705322266,8.457111358642578
The audience,the presentation,understood,The audience understood the presentation.,The audience understood the presentation.,The presentation was understood by the audience.,low,-30.999210357666016,-30.462984085083008,-0.5362262725830078
the residents,the impending storm,feared,The residents feared the impending storm.,The residents feared the impending storm.,The impending storm was feared by the residents.,low,-28.35761260986328,-38.45594024658203,10.09832763671875
the sculpture,a mythical creature,resembled,The sculpture resembled a mythical creature.,The sculpture resembled a mythical creature.,A mythical creature was resembled by the sculpture.,low,-27.475004196166992,-46.97624969482422,19.501245498657227
She,her hometown,missed,The woman missed her hometown.,The woman missed her hometown.,Her hometown was missed by the woman.,low,-29.855274200439453,-38.981597900390625,9.126323699951172
the child,the dark forest,feared,The child feared the dark forest.,The child feared the dark forest.,The dark forest was feared by the child.,low,-32.64765930175781,-41.702606201171875,9.054946899414062
the clouds,fluffy sheep in the sky,resembled,The clouds resembled fluffy sheep in the sky.,The clouds resembled fluffy sheep in the sky.,Fluffy sheep in the sky were resembled by the clouds.,low,-36.64188003540039,-61.217254638671875,24.575374603271484
The new model,the previous version,resembled,The new model resembled the previous version.,The new model resembled the previous version.,The previous version was resembled by the new model.,low,-34.33238220214844,-46.342315673828125,12.009933471679688
Alice,the presentation,dreaded,Alice dreaded the presentation.,Alice dreaded the presentation.,The presentation was dreaded by Alice.,low,-24.82434844970703,-37.13328552246094,12.308937072753906
The lecture,two hours,lasted,The lecture lasted two hours.,The lecture lasted two hours.,Two hours were lasted by the lecture.,low,-22.97178077697754,-41.71650695800781,18.744726181030273
The hiker,a rare bird,spotted,The hiker spotted a rare bird.,The hiker spotted a rare bird.,A rare bird was spotted by the hiker.,low,-27.924976348876953,-34.1674690246582,6.24249267578125
the gardener,more seeds,needed,The gardener needed more seeds.,The gardener needed more seeds.,More seeds were needed by the gardener.,low,-38.636898040771484,-34.408958435058594,-4.227939605712891
the child,his pet,missed,The child missed his pet during vacation.,The child missed his pet during vacation.,His pet was missed by the child during vacation.,low,-45.01789855957031,-48.92399597167969,3.906097412109375
the teacher,"the student""s potential",knew,The teacher knew the student's potential.,The teacher knew the student's potential.,The student's potential was knew by the teacher.,low,-32.714569091796875,-50.46894454956055,17.754375457763672
the clock,midnight,struck,The clock struck midnight.,The clock struck midnight.,Midnight was struck by the clock.,low,-19.32245635986328,-30.941247940063477,11.618791580200195
the team,"their coach""s guidance",respected,The team respected their coach's guidance.,The team respected their coach's guidance.,Their coach's guidance was respected by the team.,low,-32.15201187133789,-39.24468994140625,7.092678070068359
the town,the river,bordered,The town bordered the river.,The town bordered the river.,The river was bordered by the town.,low,-22.48415756225586,-31.692750930786133,9.208593368530273
the tourist,the ancient architecture,noticed,The tourist noticed the ancient architecture.,The tourist noticed the ancient architecture.,The ancient architecture was noticed by the tourist.,low,-36.41272735595703,-41.95995330810547,5.5472259521484375
the sculpture,a famous painting,resembled,The sculpture resembled a famous painting.,The sculpture resembled a famous painting.,A famous painting was resembled by the sculpture.,low,-30.46615982055664,-48.732608795166016,18.266448974609375
the shirt,the man,fit,The shirt fit the man.,The shirt fit the man.,The man was fit by the shirt.,low,-25.94285774230957,-33.161598205566406,7.218740463256836
the room,a cozy ambiance,had,The room had a cozy ambiance.,The room had a cozy ambiance.,A cozy ambiance was had by the room.,low,-28.65774917602539,-46.64487075805664,17.98712158203125
the cat,the bird on the windowsill,noticed,The cat noticed the bird on the windowsill intently.,The cat noticed the bird on the windowsill intently.,The bird on the windowsill was noticed intently by the cat.,low,-51.84916687011719,-61.101531982421875,9.252365112304688
Rob,his wallet,missed,Rob missed his wallet.,Rob missed his wallet.,His wallet was missed by Rob.,low,-32.35573959350586,-39.48689651489258,7.131156921386719
The project,a detailed plan,lacked,The project lacked a detailed plan.,The project lacked a detailed plan.,A detailed plan was lacked by the project.,low,-27.328800201416016,-41.50880432128906,14.180004119873047
the renovation,significant money,cost,The renovation cost significant money.,The renovation cost significant money.,Significant money was cost by the renovation.,low,-32.78390121459961,-48.195045471191406,15.411144256591797
the neighbors,the band,heard,The neighbors heard the band rehearsing late at night.,The neighbors heard the band rehearsing late at night.,The band rehearsing late at night was heard by the neighbors.,low,-47.73965072631836,-56.48705291748047,8.74740219116211
The community,his dedication to volunteering,respected,The community respected his dedication to volunteering.,The community respected his dedication to volunteering.,His dedication to volunteering was respected by the community.,low,-35.93513488769531,-38.13737106323242,2.2022361755371094
The building,renovations,underwent,The building underwent renovations last year.,The building underwent renovations last year.,Renovations were underwent last year by the building.,low,-28.14212989807129,-59.206451416015625,31.064321517944336
the box,the items,fit,The box fit the items perfectly inside.,The box fit the items perfectly inside.,The items were fit perfectly inside by the box.,low,-42.35335922241211,-52.010948181152344,9.657588958740234
The house,The old cemetery,abutted,The house abutted the old cemetery.,The house abutted the old cemetery.,The old cemetery abutted the house.,low,-33.753684997558594,-39.88621139526367,6.132526397705078
the new smartphone,nearly a thousand dollars,cost,The new smartphone cost nearly a thousand dollars.,The new smartphone cost nearly a thousand dollars.,Nearly a thousand dollars was cost by the new smartphone.,low,-40.663272857666016,-49.36259460449219,8.699321746826172
Travelers,The risks,knew,Travelers knew the risks involved.,Travelers knew the risks involved.,The risks involved were knew by the travelers.,low,-26.17233657836914,-49.44364547729492,23.27130889892578
the patient,the procedure,underwent,The patient underwent the procedure.,The patient underwent the procedure.,The procedure was underwent by the patient.,low,-25.545490264892578,-36.72843933105469,11.18294906616211
the team,the captain's judgment,trusted,The team trusted the captain's judgment.,The team trusted the captain's judgment.,The captain's judgment was trusted by the team.,low,-30.641433715820312,-43.52064895629883,12.879215240478516
the sailor,the lighthouse,saw,The sailor saw the lighthouse.,The sailor saw the lighthouse.,The lighthouse was saw by the sailor.,low,-33.59441375732422,-39.59093475341797,5.99652099609375
the jury,"the artist""s innovative approach",recognized,The jury recognized the artist's innovative approach in her work.,The jury recognized the artist's innovative approach in her work.,The artist's innovative approach in her work was recognized by the jury.,low,-46.368736267089844,-57.00703811645508,10.638301849365234
the new phone,several hundred dollars,cost,The new phone cost several hundred dollars.,The new phone cost several hundred dollars.,Several hundred dollars was cost by the new phone.,low,-33.64541244506836,-48.0400276184082,14.394615173339844
the community,the foundation's cause for the environment,believed,The community believed the foundation's cause for the environment.,The community believed the foundation's cause for the environment.,The foundation's cause for the environment was believed by the community.,low,-54.80219268798828,-58.34407043457031,3.5418777465820312
She,the flavor of the new coffee blend,liked,The barista liked the flavor of the new coffee blend.,The barista liked the flavor of the new coffee blend.,The flavour of the new coffee blend was liked by the barista.,low,-49.55369186401367,-59.54844665527344,9.994754791259766
the clouds,various animal shapes,resembled,The clouds resembled various animal shapes.,The clouds resembled various animal shapes.,Various animal shapes were resembled by the clouds.,low,-38.35896301269531,-45.17179870605469,6.812835693359375
the model,the original statue,resembled,The model resembled the original statue.,The model resembled the original statue.,The original statue was resembled by the model.,low,-35.94324493408203,-44.10923385620117,8.16598892211914
the birdwatcher,a rare species in the forest,spotted,The birdwatcher spotted a rare species in the forest.,The birdwatcher spotted a rare species in the forest.,A rare species was spotted in the forest by the birdwatcher.,low,-44.16901779174805,-50.414085388183594,6.245067596435547
the dress,her,fit,The dress fit the bride perfectly.,The dress fit the bride perfectly.,The bride was fit perfectly by the dress.,low,-34.69295883178711,-48.058162689208984,13.365203857421875
the sculpture,a majestic eagle in flight,resembled,The sculpture resembled a majestic eagle in flight.,The sculpture resembled a majestic eagle in flight.,A majestic eagle in flight was resembled by the sculpture.,low,-38.2577018737793,-59.411903381347656,21.15420150756836
the villagers,the wild animals,feared,The villagers feared the wild animals.,The villagers feared the wild animals.,The wild animals were feared by the villagers.,low,-29.075958251953125,-37.14569854736328,8.069740295410156
The table,more than anticipated,cost,The table cost more than anticipated at the auction.,The table cost more than anticipated at the auction.,More than anticipated was cost by the table at the auction.,low,-46.0088005065918,-63.32415771484375,17.315357208251953
the program,the new user,recognized,The program recognized the new user.,The program recognized the new user.,The new user was recognized by the program.,low,-35.02125930786133,-37.0838508605957,2.062591552734375
the librarian,the location of every book in the vast collection,knew,The librarian knew the location of every book in the vast collection.,The librarian knew the location of every book in the vast collection.,The location of every book in the vast collection was knew by the librarian.,low,-54.39069747924805,-67.18167877197266,12.79098129272461
The dog,The sound of thunder,feared,The dog feared the sound of thunder.,The dog feared the sound of thunder.,The sound of thunder was feared by the dog.,low,-34.159969329833984,-48.192378997802734,14.03240966796875
the children,the monster under the bed,feared,The children feared the monster under the bed.,The children feared the monster under the bed.,The monster under the bed was feared by the children.,low,-35.576026916503906,-45.15483093261719,9.578804016113281
The painting,a famous masterpiece,resembled,The painting resembled a famous masterpiece.,The painting resembled a famous masterpiece.,A famous masterpiece was resembled by the painting.,low,-32.88665008544922,-54.61186218261719,21.72521209716797
The patron,their conversation,overheard,She overheard their conversation.,The patron overheard their conversation.,Their conversation was overheard by the patron.,low,-28.669231414794922,-28.57046890258789,-0.09876251220703125
the athlete,the qualification,missed,The athlete missed the qualifying score by a margin.,The athlete missed the qualifying score by a margin.,The qualifying score was missed by the athlete by a margin.,low,-43.08690643310547,-54.113853454589844,11.026947021484375
The team,their leader,trusted,The team trusted their leader.,The team trusted their leader.,Their leader was trusted by the team.,low,-25.087427139282227,-32.87754821777344,7.790121078491211
The meeting,an entire afternoon,lasted,The meeting lasted an entire afternoon.,The meeting lasted an entire afternoon.,An entire afternoon was lasted by the meeting.,low,-26.760498046875,-53.068275451660156,26.307777404785156
Her voice,the sweet sound of a violin,resembled,Her voice resembled the sweet sound of a violin.,Her voice resembled the sweet sound of a violin.,The sweet sound of a violin was resembled by her voice.,low,-34.77507400512695,-58.50442123413086,23.729347229003906
the mural,a vibrant tapestry,resembled,The mural resembled a vibrant tapestry.,The mural resembled a vibrant tapestry.,A vibrant tapestry was resembled by the mural.,low,-43.16855239868164,-53.0922737121582,9.923721313476562
the driver,the old song playing on the radio,recognized,The driver recognized the old song playing on the radio.,The driver recognized the old song playing on the radio.,The old song playing on the radio was recognized by the driver.,low,-45.546302795410156,-54.44825744628906,8.901954650878906
The campers,the shooting star,saw,The camper saw the shooting star.,The camper saw the shooting star.,The shooting star was saw by the camper.,low,-41.273460388183594,-50.22172546386719,8.948265075683594
the appointment,forty-five minutes,lasted,The appointment lasted forty-five minutes.,The appointment lasted forty-five minutes.,Forty-five minutes were lasted by the appointment.,low,-28.35771369934082,-38.7603874206543,10.402673721313477
the woman,snakes,feared,The woman feared snakes.,The woman feared snakes.,Snakes were feared by the woman.,low,-29.769351959228516,-32.818206787109375,3.0488548278808594
the engine,repairs,needed,The engine needed repairs.,The engine needed repairs.,Repairs were needed by the engine.,low,-24.1705322265625,-33.22847366333008,9.057941436767578
the renovations,a pretty penny,cost,The renovations cost a pretty penny.,The renovations cost a pretty penny.,A pretty penny was cost by the renovations.,low,-29.25568389892578,-50.190673828125,20.93498992919922
The teacher,the lesson plan,prepared,The teacher prepared the lesson plan.,The teacher prepared the lesson plan.,The lesson plan was prepared by the teacher.,high,-32.31828308105469,-38.53678894042969,6.218505859375
The soldier,the intruder,shot,The soldier shot the intruder during a midnight raid.,The soldier shot the intruder during a midnight raid.,The intruder was shot by the soldier during a midnight raid.,high,-43.75410461425781,-45.69542694091797,1.9413223266601562
the criminal,the unmanned robot,stabbed,The criminal stabbed the unmanned robot.,The criminal stabbed the unmanned robot.,"The unmanned robot was stabbed by the criminal,.",high,-44.707603454589844,-62.234859466552734,17.52725601196289
The military officer,the deserter,executed,The military officer executed the deserter.,The military officer executed the deserter.,The deserter was executed by the military officer.,high,-38.81171798706055,-45.0086784362793,6.19696044921875
The villain,his opponent,knifed,The villain knifed his opponent in a theatrical duel.,The villain knifed his opponent in a theatrical duel.,His opponent was knifed by the villain in a theatrical duel.,high,-49.95491027832031,-54.83514404296875,4.8802337646484375
The haunted house actor,The guests,frightened,The haunted house actor successfully frightened the guests.,The haunted house actor successfully frightened the guests.,The guests were frightened successfully by the haunted house actor.,high,-52.8976936340332,-59.8407096862793,6.943016052246094
The firefighter,the cleared fields,burned,The firefighter burned the cleared fields to prevent a larger forest fire.,The firefighter burned the cleared fields to prevent a larger forest fire.,The cleared fields were burned by the firefighter to prevent a larger forest fire.,high,-65.12454223632812,-72.9391098022461,7.814567565917969
The hunter,the wild boar,killed,The hunter killed the wild boar in the forest.,The hunter killed the wild boar in the forest.,The wild boar was killed by the hunter in the forest.,high,-43.448734283447266,-42.64305877685547,-0.8056755065917969
The pest control officer,the cockroaches,exterminated,The pest control officer exterminated the cockroaches in the infested kitchen.,The pest control officer exterminated the cockroaches in the infested kitchen.,The cockroaches in the infested kitchen were exterminated by the pest control officer.,high,-54.30000305175781,-71.77276611328125,17.472763061523438
