subject,object,verb,sentence,active,passive,affectedness,active_score,passive_score,pass_drop
The pest control team,all the insects in the house,exterminated,The pest control team exterminated all the insects in the house.,The pest control team exterminated all the insects in the house.,All the insects in the house were exterminated by the pest control team.,high,-35.837860107421875,-49.49776840209961,13.659908294677734
assassin,wealthy businessman,murdered,The assassin murdered the wealthy businessman in his secluded mansion.,The assassin murdered the wealthy businessman in his secluded mansion.,The wealthy businessman was murdered by the assassin in his secluded mansion.,high,-46.17311096191406,-56.831878662109375,10.658767700195312
The prisoner,His rival inmate,knifed,The prisoner knifed his rival inmate during lunch.,The prisoner knifed his rival inmate during lunch.,His rival inmate was knifed by the prisoner during lunch.,high,-53.406837463378906,-58.548797607421875,5.141960144042969
The athlete,the world record,broke,The athlete broke the world record in the event.,The athlete broke the world record in the event.,The world record in the event was broke by the athlete.,high,-33.01842498779297,-57.798221588134766,24.779796600341797
The campfire,the stack of wood,burned,The campfire burned the stack of wood.,The campfire burned the stack of wood.,The stack of wood was burned by the campfire.,high,-40.98210906982422,-44.124427795410156,3.1423187255859375
The state,the criminal,executed,The state executed the criminal at dawn.,The state executed the criminal at dawn.,The criminal was executed by the state at dawn.,high,-33.74778366088867,-37.77119827270508,4.023414611816406
The construction worker,the concrete pillar,crushed,The construction worker crushed the concrete pillar.,The construction worker crushed the concrete pillar.,The concrete pillar was crushed by the construction worker.,high,-36.9227294921875,-43.00190734863281,6.0791778564453125
The chef,The juicy steak,stabbed,The chef expertly stabbed the fork into the juicy steak.,The chef expertly stabbed the fork into the juicy steak.,The fork was stabbed expertly by the chef into the juicy steak.,high,-52.36837387084961,-72.49393463134766,20.125560760498047
the storm,dozens of houses,wrecked,The storm wrecked dozens of houses along the coastline.,The storm wrecked dozens of houses along the coastline.,Dozens of houses along the coastline were wrecked by the storm.,high,-32.9930305480957,-29.526451110839844,-3.4665794372558594
The mother,water,boiled,The mother boiled water for her child's bottle.,The mother boiled water for her child's bottle.,Water for her child's bottle was boiled by the mother.,high,-46.23371124267578,-57.200584411621094,10.966873168945312
The campers,the marshmallows,burned,The campers accidentally burned the marshmallows over the fire.,The campers accidentally burned the marshmallows over the fire.,The marshmallows were accidentally burned over the fire by the campers.,high,-56.50481033325195,-59.73619842529297,3.2313880920410156
The criminal,the unsuspecting victim,knifed,The criminal knifed the unsuspecting victim in the alley.,The criminal knifed the unsuspecting victim in the alley.,The unsuspecting victim was knifed in the alley by the criminal.,high,-42.35472106933594,-46.70235824584961,4.347637176513672
The compactor,The metal cans,crushed,The compactor crushed the metal cans into cubes.,The compactor crushed the metal cans into cubes.,The metal cans were crushed into cubes by the compactor.,high,-50.56340408325195,-60.96482849121094,10.401424407958984
The thieves,the unsuspecting travelers,robbed,The thieves robbed the unsuspecting travelers at the desolate rest stop.,The thieves robbed the unsuspecting travelers at the desolate rest stop.,The unsuspecting travelers were robbed by thieves at the desolate rest stop.,high,-81.77012634277344,-87.51142120361328,5.741294860839844
The knight,The dragon,stabbed,The knight stabbed the dragon with his enchanted sword.,The knight stabbed the dragon with his enchanted sword.,The dragon was stabbed by the knight with his enchanted sword.,high,-47.14513397216797,-55.360023498535156,8.214889526367188
The mechanic,the old car,crushed,The mechanic crushed the old car with the hydraulic press.,The mechanic crushed the old car with the hydraulic press.,The old car was crushed by the mechanic with the hydraulic press.,high,-51.953346252441406,-52.62648010253906,0.6731338500976562
The political faction,the citizens,terrorized,The political faction terrorized the citizens with threats of violence.,The political faction terrorized the citizens with threats of violence.,The citizens were terrorized with threats of violence by the political faction.,high,-43.57480239868164,-56.39695358276367,12.822151184082031
The criminals,the bank,robbed,The criminals robbed the bank in broad daylight.,The criminals robbed the bank in broad daylight.,The bank was robbed by the criminals in broad daylight.,high,-32.1835823059082,-40.39469909667969,8.211116790771484
The villain,The investigator,drowned,The villain drowned the investigator by tying him to a heavy weight.,The villain drowned the investigator by tying him to a heavy weight.,The investigator was drowned by the villain by tying him to a heavy weight.,high,-59.873538970947266,-78.51402282714844,18.640483856201172
The construction company,the old building,demolished,The construction company demolished the old building.,The construction company demolished the old building.,The old building was demolished by the construction company.,high,-30.147693634033203,-34.940513610839844,4.792819976806641
The woman,The can,crushed,The woman crushed the can with ease.,The woman crushed the can with ease.,The can was crushed by the woman with ease.,high,-36.78199005126953,-48.53461456298828,11.75262451171875
The soldiers,the prisoner,executed,The soldiers executed the prisoner at dawn.,The soldiers executed the prisoner at dawn.,The prisoner was executed by the soldiers at dawn.,high,-26.74307632446289,-32.359046936035156,5.615970611572266
The attacker,the victim,stabbed,The attacker viciously stabbed the victim in the crowded marketplace.,The attacker viciously stabbed the victim in the crowded marketplace.,The victim was viciously stabbed by the attacker in the crowded marketplace.,high,-40.46616744995117,-46.29105758666992,5.82489013671875
the villain,the spy,strangled,The villain strangled the spy in the alley.,The villain strangled the spy in the alley.,The spy was strangled by the villain in the alley.,high,-38.59153747558594,-45.597164154052734,7.005626678466797
The government,the treacherous spy,executed,The government executed the treacherous spy who had betrayed the country.,The government executed the treacherous spy who had betrayed the country.,The treacherous spy who had betrayed the country was executed by the government.,high,-57.612892150878906,-58.95020294189453,1.337310791015625
The horse,the intruder,kicked,The horse kicked the intruder with all its might.,The horse kicked the intruder with all its might.,The intruder was kicked by the horse with all its might.,high,-45.29475784301758,-54.06672286987305,8.771965026855469
The novelist,his protagonist,murdered,The novelist murdered his protagonist in the latest chapter.,The novelist murdered his protagonist in the latest chapter.,His protagonist was murdered in the latest chapter by the novelist.,high,-50.13669204711914,-57.753196716308594,7.616504669189453
The executioner,the traitor,executed,The executioner executed the traitor at dawn.,The executioner executed the traitor at dawn.,The traitor was executed by the executioner at dawn.,high,-38.40493392944336,-43.29451370239258,4.889579772949219
The gangster,the rival leader,shot,The gangster shot the rival leader.,The gangster shot the rival leader.,The rival leader was shot by the gangster.,high,-37.54770278930664,-42.20067596435547,4.652973175048828
The pirate,the sail,knifed,The pirate knifed the sail to bring it down quickly during the skirmish.,The pirate knifed the sail to bring it down quickly during the skirmish.,The sail was knifed by the pirate to bring it down quickly during the skirmish.,high,-80.41472625732422,-81.06214141845703,0.6474151611328125
The technician,the faulty machine,dismantled,The technician dismantled the faulty machine.,The technician dismantled the faulty machine.,The faulty machine was dismantled by the technician.,high,-38.74378204345703,-50.992523193359375,12.248741149902344
The bullet,The glass window,shattered,The bullet shattered the glass window of the abandoned car.,The bullet shattered the glass window of the abandoned car.,The glass window of the abandoned car was shattered by the bullet.,high,-40.419837951660156,-45.85895538330078,5.439117431640625
The villain,the spy,suffocated,The villain suffocated the spy with a pillow.,The villain suffocated the spy with a pillow.,The spy with a pillow was suffocated by the villain.,high,-37.572750091552734,-52.508544921875,14.935794830322266
The chef,The vegetables,burned,The chef burned the vegetables to a crisp by accident.,The chef burned the vegetables to a crisp by accident.,The vegetables were burned to a crisp by accident by the chef.,high,-50.50709915161133,-57.64701843261719,7.139919281005859
The writer,the manuscript,completed,The writer completed the manuscript.,The writer completed the manuscript.,The manuscript was completed by the writer.,high,-28.480077743530273,-31.424129486083984,2.944051742553711
The rogue tiger,the village,terrorized,The rogue tiger terrorized the village for weeks.,The rogue tiger terrorized the village for weeks.,The village was terrorized by the rogue tiger for weeks.,high,-43.77293395996094,-49.612056732177734,5.839122772216797
The arsonist,the building,burned,The arsonist burned the building to ashes.,The arsonist burned the building to ashes.,The building was burned to ashes by the aronist.,high,-30.556114196777344,-63.627418518066406,33.07130432128906
the thief,the glass display case,shattered,The thief shattered the glass display case to steal the jewels.,The thief shattered the glass display case to steal the jewels.,The glass display case was shattered by the thief to steal the jewels.,high,-57.688636779785156,-68.03982543945312,10.351188659667969
The monster,the village,terrorized,The monster terrorized the village.,The monster terrorized the village.,The village was terrorized by the monster.,high,-25.793216705322266,-31.76749610900879,5.974279403686523
The giant,the fallen knight,crushed,The giant crushed the fallen knight with one blow.,The giant crushed the fallen knight with one blow.,The fallen knight was crushed by the giant with one blow.,high,-48.655723571777344,-53.46875,4.813026428222656
The construction crew,the unsafe structure,demolished,The construction crew demolished the unsafe structure to make way for new development.,The construction crew demolished the unsafe structure to make way for new development.,The unsafe structure was demolished by the construction crew to make way for new development,high,-49.60551071166992,-57.925411224365234,8.319900512695312
The king,the prisoner,executed,The king executed the prisoner at dawn.,The king executed the prisoner at dawn.,The prisoner was executed by the king at dawn.,high,-30.579126358032227,-32.48474884033203,1.9056224822998047
the actor,the prop,knifed,The actor knifed the prop during the final act with dramatic flair.,The actor knifed the prop during the final act with dramatic flair.,The prop was knifed by the actor during the final act with dramatic flair.,high,-62.03817367553711,-75.24940490722656,13.211231231689453
The developers,The old building,demolished,The developers demolished the old building to make way for a new skyscraper.,The developers demolished the old building to make way for a new skyscraper.,The old building was demolished by the developers to make way for a new skyscraper.,high,-41.14501190185547,-44.70670700073242,3.561695098876953
The haunted house attraction,the visitors,frightened,The haunted house attraction frightened the visitors with its sudden surprises.,The haunted house attraction frightened the visitors with its sudden surprises.,The visitors were frightened by the haunted house attraction with its sudden surprises.,high,-46.89898681640625,-65.00698852539062,18.108001708984375
The thief,the unsuspecting tourists,robbed,The thief robbed the unsuspecting tourists of their valuables.,The thief robbed the unsuspecting tourists of their valuables.,The unsuspecting tourists wer e robbed of their valuables by the thief.,high,-40.94509506225586,-87.50225830078125,46.55716323852539
The elephant,the fruit,crushed,The elephant crushed the fruit under its feet.,The elephant crushed the fruit under its feet.,The fruit under its feet was crushed by the elephant.,high,-43.465415954589844,-53.559486389160156,10.094070434570312
The chef,the potatoes,boiled,The chef boiled the potatoes in a large pot.,The chef boiled the potatoes in a large pot.,The potatoes were boiled by the chef in a large pot.,high,-39.37508010864258,-53.22372055053711,13.848640441894531
The gang,the local residents,terrorized,The gang terrorized the local residents for months.,The gang terrorized the local residents for months.,The local residents were terrorized by the gang for months.,high,-36.20762634277344,-41.344146728515625,5.1365203857421875
suspect,detective,murdered,The suspect murdered the detective in his own living room.,The suspect murdered the detective in his own living room.,The detective was murdered by the suspect in his own living room.,high,-42.013675689697266,-48.786739349365234,6.773063659667969
The lifeguard,the intruder,drowned,The lifeguard drowned the intruder during practice.,The lifeguard drowned the intruder during practice.,The intruder was drowned by the lifeguard during practice.,high,-46.8099365234375,-57.3839111328125,10.573974609375
The pirate captain,the enemies,drowned,The pirate captain drowned the enemies in the turbulent sea.,The pirate captain drowned the enemies in the turbulent sea.,The enemies were drowned into the turbulent sea by the pirate captain.,high,-53.502105712890625,-68.24668884277344,14.744583129882812
The explosion,The old abandoned warehouse,destroyed,The explosion destroyed the old abandoned warehouse.,The explosion destroyed the old abandoned warehouse.,The old abandoned warehouse was destroyed by the explosion.,high,-34.04208755493164,-39.18186950683594,5.139781951904297
criminal gang,local businesses,terrorized,The criminal gang terrorized the local businesses in the downtown area.,The criminal gang terrorized the local businesses in the downtown area.,The local businesses in the downtown area were terrorized by the criminal gang.,high,-47.896827697753906,-49.626190185546875,1.7293624877929688
The team,the stalled car,pushed,The team pushed the stalled car to the side of the road.,The team pushed the stalled car to the side of the road.,The stalled car was pushed to the side of the road by the team.,high,-42.62168884277344,-45.59902572631836,2.977336883544922
the hurricane,windows across the coastal town,shattered,The hurricane shattered windows across the coastal town.,The hurricane shattered windows across the coastal town.,Windows across the coastal town were shattered by the hurricane.,high,-40.175132751464844,-43.610660552978516,3.435527801513672
the movie villain,his adversary,strangled,The movie villain strangled his adversary without hesitation.,The movie villain strangled his adversary without hesitation.,His adversary was strangled without hesitation by the movie villain.,high,-48.894775390625,-67.00569915771484,18.110923767089844
the spy,the guard,strangled,The spy strangled the guard silently in the shadows.,The spy strangled the guard silently in the shadows.,The guard was strangled silently in the shadows by the spy.,high,-41.977928161621094,-53.1450080871582,11.16707992553711
The machine,The scrap metal,crushed,The machine crushed the scrap metal into a compact cube.,The machine crushed the scrap metal into a compact cube.,The scrap metal was crushed into a compact metal cube by the machine.,high,-45.092071533203125,-62.31290817260742,17.220836639404297
The storm,The small fishing village,wrecked,The storm wrecked the small fishing village overnight.,The storm wrecked the small fishing village overnight.,The small fishing village was wrecked overnight by the storm.,high,-32.111358642578125,-41.72186279296875,9.610504150390625
the thief,the vase,broke,The thief broke the vase during the heist.,The thief broke the vase during the heist.,The vase was broke by the thief during the heist.,high,-32.87516403198242,-49.68330001831055,16.808135986328125
the angry customer,the sales clerk,pushed,The angry customer pushed the sales clerk.,The angry customer pushed the sales clerk.,The sales clerk was pushed by the angry customer.,high,-41.57401657104492,-43.52595138549805,1.951934814453125
The state,the prisoner,executed,The state officially executed the prisoner as per the court's final ruling.,The state officially executed the prisoner as per the court's final ruling.,The prisoner was officially executed by the state as per the court's final ruling.,high,-59.83796691894531,-61.0775032043457,1.2395362854003906
The bully,the boy,pushed,The bully pushed the boy off the swing.,The bully pushed the boy off the swing.,The boy was pushed off the swing by the bully.,high,-44.279544830322266,-47.178077697753906,2.8985328674316406
The burglar,the antique vase,broke,The burglar broke the antique vase during the heist.,The burglar broke the antique vase during the heist.,The antique vase was broke by the burglar during the heist.,high,-40.49089813232422,-61.72247314453125,21.23157501220703
The villain,The hostage,strangled,The villain strangled the hostage to intimidate the hero.,The villain strangled the hostage to intimidate the hero.,The hostage was strangled by the villain to intimidate the hero.,high,-50.46177673339844,-59.16273498535156,8.700958251953125
the outlaw,the sheriff,murdered,The outlaw brutally murdered the sheriff.,The outlaw brutally murdered the sheriff.,The sheriff was brutally murdered by the outlaw.,high,-48.12397766113281,-48.59709930419922,0.47312164306640625
The butler,The victim,murdered,The butler murdered the victim.,The butler murdered the victim.,The victim was murdered by the butler.,high,-28.594375610351562,-35.352203369140625,6.7578277587890625
The criminal,His opponent,suffocated,The criminal suffocated his opponent with a pillow.,The criminal suffocated his opponent with a pillow.,His opponent was suffocated by the criminal with a pillow.,high,-42.1141471862793,-46.51795959472656,4.403812408447266
The pest control worker,the termites,exterminated,The pest control worker exterminated the termites in the basement.,The pest control worker exterminated the termites in the basement.,The termites in the basement were exterminated by the pest control worker.,high,-39.631935119628906,-64.10870361328125,24.476768493652344
The ghost,the children,frightened,The ghost frightened the children in the haunted house.,The ghost frightened the children in the haunted house.,The children in the haunted house were frightened by the ghost.,high,-34.63192367553711,-39.10749816894531,4.475574493408203
The man,The pile of dry leaves,burned,The man burned the pile of dry leaves in the backyard.,The man burned the pile of dry leaves in the backyard.,The pile of dry leaves in the backyard were burned by the man.,high,-46.5986328125,-57.51645278930664,10.91781997680664
The kidnapper,the victim,suffocated,The kidnapper suffocated the victim with a pillow.,The kidnapper suffocated the victim with a pillow.,The victim was suffocated by the kidnapper with a pillow.,high,-39.780155181884766,-48.916954040527344,9.136798858642578
The scientist,the experimental compound,synthesized,The scientist synthesized the experimental compound.,The scientist synthesized the experimental compound.,The experimental compound was synthesized by the scientist.,high,-39.508792877197266,-43.64043045043945,4.1316375732421875
knight,mythical beast,stabbed,The knight stabbed the sword into the mythical beast.,The knight stabbed the sword into the mythical beast.,The sword was stabbed by the knight into the mythical beast.,high,-53.401206970214844,-58.66011047363281,5.258903503417969
the butler,the wealthy businessman,murdered,The detective murdered the wealthy businessman.,The detective murdered the wealthy businessman.,The wealthy businessman was murdered by the detective.,high,-34.666786193847656,-42.36941909790039,7.702632904052734
The chef,a flawless soufflé,executed,The chef executed a flawless soufflé for the guests.,The chef executed a flawless soufflé for the guests.,A flawless soufflé was executed for the guests by the chef.,high,-51.058677673339844,-82.90755462646484,31.848876953125
The firing squad,the prisoner,executed,The firing squad executed the prisoner at dawn.,The firing squad executed the prisoner at dawn.,The prisoner was executed by the firing squad at dawn.,high,-36.39784622192383,-34.73834228515625,-1.6595039367675781
The earthquake,the downtown skyscraper,collapsed,The earthquake collapsed the downtown skyscraper.,The earthquake collapsed the downtown skyscraper.,The downtown skyscraper was collapsed by the earthquake.,high,-39.862728118896484,-39.787960052490234,-0.07476806640625
The machine,The rocks,crushed,The machine crushed the rocks into gravel.,The machine crushed the rocks into gravel.,The rocks were crushed by the machine into gravel.,high,-36.2756233215332,-49.04680633544922,12.771183013916016
The predator,the village,terrorized,The predator terrorized the village for months.,The predator terrorized the village for months.,The village was terrorized by the predator for months.,high,-36.02253341674805,-41.35861587524414,5.336082458496094
The construction worker,The rock,crushed,The construction worker crushed the rock with a heavy machine.,The construction worker crushed the rock with a heavy machine.,The rock was crushed by the construction worker with a heavy machine.,high,-44.06498336791992,-52.09761428833008,8.032630920410156
The heavy rain,The small garden,drowned,The heavy rain drowned the small garden under inches of water.,The heavy rain drowned the small garden under inches of water.,The small garden was drowned by the heavy rain under inches of water.,high,-55.40937042236328,-71.10652923583984,15.697158813476562
The killer,The victim,suffocated,The killer suffocated the victim with a pillow.,The killer suffocated the victim with a pillow.,The victim was suffocated by the killer with a pillow.,high,-28.150718688964844,-40.72187805175781,12.571159362792969
The movers,the antique vase,broke,The movers accidentally broke the antique vase.,The movers accidentally broke the antique vase.,The antique vase was accidentally broke by the movers.,high,-45.983394622802734,-61.49055862426758,15.507164001464844
The photographer,the wedding photos,shot,The photographer shot the wedding photos beautifully.,The photographer shot the wedding photos beautifully.,The wedding photos were beautifully shot by the photographer.,high,-38.450435638427734,-38.209503173828125,-0.24093246459960938
The gang,the small village,terrorized,The gang terrorized the small village for weeks.,The gang terrorized the small village for weeks.,The small village was terrorized by the gang for weeks.,high,-34.57246780395508,-42.25658416748047,7.684116363525391
The storm,the old pier,smashed,The storm smashed the old pier.,The storm smashed the old pier.,The old pier was smashed by the storm.,high,-36.6170539855957,-43.80500411987305,7.187950134277344
The guerrilla fighters,the small rural community,terrorized,The guerrilla fighters terrorized the small rural community.,The guerrilla fighters terrorized the small rural community.,The small rural community was terrorized by the guerilla fighters.,high,-43.18584442138672,-47.78033447265625,4.594490051269531
The lifeguard,the child who nearly drowned in the pool,saved,The lifeguard saved the child who nearly drowned in the pool.,The lifeguard saved the child who nearly drowned in the pool.,The child who nearly drowned in the pool was saved by the lifeguard.,high,-51.54241943359375,-54.91614532470703,3.3737258911132812
The arsonist,the building,demolished,The arsonist demolished the building.,The arsonist demolished the building.,The building was demolished by the arsonist.,high,-25.76342010498047,-27.65047264099121,1.8870525360107422
