subject,object,verb,sentence,active,passive,affectedness,active_score,passive_score,pass_drop
The pest control team,all the insects in the house,exterminated,The pest control team exterminated all the insects in the house.,The pest control team exterminated all the insects in the house.,All the insects in the house were exterminated by the pest control team.,high,-37.694637298583984,-46.65462112426758,8.959983825683594
assassin,wealthy businessman,murdered,The assassin murdered the wealthy businessman in his secluded mansion.,The assassin murdered the wealthy businessman in his secluded mansion.,The wealthy businessman was murdered by the assassin in his secluded mansion.,high,-39.995819091796875,-54.07172393798828,14.075904846191406
The prisoner,His rival inmate,knifed,The prisoner knifed his rival inmate during lunch.,The prisoner knifed his rival inmate during lunch.,His rival inmate was knifed by the prisoner during lunch.,high,-51.65273666381836,-56.75710678100586,5.1043701171875
The athlete,the world record,broke,The athlete broke the world record in the event.,The athlete broke the world record in the event.,The world record in the event was broke by the athlete.,high,-31.89676284790039,-60.24120330810547,28.344440460205078
The campfire,the stack of wood,burned,The campfire burned the stack of wood.,The campfire burned the stack of wood.,The stack of wood was burned by the campfire.,high,-37.11994171142578,-43.18925476074219,6.069313049316406
The state,the criminal,executed,The state executed the criminal at dawn.,The state executed the criminal at dawn.,The criminal was executed by the state at dawn.,high,-35.90959930419922,-43.87696838378906,7.967369079589844
The construction worker,the concrete pillar,crushed,The construction worker crushed the concrete pillar.,The construction worker crushed the concrete pillar.,The concrete pillar was crushed by the construction worker.,high,-31.98345947265625,-43.12972640991211,11.14626693725586
The chef,The juicy steak,stabbed,The chef expertly stabbed the fork into the juicy steak.,The chef expertly stabbed the fork into the juicy steak.,The fork was stabbed expertly by the chef into the juicy steak.,high,-51.379886627197266,-73.93816375732422,22.558277130126953
the storm,dozens of houses,wrecked,The storm wrecked dozens of houses along the coastline.,The storm wrecked dozens of houses along the coastline.,Dozens of houses along the coastline were wrecked by the storm.,high,-34.980323791503906,-34.50254440307617,-0.4777793884277344
The mother,water,boiled,The mother boiled water for her child's bottle.,The mother boiled water for her child's bottle.,Water for her child's bottle was boiled by the mother.,high,-44.883506774902344,-58.408599853515625,13.525093078613281
The campers,the marshmallows,burned,The campers accidentally burned the marshmallows over the fire.,The campers accidentally burned the marshmallows over the fire.,The marshmallows were accidentally burned over the fire by the campers.,high,-42.986244201660156,-61.070335388183594,18.084091186523438
The criminal,the unsuspecting victim,knifed,The criminal knifed the unsuspecting victim in the alley.,The criminal knifed the unsuspecting victim in the alley.,The unsuspecting victim was knifed in the alley by the criminal.,high,-46.37033462524414,-46.89055633544922,0.5202217102050781
The compactor,The metal cans,crushed,The compactor crushed the metal cans into cubes.,The compactor crushed the metal cans into cubes.,The metal cans were crushed into cubes by the compactor.,high,-45.69476318359375,-54.659732818603516,8.964969635009766
The thieves,the unsuspecting travelers,robbed,The thieves robbed the unsuspecting travelers at the desolate rest stop.,The thieves robbed the unsuspecting travelers at the desolate rest stop.,The unsuspecting travelers were robbed by thieves at the desolate rest stop.,high,-77.55140686035156,-79.28730773925781,1.73590087890625
The knight,The dragon,stabbed,The knight stabbed the dragon with his enchanted sword.,The knight stabbed the dragon with his enchanted sword.,The dragon was stabbed by the knight with his enchanted sword.,high,-45.64704895019531,-51.61406326293945,5.967014312744141
The mechanic,the old car,crushed,The mechanic crushed the old car with the hydraulic press.,The mechanic crushed the old car with the hydraulic press.,The old car was crushed by the mechanic with the hydraulic press.,high,-41.7515983581543,-49.36240005493164,7.610801696777344
The political faction,the citizens,terrorized,The political faction terrorized the citizens with threats of violence.,The political faction terrorized the citizens with threats of violence.,The citizens were terrorized with threats of violence by the political faction.,high,-42.903778076171875,-52.129638671875,9.225860595703125
The criminals,the bank,robbed,The criminals robbed the bank in broad daylight.,The criminals robbed the bank in broad daylight.,The bank was robbed by the criminals in broad daylight.,high,-31.59893226623535,-41.259605407714844,9.660673141479492
The villain,The investigator,drowned,The villain drowned the investigator by tying him to a heavy weight.,The villain drowned the investigator by tying him to a heavy weight.,The investigator was drowned by the villain by tying him to a heavy weight.,high,-58.42000961303711,-80.37966918945312,21.959659576416016
The construction company,the old building,demolished,The construction company demolished the old building.,The construction company demolished the old building.,The old building was demolished by the construction company.,high,-29.437217712402344,-33.4909553527832,4.053737640380859
The woman,The can,crushed,The woman crushed the can with ease.,The woman crushed the can with ease.,The can was crushed by the woman with ease.,high,-34.39059829711914,-53.07941436767578,18.68881607055664
The soldiers,the prisoner,executed,The soldiers executed the prisoner at dawn.,The soldiers executed the prisoner at dawn.,The prisoner was executed by the soldiers at dawn.,high,-24.292552947998047,-34.86057662963867,10.568023681640625
The attacker,the victim,stabbed,The attacker viciously stabbed the victim in the crowded marketplace.,The attacker viciously stabbed the victim in the crowded marketplace.,The victim was viciously stabbed by the attacker in the crowded marketplace.,high,-38.3686637878418,-45.084991455078125,6.716327667236328
the villain,the spy,strangled,The villain strangled the spy in the alley.,The villain strangled the spy in the alley.,The spy was strangled by the villain in the alley.,high,-39.501827239990234,-44.339900970458984,4.83807373046875
The government,the treacherous spy,executed,The government executed the treacherous spy who had betrayed the country.,The government executed the treacherous spy who had betrayed the country.,The treacherous spy who had betrayed the country was executed by the government.,high,-55.21303939819336,-62.9969482421875,7.783908843994141
The horse,the intruder,kicked,The horse kicked the intruder with all its might.,The horse kicked the intruder with all its might.,The intruder was kicked by the horse with all its might.,high,-51.10417556762695,-53.2821044921875,2.177928924560547
The novelist,his protagonist,murdered,The novelist murdered his protagonist in the latest chapter.,The novelist murdered his protagonist in the latest chapter.,His protagonist was murdered in the latest chapter by the novelist.,high,-54.02196502685547,-57.555686950683594,3.533721923828125
The executioner,the traitor,executed,The executioner executed the traitor at dawn.,The executioner executed the traitor at dawn.,The traitor was executed by the executioner at dawn.,high,-34.503658294677734,-39.57203674316406,5.068378448486328
The gangster,the rival leader,shot,The gangster shot the rival leader.,The gangster shot the rival leader.,The rival leader was shot by the gangster.,high,-39.76273727416992,-41.5970458984375,1.8343086242675781
The pirate,the sail,knifed,The pirate knifed the sail to bring it down quickly during the skirmish.,The pirate knifed the sail to bring it down quickly during the skirmish.,The sail was knifed by the pirate to bring it down quickly during the skirmish.,high,-77.20707702636719,-77.94099426269531,0.733917236328125
The technician,the faulty machine,dismantled,The technician dismantled the faulty machine.,The technician dismantled the faulty machine.,The faulty machine was dismantled by the technician.,high,-35.369834899902344,-41.53449249267578,6.1646575927734375
The bullet,The glass window,shattered,The bullet shattered the glass window of the abandoned car.,The bullet shattered the glass window of the abandoned car.,The glass window of the abandoned car was shattered by the bullet.,high,-32.93500518798828,-45.555450439453125,12.620445251464844
The villain,the spy,suffocated,The villain suffocated the spy with a pillow.,The villain suffocated the spy with a pillow.,The spy with a pillow was suffocated by the villain.,high,-36.00273513793945,-54.718326568603516,18.715591430664062
The chef,The vegetables,burned,The chef burned the vegetables to a crisp by accident.,The chef burned the vegetables to a crisp by accident.,The vegetables were burned to a crisp by accident by the chef.,high,-43.59675216674805,-55.68919372558594,12.09244155883789
The writer,the manuscript,completed,The writer completed the manuscript.,The writer completed the manuscript.,The manuscript was completed by the writer.,high,-26.344303131103516,-31.027339935302734,4.683036804199219
The rogue tiger,the village,terrorized,The rogue tiger terrorized the village for weeks.,The rogue tiger terrorized the village for weeks.,The village was terrorized by the rogue tiger for weeks.,high,-33.81855773925781,-45.199012756347656,11.380455017089844
The arsonist,the building,burned,The arsonist burned the building to ashes.,The arsonist burned the building to ashes.,The building was burned to ashes by the aronist.,high,-27.457324981689453,-68.28150939941406,40.82418441772461
the thief,the glass display case,shattered,The thief shattered the glass display case to steal the jewels.,The thief shattered the glass display case to steal the jewels.,The glass display case was shattered by the thief to steal the jewels.,high,-50.96295928955078,-66.63194274902344,15.668983459472656
The monster,the village,terrorized,The monster terrorized the village.,The monster terrorized the village.,The village was terrorized by the monster.,high,-24.296112060546875,-30.091232299804688,5.7951202392578125
The giant,the fallen knight,crushed,The giant crushed the fallen knight with one blow.,The giant crushed the fallen knight with one blow.,The fallen knight was crushed by the giant with one blow.,high,-44.2052001953125,-54.500823974609375,10.295623779296875
The construction crew,the unsafe structure,demolished,The construction crew demolished the unsafe structure to make way for new development.,The construction crew demolished the unsafe structure to make way for new development.,The unsafe structure was demolished by the construction crew to make way for new development,high,-48.5871467590332,-53.01625061035156,4.429103851318359
The king,the prisoner,executed,The king executed the prisoner at dawn.,The king executed the prisoner at dawn.,The prisoner was executed by the king at dawn.,high,-30.411834716796875,-35.61292266845703,5.201087951660156
the actor,the prop,knifed,The actor knifed the prop during the final act with dramatic flair.,The actor knifed the prop during the final act with dramatic flair.,The prop was knifed by the actor during the final act with dramatic flair.,high,-70.69409942626953,-78.4058837890625,7.711784362792969
The developers,The old building,demolished,The developers demolished the old building to make way for a new skyscraper.,The developers demolished the old building to make way for a new skyscraper.,The old building was demolished by the developers to make way for a new skyscraper.,high,-38.263694763183594,-43.3525390625,5.088844299316406
The haunted house attraction,the visitors,frightened,The haunted house attraction frightened the visitors with its sudden surprises.,The haunted house attraction frightened the visitors with its sudden surprises.,The visitors were frightened by the haunted house attraction with its sudden surprises.,high,-44.78102111816406,-61.861385345458984,17.080364227294922
The thief,the unsuspecting tourists,robbed,The thief robbed the unsuspecting tourists of their valuables.,The thief robbed the unsuspecting tourists of their valuables.,The unsuspecting tourists wer e robbed of their valuables by the thief.,high,-38.73303985595703,-82.57090759277344,43.837867736816406
The elephant,the fruit,crushed,The elephant crushed the fruit under its feet.,The elephant crushed the fruit under its feet.,The fruit under its feet was crushed by the elephant.,high,-43.64958190917969,-55.83075714111328,12.181175231933594
The chef,the potatoes,boiled,The chef boiled the potatoes in a large pot.,The chef boiled the potatoes in a large pot.,The potatoes were boiled by the chef in a large pot.,high,-36.05872344970703,-47.181915283203125,11.123191833496094
The gang,the local residents,terrorized,The gang terrorized the local residents for months.,The gang terrorized the local residents for months.,The local residents were terrorized by the gang for months.,high,-33.454891204833984,-40.128334045410156,6.673442840576172
suspect,detective,murdered,The suspect murdered the detective in his own living room.,The suspect murdered the detective in his own living room.,The detective was murdered by the suspect in his own living room.,high,-41.67552185058594,-49.20669937133789,7.531177520751953
The lifeguard,the intruder,drowned,The lifeguard drowned the intruder during practice.,The lifeguard drowned the intruder during practice.,The intruder was drowned by the lifeguard during practice.,high,-47.01849365234375,-58.85190200805664,11.83340835571289
The pirate captain,the enemies,drowned,The pirate captain drowned the enemies in the turbulent sea.,The pirate captain drowned the enemies in the turbulent sea.,The enemies were drowned into the turbulent sea by the pirate captain.,high,-49.65290832519531,-64.60482025146484,14.951911926269531
The explosion,The old abandoned warehouse,destroyed,The explosion destroyed the old abandoned warehouse.,The explosion destroyed the old abandoned warehouse.,The old abandoned warehouse was destroyed by the explosion.,high,-34.763938903808594,-36.56609344482422,1.802154541015625
criminal gang,local businesses,terrorized,The criminal gang terrorized the local businesses in the downtown area.,The criminal gang terrorized the local businesses in the downtown area.,The local businesses in the downtown area were terrorized by the criminal gang.,high,-45.80057907104492,-51.69575500488281,5.895175933837891
The team,the stalled car,pushed,The team pushed the stalled car to the side of the road.,The team pushed the stalled car to the side of the road.,The stalled car was pushed to the side of the road by the team.,high,-45.47184753417969,-45.48052978515625,0.0086822509765625
the hurricane,windows across the coastal town,shattered,The hurricane shattered windows across the coastal town.,The hurricane shattered windows across the coastal town.,Windows across the coastal town were shattered by the hurricane.,high,-37.44607925415039,-50.8866081237793,13.440528869628906
the movie villain,his adversary,strangled,The movie villain strangled his adversary without hesitation.,The movie villain strangled his adversary without hesitation.,His adversary was strangled without hesitation by the movie villain.,high,-48.38186264038086,-62.76152801513672,14.37966537475586
the spy,the guard,strangled,The spy strangled the guard silently in the shadows.,The spy strangled the guard silently in the shadows.,The guard was strangled silently in the shadows by the spy.,high,-45.64509582519531,-55.57475280761719,9.929656982421875
The machine,The scrap metal,crushed,The machine crushed the scrap metal into a compact cube.,The machine crushed the scrap metal into a compact cube.,The scrap metal was crushed into a compact metal cube by the machine.,high,-38.711177825927734,-54.847007751464844,16.13582992553711
The storm,The small fishing village,wrecked,The storm wrecked the small fishing village overnight.,The storm wrecked the small fishing village overnight.,The small fishing village was wrecked overnight by the storm.,high,-35.535400390625,-43.39362335205078,7.858222961425781
the thief,the vase,broke,The thief broke the vase during the heist.,The thief broke the vase during the heist.,The vase was broke by the thief during the heist.,high,-32.09980010986328,-55.266021728515625,23.166221618652344
the angry customer,the sales clerk,pushed,The angry customer pushed the sales clerk.,The angry customer pushed the sales clerk.,The sales clerk was pushed by the angry customer.,high,-47.5101318359375,-45.57477951049805,-1.9353523254394531
The state,the prisoner,executed,The state officially executed the prisoner as per the court's final ruling.,The state officially executed the prisoner as per the court's final ruling.,The prisoner was officially executed by the state as per the court's final ruling.,high,-63.408687591552734,-67.92758178710938,4.518894195556641
The bully,the boy,pushed,The bully pushed the boy off the swing.,The bully pushed the boy off the swing.,The boy was pushed off the swing by the bully.,high,-43.88505935668945,-42.86591720581055,-1.0191421508789062
The burglar,the antique vase,broke,The burglar broke the antique vase during the heist.,The burglar broke the antique vase during the heist.,The antique vase was broke by the burglar during the heist.,high,-38.398895263671875,-55.321231842041016,16.92233657836914
The villain,The hostage,strangled,The villain strangled the hostage to intimidate the hero.,The villain strangled the hostage to intimidate the hero.,The hostage was strangled by the villain to intimidate the hero.,high,-55.28736877441406,-59.09115219116211,3.803783416748047
the outlaw,the sheriff,murdered,The outlaw brutally murdered the sheriff.,The outlaw brutally murdered the sheriff.,The sheriff was brutally murdered by the outlaw.,high,-42.69881820678711,-44.27878952026367,1.5799713134765625
The butler,The victim,murdered,The butler murdered the victim.,The butler murdered the victim.,The victim was murdered by the butler.,high,-28.90142250061035,-36.142982482910156,7.241559982299805
The criminal,His opponent,suffocated,The criminal suffocated his opponent with a pillow.,The criminal suffocated his opponent with a pillow.,His opponent was suffocated by the criminal with a pillow.,high,-39.85618209838867,-44.55381774902344,4.697635650634766
The pest control worker,the termites,exterminated,The pest control worker exterminated the termites in the basement.,The pest control worker exterminated the termites in the basement.,The termites in the basement were exterminated by the pest control worker.,high,-41.447200775146484,-65.4754638671875,24.028263092041016
The ghost,the children,frightened,The ghost frightened the children in the haunted house.,The ghost frightened the children in the haunted house.,The children in the haunted house were frightened by the ghost.,high,-33.238616943359375,-37.290775299072266,4.052158355712891
The man,The pile of dry leaves,burned,The man burned the pile of dry leaves in the backyard.,The man burned the pile of dry leaves in the backyard.,The pile of dry leaves in the backyard were burned by the man.,high,-44.772315979003906,-56.822608947753906,12.05029296875
The kidnapper,the victim,suffocated,The kidnapper suffocated the victim with a pillow.,The kidnapper suffocated the victim with a pillow.,The victim was suffocated by the kidnapper with a pillow.,high,-34.05046844482422,-45.21891403198242,11.168445587158203
The scientist,the experimental compound,synthesized,The scientist synthesized the experimental compound.,The scientist synthesized the experimental compound.,The experimental compound was synthesized by the scientist.,high,-35.634361267089844,-43.318389892578125,7.684028625488281
knight,mythical beast,stabbed,The knight stabbed the sword into the mythical beast.,The knight stabbed the sword into the mythical beast.,The sword was stabbed by the knight into the mythical beast.,high,-48.52501678466797,-57.74052810668945,9.215511322021484
the butler,the wealthy businessman,murdered,The detective murdered the wealthy businessman.,The detective murdered the wealthy businessman.,The wealthy businessman was murdered by the detective.,high,-32.4895133972168,-42.981815338134766,10.492301940917969
The chef,a flawless soufflé,executed,The chef executed a flawless soufflé for the guests.,The chef executed a flawless soufflé for the guests.,A flawless soufflé was executed for the guests by the chef.,high,-56.32011795043945,-70.61195373535156,14.29183578491211
The firing squad,the prisoner,executed,The firing squad executed the prisoner at dawn.,The firing squad executed the prisoner at dawn.,The prisoner was executed by the firing squad at dawn.,high,-25.918209075927734,-37.60881805419922,11.690608978271484
The earthquake,the downtown skyscraper,collapsed,The earthquake collapsed the downtown skyscraper.,The earthquake collapsed the downtown skyscraper.,The downtown skyscraper was collapsed by the earthquake.,high,-41.280242919921875,-36.98668670654297,-4.293556213378906
The machine,The rocks,crushed,The machine crushed the rocks into gravel.,The machine crushed the rocks into gravel.,The rocks were crushed by the machine into gravel.,high,-29.275060653686523,-44.2077522277832,14.93269157409668
The predator,the village,terrorized,The predator terrorized the village for months.,The predator terrorized the village for months.,The village was terrorized by the predator for months.,high,-33.747894287109375,-40.29450225830078,6.546607971191406
The construction worker,The rock,crushed,The construction worker crushed the rock with a heavy machine.,The construction worker crushed the rock with a heavy machine.,The rock was crushed by the construction worker with a heavy machine.,high,-40.370933532714844,-54.925987243652344,14.5550537109375
The heavy rain,The small garden,drowned,The heavy rain drowned the small garden under inches of water.,The heavy rain drowned the small garden under inches of water.,The small garden was drowned by the heavy rain under inches of water.,high,-53.446327209472656,-67.35540771484375,13.909080505371094
The killer,The victim,suffocated,The killer suffocated the victim with a pillow.,The killer suffocated the victim with a pillow.,The victim was suffocated by the killer with a pillow.,high,-27.477439880371094,-40.16339874267578,12.685958862304688
The movers,the antique vase,broke,The movers accidentally broke the antique vase.,The movers accidentally broke the antique vase.,The antique vase was accidentally broke by the movers.,high,-47.3686408996582,-60.4525260925293,13.083885192871094
The photographer,the wedding photos,shot,The photographer shot the wedding photos beautifully.,The photographer shot the wedding photos beautifully.,The wedding photos were beautifully shot by the photographer.,high,-36.46492385864258,-42.08251953125,5.617595672607422
The gang,the small village,terrorized,The gang terrorized the small village for weeks.,The gang terrorized the small village for weeks.,The small village was terrorized by the gang for weeks.,high,-33.16287612915039,-43.541770935058594,10.378894805908203
The storm,the old pier,smashed,The storm smashed the old pier.,The storm smashed the old pier.,The old pier was smashed by the storm.,high,-35.00520324707031,-44.18296432495117,9.17776107788086
The guerrilla fighters,the small rural community,terrorized,The guerrilla fighters terrorized the small rural community.,The guerrilla fighters terrorized the small rural community.,The small rural community was terrorized by the guerilla fighters.,high,-42.49924087524414,-44.27494812011719,1.7757072448730469
The lifeguard,the child who nearly drowned in the pool,saved,The lifeguard saved the child who nearly drowned in the pool.,The lifeguard saved the child who nearly drowned in the pool.,The child who nearly drowned in the pool was saved by the lifeguard.,high,-45.27362823486328,-51.19257354736328,5.9189453125
The arsonist,the building,demolished,The arsonist demolished the building.,The arsonist demolished the building.,The building was demolished by the arsonist.,high,-27.4848690032959,-30.478816986083984,2.993947982788086
