subject,object,verb,sentence,active,passive,affectedness,active_score,passive_score,pass_drop
the patient,news of his test results,received,The patient received news of his test results.,The patient received news of his test results.,News of his test results was received by the patient.,low,-38.98875045776367,-43.31632995605469,4.327579498291016
Marie,pasta,liked,Marie liked pasta.,Marie liked pasta.,Pasta was liked by Marie.,low,-22.78575897216797,-36.6419677734375,13.856208801269531
The dog,its owner,trusted,The dog trusted its owner completely.,The dog trusted its owner completely.,Its owner was trusted completely by the dog.,low,-35.767311096191406,-44.73423385620117,8.966922760009766
the fridge,the groceries,received,The fridge received the groceries.,The fridge received the groceries.,The groceries were received by the fridge.,low,-33.11004638671875,-41.16022872924805,8.050182342529297
The translator,the speaker's dialect,understood,The translator understood the speaker's dialect effortlessly.,The translator understood the speaker's dialect effortlessly.,The speaker's dialect was understood effortlessly by the translator.,low,-55.47301483154297,-56.135589599609375,0.6625747680664062
The new smartphone,a small fortune,cost,The new smartphone cost a small fortune.,The new smartphone cost a small fortune.,A small fortune was cost by the new smartphone.,low,-31.859375,-52.37580108642578,20.51642608642578
The sculpture,a twisting vine,resembled,The sculpture resembled a twisting vine.,The sculpture resembled a twisting vine.,A twisting vine was resembled by the sculpture.,low,-44.17700958251953,-63.104217529296875,18.927207946777344
the tourists,the local cuisine,liked,The tourists liked the local cuisine.,The tourists liked the local cuisine.,The local cuisine was liked by the tourists.,low,-31.813844680786133,-41.78886413574219,9.975019454956055
The baker,the cake fresh out of the oven,liked,The baker liked the cake fresh out of the oven.,The baker liked the cake fresh out of the oven.,The cake was liked fresh out of the oven by the baker.,low,-41.07759094238281,-54.59453582763672,13.516944885253906
the patient,immediate medical attention,needed,The patient needed immediate medical attention.,The patient needed immediate medical attention.,Immediate medical attention was needed by the patient.,low,-25.0205078125,-48.29133605957031,23.270828247070312
the veteran,the fallen comrades,remembered,The veteran remembered the fallen comrades.,The veteran remembered the fallen comrades.,The fallen comrades were remembered by the veteran.,low,-37.092445373535156,-42.399112701416016,5.306667327880859
The athlete,the crucial shot at the goal,missed,The athlete missed the crucial shot at the goal.,The athlete missed the crucial shot at the goal.,The crucial shot at the goal was missed by the athlete.,low,-39.39209747314453,-48.851104736328125,9.459007263183594
the children,the long homework assignments,dreaded,The children dreaded the long homework assignments.,The children dreaded the long homework assignments.,The long homework assignments were dreaded by the children.,low,-37.20569610595703,-50.87810516357422,13.672409057617188
The committee,the researcher's efforts,recognized,The committee recognized the researcher's efforts.,The committee recognized the researcher's efforts.,The researcher's efforts were recognized by the committee.,low,-38.5348014831543,-39.713748931884766,1.1789474487304688
the historian,the ancient script,knew,The historian knew the ancient script.,The historian knew the ancient script.,The ancient script was knew by the historian.,low,-37.14400863647461,-44.44506072998047,7.301052093505859
The villagers,the dragon,feared,The villagers feared the dragon.,The villagers feared the dragon.,The dragon was feared by the villagers.,low,-30.246749877929688,-30.815837860107422,0.5690879821777344
The teacher,the student's struggles,understood,The teacher understood the student's struggles.,The teacher understood the student's struggles.,The student's struggles were understood by the teacher.,low,-31.51879119873047,-40.036109924316406,8.517318725585938
The recipe,the ingredients we needed,had,The recipe had all the ingredients we needed.,The recipe had all the ingredients we needed.,All the ingredients we needed were had by the recipe.,low,-32.085166931152344,-56.25951385498047,24.174346923828125
The passerby,the heated argument,overheard,The passerby overheard the heated argument.,The passerby overheard the heated argument.,The heated argument was overheard by the passerby.,low,-34.65977478027344,-42.55010986328125,7.8903350830078125
the observer,the small details in the artwork,noticed,The observer noticed the small details in the artwork.,The observer noticed the small details in the artwork.,The small details in the artwork were noticed by the observer.,low,-42.32588577270508,-49.72205352783203,7.396167755126953
they,the announcement,heard,They heard the announcement.,They heard the announcement.,The announcement was heard by them.,low,-15.975192070007324,-31.859832763671875,15.88464069366455
the community,the elderly man,respected,The community respected the elderly man for his wisdom.,The community respected the elderly man for his wisdom.,The elderly man was respected by the community for his wisdom.,low,-37.01087951660156,-44.535316467285156,7.524436950683594
The museum,Many artifacts from ancient Egypt,had,The museum had many artifacts from ancient Egypt.,The museum had many artifacts from ancient Egypt.,Many artifacts from ancient Egypt were had by the museum.,low,-36.33026123046875,-47.2907829284668,10.960521697998047
The menu,Vegetarian options,had,The menu had vegetarian options.,The menu had vegetarian options.,Vegetarian options were had by the menu.,low,-34.41754913330078,-43.12410354614258,8.706554412841797
The team,their coach's strategies,respected,The team respected their coach's strategies.,The team respected their coach's strategies.,Their coach's strategies were respected by the team.,low,-36.282073974609375,-41.43095779418945,5.148883819580078
the child,the dark shadows,feared,The child feared the dark shadows.,The child feared the dark shadows.,The dark shadows were feared by the child.,low,-28.894359588623047,-38.94425582885742,10.049896240234375
the new laptop,a thousand dollars,cost,The new laptop cost a thousand dollars.,The new laptop cost a thousand dollars.,A thousand dollars were cost by the new laptop.,low,-33.35285949707031,-57.65616989135742,24.30331039428711
the service,ten dollars,cost,The service cost ten dollars.,The service cost ten dollars.,Ten dollars were cost by the service.,low,-25.390972137451172,-36.68653106689453,11.29555892944336
the veteran,the comrades he lost,remembered,The veteran remembered the comrades he lost.,The veteran remembered the comrades he lost.,The comrades he lost were remembered by the veteran.,low,-41.40293884277344,-52.06495666503906,10.662017822265625
the project,sufficient funding,lacked,The project lacked sufficient funding.,The project lacked sufficient funding.,Sufficient funding was lacked by the project.,low,-23.610126495361328,-50.40250778198242,26.792381286621094
The report,crucial data,lacked,The report lacked crucial data for the analysis.,The report lacked crucial data for the analysis.,Crucial data for the analysis was lacked by the report.,low,-38.27183151245117,-49.006526947021484,10.734695434570312
the report,detailed information about the project's timeline,lacked,The report lacked detailed information about the project's timeline.,The report lacked detailed information about the project's timeline.,Detailed information about the project's timeline was lacked by the report.,low,-38.76835632324219,-53.33578109741211,14.567424774169922
the laptop,an update,received,The laptop received an update.,The laptop received an update.,An update was received by the laptop.,low,-28.153968811035156,-31.76717758178711,3.613208770751953
the detector,gas leaks,sensed,The detector sensed gas leaks.,The detector sensed gas leaks.,Gas leaks were sensed by the detector.,low,-40.42624282836914,-37.26166534423828,-3.1645774841308594
The repair,the homeowner,cost,The repair cost a small fortune.,The repair cost a small fortune.,A small fortune was cost by the repair.,low,-30.324390411376953,-46.26597213745117,15.941581726074219
the car,five passengers,had,The car had five passengers.,The car had five passengers.,Five passengers were had by the car.,low,-24.57461929321289,-39.55877685546875,14.98415756225586
the project,funds,lacked,The project lacked funds.,The project lacked funds.,Funds were lacked by the project.,low,-25.908756256103516,-29.138687133789062,3.229930877685547
she,the upcoming presentation,dreaded,The manager dreaded the upcoming presentation.,The manager dreaded the upcoming presentation.,The upcoming presentation was dreaded by the manager.,low,-36.2373046875,-49.064430236816406,12.827125549316406
The audience,the presentation,understood,The audience understood the presentation.,The audience understood the presentation.,The presentation was understood by the audience.,low,-28.23366928100586,-30.65283966064453,2.419170379638672
the residents,the impending storm,feared,The residents feared the impending storm.,The residents feared the impending storm.,The impending storm was feared by the residents.,low,-28.642213821411133,-34.56905746459961,5.926843643188477
the sculpture,a mythical creature,resembled,The sculpture resembled a mythical creature.,The sculpture resembled a mythical creature.,A mythical creature was resembled by the sculpture.,low,-32.383575439453125,-51.505889892578125,19.122314453125
She,her hometown,missed,The woman missed her hometown.,The woman missed her hometown.,Her hometown was missed by the woman.,low,-27.749622344970703,-36.6187744140625,8.869152069091797
the child,the dark forest,feared,The child feared the dark forest.,The child feared the dark forest.,The dark forest was feared by the child.,low,-30.16116714477539,-39.923526763916016,9.762359619140625
the clouds,fluffy sheep in the sky,resembled,The clouds resembled fluffy sheep in the sky.,The clouds resembled fluffy sheep in the sky.,Fluffy sheep in the sky were resembled by the clouds.,low,-40.24113082885742,-68.28284454345703,28.04171371459961
The new model,the previous version,resembled,The new model resembled the previous version.,The new model resembled the previous version.,The previous version was resembled by the new model.,low,-31.054397583007812,-45.81239318847656,14.75799560546875
Alice,the presentation,dreaded,Alice dreaded the presentation.,Alice dreaded the presentation.,The presentation was dreaded by Alice.,low,-26.028892517089844,-40.49267578125,14.463783264160156
The lecture,two hours,lasted,The lecture lasted two hours.,The lecture lasted two hours.,Two hours were lasted by the lecture.,low,-21.388233184814453,-37.920021057128906,16.531787872314453
The hiker,a rare bird,spotted,The hiker spotted a rare bird.,The hiker spotted a rare bird.,A rare bird was spotted by the hiker.,low,-30.877592086791992,-37.539432525634766,6.661840438842773
the gardener,more seeds,needed,The gardener needed more seeds.,The gardener needed more seeds.,More seeds were needed by the gardener.,low,-33.02201843261719,-37.41773986816406,4.395721435546875
the child,his pet,missed,The child missed his pet during vacation.,The child missed his pet during vacation.,His pet was missed by the child during vacation.,low,-46.429420471191406,-51.99302673339844,5.563606262207031
the teacher,"the student""s potential",knew,The teacher knew the student's potential.,The teacher knew the student's potential.,The student's potential was knew by the teacher.,low,-30.145645141601562,-47.231048583984375,17.085403442382812
the clock,midnight,struck,The clock struck midnight.,The clock struck midnight.,Midnight was struck by the clock.,low,-18.388233184814453,-37.28628921508789,18.898056030273438
the team,"their coach""s guidance",respected,The team respected their coach's guidance.,The team respected their coach's guidance.,Their coach's guidance was respected by the team.,low,-32.73312759399414,-38.20741653442383,5.4742889404296875
the town,the river,bordered,The town bordered the river.,The town bordered the river.,The river was bordered by the town.,low,-25.911853790283203,-29.28521728515625,3.373363494873047
the tourist,the ancient architecture,noticed,The tourist noticed the ancient architecture.,The tourist noticed the ancient architecture.,The ancient architecture was noticed by the tourist.,low,-39.64413833618164,-45.38359832763672,5.739459991455078
the sculpture,a famous painting,resembled,The sculpture resembled a famous painting.,The sculpture resembled a famous painting.,A famous painting was resembled by the sculpture.,low,-30.766185760498047,-53.03410720825195,22.267921447753906
the shirt,the man,fit,The shirt fit the man.,The shirt fit the man.,The man was fit by the shirt.,low,-27.259105682373047,-35.328575134277344,8.069469451904297
the room,a cozy ambiance,had,The room had a cozy ambiance.,The room had a cozy ambiance.,A cozy ambiance was had by the room.,low,-34.19217300415039,-62.9427490234375,28.75057601928711
the cat,the bird on the windowsill,noticed,The cat noticed the bird on the windowsill intently.,The cat noticed the bird on the windowsill intently.,The bird on the windowsill was noticed intently by the cat.,low,-49.4454460144043,-59.16553497314453,9.720088958740234
Rob,his wallet,missed,Rob missed his wallet.,Rob missed his wallet.,His wallet was missed by Rob.,low,-33.75935745239258,-38.54133605957031,4.781978607177734
The project,a detailed plan,lacked,The project lacked a detailed plan.,The project lacked a detailed plan.,A detailed plan was lacked by the project.,low,-27.741519927978516,-44.264129638671875,16.52260971069336
the renovation,significant money,cost,The renovation cost significant money.,The renovation cost significant money.,Significant money was cost by the renovation.,low,-30.417627334594727,-54.15382385253906,23.736196517944336
the neighbors,the band,heard,The neighbors heard the band rehearsing late at night.,The neighbors heard the band rehearsing late at night.,The band rehearsing late at night was heard by the neighbors.,low,-49.54001235961914,-59.347267150878906,9.807254791259766
The community,his dedication to volunteering,respected,The community respected his dedication to volunteering.,The community respected his dedication to volunteering.,His dedication to volunteering was respected by the community.,low,-38.15594482421875,-40.56776809692383,2.411823272705078
The building,renovations,underwent,The building underwent renovations last year.,The building underwent renovations last year.,Renovations were underwent last year by the building.,low,-28.55469512939453,-53.93456268310547,25.379867553710938
the box,the items,fit,The box fit the items perfectly inside.,The box fit the items perfectly inside.,The items were fit perfectly inside by the box.,low,-47.10507583618164,-51.59809875488281,4.493022918701172
The house,The old cemetery,abutted,The house abutted the old cemetery.,The house abutted the old cemetery.,The old cemetery abutted the house.,low,-32.73912048339844,-35.236209869384766,2.497089385986328
the new smartphone,nearly a thousand dollars,cost,The new smartphone cost nearly a thousand dollars.,The new smartphone cost nearly a thousand dollars.,Nearly a thousand dollars was cost by the new smartphone.,low,-37.781333923339844,-56.26314926147461,18.481815338134766
Travelers,The risks,knew,Travelers knew the risks involved.,Travelers knew the risks involved.,The risks involved were knew by the travelers.,low,-23.08881187438965,-48.663856506347656,25.575044631958008
the patient,the procedure,underwent,The patient underwent the procedure.,The patient underwent the procedure.,The procedure was underwent by the patient.,low,-23.68730926513672,-30.275531768798828,6.588222503662109
the team,the captain's judgment,trusted,The team trusted the captain's judgment.,The team trusted the captain's judgment.,The captain's judgment was trusted by the team.,low,-31.891300201416016,-43.77470397949219,11.883403778076172
the sailor,the lighthouse,saw,The sailor saw the lighthouse.,The sailor saw the lighthouse.,The lighthouse was saw by the sailor.,low,-33.53532409667969,-44.782135009765625,11.246810913085938
the jury,"the artist""s innovative approach",recognized,The jury recognized the artist's innovative approach in her work.,The jury recognized the artist's innovative approach in her work.,The artist's innovative approach in her work was recognized by the jury.,low,-48.35533905029297,-56.11383056640625,7.758491516113281
the new phone,several hundred dollars,cost,The new phone cost several hundred dollars.,The new phone cost several hundred dollars.,Several hundred dollars was cost by the new phone.,low,-31.557594299316406,-52.28617477416992,20.728580474853516
the community,the foundation's cause for the environment,believed,The community believed the foundation's cause for the environment.,The community believed the foundation's cause for the environment.,The foundation's cause for the environment was believed by the community.,low,-56.29027557373047,-60.166481018066406,3.8762054443359375
She,the flavor of the new coffee blend,liked,The barista liked the flavor of the new coffee blend.,The barista liked the flavor of the new coffee blend.,The flavour of the new coffee blend was liked by the barista.,low,-50.52729415893555,-54.920475006103516,4.393180847167969
the clouds,various animal shapes,resembled,The clouds resembled various animal shapes.,The clouds resembled various animal shapes.,Various animal shapes were resembled by the clouds.,low,-43.21656036376953,-52.94800567626953,9.7314453125
the model,the original statue,resembled,The model resembled the original statue.,The model resembled the original statue.,The original statue was resembled by the model.,low,-34.572811126708984,-48.016319274902344,13.44350814819336
the birdwatcher,a rare species in the forest,spotted,The birdwatcher spotted a rare species in the forest.,The birdwatcher spotted a rare species in the forest.,A rare species was spotted in the forest by the birdwatcher.,low,-43.355506896972656,-52.033775329589844,8.678268432617188
the dress,her,fit,The dress fit the bride perfectly.,The dress fit the bride perfectly.,The bride was fit perfectly by the dress.,low,-39.79814529418945,-44.28543472290039,4.4872894287109375
the sculpture,a majestic eagle in flight,resembled,The sculpture resembled a majestic eagle in flight.,The sculpture resembled a majestic eagle in flight.,A majestic eagle in flight was resembled by the sculpture.,low,-37.22248458862305,-68.06735229492188,30.844867706298828
the villagers,the wild animals,feared,The villagers feared the wild animals.,The villagers feared the wild animals.,The wild animals were feared by the villagers.,low,-28.15125274658203,-34.374794006347656,6.223541259765625
The table,more than anticipated,cost,The table cost more than anticipated at the auction.,The table cost more than anticipated at the auction.,More than anticipated was cost by the table at the auction.,low,-44.09015655517578,-60.241905212402344,16.151748657226562
the program,the new user,recognized,The program recognized the new user.,The program recognized the new user.,The new user was recognized by the program.,low,-38.10923767089844,-39.42292785644531,1.313690185546875
the librarian,the location of every book in the vast collection,knew,The librarian knew the location of every book in the vast collection.,The librarian knew the location of every book in the vast collection.,The location of every book in the vast collection was knew by the librarian.,low,-50.7493896484375,-62.076499938964844,11.327110290527344
The dog,The sound of thunder,feared,The dog feared the sound of thunder.,The dog feared the sound of thunder.,The sound of thunder was feared by the dog.,low,-32.97942352294922,-42.91746520996094,9.938041687011719
the children,the monster under the bed,feared,The children feared the monster under the bed.,The children feared the monster under the bed.,The monster under the bed was feared by the children.,low,-38.81525421142578,-46.61254119873047,7.7972869873046875
The painting,a famous masterpiece,resembled,The painting resembled a famous masterpiece.,The painting resembled a famous masterpiece.,A famous masterpiece was resembled by the painting.,low,-29.925518035888672,-56.55342102050781,26.62790298461914
The patron,their conversation,overheard,She overheard their conversation.,The patron overheard their conversation.,Their conversation was overheard by the patron.,low,-28.921417236328125,-31.78837013244629,2.866952896118164
the athlete,the qualification,missed,The athlete missed the qualifying score by a margin.,The athlete missed the qualifying score by a margin.,The qualifying score was missed by the athlete by a margin.,low,-40.12843322753906,-55.0471305847168,14.918697357177734
The team,their leader,trusted,The team trusted their leader.,The team trusted their leader.,Their leader was trusted by the team.,low,-26.15069580078125,-31.141231536865234,4.990535736083984
The meeting,an entire afternoon,lasted,The meeting lasted an entire afternoon.,The meeting lasted an entire afternoon.,An entire afternoon was lasted by the meeting.,low,-26.895004272460938,-47.44812774658203,20.553123474121094
Her voice,the sweet sound of a violin,resembled,Her voice resembled the sweet sound of a violin.,Her voice resembled the sweet sound of a violin.,The sweet sound of a violin was resembled by her voice.,low,-38.66999053955078,-59.195335388183594,20.525344848632812
the mural,a vibrant tapestry,resembled,The mural resembled a vibrant tapestry.,The mural resembled a vibrant tapestry.,A vibrant tapestry was resembled by the mural.,low,-43.944908142089844,-60.13479995727539,16.189891815185547
the driver,the old song playing on the radio,recognized,The driver recognized the old song playing on the radio.,The driver recognized the old song playing on the radio.,The old song playing on the radio was recognized by the driver.,low,-43.247337341308594,-52.191619873046875,8.944282531738281
The campers,the shooting star,saw,The camper saw the shooting star.,The camper saw the shooting star.,The shooting star was saw by the camper.,low,-41.285945892333984,-49.130523681640625,7.844577789306641
the appointment,forty-five minutes,lasted,The appointment lasted forty-five minutes.,The appointment lasted forty-five minutes.,Forty-five minutes were lasted by the appointment.,low,-34.1718864440918,-40.142024993896484,5.9701385498046875
the woman,snakes,feared,The woman feared snakes.,The woman feared snakes.,Snakes were feared by the woman.,low,-33.94729232788086,-38.029075622558594,4.081783294677734
the engine,repairs,needed,The engine needed repairs.,The engine needed repairs.,Repairs were needed by the engine.,low,-21.558242797851562,-34.90000534057617,13.34176254272461
the renovations,a pretty penny,cost,The renovations cost a pretty penny.,The renovations cost a pretty penny.,A pretty penny was cost by the renovations.,low,-28.96792984008789,-49.83354568481445,20.865615844726562
The teacher,the lesson plan,prepared,The teacher prepared the lesson plan.,The teacher prepared the lesson plan.,The lesson plan was prepared by the teacher.,high,-31.607318878173828,-38.834136962890625,7.226818084716797
The soldier,the intruder,shot,The soldier shot the intruder during a midnight raid.,The soldier shot the intruder during a midnight raid.,The intruder was shot by the soldier during a midnight raid.,high,-35.951576232910156,-41.4173583984375,5.465782165527344
the criminal,the unmanned robot,stabbed,The criminal stabbed the unmanned robot.,The criminal stabbed the unmanned robot.,"The unmanned robot was stabbed by the criminal,.",high,-46.739837646484375,-59.0282096862793,12.288372039794922
The military officer,the deserter,executed,The military officer executed the deserter.,The military officer executed the deserter.,The deserter was executed by the military officer.,high,-34.307533264160156,-39.973018646240234,5.665485382080078
The villain,his opponent,knifed,The villain knifed his opponent in a theatrical duel.,The villain knifed his opponent in a theatrical duel.,His opponent was knifed by the villain in a theatrical duel.,high,-44.194801330566406,-50.536827087402344,6.3420257568359375
The haunted house actor,The guests,frightened,The haunted house actor successfully frightened the guests.,The haunted house actor successfully frightened the guests.,The guests were frightened successfully by the haunted house actor.,high,-45.83298110961914,-62.95054244995117,17.11756134033203
The firefighter,the cleared fields,burned,The firefighter burned the cleared fields to prevent a larger forest fire.,The firefighter burned the cleared fields to prevent a larger forest fire.,The cleared fields were burned by the firefighter to prevent a larger forest fire.,high,-67.85053253173828,-77.98670196533203,10.13616943359375
The hunter,the wild boar,killed,The hunter killed the wild boar in the forest.,The hunter killed the wild boar in the forest.,The wild boar was killed by the hunter in the forest.,high,-33.73714828491211,-35.827640533447266,2.0904922485351562
The pest control officer,the cockroaches,exterminated,The pest control officer exterminated the cockroaches in the infested kitchen.,The pest control officer exterminated the cockroaches in the infested kitchen.,The cockroaches in the infested kitchen were exterminated by the pest control officer.,high,-45.1390380859375,-66.07540130615234,20.936363220214844
