subject,object,verb,sentence,active,passive,affectedness,active_score,passive_score,pass_drop
the patient,news of his test results,received,The patient received news of his test results.,The patient received news of his test results.,News of his test results was received by the patient.,low,-39.70077133178711,-43.65620803833008,3.9554367065429688
Marie,pasta,liked,Marie liked pasta.,Marie liked pasta.,Pasta was liked by Marie.,low,-27.670085906982422,-37.649818420410156,9.979732513427734
The dog,its owner,trusted,The dog trusted its owner completely.,The dog trusted its owner completely.,Its owner was trusted completely by the dog.,low,-32.826114654541016,-42.137847900390625,9.31173324584961
the fridge,the groceries,received,The fridge received the groceries.,The fridge received the groceries.,The groceries were received by the fridge.,low,-37.308982849121094,-41.5754508972168,4.266468048095703
The translator,the speaker's dialect,understood,The translator understood the speaker's dialect effortlessly.,The translator understood the speaker's dialect effortlessly.,The speaker's dialect was understood effortlessly by the translator.,low,-56.31638717651367,-54.620426177978516,-1.6959609985351562
The new smartphone,a small fortune,cost,The new smartphone cost a small fortune.,The new smartphone cost a small fortune.,A small fortune was cost by the new smartphone.,low,-31.110580444335938,-54.28370666503906,23.173126220703125
The sculpture,a twisting vine,resembled,The sculpture resembled a twisting vine.,The sculpture resembled a twisting vine.,A twisting vine was resembled by the sculpture.,low,-43.32168197631836,-66.43373107910156,23.112049102783203
the tourists,the local cuisine,liked,The tourists liked the local cuisine.,The tourists liked the local cuisine.,The local cuisine was liked by the tourists.,low,-29.10602569580078,-37.458221435546875,8.352195739746094
The baker,the cake fresh out of the oven,liked,The baker liked the cake fresh out of the oven.,The baker liked the cake fresh out of the oven.,The cake was liked fresh out of the oven by the baker.,low,-42.2682991027832,-51.014678955078125,8.746379852294922
the patient,immediate medical attention,needed,The patient needed immediate medical attention.,The patient needed immediate medical attention.,Immediate medical attention was needed by the patient.,low,-28.944499969482422,-43.533634185791016,14.589134216308594
the veteran,the fallen comrades,remembered,The veteran remembered the fallen comrades.,The veteran remembered the fallen comrades.,The fallen comrades were remembered by the veteran.,low,-34.829345703125,-41.32948303222656,6.5001373291015625
The athlete,the crucial shot at the goal,missed,The athlete missed the crucial shot at the goal.,The athlete missed the crucial shot at the goal.,The crucial shot at the goal was missed by the athlete.,low,-38.25869369506836,-51.80242156982422,13.54372787475586
the children,the long homework assignments,dreaded,The children dreaded the long homework assignments.,The children dreaded the long homework assignments.,The long homework assignments were dreaded by the children.,low,-37.43776321411133,-45.56899642944336,8.131233215332031
The committee,the researcher's efforts,recognized,The committee recognized the researcher's efforts.,The committee recognized the researcher's efforts.,The researcher's efforts were recognized by the committee.,low,-36.90312957763672,-39.98588562011719,3.0827560424804688
the historian,the ancient script,knew,The historian knew the ancient script.,The historian knew the ancient script.,The ancient script was knew by the historian.,low,-36.00259017944336,-43.46150207519531,7.458911895751953
The villagers,the dragon,feared,The villagers feared the dragon.,The villagers feared the dragon.,The dragon was feared by the villagers.,low,-27.121627807617188,-31.424291610717773,4.302663803100586
The teacher,the student's struggles,understood,The teacher understood the student's struggles.,The teacher understood the student's struggles.,The student's struggles were understood by the teacher.,low,-32.5220832824707,-40.67938995361328,8.157306671142578
The recipe,the ingredients we needed,had,The recipe had all the ingredients we needed.,The recipe had all the ingredients we needed.,All the ingredients we needed were had by the recipe.,low,-30.37772560119629,-50.4520263671875,20.07430076599121
The passerby,the heated argument,overheard,The passerby overheard the heated argument.,The passerby overheard the heated argument.,The heated argument was overheard by the passerby.,low,-34.43674850463867,-43.34832000732422,8.911571502685547
the observer,the small details in the artwork,noticed,The observer noticed the small details in the artwork.,The observer noticed the small details in the artwork.,The small details in the artwork were noticed by the observer.,low,-40.56230163574219,-47.67192077636719,7.109619140625
they,the announcement,heard,They heard the announcement.,They heard the announcement.,The announcement was heard by them.,low,-16.318370819091797,-31.922351837158203,15.603981018066406
the community,the elderly man,respected,The community respected the elderly man for his wisdom.,The community respected the elderly man for his wisdom.,The elderly man was respected by the community for his wisdom.,low,-39.23894500732422,-44.416378021240234,5.177433013916016
The museum,Many artifacts from ancient Egypt,had,The museum had many artifacts from ancient Egypt.,The museum had many artifacts from ancient Egypt.,Many artifacts from ancient Egypt were had by the museum.,low,-36.40228271484375,-50.426395416259766,14.024112701416016
The menu,Vegetarian options,had,The menu had vegetarian options.,The menu had vegetarian options.,Vegetarian options were had by the menu.,low,-25.94015884399414,-37.70471954345703,11.76456069946289
The team,their coach's strategies,respected,The team respected their coach's strategies.,The team respected their coach's strategies.,Their coach's strategies were respected by the team.,low,-33.525508880615234,-41.100311279296875,7.574802398681641
the child,the dark shadows,feared,The child feared the dark shadows.,The child feared the dark shadows.,The dark shadows were feared by the child.,low,-28.962146759033203,-37.81675338745117,8.854606628417969
the new laptop,a thousand dollars,cost,The new laptop cost a thousand dollars.,The new laptop cost a thousand dollars.,A thousand dollars were cost by the new laptop.,low,-30.510089874267578,-56.746559143066406,26.236469268798828
the service,ten dollars,cost,The service cost ten dollars.,The service cost ten dollars.,Ten dollars were cost by the service.,low,-28.932580947875977,-42.52916717529297,13.596586227416992
the veteran,the comrades he lost,remembered,The veteran remembered the comrades he lost.,The veteran remembered the comrades he lost.,The comrades he lost were remembered by the veteran.,low,-44.27903747558594,-56.64775848388672,12.368721008300781
the project,sufficient funding,lacked,The project lacked sufficient funding.,The project lacked sufficient funding.,Sufficient funding was lacked by the project.,low,-26.950759887695312,-47.06373977661133,20.112979888916016
The report,crucial data,lacked,The report lacked crucial data for the analysis.,The report lacked crucial data for the analysis.,Crucial data for the analysis was lacked by the report.,low,-39.174598693847656,-50.475379943847656,11.30078125
the report,detailed information about the project's timeline,lacked,The report lacked detailed information about the project's timeline.,The report lacked detailed information about the project's timeline.,Detailed information about the project's timeline was lacked by the report.,low,-38.73687744140625,-50.23955535888672,11.502677917480469
the laptop,an update,received,The laptop received an update.,The laptop received an update.,An update was received by the laptop.,low,-30.029281616210938,-36.819759368896484,6.790477752685547
the detector,gas leaks,sensed,The detector sensed gas leaks.,The detector sensed gas leaks.,Gas leaks were sensed by the detector.,low,-42.280513763427734,-39.32192611694336,-2.958587646484375
The repair,the homeowner,cost,The repair cost a small fortune.,The repair cost a small fortune.,A small fortune was cost by the repair.,low,-31.30303955078125,-50.70131301879883,19.398273468017578
the car,five passengers,had,The car had five passengers.,The car had five passengers.,Five passengers were had by the car.,low,-25.228761672973633,-35.891258239746094,10.662496566772461
the project,funds,lacked,The project lacked funds.,The project lacked funds.,Funds were lacked by the project.,low,-26.38094711303711,-35.163002014160156,8.782054901123047
she,the upcoming presentation,dreaded,The manager dreaded the upcoming presentation.,The manager dreaded the upcoming presentation.,The upcoming presentation was dreaded by the manager.,low,-32.317996978759766,-43.27058029174805,10.952583312988281
The audience,the presentation,understood,The audience understood the presentation.,The audience understood the presentation.,The presentation was understood by the audience.,low,-27.26732635498047,-29.49041748046875,2.2230911254882812
the residents,the impending storm,feared,The residents feared the impending storm.,The residents feared the impending storm.,The impending storm was feared by the residents.,low,-27.299694061279297,-36.159820556640625,8.860126495361328
the sculpture,a mythical creature,resembled,The sculpture resembled a mythical creature.,The sculpture resembled a mythical creature.,A mythical creature was resembled by the sculpture.,low,-31.123947143554688,-47.862937927246094,16.738990783691406
She,her hometown,missed,The woman missed her hometown.,The woman missed her hometown.,Her hometown was missed by the woman.,low,-26.868576049804688,-36.25551223754883,9.38693618774414
the child,the dark forest,feared,The child feared the dark forest.,The child feared the dark forest.,The dark forest was feared by the child.,low,-28.93767547607422,-40.47947692871094,11.541801452636719
the clouds,fluffy sheep in the sky,resembled,The clouds resembled fluffy sheep in the sky.,The clouds resembled fluffy sheep in the sky.,Fluffy sheep in the sky were resembled by the clouds.,low,-42.82612991333008,-65.82452392578125,22.998394012451172
The new model,the previous version,resembled,The new model resembled the previous version.,The new model resembled the previous version.,The previous version was resembled by the new model.,low,-34.710330963134766,-49.762451171875,15.052120208740234
Alice,the presentation,dreaded,Alice dreaded the presentation.,Alice dreaded the presentation.,The presentation was dreaded by Alice.,low,-21.744720458984375,-40.81041717529297,19.065696716308594
The lecture,two hours,lasted,The lecture lasted two hours.,The lecture lasted two hours.,Two hours were lasted by the lecture.,low,-21.91172981262207,-41.3828239440918,19.471094131469727
The hiker,a rare bird,spotted,The hiker spotted a rare bird.,The hiker spotted a rare bird.,A rare bird was spotted by the hiker.,low,-32.63031005859375,-36.88987350463867,4.259563446044922
the gardener,more seeds,needed,The gardener needed more seeds.,The gardener needed more seeds.,More seeds were needed by the gardener.,low,-35.38652801513672,-38.69251251220703,3.3059844970703125
the child,his pet,missed,The child missed his pet during vacation.,The child missed his pet during vacation.,His pet was missed by the child during vacation.,low,-39.73335647583008,-46.27965545654297,6.546298980712891
the teacher,"the student""s potential",knew,The teacher knew the student's potential.,The teacher knew the student's potential.,The student's potential was knew by the teacher.,low,-28.835346221923828,-45.79686737060547,16.96152114868164
the clock,midnight,struck,The clock struck midnight.,The clock struck midnight.,Midnight was struck by the clock.,low,-23.767494201660156,-35.6627197265625,11.895225524902344
the team,"their coach""s guidance",respected,The team respected their coach's guidance.,The team respected their coach's guidance.,Their coach's guidance was respected by the team.,low,-31.631179809570312,-39.02912139892578,7.397941589355469
the town,the river,bordered,The town bordered the river.,The town bordered the river.,The river was bordered by the town.,low,-23.64299964904785,-29.929466247558594,6.286466598510742
the tourist,the ancient architecture,noticed,The tourist noticed the ancient architecture.,The tourist noticed the ancient architecture.,The ancient architecture was noticed by the tourist.,low,-36.684730529785156,-38.822364807128906,2.13763427734375
the sculpture,a famous painting,resembled,The sculpture resembled a famous painting.,The sculpture resembled a famous painting.,A famous painting was resembled by the sculpture.,low,-30.435379028320312,-53.46308517456055,23.027706146240234
the shirt,the man,fit,The shirt fit the man.,The shirt fit the man.,The man was fit by the shirt.,low,-28.838695526123047,-34.93414306640625,6.095447540283203
the room,a cozy ambiance,had,The room had a cozy ambiance.,The room had a cozy ambiance.,A cozy ambiance was had by the room.,low,-31.888355255126953,-51.10411071777344,19.215755462646484
the cat,the bird on the windowsill,noticed,The cat noticed the bird on the windowsill intently.,The cat noticed the bird on the windowsill intently.,The bird on the windowsill was noticed intently by the cat.,low,-50.318809509277344,-59.8912353515625,9.572425842285156
Rob,his wallet,missed,Rob missed his wallet.,Rob missed his wallet.,His wallet was missed by Rob.,low,-35.00311279296875,-41.56309509277344,6.5599822998046875
The project,a detailed plan,lacked,The project lacked a detailed plan.,The project lacked a detailed plan.,A detailed plan was lacked by the project.,low,-28.70012664794922,-44.122413635253906,15.422286987304688
the renovation,significant money,cost,The renovation cost significant money.,The renovation cost significant money.,Significant money was cost by the renovation.,low,-37.136871337890625,-53.80769348144531,16.670822143554688
the neighbors,the band,heard,The neighbors heard the band rehearsing late at night.,The neighbors heard the band rehearsing late at night.,The band rehearsing late at night was heard by the neighbors.,low,-47.110694885253906,-57.6046257019043,10.49393081665039
The community,his dedication to volunteering,respected,The community respected his dedication to volunteering.,The community respected his dedication to volunteering.,His dedication to volunteering was respected by the community.,low,-37.40532684326172,-41.038291931152344,3.632965087890625
The building,renovations,underwent,The building underwent renovations last year.,The building underwent renovations last year.,Renovations were underwent last year by the building.,low,-36.13949203491211,-53.15546417236328,17.015972137451172
the box,the items,fit,The box fit the items perfectly inside.,The box fit the items perfectly inside.,The items were fit perfectly inside by the box.,low,-45.99297332763672,-47.72771453857422,1.7347412109375
The house,The old cemetery,abutted,The house abutted the old cemetery.,The house abutted the old cemetery.,The old cemetery abutted the house.,low,-37.543792724609375,-36.222816467285156,-1.3209762573242188
the new smartphone,nearly a thousand dollars,cost,The new smartphone cost nearly a thousand dollars.,The new smartphone cost nearly a thousand dollars.,Nearly a thousand dollars was cost by the new smartphone.,low,-36.35871505737305,-55.953712463378906,19.59499740600586
Travelers,The risks,knew,Travelers knew the risks involved.,Travelers knew the risks involved.,The risks involved were knew by the travelers.,low,-23.64422607421875,-49.4759521484375,25.83172607421875
the patient,the procedure,underwent,The patient underwent the procedure.,The patient underwent the procedure.,The procedure was underwent by the patient.,low,-23.394184112548828,-32.61469268798828,9.220508575439453
the team,the captain's judgment,trusted,The team trusted the captain's judgment.,The team trusted the captain's judgment.,The captain's judgment was trusted by the team.,low,-26.686302185058594,-40.27333450317383,13.587032318115234
the sailor,the lighthouse,saw,The sailor saw the lighthouse.,The sailor saw the lighthouse.,The lighthouse was saw by the sailor.,low,-33.42524337768555,-42.678955078125,9.253711700439453
the jury,"the artist""s innovative approach",recognized,The jury recognized the artist's innovative approach in her work.,The jury recognized the artist's innovative approach in her work.,The artist's innovative approach in her work was recognized by the jury.,low,-44.550785064697266,-53.06919860839844,8.518413543701172
the new phone,several hundred dollars,cost,The new phone cost several hundred dollars.,The new phone cost several hundred dollars.,Several hundred dollars was cost by the new phone.,low,-30.365711212158203,-53.7365837097168,23.370872497558594
the community,the foundation's cause for the environment,believed,The community believed the foundation's cause for the environment.,The community believed the foundation's cause for the environment.,The foundation's cause for the environment was believed by the community.,low,-53.90205383300781,-51.56263732910156,-2.33941650390625
She,the flavor of the new coffee blend,liked,The barista liked the flavor of the new coffee blend.,The barista liked the flavor of the new coffee blend.,The flavour of the new coffee blend was liked by the barista.,low,-51.540000915527344,-58.136566162109375,6.596565246582031
the clouds,various animal shapes,resembled,The clouds resembled various animal shapes.,The clouds resembled various animal shapes.,Various animal shapes were resembled by the clouds.,low,-42.95417022705078,-52.86357879638672,9.909408569335938
the model,the original statue,resembled,The model resembled the original statue.,The model resembled the original statue.,The original statue was resembled by the model.,low,-38.151214599609375,-47.88115310668945,9.729938507080078
the birdwatcher,a rare species in the forest,spotted,The birdwatcher spotted a rare species in the forest.,The birdwatcher spotted a rare species in the forest.,A rare species was spotted in the forest by the birdwatcher.,low,-37.67415237426758,-51.442771911621094,13.768619537353516
the dress,her,fit,The dress fit the bride perfectly.,The dress fit the bride perfectly.,The bride was fit perfectly by the dress.,low,-38.71525573730469,-46.41303253173828,7.697776794433594
the sculpture,a majestic eagle in flight,resembled,The sculpture resembled a majestic eagle in flight.,The sculpture resembled a majestic eagle in flight.,A majestic eagle in flight was resembled by the sculpture.,low,-42.16520690917969,-64.7280502319336,22.562843322753906
the villagers,the wild animals,feared,The villagers feared the wild animals.,The villagers feared the wild animals.,The wild animals were feared by the villagers.,low,-26.07086181640625,-33.61476516723633,7.543903350830078
The table,more than anticipated,cost,The table cost more than anticipated at the auction.,The table cost more than anticipated at the auction.,More than anticipated was cost by the table at the auction.,low,-43.36322021484375,-58.33425521850586,14.97103500366211
the program,the new user,recognized,The program recognized the new user.,The program recognized the new user.,The new user was recognized by the program.,low,-34.71644973754883,-39.2115364074707,4.495086669921875
the librarian,the location of every book in the vast collection,knew,The librarian knew the location of every book in the vast collection.,The librarian knew the location of every book in the vast collection.,The location of every book in the vast collection was knew by the librarian.,low,-51.21261215209961,-63.681705474853516,12.469093322753906
The dog,The sound of thunder,feared,The dog feared the sound of thunder.,The dog feared the sound of thunder.,The sound of thunder was feared by the dog.,low,-34.80805206298828,-46.02120590209961,11.213153839111328
the children,the monster under the bed,feared,The children feared the monster under the bed.,The children feared the monster under the bed.,The monster under the bed was feared by the children.,low,-36.59190368652344,-43.20962142944336,6.617717742919922
The painting,a famous masterpiece,resembled,The painting resembled a famous masterpiece.,The painting resembled a famous masterpiece.,A famous masterpiece was resembled by the painting.,low,-32.33319854736328,-53.393287658691406,21.060089111328125
The patron,their conversation,overheard,She overheard their conversation.,The patron overheard their conversation.,Their conversation was overheard by the patron.,low,-31.532398223876953,-31.695737838745117,0.16333961486816406
the athlete,the qualification,missed,The athlete missed the qualifying score by a margin.,The athlete missed the qualifying score by a margin.,The qualifying score was missed by the athlete by a margin.,low,-45.993804931640625,-60.610660552978516,14.61685562133789
The team,their leader,trusted,The team trusted their leader.,The team trusted their leader.,Their leader was trusted by the team.,low,-24.440345764160156,-27.962989807128906,3.52264404296875
The meeting,an entire afternoon,lasted,The meeting lasted an entire afternoon.,The meeting lasted an entire afternoon.,An entire afternoon was lasted by the meeting.,low,-27.330669403076172,-48.0994758605957,20.76880645751953
Her voice,the sweet sound of a violin,resembled,Her voice resembled the sweet sound of a violin.,Her voice resembled the sweet sound of a violin.,The sweet sound of a violin was resembled by her voice.,low,-38.21181106567383,-59.85744094848633,21.6456298828125
the mural,a vibrant tapestry,resembled,The mural resembled a vibrant tapestry.,The mural resembled a vibrant tapestry.,A vibrant tapestry was resembled by the mural.,low,-44.37379837036133,-59.14141082763672,14.76761245727539
the driver,the old song playing on the radio,recognized,The driver recognized the old song playing on the radio.,The driver recognized the old song playing on the radio.,The old song playing on the radio was recognized by the driver.,low,-48.98176956176758,-60.33186340332031,11.350093841552734
The campers,the shooting star,saw,The camper saw the shooting star.,The camper saw the shooting star.,The shooting star was saw by the camper.,low,-42.93569564819336,-50.9833984375,8.04770278930664
the appointment,forty-five minutes,lasted,The appointment lasted forty-five minutes.,The appointment lasted forty-five minutes.,Forty-five minutes were lasted by the appointment.,low,-28.343488693237305,-45.32651138305664,16.983022689819336
the woman,snakes,feared,The woman feared snakes.,The woman feared snakes.,Snakes were feared by the woman.,low,-29.711898803710938,-35.96837615966797,6.256477355957031
the engine,repairs,needed,The engine needed repairs.,The engine needed repairs.,Repairs were needed by the engine.,low,-26.577861785888672,-35.84934997558594,9.271488189697266
the renovations,a pretty penny,cost,The renovations cost a pretty penny.,The renovations cost a pretty penny.,A pretty penny was cost by the renovations.,low,-29.790321350097656,-48.294227600097656,18.50390625
The teacher,the lesson plan,prepared,The teacher prepared the lesson plan.,The teacher prepared the lesson plan.,The lesson plan was prepared by the teacher.,high,-28.365036010742188,-35.92474365234375,7.5597076416015625
The soldier,the intruder,shot,The soldier shot the intruder during a midnight raid.,The soldier shot the intruder during a midnight raid.,The intruder was shot by the soldier during a midnight raid.,high,-43.23344421386719,-47.403648376464844,4.170204162597656
the criminal,the unmanned robot,stabbed,The criminal stabbed the unmanned robot.,The criminal stabbed the unmanned robot.,"The unmanned robot was stabbed by the criminal,.",high,-47.2414436340332,-59.90259552001953,12.661151885986328
The military officer,the deserter,executed,The military officer executed the deserter.,The military officer executed the deserter.,The deserter was executed by the military officer.,high,-37.67344284057617,-41.270790100097656,3.5973472595214844
The villain,his opponent,knifed,The villain knifed his opponent in a theatrical duel.,The villain knifed his opponent in a theatrical duel.,His opponent was knifed by the villain in a theatrical duel.,high,-48.75138854980469,-56.16505813598633,7.413669586181641
The haunted house actor,The guests,frightened,The haunted house actor successfully frightened the guests.,The haunted house actor successfully frightened the guests.,The guests were frightened successfully by the haunted house actor.,high,-46.20219802856445,-61.078330993652344,14.87613296508789
The firefighter,the cleared fields,burned,The firefighter burned the cleared fields to prevent a larger forest fire.,The firefighter burned the cleared fields to prevent a larger forest fire.,The cleared fields were burned by the firefighter to prevent a larger forest fire.,high,-64.64443969726562,-68.80470275878906,4.1602630615234375
The hunter,the wild boar,killed,The hunter killed the wild boar in the forest.,The hunter killed the wild boar in the forest.,The wild boar was killed by the hunter in the forest.,high,-36.75436019897461,-41.6563835144043,4.9020233154296875
The pest control officer,the cockroaches,exterminated,The pest control officer exterminated the cockroaches in the infested kitchen.,The pest control officer exterminated the cockroaches in the infested kitchen.,The cockroaches in the infested kitchen were exterminated by the pest control officer.,high,-38.77054977416992,-59.125240325927734,20.354690551757812
