subject,object,verb,sentence,active,passive,affectedness,active_score,passive_score,pass_drop
the patient,news of his test results,received,The patient received news of his test results.,The patient received news of his test results.,News of his test results was received by the patient.,low,-40.253570556640625,-44.376380920410156,4.122810363769531
Marie,pasta,liked,Marie liked pasta.,Marie liked pasta.,Pasta was liked by Marie.,low,-26.06011199951172,-35.81188201904297,9.75177001953125
The dog,its owner,trusted,The dog trusted its owner completely.,The dog trusted its owner completely.,Its owner was trusted completely by the dog.,low,-39.44414520263672,-43.97771453857422,4.5335693359375
the fridge,the groceries,received,The fridge received the groceries.,The fridge received the groceries.,The groceries were received by the fridge.,low,-35.71479797363281,-39.823707580566406,4.108909606933594
The translator,the speaker's dialect,understood,The translator understood the speaker's dialect effortlessly.,The translator understood the speaker's dialect effortlessly.,The speaker's dialect was understood effortlessly by the translator.,low,-54.71467590332031,-58.93073654174805,4.216060638427734
The new smartphone,a small fortune,cost,The new smartphone cost a small fortune.,The new smartphone cost a small fortune.,A small fortune was cost by the new smartphone.,low,-32.182716369628906,-54.12983322143555,21.94711685180664
The sculpture,a twisting vine,resembled,The sculpture resembled a twisting vine.,The sculpture resembled a twisting vine.,A twisting vine was resembled by the sculpture.,low,-42.40781021118164,-60.34687423706055,17.939064025878906
the tourists,the local cuisine,liked,The tourists liked the local cuisine.,The tourists liked the local cuisine.,The local cuisine was liked by the tourists.,low,-32.88358688354492,-38.870033264160156,5.986446380615234
The baker,the cake fresh out of the oven,liked,The baker liked the cake fresh out of the oven.,The baker liked the cake fresh out of the oven.,The cake was liked fresh out of the oven by the baker.,low,-39.97944259643555,-56.18162536621094,16.20218276977539
the patient,immediate medical attention,needed,The patient needed immediate medical attention.,The patient needed immediate medical attention.,Immediate medical attention was needed by the patient.,low,-26.107868194580078,-39.79533767700195,13.687469482421875
the veteran,the fallen comrades,remembered,The veteran remembered the fallen comrades.,The veteran remembered the fallen comrades.,The fallen comrades were remembered by the veteran.,low,-40.17567443847656,-43.09734344482422,2.9216690063476562
The athlete,the crucial shot at the goal,missed,The athlete missed the crucial shot at the goal.,The athlete missed the crucial shot at the goal.,The crucial shot at the goal was missed by the athlete.,low,-44.033226013183594,-51.647891998291016,7.614665985107422
the children,the long homework assignments,dreaded,The children dreaded the long homework assignments.,The children dreaded the long homework assignments.,The long homework assignments were dreaded by the children.,low,-46.05120086669922,-50.298980712890625,4.247779846191406
The committee,the researcher's efforts,recognized,The committee recognized the researcher's efforts.,The committee recognized the researcher's efforts.,The researcher's efforts were recognized by the committee.,low,-37.62702178955078,-38.81954574584961,1.1925239562988281
the historian,the ancient script,knew,The historian knew the ancient script.,The historian knew the ancient script.,The ancient script was knew by the historian.,low,-36.71742248535156,-45.711727142333984,8.994304656982422
The villagers,the dragon,feared,The villagers feared the dragon.,The villagers feared the dragon.,The dragon was feared by the villagers.,low,-26.698558807373047,-34.191070556640625,7.492511749267578
The teacher,the student's struggles,understood,The teacher understood the student's struggles.,The teacher understood the student's struggles.,The student's struggles were understood by the teacher.,low,-32.28556823730469,-42.41192626953125,10.126358032226562
The recipe,the ingredients we needed,had,The recipe had all the ingredients we needed.,The recipe had all the ingredients we needed.,All the ingredients we needed were had by the recipe.,low,-30.503747940063477,-47.45671844482422,16.952970504760742
The passerby,the heated argument,overheard,The passerby overheard the heated argument.,The passerby overheard the heated argument.,The heated argument was overheard by the passerby.,low,-39.59257888793945,-39.17191696166992,-0.42066192626953125
the observer,the small details in the artwork,noticed,The observer noticed the small details in the artwork.,The observer noticed the small details in the artwork.,The small details in the artwork were noticed by the observer.,low,-40.91587829589844,-53.61243438720703,12.696556091308594
they,the announcement,heard,They heard the announcement.,They heard the announcement.,The announcement was heard by them.,low,-17.148983001708984,-30.342716217041016,13.193733215332031
the community,the elderly man,respected,The community respected the elderly man for his wisdom.,The community respected the elderly man for his wisdom.,The elderly man was respected by the community for his wisdom.,low,-43.92906188964844,-42.71269989013672,-1.2163619995117188
The museum,Many artifacts from ancient Egypt,had,The museum had many artifacts from ancient Egypt.,The museum had many artifacts from ancient Egypt.,Many artifacts from ancient Egypt were had by the museum.,low,-35.79258728027344,-47.20222473144531,11.409637451171875
The menu,Vegetarian options,had,The menu had vegetarian options.,The menu had vegetarian options.,Vegetarian options were had by the menu.,low,-31.52863311767578,-39.601806640625,8.073173522949219
The team,their coach's strategies,respected,The team respected their coach's strategies.,The team respected their coach's strategies.,Their coach's strategies were respected by the team.,low,-38.97338104248047,-44.7847900390625,5.811408996582031
the child,the dark shadows,feared,The child feared the dark shadows.,The child feared the dark shadows.,The dark shadows were feared by the child.,low,-27.941877365112305,-38.31519317626953,10.373315811157227
the new laptop,a thousand dollars,cost,The new laptop cost a thousand dollars.,The new laptop cost a thousand dollars.,A thousand dollars were cost by the new laptop.,low,-33.175933837890625,-54.28639602661133,21.110462188720703
the service,ten dollars,cost,The service cost ten dollars.,The service cost ten dollars.,Ten dollars were cost by the service.,low,-29.922338485717773,-39.98790740966797,10.065568923950195
the veteran,the comrades he lost,remembered,The veteran remembered the comrades he lost.,The veteran remembered the comrades he lost.,The comrades he lost were remembered by the veteran.,low,-46.681175231933594,-54.678504943847656,7.9973297119140625
the project,sufficient funding,lacked,The project lacked sufficient funding.,The project lacked sufficient funding.,Sufficient funding was lacked by the project.,low,-24.059619903564453,-49.47137451171875,25.411754608154297
The report,crucial data,lacked,The report lacked crucial data for the analysis.,The report lacked crucial data for the analysis.,Crucial data for the analysis was lacked by the report.,low,-34.41834259033203,-55.56317901611328,21.14483642578125
the report,detailed information about the project's timeline,lacked,The report lacked detailed information about the project's timeline.,The report lacked detailed information about the project's timeline.,Detailed information about the project's timeline was lacked by the report.,low,-39.71579360961914,-53.71678924560547,14.000995635986328
the laptop,an update,received,The laptop received an update.,The laptop received an update.,An update was received by the laptop.,low,-29.907894134521484,-35.057823181152344,5.149929046630859
the detector,gas leaks,sensed,The detector sensed gas leaks.,The detector sensed gas leaks.,Gas leaks were sensed by the detector.,low,-44.54218673706055,-44.393775939941406,-0.14841079711914062
The repair,the homeowner,cost,The repair cost a small fortune.,The repair cost a small fortune.,A small fortune was cost by the repair.,low,-29.560781478881836,-51.706398010253906,22.14561653137207
the car,five passengers,had,The car had five passengers.,The car had five passengers.,Five passengers were had by the car.,low,-25.59992027282715,-33.850830078125,8.250909805297852
the project,funds,lacked,The project lacked funds.,The project lacked funds.,Funds were lacked by the project.,low,-21.041400909423828,-33.602134704589844,12.560733795166016
she,the upcoming presentation,dreaded,The manager dreaded the upcoming presentation.,The manager dreaded the upcoming presentation.,The upcoming presentation was dreaded by the manager.,low,-36.50238800048828,-48.10721969604492,11.60483169555664
The audience,the presentation,understood,The audience understood the presentation.,The audience understood the presentation.,The presentation was understood by the audience.,low,-26.462411880493164,-31.195938110351562,4.733526229858398
the residents,the impending storm,feared,The residents feared the impending storm.,The residents feared the impending storm.,The impending storm was feared by the residents.,low,-28.167346954345703,-38.07838439941406,9.91103744506836
the sculpture,a mythical creature,resembled,The sculpture resembled a mythical creature.,The sculpture resembled a mythical creature.,A mythical creature was resembled by the sculpture.,low,-32.24017333984375,-53.677982330322266,21.437808990478516
She,her hometown,missed,The woman missed her hometown.,The woman missed her hometown.,Her hometown was missed by the woman.,low,-29.46280288696289,-37.99897003173828,8.53616714477539
the child,the dark forest,feared,The child feared the dark forest.,The child feared the dark forest.,The dark forest was feared by the child.,low,-29.962186813354492,-37.47859191894531,7.51640510559082
the clouds,fluffy sheep in the sky,resembled,The clouds resembled fluffy sheep in the sky.,The clouds resembled fluffy sheep in the sky.,Fluffy sheep in the sky were resembled by the clouds.,low,-45.21211242675781,-66.9124526977539,21.700340270996094
The new model,the previous version,resembled,The new model resembled the previous version.,The new model resembled the previous version.,The previous version was resembled by the new model.,low,-34.35263442993164,-47.43192672729492,13.079292297363281
Alice,the presentation,dreaded,Alice dreaded the presentation.,Alice dreaded the presentation.,The presentation was dreaded by Alice.,low,-25.749717712402344,-41.8088493347168,16.059131622314453
The lecture,two hours,lasted,The lecture lasted two hours.,The lecture lasted two hours.,Two hours were lasted by the lecture.,low,-22.832672119140625,-46.61046600341797,23.777793884277344
The hiker,a rare bird,spotted,The hiker spotted a rare bird.,The hiker spotted a rare bird.,A rare bird was spotted by the hiker.,low,-35.280399322509766,-38.595706939697266,3.3153076171875
the gardener,more seeds,needed,The gardener needed more seeds.,The gardener needed more seeds.,More seeds were needed by the gardener.,low,-34.126609802246094,-33.30018997192383,-0.8264198303222656
the child,his pet,missed,The child missed his pet during vacation.,The child missed his pet during vacation.,His pet was missed by the child during vacation.,low,-49.794532775878906,-51.712154388427734,1.9176216125488281
the teacher,"the student""s potential",knew,The teacher knew the student's potential.,The teacher knew the student's potential.,The student's potential was knew by the teacher.,low,-33.96046829223633,-50.282859802246094,16.322391510009766
the clock,midnight,struck,The clock struck midnight.,The clock struck midnight.,Midnight was struck by the clock.,low,-24.842267990112305,-34.14567565917969,9.303407669067383
the team,"their coach""s guidance",respected,The team respected their coach's guidance.,The team respected their coach's guidance.,Their coach's guidance was respected by the team.,low,-33.131038665771484,-37.86985778808594,4.738819122314453
the town,the river,bordered,The town bordered the river.,The town bordered the river.,The river was bordered by the town.,low,-26.508481979370117,-32.071510314941406,5.563028335571289
the tourist,the ancient architecture,noticed,The tourist noticed the ancient architecture.,The tourist noticed the ancient architecture.,The ancient architecture was noticed by the tourist.,low,-37.31299591064453,-39.6925048828125,2.3795089721679688
the sculpture,a famous painting,resembled,The sculpture resembled a famous painting.,The sculpture resembled a famous painting.,A famous painting was resembled by the sculpture.,low,-31.83733367919922,-52.03382873535156,20.196495056152344
the shirt,the man,fit,The shirt fit the man.,The shirt fit the man.,The man was fit by the shirt.,low,-28.510452270507812,-36.471641540527344,7.961189270019531
the room,a cozy ambiance,had,The room had a cozy ambiance.,The room had a cozy ambiance.,A cozy ambiance was had by the room.,low,-33.94499206542969,-51.43324279785156,17.488250732421875
the cat,the bird on the windowsill,noticed,The cat noticed the bird on the windowsill intently.,The cat noticed the bird on the windowsill intently.,The bird on the windowsill was noticed intently by the cat.,low,-53.30059051513672,-62.58161926269531,9.281028747558594
Rob,his wallet,missed,Rob missed his wallet.,Rob missed his wallet.,His wallet was missed by Rob.,low,-37.04636764526367,-39.224727630615234,2.1783599853515625
The project,a detailed plan,lacked,The project lacked a detailed plan.,The project lacked a detailed plan.,A detailed plan was lacked by the project.,low,-29.693138122558594,-44.548091888427734,14.85495376586914
the renovation,significant money,cost,The renovation cost significant money.,The renovation cost significant money.,Significant money was cost by the renovation.,low,-36.94911575317383,-52.07069396972656,15.121578216552734
the neighbors,the band,heard,The neighbors heard the band rehearsing late at night.,The neighbors heard the band rehearsing late at night.,The band rehearsing late at night was heard by the neighbors.,low,-42.674442291259766,-55.32830810546875,12.653865814208984
The community,his dedication to volunteering,respected,The community respected his dedication to volunteering.,The community respected his dedication to volunteering.,His dedication to volunteering was respected by the community.,low,-39.70448303222656,-40.918121337890625,1.2136383056640625
The building,renovations,underwent,The building underwent renovations last year.,The building underwent renovations last year.,Renovations were underwent last year by the building.,low,-27.563064575195312,-55.42561340332031,27.862548828125
the box,the items,fit,The box fit the items perfectly inside.,The box fit the items perfectly inside.,The items were fit perfectly inside by the box.,low,-51.52970886230469,-53.68942642211914,2.159717559814453
The house,The old cemetery,abutted,The house abutted the old cemetery.,The house abutted the old cemetery.,The old cemetery abutted the house.,low,-33.17930221557617,-35.03834915161133,1.8590469360351562
the new smartphone,nearly a thousand dollars,cost,The new smartphone cost nearly a thousand dollars.,The new smartphone cost nearly a thousand dollars.,Nearly a thousand dollars was cost by the new smartphone.,low,-41.78712463378906,-51.70787811279297,9.920753479003906
Travelers,The risks,knew,Travelers knew the risks involved.,Travelers knew the risks involved.,The risks involved were knew by the travelers.,low,-24.392669677734375,-48.40940475463867,24.016735076904297
the patient,the procedure,underwent,The patient underwent the procedure.,The patient underwent the procedure.,The procedure was underwent by the patient.,low,-24.636423110961914,-30.82114028930664,6.184717178344727
the team,the captain's judgment,trusted,The team trusted the captain's judgment.,The team trusted the captain's judgment.,The captain's judgment was trusted by the team.,low,-35.009117126464844,-42.220924377441406,7.2118072509765625
the sailor,the lighthouse,saw,The sailor saw the lighthouse.,The sailor saw the lighthouse.,The lighthouse was saw by the sailor.,low,-32.039794921875,-41.335208892822266,9.295413970947266
the jury,"the artist""s innovative approach",recognized,The jury recognized the artist's innovative approach in her work.,The jury recognized the artist's innovative approach in her work.,The artist's innovative approach in her work was recognized by the jury.,low,-52.740623474121094,-60.90339660644531,8.162773132324219
the new phone,several hundred dollars,cost,The new phone cost several hundred dollars.,The new phone cost several hundred dollars.,Several hundred dollars was cost by the new phone.,low,-32.16514587402344,-46.02906036376953,13.863914489746094
the community,the foundation's cause for the environment,believed,The community believed the foundation's cause for the environment.,The community believed the foundation's cause for the environment.,The foundation's cause for the environment was believed by the community.,low,-54.49835968017578,-56.126197814941406,1.627838134765625
She,the flavor of the new coffee blend,liked,The barista liked the flavor of the new coffee blend.,The barista liked the flavor of the new coffee blend.,The flavour of the new coffee blend was liked by the barista.,low,-52.16851043701172,-56.23630142211914,4.067790985107422
the clouds,various animal shapes,resembled,The clouds resembled various animal shapes.,The clouds resembled various animal shapes.,Various animal shapes were resembled by the clouds.,low,-43.49653625488281,-49.738868713378906,6.242332458496094
the model,the original statue,resembled,The model resembled the original statue.,The model resembled the original statue.,The original statue was resembled by the model.,low,-37.502464294433594,-50.467124938964844,12.96466064453125
the birdwatcher,a rare species in the forest,spotted,The birdwatcher spotted a rare species in the forest.,The birdwatcher spotted a rare species in the forest.,A rare species was spotted in the forest by the birdwatcher.,low,-47.382781982421875,-55.889488220214844,8.506706237792969
the dress,her,fit,The dress fit the bride perfectly.,The dress fit the bride perfectly.,The bride was fit perfectly by the dress.,low,-39.09436798095703,-48.993778228759766,9.899410247802734
the sculpture,a majestic eagle in flight,resembled,The sculpture resembled a majestic eagle in flight.,The sculpture resembled a majestic eagle in flight.,A majestic eagle in flight was resembled by the sculpture.,low,-50.35176086425781,-73.46165466308594,23.109893798828125
the villagers,the wild animals,feared,The villagers feared the wild animals.,The villagers feared the wild animals.,The wild animals were feared by the villagers.,low,-26.882816314697266,-36.958377838134766,10.0755615234375
The table,more than anticipated,cost,The table cost more than anticipated at the auction.,The table cost more than anticipated at the auction.,More than anticipated was cost by the table at the auction.,low,-47.17775344848633,-60.44562530517578,13.267871856689453
the program,the new user,recognized,The program recognized the new user.,The program recognized the new user.,The new user was recognized by the program.,low,-39.03789138793945,-38.856903076171875,-0.18098831176757812
the librarian,the location of every book in the vast collection,knew,The librarian knew the location of every book in the vast collection.,The librarian knew the location of every book in the vast collection.,The location of every book in the vast collection was knew by the librarian.,low,-55.078521728515625,-67.27409362792969,12.195571899414062
The dog,The sound of thunder,feared,The dog feared the sound of thunder.,The dog feared the sound of thunder.,The sound of thunder was feared by the dog.,low,-34.92310333251953,-42.71638488769531,7.793281555175781
the children,the monster under the bed,feared,The children feared the monster under the bed.,The children feared the monster under the bed.,The monster under the bed was feared by the children.,low,-40.15581512451172,-47.535804748535156,7.3799896240234375
The painting,a famous masterpiece,resembled,The painting resembled a famous masterpiece.,The painting resembled a famous masterpiece.,A famous masterpiece was resembled by the painting.,low,-33.699317932128906,-55.2242546081543,21.52493667602539
The patron,their conversation,overheard,She overheard their conversation.,The patron overheard their conversation.,Their conversation was overheard by the patron.,low,-30.776247024536133,-29.24498748779297,-1.531259536743164
the athlete,the qualification,missed,The athlete missed the qualifying score by a margin.,The athlete missed the qualifying score by a margin.,The qualifying score was missed by the athlete by a margin.,low,-50.736778259277344,-62.4156494140625,11.678871154785156
The team,their leader,trusted,The team trusted their leader.,The team trusted their leader.,Their leader was trusted by the team.,low,-27.162851333618164,-30.246105194091797,3.083253860473633
The meeting,an entire afternoon,lasted,The meeting lasted an entire afternoon.,The meeting lasted an entire afternoon.,An entire afternoon was lasted by the meeting.,low,-30.140716552734375,-49.51366424560547,19.372947692871094
Her voice,the sweet sound of a violin,resembled,Her voice resembled the sweet sound of a violin.,Her voice resembled the sweet sound of a violin.,The sweet sound of a violin was resembled by her voice.,low,-40.248809814453125,-62.846900939941406,22.59809112548828
the mural,a vibrant tapestry,resembled,The mural resembled a vibrant tapestry.,The mural resembled a vibrant tapestry.,A vibrant tapestry was resembled by the mural.,low,-44.745941162109375,-64.22376251220703,19.477821350097656
the driver,the old song playing on the radio,recognized,The driver recognized the old song playing on the radio.,The driver recognized the old song playing on the radio.,The old song playing on the radio was recognized by the driver.,low,-45.630760192871094,-55.41447448730469,9.783714294433594
The campers,the shooting star,saw,The camper saw the shooting star.,The camper saw the shooting star.,The shooting star was saw by the camper.,low,-37.96145248413086,-50.8756217956543,12.914169311523438
the appointment,forty-five minutes,lasted,The appointment lasted forty-five minutes.,The appointment lasted forty-five minutes.,Forty-five minutes were lasted by the appointment.,low,-31.028045654296875,-43.6094970703125,12.581451416015625
the woman,snakes,feared,The woman feared snakes.,The woman feared snakes.,Snakes were feared by the woman.,low,-29.08965301513672,-30.514972686767578,1.4253196716308594
the engine,repairs,needed,The engine needed repairs.,The engine needed repairs.,Repairs were needed by the engine.,low,-24.004928588867188,-30.39779281616211,6.392864227294922
the renovations,a pretty penny,cost,The renovations cost a pretty penny.,The renovations cost a pretty penny.,A pretty penny was cost by the renovations.,low,-28.094318389892578,-51.48445510864258,23.39013671875
The teacher,the lesson plan,prepared,The teacher prepared the lesson plan.,The teacher prepared the lesson plan.,The lesson plan was prepared by the teacher.,high,-28.7641544342041,-40.19799041748047,11.433835983276367
The soldier,the intruder,shot,The soldier shot the intruder during a midnight raid.,The soldier shot the intruder during a midnight raid.,The intruder was shot by the soldier during a midnight raid.,high,-41.098140716552734,-46.35833740234375,5.260196685791016
the criminal,the unmanned robot,stabbed,The criminal stabbed the unmanned robot.,The criminal stabbed the unmanned robot.,"The unmanned robot was stabbed by the criminal,.",high,-47.2809944152832,-59.70124053955078,12.420246124267578
The military officer,the deserter,executed,The military officer executed the deserter.,The military officer executed the deserter.,The deserter was executed by the military officer.,high,-38.06111145019531,-41.683067321777344,3.6219558715820312
The villain,his opponent,knifed,The villain knifed his opponent in a theatrical duel.,The villain knifed his opponent in a theatrical duel.,His opponent was knifed by the villain in a theatrical duel.,high,-45.224700927734375,-50.845462799072266,5.620761871337891
The haunted house actor,The guests,frightened,The haunted house actor successfully frightened the guests.,The haunted house actor successfully frightened the guests.,The guests were frightened successfully by the haunted house actor.,high,-46.22185134887695,-57.560386657714844,11.33853530883789
The firefighter,the cleared fields,burned,The firefighter burned the cleared fields to prevent a larger forest fire.,The firefighter burned the cleared fields to prevent a larger forest fire.,The cleared fields were burned by the firefighter to prevent a larger forest fire.,high,-62.72590255737305,-70.1446533203125,7.418750762939453
The hunter,the wild boar,killed,The hunter killed the wild boar in the forest.,The hunter killed the wild boar in the forest.,The wild boar was killed by the hunter in the forest.,high,-40.56789016723633,-48.65819549560547,8.09030532836914
The pest control officer,the cockroaches,exterminated,The pest control officer exterminated the cockroaches in the infested kitchen.,The pest control officer exterminated the cockroaches in the infested kitchen.,The cockroaches in the infested kitchen were exterminated by the pest control officer.,high,-46.11948776245117,-60.90087890625,14.781391143798828
