subject,object,verb,sentence,active,passive,affectedness,active_score,passive_score,pass_drop
The pest control team,all the insects in the house,exterminated,The pest control team exterminated all the insects in the house.,The pest control team exterminated all the insects in the house.,All the insects in the house were exterminated by the pest control team.,high,-38.1839485168457,-47.057594299316406,8.873645782470703
assassin,wealthy businessman,murdered,The assassin murdered the wealthy businessman in his secluded mansion.,The assassin murdered the wealthy businessman in his secluded mansion.,The wealthy businessman was murdered by the assassin in his secluded mansion.,high,-46.087013244628906,-55.26673889160156,9.179725646972656
The prisoner,His rival inmate,knifed,The prisoner knifed his rival inmate during lunch.,The prisoner knifed his rival inmate during lunch.,His rival inmate was knifed by the prisoner during lunch.,high,-56.38595962524414,-61.00736999511719,4.621410369873047
The athlete,the world record,broke,The athlete broke the world record in the event.,The athlete broke the world record in the event.,The world record in the event was broke by the athlete.,high,-37.2982063293457,-57.64701843261719,20.348812103271484
The campfire,the stack of wood,burned,The campfire burned the stack of wood.,The campfire burned the stack of wood.,The stack of wood was burned by the campfire.,high,-39.37645721435547,-49.643733978271484,10.267276763916016
The state,the criminal,executed,The state executed the criminal at dawn.,The state executed the criminal at dawn.,The criminal was executed by the state at dawn.,high,-35.28107452392578,-36.54074478149414,1.2596702575683594
The construction worker,the concrete pillar,crushed,The construction worker crushed the concrete pillar.,The construction worker crushed the concrete pillar.,The concrete pillar was crushed by the construction worker.,high,-34.872440338134766,-47.545188903808594,12.672748565673828
The chef,The juicy steak,stabbed,The chef expertly stabbed the fork into the juicy steak.,The chef expertly stabbed the fork into the juicy steak.,The fork was stabbed expertly by the chef into the juicy steak.,high,-58.956146240234375,-75.74175262451172,16.785606384277344
the storm,dozens of houses,wrecked,The storm wrecked dozens of houses along the coastline.,The storm wrecked dozens of houses along the coastline.,Dozens of houses along the coastline were wrecked by the storm.,high,-32.601905822753906,-33.44267272949219,0.8407669067382812
The mother,water,boiled,The mother boiled water for her child's bottle.,The mother boiled water for her child's bottle.,Water for her child's bottle was boiled by the mother.,high,-45.76910400390625,-56.602020263671875,10.832916259765625
The campers,the marshmallows,burned,The campers accidentally burned the marshmallows over the fire.,The campers accidentally burned the marshmallows over the fire.,The marshmallows were accidentally burned over the fire by the campers.,high,-49.34005355834961,-57.280181884765625,7.940128326416016
The criminal,the unsuspecting victim,knifed,The criminal knifed the unsuspecting victim in the alley.,The criminal knifed the unsuspecting victim in the alley.,The unsuspecting victim was knifed in the alley by the criminal.,high,-51.67530059814453,-46.57358932495117,-5.101711273193359
The compactor,The metal cans,crushed,The compactor crushed the metal cans into cubes.,The compactor crushed the metal cans into cubes.,The metal cans were crushed into cubes by the compactor.,high,-49.251041412353516,-56.132999420166016,6.8819580078125
The thieves,the unsuspecting travelers,robbed,The thieves robbed the unsuspecting travelers at the desolate rest stop.,The thieves robbed the unsuspecting travelers at the desolate rest stop.,The unsuspecting travelers were robbed by thieves at the desolate rest stop.,high,-79.22643280029297,-78.87910461425781,-0.34732818603515625
The knight,The dragon,stabbed,The knight stabbed the dragon with his enchanted sword.,The knight stabbed the dragon with his enchanted sword.,The dragon was stabbed by the knight with his enchanted sword.,high,-49.873661041259766,-55.80364227294922,5.929981231689453
The mechanic,the old car,crushed,The mechanic crushed the old car with the hydraulic press.,The mechanic crushed the old car with the hydraulic press.,The old car was crushed by the mechanic with the hydraulic press.,high,-49.18428421020508,-51.40251541137695,2.218231201171875
The political faction,the citizens,terrorized,The political faction terrorized the citizens with threats of violence.,The political faction terrorized the citizens with threats of violence.,The citizens were terrorized with threats of violence by the political faction.,high,-46.719093322753906,-53.15123748779297,6.4321441650390625
The criminals,the bank,robbed,The criminals robbed the bank in broad daylight.,The criminals robbed the bank in broad daylight.,The bank was robbed by the criminals in broad daylight.,high,-34.426048278808594,-45.00029754638672,10.574249267578125
The villain,The investigator,drowned,The villain drowned the investigator by tying him to a heavy weight.,The villain drowned the investigator by tying him to a heavy weight.,The investigator was drowned by the villain by tying him to a heavy weight.,high,-66.00205993652344,-76.71455383300781,10.712493896484375
The construction company,the old building,demolished,The construction company demolished the old building.,The construction company demolished the old building.,The old building was demolished by the construction company.,high,-33.016212463378906,-35.85113525390625,2.8349227905273438
The woman,The can,crushed,The woman crushed the can with ease.,The woman crushed the can with ease.,The can was crushed by the woman with ease.,high,-39.901954650878906,-49.26222229003906,9.360267639160156
The soldiers,the prisoner,executed,The soldiers executed the prisoner at dawn.,The soldiers executed the prisoner at dawn.,The prisoner was executed by the soldiers at dawn.,high,-25.63990020751953,-31.129289627075195,5.489389419555664
The attacker,the victim,stabbed,The attacker viciously stabbed the victim in the crowded marketplace.,The attacker viciously stabbed the victim in the crowded marketplace.,The victim was viciously stabbed by the attacker in the crowded marketplace.,high,-42.00016784667969,-42.693260192871094,0.6930923461914062
the villain,the spy,strangled,The villain strangled the spy in the alley.,The villain strangled the spy in the alley.,The spy was strangled by the villain in the alley.,high,-43.49044418334961,-50.79606628417969,7.305622100830078
The government,the treacherous spy,executed,The government executed the treacherous spy who had betrayed the country.,The government executed the treacherous spy who had betrayed the country.,The treacherous spy who had betrayed the country was executed by the government.,high,-56.45045471191406,-61.34577178955078,4.895317077636719
The horse,the intruder,kicked,The horse kicked the intruder with all its might.,The horse kicked the intruder with all its might.,The intruder was kicked by the horse with all its might.,high,-51.28704071044922,-56.892723083496094,5.605682373046875
The novelist,his protagonist,murdered,The novelist murdered his protagonist in the latest chapter.,The novelist murdered his protagonist in the latest chapter.,His protagonist was murdered in the latest chapter by the novelist.,high,-53.13945388793945,-54.58744430541992,1.4479904174804688
The executioner,the traitor,executed,The executioner executed the traitor at dawn.,The executioner executed the traitor at dawn.,The traitor was executed by the executioner at dawn.,high,-37.210243225097656,-36.045021057128906,-1.16522216796875
The gangster,the rival leader,shot,The gangster shot the rival leader.,The gangster shot the rival leader.,The rival leader was shot by the gangster.,high,-37.31947708129883,-49.66850280761719,12.34902572631836
The pirate,the sail,knifed,The pirate knifed the sail to bring it down quickly during the skirmish.,The pirate knifed the sail to bring it down quickly during the skirmish.,The sail was knifed by the pirate to bring it down quickly during the skirmish.,high,-76.37399291992188,-78.83943176269531,2.4654388427734375
The technician,the faulty machine,dismantled,The technician dismantled the faulty machine.,The technician dismantled the faulty machine.,The faulty machine was dismantled by the technician.,high,-36.73543167114258,-47.06590270996094,10.33047103881836
The bullet,The glass window,shattered,The bullet shattered the glass window of the abandoned car.,The bullet shattered the glass window of the abandoned car.,The glass window of the abandoned car was shattered by the bullet.,high,-38.314697265625,-44.979530334472656,6.664833068847656
The villain,the spy,suffocated,The villain suffocated the spy with a pillow.,The villain suffocated the spy with a pillow.,The spy with a pillow was suffocated by the villain.,high,-40.258792877197266,-54.42304611206055,14.164253234863281
The chef,The vegetables,burned,The chef burned the vegetables to a crisp by accident.,The chef burned the vegetables to a crisp by accident.,The vegetables were burned to a crisp by accident by the chef.,high,-49.68728256225586,-56.763702392578125,7.076419830322266
The writer,the manuscript,completed,The writer completed the manuscript.,The writer completed the manuscript.,The manuscript was completed by the writer.,high,-27.52349281311035,-31.904285430908203,4.380792617797852
The rogue tiger,the village,terrorized,The rogue tiger terrorized the village for weeks.,The rogue tiger terrorized the village for weeks.,The village was terrorized by the rogue tiger for weeks.,high,-40.61790084838867,-45.33680725097656,4.718906402587891
The arsonist,the building,burned,The arsonist burned the building to ashes.,The arsonist burned the building to ashes.,The building was burned to ashes by the aronist.,high,-27.756093978881836,-62.56165313720703,34.805559158325195
the thief,the glass display case,shattered,The thief shattered the glass display case to steal the jewels.,The thief shattered the glass display case to steal the jewels.,The glass display case was shattered by the thief to steal the jewels.,high,-58.055118560791016,-68.2966079711914,10.24148941040039
The monster,the village,terrorized,The monster terrorized the village.,The monster terrorized the village.,The village was terrorized by the monster.,high,-29.27428436279297,-31.7357234954834,2.4614391326904297
The giant,the fallen knight,crushed,The giant crushed the fallen knight with one blow.,The giant crushed the fallen knight with one blow.,The fallen knight was crushed by the giant with one blow.,high,-51.61919021606445,-58.110931396484375,6.491741180419922
The construction crew,the unsafe structure,demolished,The construction crew demolished the unsafe structure to make way for new development.,The construction crew demolished the unsafe structure to make way for new development.,The unsafe structure was demolished by the construction crew to make way for new development,high,-51.625526428222656,-56.980777740478516,5.355251312255859
The king,the prisoner,executed,The king executed the prisoner at dawn.,The king executed the prisoner at dawn.,The prisoner was executed by the king at dawn.,high,-29.345069885253906,-34.0695686340332,4.724498748779297
the actor,the prop,knifed,The actor knifed the prop during the final act with dramatic flair.,The actor knifed the prop during the final act with dramatic flair.,The prop was knifed by the actor during the final act with dramatic flair.,high,-67.4733657836914,-77.03358459472656,9.560218811035156
The developers,The old building,demolished,The developers demolished the old building to make way for a new skyscraper.,The developers demolished the old building to make way for a new skyscraper.,The old building was demolished by the developers to make way for a new skyscraper.,high,-42.157920837402344,-46.865631103515625,4.707710266113281
The haunted house attraction,the visitors,frightened,The haunted house attraction frightened the visitors with its sudden surprises.,The haunted house attraction frightened the visitors with its sudden surprises.,The visitors were frightened by the haunted house attraction with its sudden surprises.,high,-59.69471740722656,-64.66629028320312,4.9715728759765625
The thief,the unsuspecting tourists,robbed,The thief robbed the unsuspecting tourists of their valuables.,The thief robbed the unsuspecting tourists of their valuables.,The unsuspecting tourists wer e robbed of their valuables by the thief.,high,-49.90668487548828,-84.69501495361328,34.788330078125
The elephant,the fruit,crushed,The elephant crushed the fruit under its feet.,The elephant crushed the fruit under its feet.,The fruit under its feet was crushed by the elephant.,high,-46.93360900878906,-56.51564025878906,9.58203125
The chef,the potatoes,boiled,The chef boiled the potatoes in a large pot.,The chef boiled the potatoes in a large pot.,The potatoes were boiled by the chef in a large pot.,high,-36.50777053833008,-47.25017547607422,10.74240493774414
The gang,the local residents,terrorized,The gang terrorized the local residents for months.,The gang terrorized the local residents for months.,The local residents were terrorized by the gang for months.,high,-31.39370346069336,-39.556976318359375,8.163272857666016
suspect,detective,murdered,The suspect murdered the detective in his own living room.,The suspect murdered the detective in his own living room.,The detective was murdered by the suspect in his own living room.,high,-48.131256103515625,-47.832977294921875,-0.29827880859375
The lifeguard,the intruder,drowned,The lifeguard drowned the intruder during practice.,The lifeguard drowned the intruder during practice.,The intruder was drowned by the lifeguard during practice.,high,-48.089385986328125,-60.227943420410156,12.138557434082031
The pirate captain,the enemies,drowned,The pirate captain drowned the enemies in the turbulent sea.,The pirate captain drowned the enemies in the turbulent sea.,The enemies were drowned into the turbulent sea by the pirate captain.,high,-51.531307220458984,-64.87410736083984,13.34280014038086
The explosion,The old abandoned warehouse,destroyed,The explosion destroyed the old abandoned warehouse.,The explosion destroyed the old abandoned warehouse.,The old abandoned warehouse was destroyed by the explosion.,high,-35.52333450317383,-36.11122131347656,0.5878868103027344
criminal gang,local businesses,terrorized,The criminal gang terrorized the local businesses in the downtown area.,The criminal gang terrorized the local businesses in the downtown area.,The local businesses in the downtown area were terrorized by the criminal gang.,high,-46.630157470703125,-50.06199264526367,3.431835174560547
The team,the stalled car,pushed,The team pushed the stalled car to the side of the road.,The team pushed the stalled car to the side of the road.,The stalled car was pushed to the side of the road by the team.,high,-41.23019027709961,-46.341941833496094,5.111751556396484
the hurricane,windows across the coastal town,shattered,The hurricane shattered windows across the coastal town.,The hurricane shattered windows across the coastal town.,Windows across the coastal town were shattered by the hurricane.,high,-40.1422119140625,-54.06294250488281,13.920730590820312
the movie villain,his adversary,strangled,The movie villain strangled his adversary without hesitation.,The movie villain strangled his adversary without hesitation.,His adversary was strangled without hesitation by the movie villain.,high,-55.37025833129883,-62.73231506347656,7.362056732177734
the spy,the guard,strangled,The spy strangled the guard silently in the shadows.,The spy strangled the guard silently in the shadows.,The guard was strangled silently in the shadows by the spy.,high,-52.189483642578125,-62.835731506347656,10.646247863769531
The machine,The scrap metal,crushed,The machine crushed the scrap metal into a compact cube.,The machine crushed the scrap metal into a compact cube.,The scrap metal was crushed into a compact metal cube by the machine.,high,-47.94203567504883,-61.06014633178711,13.118110656738281
The storm,The small fishing village,wrecked,The storm wrecked the small fishing village overnight.,The storm wrecked the small fishing village overnight.,The small fishing village was wrecked overnight by the storm.,high,-34.14077377319336,-41.95846939086914,7.817695617675781
the thief,the vase,broke,The thief broke the vase during the heist.,The thief broke the vase during the heist.,The vase was broke by the thief during the heist.,high,-39.544761657714844,-57.3025016784668,17.757740020751953
the angry customer,the sales clerk,pushed,The angry customer pushed the sales clerk.,The angry customer pushed the sales clerk.,The sales clerk was pushed by the angry customer.,high,-42.323570251464844,-46.92024230957031,4.596672058105469
The state,the prisoner,executed,The state officially executed the prisoner as per the court's final ruling.,The state officially executed the prisoner as per the court's final ruling.,The prisoner was officially executed by the state as per the court's final ruling.,high,-54.079856872558594,-54.861114501953125,0.7812576293945312
The bully,the boy,pushed,The bully pushed the boy off the swing.,The bully pushed the boy off the swing.,The boy was pushed off the swing by the bully.,high,-48.55931091308594,-45.9575080871582,-2.6018028259277344
The burglar,the antique vase,broke,The burglar broke the antique vase during the heist.,The burglar broke the antique vase during the heist.,The antique vase was broke by the burglar during the heist.,high,-41.2117919921875,-58.71586227416992,17.504070281982422
The villain,The hostage,strangled,The villain strangled the hostage to intimidate the hero.,The villain strangled the hostage to intimidate the hero.,The hostage was strangled by the villain to intimidate the hero.,high,-58.441078186035156,-62.76416778564453,4.323089599609375
the outlaw,the sheriff,murdered,The outlaw brutally murdered the sheriff.,The outlaw brutally murdered the sheriff.,The sheriff was brutally murdered by the outlaw.,high,-44.0452880859375,-41.81309509277344,-2.2321929931640625
The butler,The victim,murdered,The butler murdered the victim.,The butler murdered the victim.,The victim was murdered by the butler.,high,-29.245323181152344,-30.811874389648438,1.5665512084960938
The criminal,His opponent,suffocated,The criminal suffocated his opponent with a pillow.,The criminal suffocated his opponent with a pillow.,His opponent was suffocated by the criminal with a pillow.,high,-41.716033935546875,-45.98493194580078,4.268898010253906
The pest control worker,the termites,exterminated,The pest control worker exterminated the termites in the basement.,The pest control worker exterminated the termites in the basement.,The termites in the basement were exterminated by the pest control worker.,high,-39.078121185302734,-59.667747497558594,20.58962631225586
The ghost,the children,frightened,The ghost frightened the children in the haunted house.,The ghost frightened the children in the haunted house.,The children in the haunted house were frightened by the ghost.,high,-38.1185188293457,-39.9952278137207,1.876708984375
The man,The pile of dry leaves,burned,The man burned the pile of dry leaves in the backyard.,The man burned the pile of dry leaves in the backyard.,The pile of dry leaves in the backyard were burned by the man.,high,-46.333282470703125,-58.41936111450195,12.086078643798828
The kidnapper,the victim,suffocated,The kidnapper suffocated the victim with a pillow.,The kidnapper suffocated the victim with a pillow.,The victim was suffocated by the kidnapper with a pillow.,high,-34.100624084472656,-47.100704193115234,13.000080108642578
The scientist,the experimental compound,synthesized,The scientist synthesized the experimental compound.,The scientist synthesized the experimental compound.,The experimental compound was synthesized by the scientist.,high,-39.650169372558594,-46.88325500488281,7.233085632324219
knight,mythical beast,stabbed,The knight stabbed the sword into the mythical beast.,The knight stabbed the sword into the mythical beast.,The sword was stabbed by the knight into the mythical beast.,high,-53.61870574951172,-61.20514678955078,7.5864410400390625
the butler,the wealthy businessman,murdered,The detective murdered the wealthy businessman.,The detective murdered the wealthy businessman.,The wealthy businessman was murdered by the detective.,high,-34.4018440246582,-47.84022903442383,13.438385009765625
The chef,a flawless soufflé,executed,The chef executed a flawless soufflé for the guests.,The chef executed a flawless soufflé for the guests.,A flawless soufflé was executed for the guests by the chef.,high,-50.71611404418945,-71.89180755615234,21.17569351196289
The firing squad,the prisoner,executed,The firing squad executed the prisoner at dawn.,The firing squad executed the prisoner at dawn.,The prisoner was executed by the firing squad at dawn.,high,-27.616291046142578,-34.820068359375,7.203777313232422
The earthquake,the downtown skyscraper,collapsed,The earthquake collapsed the downtown skyscraper.,The earthquake collapsed the downtown skyscraper.,The downtown skyscraper was collapsed by the earthquake.,high,-39.234092712402344,-35.95322799682617,-3.280864715576172
The machine,The rocks,crushed,The machine crushed the rocks into gravel.,The machine crushed the rocks into gravel.,The rocks were crushed by the machine into gravel.,high,-38.668399810791016,-47.87348937988281,9.205089569091797
The predator,the village,terrorized,The predator terrorized the village for months.,The predator terrorized the village for months.,The village was terrorized by the predator for months.,high,-32.101722717285156,-39.470027923583984,7.368305206298828
The construction worker,The rock,crushed,The construction worker crushed the rock with a heavy machine.,The construction worker crushed the rock with a heavy machine.,The rock was crushed by the construction worker with a heavy machine.,high,-43.34716033935547,-49.612449645996094,6.265289306640625
The heavy rain,The small garden,drowned,The heavy rain drowned the small garden under inches of water.,The heavy rain drowned the small garden under inches of water.,The small garden was drowned by the heavy rain under inches of water.,high,-56.17385482788086,-65.67455291748047,9.50069808959961
The killer,The victim,suffocated,The killer suffocated the victim with a pillow.,The killer suffocated the victim with a pillow.,The victim was suffocated by the killer with a pillow.,high,-29.95281410217285,-39.393218994140625,9.440404891967773
The movers,the antique vase,broke,The movers accidentally broke the antique vase.,The movers accidentally broke the antique vase.,The antique vase was accidentally broke by the movers.,high,-45.266048431396484,-60.34661102294922,15.080562591552734
The photographer,the wedding photos,shot,The photographer shot the wedding photos beautifully.,The photographer shot the wedding photos beautifully.,The wedding photos were beautifully shot by the photographer.,high,-36.166038513183594,-38.32821273803711,2.1621742248535156
The gang,the small village,terrorized,The gang terrorized the small village for weeks.,The gang terrorized the small village for weeks.,The small village was terrorized by the gang for weeks.,high,-30.909469604492188,-39.480613708496094,8.571144104003906
The storm,the old pier,smashed,The storm smashed the old pier.,The storm smashed the old pier.,The old pier was smashed by the storm.,high,-31.221988677978516,-40.43598556518555,9.213996887207031
The guerrilla fighters,the small rural community,terrorized,The guerrilla fighters terrorized the small rural community.,The guerrilla fighters terrorized the small rural community.,The small rural community was terrorized by the guerilla fighters.,high,-40.82361602783203,-43.78835678100586,2.964740753173828
The lifeguard,the child who nearly drowned in the pool,saved,The lifeguard saved the child who nearly drowned in the pool.,The lifeguard saved the child who nearly drowned in the pool.,The child who nearly drowned in the pool was saved by the lifeguard.,high,-49.54398727416992,-55.536190032958984,5.9922027587890625
The arsonist,the building,demolished,The arsonist demolished the building.,The arsonist demolished the building.,The building was demolished by the arsonist.,high,-26.207077026367188,-30.162616729736328,3.9555397033691406
