subject,object,verb,sentence,active,passive,affectedness,active_score,passive_score,pass_drop
The pest control team,all the insects in the house,exterminated,The pest control team exterminated all the insects in the house.,The pest control team exterminated all the insects in the house.,All the insects in the house were exterminated by the pest control team.,high,-37.25982666015625,-48.802345275878906,11.542518615722656
assassin,wealthy businessman,murdered,The assassin murdered the wealthy businessman in his secluded mansion.,The assassin murdered the wealthy businessman in his secluded mansion.,The wealthy businessman was murdered by the assassin in his secluded mansion.,high,-43.260677337646484,-53.543914794921875,10.28323745727539
The prisoner,His rival inmate,knifed,The prisoner knifed his rival inmate during lunch.,The prisoner knifed his rival inmate during lunch.,His rival inmate was knifed by the prisoner during lunch.,high,-52.817970275878906,-63.99959945678711,11.181629180908203
The athlete,the world record,broke,The athlete broke the world record in the event.,The athlete broke the world record in the event.,The world record in the event was broke by the athlete.,high,-33.205596923828125,-50.183753967285156,16.97815704345703
The campfire,the stack of wood,burned,The campfire burned the stack of wood.,The campfire burned the stack of wood.,The stack of wood was burned by the campfire.,high,-37.71735382080078,-46.48012924194336,8.762775421142578
The state,the criminal,executed,The state executed the criminal at dawn.,The state executed the criminal at dawn.,The criminal was executed by the state at dawn.,high,-33.58526611328125,-39.239585876464844,5.654319763183594
The construction worker,the concrete pillar,crushed,The construction worker crushed the concrete pillar.,The construction worker crushed the concrete pillar.,The concrete pillar was crushed by the construction worker.,high,-34.77049255371094,-44.99203109741211,10.221538543701172
The chef,The juicy steak,stabbed,The chef expertly stabbed the fork into the juicy steak.,The chef expertly stabbed the fork into the juicy steak.,The fork was stabbed expertly by the chef into the juicy steak.,high,-54.70787811279297,-70.43370819091797,15.725830078125
the storm,dozens of houses,wrecked,The storm wrecked dozens of houses along the coastline.,The storm wrecked dozens of houses along the coastline.,Dozens of houses along the coastline were wrecked by the storm.,high,-35.95217514038086,-34.564510345458984,-1.387664794921875
The mother,water,boiled,The mother boiled water for her child's bottle.,The mother boiled water for her child's bottle.,Water for her child's bottle was boiled by the mother.,high,-48.01304626464844,-55.95764923095703,7.944602966308594
The campers,the marshmallows,burned,The campers accidentally burned the marshmallows over the fire.,The campers accidentally burned the marshmallows over the fire.,The marshmallows were accidentally burned over the fire by the campers.,high,-49.12762451171875,-66.91712951660156,17.789505004882812
The criminal,the unsuspecting victim,knifed,The criminal knifed the unsuspecting victim in the alley.,The criminal knifed the unsuspecting victim in the alley.,The unsuspecting victim was knifed in the alley by the criminal.,high,-40.15966796875,-47.48773193359375,7.32806396484375
The compactor,The metal cans,crushed,The compactor crushed the metal cans into cubes.,The compactor crushed the metal cans into cubes.,The metal cans were crushed into cubes by the compactor.,high,-46.01384353637695,-51.62892532348633,5.615081787109375
The thieves,the unsuspecting travelers,robbed,The thieves robbed the unsuspecting travelers at the desolate rest stop.,The thieves robbed the unsuspecting travelers at the desolate rest stop.,The unsuspecting travelers were robbed by thieves at the desolate rest stop.,high,-70.32117462158203,-79.35997772216797,9.038803100585938
The knight,The dragon,stabbed,The knight stabbed the dragon with his enchanted sword.,The knight stabbed the dragon with his enchanted sword.,The dragon was stabbed by the knight with his enchanted sword.,high,-43.22369384765625,-54.67174530029297,11.448051452636719
The mechanic,the old car,crushed,The mechanic crushed the old car with the hydraulic press.,The mechanic crushed the old car with the hydraulic press.,The old car was crushed by the mechanic with the hydraulic press.,high,-47.222774505615234,-49.694480895996094,2.4717063903808594
The political faction,the citizens,terrorized,The political faction terrorized the citizens with threats of violence.,The political faction terrorized the citizens with threats of violence.,The citizens were terrorized with threats of violence by the political faction.,high,-43.920318603515625,-52.73372268676758,8.813404083251953
The criminals,the bank,robbed,The criminals robbed the bank in broad daylight.,The criminals robbed the bank in broad daylight.,The bank was robbed by the criminals in broad daylight.,high,-35.58937072753906,-41.7518310546875,6.1624603271484375
The villain,The investigator,drowned,The villain drowned the investigator by tying him to a heavy weight.,The villain drowned the investigator by tying him to a heavy weight.,The investigator was drowned by the villain by tying him to a heavy weight.,high,-59.1102180480957,-74.39297485351562,15.282756805419922
The construction company,the old building,demolished,The construction company demolished the old building.,The construction company demolished the old building.,The old building was demolished by the construction company.,high,-30.895076751708984,-33.96663284301758,3.0715560913085938
The woman,The can,crushed,The woman crushed the can with ease.,The woman crushed the can with ease.,The can was crushed by the woman with ease.,high,-38.91012954711914,-47.522613525390625,8.612483978271484
The soldiers,the prisoner,executed,The soldiers executed the prisoner at dawn.,The soldiers executed the prisoner at dawn.,The prisoner was executed by the soldiers at dawn.,high,-26.93185043334961,-37.760963439941406,10.829113006591797
The attacker,the victim,stabbed,The attacker viciously stabbed the victim in the crowded marketplace.,The attacker viciously stabbed the victim in the crowded marketplace.,The victim was viciously stabbed by the attacker in the crowded marketplace.,high,-48.140567779541016,-42.59851837158203,-5.542049407958984
the villain,the spy,strangled,The villain strangled the spy in the alley.,The villain strangled the spy in the alley.,The spy was strangled by the villain in the alley.,high,-41.3016471862793,-45.46625518798828,4.164608001708984
The government,the treacherous spy,executed,The government executed the treacherous spy who had betrayed the country.,The government executed the treacherous spy who had betrayed the country.,The treacherous spy who had betrayed the country was executed by the government.,high,-52.579036712646484,-57.96822738647461,5.389190673828125
The horse,the intruder,kicked,The horse kicked the intruder with all its might.,The horse kicked the intruder with all its might.,The intruder was kicked by the horse with all its might.,high,-47.07105255126953,-53.36885070800781,6.297798156738281
The novelist,his protagonist,murdered,The novelist murdered his protagonist in the latest chapter.,The novelist murdered his protagonist in the latest chapter.,His protagonist was murdered in the latest chapter by the novelist.,high,-46.892364501953125,-53.77154541015625,6.879180908203125
The executioner,the traitor,executed,The executioner executed the traitor at dawn.,The executioner executed the traitor at dawn.,The traitor was executed by the executioner at dawn.,high,-39.623756408691406,-42.34239959716797,2.7186431884765625
The gangster,the rival leader,shot,The gangster shot the rival leader.,The gangster shot the rival leader.,The rival leader was shot by the gangster.,high,-42.48797607421875,-41.5973014831543,-0.8906745910644531
The pirate,the sail,knifed,The pirate knifed the sail to bring it down quickly during the skirmish.,The pirate knifed the sail to bring it down quickly during the skirmish.,The sail was knifed by the pirate to bring it down quickly during the skirmish.,high,-74.5407943725586,-83.6896743774414,9.148880004882812
The technician,the faulty machine,dismantled,The technician dismantled the faulty machine.,The technician dismantled the faulty machine.,The faulty machine was dismantled by the technician.,high,-32.61561965942383,-45.01642608642578,12.400806427001953
The bullet,The glass window,shattered,The bullet shattered the glass window of the abandoned car.,The bullet shattered the glass window of the abandoned car.,The glass window of the abandoned car was shattered by the bullet.,high,-37.16320037841797,-45.615413665771484,8.452213287353516
The villain,the spy,suffocated,The villain suffocated the spy with a pillow.,The villain suffocated the spy with a pillow.,The spy with a pillow was suffocated by the villain.,high,-36.576168060302734,-55.864952087402344,19.28878402709961
The chef,The vegetables,burned,The chef burned the vegetables to a crisp by accident.,The chef burned the vegetables to a crisp by accident.,The vegetables were burned to a crisp by accident by the chef.,high,-43.33121109008789,-52.231727600097656,8.900516510009766
The writer,the manuscript,completed,The writer completed the manuscript.,The writer completed the manuscript.,The manuscript was completed by the writer.,high,-27.266864776611328,-31.16623306274414,3.8993682861328125
The rogue tiger,the village,terrorized,The rogue tiger terrorized the village for weeks.,The rogue tiger terrorized the village for weeks.,The village was terrorized by the rogue tiger for weeks.,high,-37.59587097167969,-46.7121696472168,9.11629867553711
The arsonist,the building,burned,The arsonist burned the building to ashes.,The arsonist burned the building to ashes.,The building was burned to ashes by the aronist.,high,-29.709789276123047,-62.675811767578125,32.96602249145508
the thief,the glass display case,shattered,The thief shattered the glass display case to steal the jewels.,The thief shattered the glass display case to steal the jewels.,The glass display case was shattered by the thief to steal the jewels.,high,-50.24833679199219,-61.11452865600586,10.866191864013672
The monster,the village,terrorized,The monster terrorized the village.,The monster terrorized the village.,The village was terrorized by the monster.,high,-28.375648498535156,-33.162662506103516,4.787014007568359
The giant,the fallen knight,crushed,The giant crushed the fallen knight with one blow.,The giant crushed the fallen knight with one blow.,The fallen knight was crushed by the giant with one blow.,high,-45.9517822265625,-55.0966682434082,9.144886016845703
The construction crew,the unsafe structure,demolished,The construction crew demolished the unsafe structure to make way for new development.,The construction crew demolished the unsafe structure to make way for new development.,The unsafe structure was demolished by the construction crew to make way for new development,high,-49.168312072753906,-57.27654266357422,8.108230590820312
The king,the prisoner,executed,The king executed the prisoner at dawn.,The king executed the prisoner at dawn.,The prisoner was executed by the king at dawn.,high,-32.71425247192383,-35.81582260131836,3.1015701293945312
the actor,the prop,knifed,The actor knifed the prop during the final act with dramatic flair.,The actor knifed the prop during the final act with dramatic flair.,The prop was knifed by the actor during the final act with dramatic flair.,high,-60.46662521362305,-71.40802764892578,10.941402435302734
The developers,The old building,demolished,The developers demolished the old building to make way for a new skyscraper.,The developers demolished the old building to make way for a new skyscraper.,The old building was demolished by the developers to make way for a new skyscraper.,high,-41.57675552368164,-46.66954803466797,5.092792510986328
The haunted house attraction,the visitors,frightened,The haunted house attraction frightened the visitors with its sudden surprises.,The haunted house attraction frightened the visitors with its sudden surprises.,The visitors were frightened by the haunted house attraction with its sudden surprises.,high,-48.94667053222656,-67.1717758178711,18.22510528564453
The thief,the unsuspecting tourists,robbed,The thief robbed the unsuspecting tourists of their valuables.,The thief robbed the unsuspecting tourists of their valuables.,The unsuspecting tourists wer e robbed of their valuables by the thief.,high,-39.96807861328125,-83.18228912353516,43.214210510253906
The elephant,the fruit,crushed,The elephant crushed the fruit under its feet.,The elephant crushed the fruit under its feet.,The fruit under its feet was crushed by the elephant.,high,-47.26641845703125,-54.72943878173828,7.463020324707031
The chef,the potatoes,boiled,The chef boiled the potatoes in a large pot.,The chef boiled the potatoes in a large pot.,The potatoes were boiled by the chef in a large pot.,high,-34.46794128417969,-48.51771926879883,14.04977798461914
The gang,the local residents,terrorized,The gang terrorized the local residents for months.,The gang terrorized the local residents for months.,The local residents were terrorized by the gang for months.,high,-33.2957763671875,-42.101322174072266,8.805545806884766
suspect,detective,murdered,The suspect murdered the detective in his own living room.,The suspect murdered the detective in his own living room.,The detective was murdered by the suspect in his own living room.,high,-41.020938873291016,-44.21531677246094,3.194377899169922
The lifeguard,the intruder,drowned,The lifeguard drowned the intruder during practice.,The lifeguard drowned the intruder during practice.,The intruder was drowned by the lifeguard during practice.,high,-51.365455627441406,-53.602622985839844,2.2371673583984375
The pirate captain,the enemies,drowned,The pirate captain drowned the enemies in the turbulent sea.,The pirate captain drowned the enemies in the turbulent sea.,The enemies were drowned into the turbulent sea by the pirate captain.,high,-53.87299728393555,-65.93791961669922,12.064922332763672
The explosion,The old abandoned warehouse,destroyed,The explosion destroyed the old abandoned warehouse.,The explosion destroyed the old abandoned warehouse.,The old abandoned warehouse was destroyed by the explosion.,high,-34.08130645751953,-38.27812576293945,4.196819305419922
criminal gang,local businesses,terrorized,The criminal gang terrorized the local businesses in the downtown area.,The criminal gang terrorized the local businesses in the downtown area.,The local businesses in the downtown area were terrorized by the criminal gang.,high,-44.647071838378906,-55.41261672973633,10.765544891357422
The team,the stalled car,pushed,The team pushed the stalled car to the side of the road.,The team pushed the stalled car to the side of the road.,The stalled car was pushed to the side of the road by the team.,high,-38.99240493774414,-48.76481628417969,9.772411346435547
the hurricane,windows across the coastal town,shattered,The hurricane shattered windows across the coastal town.,The hurricane shattered windows across the coastal town.,Windows across the coastal town were shattered by the hurricane.,high,-37.162635803222656,-47.08798599243164,9.925350189208984
the movie villain,his adversary,strangled,The movie villain strangled his adversary without hesitation.,The movie villain strangled his adversary without hesitation.,His adversary was strangled without hesitation by the movie villain.,high,-50.159423828125,-63.04925537109375,12.88983154296875
the spy,the guard,strangled,The spy strangled the guard silently in the shadows.,The spy strangled the guard silently in the shadows.,The guard was strangled silently in the shadows by the spy.,high,-40.260013580322266,-54.93942642211914,14.679412841796875
The machine,The scrap metal,crushed,The machine crushed the scrap metal into a compact cube.,The machine crushed the scrap metal into a compact cube.,The scrap metal was crushed into a compact metal cube by the machine.,high,-40.079917907714844,-50.59960174560547,10.519683837890625
The storm,The small fishing village,wrecked,The storm wrecked the small fishing village overnight.,The storm wrecked the small fishing village overnight.,The small fishing village was wrecked overnight by the storm.,high,-32.419822692871094,-38.46418380737305,6.044361114501953
the thief,the vase,broke,The thief broke the vase during the heist.,The thief broke the vase during the heist.,The vase was broke by the thief during the heist.,high,-38.17251968383789,-55.729896545410156,17.557376861572266
the angry customer,the sales clerk,pushed,The angry customer pushed the sales clerk.,The angry customer pushed the sales clerk.,The sales clerk was pushed by the angry customer.,high,-46.792205810546875,-44.84992218017578,-1.9422836303710938
The state,the prisoner,executed,The state officially executed the prisoner as per the court's final ruling.,The state officially executed the prisoner as per the court's final ruling.,The prisoner was officially executed by the state as per the court's final ruling.,high,-57.03040313720703,-64.2733154296875,7.242912292480469
The bully,the boy,pushed,The bully pushed the boy off the swing.,The bully pushed the boy off the swing.,The boy was pushed off the swing by the bully.,high,-43.80787658691406,-43.422943115234375,-0.3849334716796875
The burglar,the antique vase,broke,The burglar broke the antique vase during the heist.,The burglar broke the antique vase during the heist.,The antique vase was broke by the burglar during the heist.,high,-39.80772399902344,-58.87874984741211,19.071025848388672
The villain,The hostage,strangled,The villain strangled the hostage to intimidate the hero.,The villain strangled the hostage to intimidate the hero.,The hostage was strangled by the villain to intimidate the hero.,high,-53.38606262207031,-58.88494110107422,5.498878479003906
the outlaw,the sheriff,murdered,The outlaw brutally murdered the sheriff.,The outlaw brutally murdered the sheriff.,The sheriff was brutally murdered by the outlaw.,high,-44.18830490112305,-42.311683654785156,-1.8766212463378906
The butler,The victim,murdered,The butler murdered the victim.,The butler murdered the victim.,The victim was murdered by the butler.,high,-30.275470733642578,-31.568899154663086,1.2934284210205078
The criminal,His opponent,suffocated,The criminal suffocated his opponent with a pillow.,The criminal suffocated his opponent with a pillow.,His opponent was suffocated by the criminal with a pillow.,high,-36.758636474609375,-45.3985481262207,8.639911651611328
The pest control worker,the termites,exterminated,The pest control worker exterminated the termites in the basement.,The pest control worker exterminated the termites in the basement.,The termites in the basement were exterminated by the pest control worker.,high,-43.824058532714844,-65.57789611816406,21.75383758544922
The ghost,the children,frightened,The ghost frightened the children in the haunted house.,The ghost frightened the children in the haunted house.,The children in the haunted house were frightened by the ghost.,high,-34.88267517089844,-40.41410827636719,5.53143310546875
The man,The pile of dry leaves,burned,The man burned the pile of dry leaves in the backyard.,The man burned the pile of dry leaves in the backyard.,The pile of dry leaves in the backyard were burned by the man.,high,-43.911861419677734,-54.05219268798828,10.140331268310547
The kidnapper,the victim,suffocated,The kidnapper suffocated the victim with a pillow.,The kidnapper suffocated the victim with a pillow.,The victim was suffocated by the kidnapper with a pillow.,high,-32.40034484863281,-43.88500213623047,11.484657287597656
The scientist,the experimental compound,synthesized,The scientist synthesized the experimental compound.,The scientist synthesized the experimental compound.,The experimental compound was synthesized by the scientist.,high,-43.15752410888672,-45.716896057128906,2.5593719482421875
knight,mythical beast,stabbed,The knight stabbed the sword into the mythical beast.,The knight stabbed the sword into the mythical beast.,The sword was stabbed by the knight into the mythical beast.,high,-49.38633728027344,-55.263668060302734,5.877330780029297
the butler,the wealthy businessman,murdered,The detective murdered the wealthy businessman.,The detective murdered the wealthy businessman.,The wealthy businessman was murdered by the detective.,high,-30.02084732055664,-41.99831771850586,11.977470397949219
The chef,a flawless soufflé,executed,The chef executed a flawless soufflé for the guests.,The chef executed a flawless soufflé for the guests.,A flawless soufflé was executed for the guests by the chef.,high,-55.19005584716797,-74.25843811035156,19.068382263183594
The firing squad,the prisoner,executed,The firing squad executed the prisoner at dawn.,The firing squad executed the prisoner at dawn.,The prisoner was executed by the firing squad at dawn.,high,-33.36407470703125,-39.30690383911133,5.942829132080078
The earthquake,the downtown skyscraper,collapsed,The earthquake collapsed the downtown skyscraper.,The earthquake collapsed the downtown skyscraper.,The downtown skyscraper was collapsed by the earthquake.,high,-33.97158432006836,-37.127716064453125,3.1561317443847656
The machine,The rocks,crushed,The machine crushed the rocks into gravel.,The machine crushed the rocks into gravel.,The rocks were crushed by the machine into gravel.,high,-32.727943420410156,-41.46608352661133,8.738140106201172
The predator,the village,terrorized,The predator terrorized the village for months.,The predator terrorized the village for months.,The village was terrorized by the predator for months.,high,-35.159019470214844,-44.44948196411133,9.290462493896484
The construction worker,The rock,crushed,The construction worker crushed the rock with a heavy machine.,The construction worker crushed the rock with a heavy machine.,The rock was crushed by the construction worker with a heavy machine.,high,-38.671844482421875,-50.590171813964844,11.918327331542969
The heavy rain,The small garden,drowned,The heavy rain drowned the small garden under inches of water.,The heavy rain drowned the small garden under inches of water.,The small garden was drowned by the heavy rain under inches of water.,high,-52.44853973388672,-64.51889038085938,12.070350646972656
The killer,The victim,suffocated,The killer suffocated the victim with a pillow.,The killer suffocated the victim with a pillow.,The victim was suffocated by the killer with a pillow.,high,-27.124174118041992,-39.875694274902344,12.751520156860352
The movers,the antique vase,broke,The movers accidentally broke the antique vase.,The movers accidentally broke the antique vase.,The antique vase was accidentally broke by the movers.,high,-49.649349212646484,-57.43516540527344,7.785816192626953
The photographer,the wedding photos,shot,The photographer shot the wedding photos beautifully.,The photographer shot the wedding photos beautifully.,The wedding photos were beautifully shot by the photographer.,high,-37.72463607788086,-40.046783447265625,2.3221473693847656
The gang,the small village,terrorized,The gang terrorized the small village for weeks.,The gang terrorized the small village for weeks.,The small village was terrorized by the gang for weeks.,high,-34.09246063232422,-43.9681282043457,9.875667572021484
The storm,the old pier,smashed,The storm smashed the old pier.,The storm smashed the old pier.,The old pier was smashed by the storm.,high,-34.85668182373047,-38.501441955566406,3.6447601318359375
The guerrilla fighters,the small rural community,terrorized,The guerrilla fighters terrorized the small rural community.,The guerrilla fighters terrorized the small rural community.,The small rural community was terrorized by the guerilla fighters.,high,-45.092952728271484,-49.104923248291016,4.011970520019531
The lifeguard,the child who nearly drowned in the pool,saved,The lifeguard saved the child who nearly drowned in the pool.,The lifeguard saved the child who nearly drowned in the pool.,The child who nearly drowned in the pool was saved by the lifeguard.,high,-48.77556228637695,-54.388275146484375,5.612712860107422
The arsonist,the building,demolished,The arsonist demolished the building.,The arsonist demolished the building.,The building was demolished by the arsonist.,high,-28.52972412109375,-30.293792724609375,1.764068603515625
