Verb,Vno,Set,VtypeNEW,passive,active,active_score,passive_score,pass_drop
fear,V389,1a,(c) Experiencer-Theme,Marge was feared by Homer.,Homer feared Marge.,-40.8892822265625,-45.20266342163086,4.313381195068359
feed,V271,1a,(a) Agent-Patient,Marge was fed by Homer.,Homer fed Marge.,-44.967323303222656,-41.013553619384766,-3.9537696838378906
feel,V396,1a,(c) Experiencer-Theme,The earthquake was felt by Homer.,Homer felt the earthquake.,-32.83525466918945,-37.69721603393555,4.861961364746094
fill,V013,1a,(a) Agent-Patient,The cup was filled by Homer.,Homer filled the cup.,-33.645263671875,-37.6770133972168,4.031749725341797
film,V213,1a,(a) Agent-Patient,Marge was filmed by Homer.,Homer filmed Marge.,-41.27024841308594,-39.316837310791016,-1.9534111022949219
finish,V151,1a,(a) Agent-Patient,The crossword was finished by Homer.,Homer finished the crossword.,-38.9892692565918,-41.50686264038086,2.5175933837890625
fold,V136,1a,(a) Agent-Patient,The map was folded by Homer.,Homer folded the map.,-34.05181121826172,-38.78398132324219,4.732170104980469
follow,V290,1b,(a) Agent-Patient,Marge was followed by Homer.,Homer followed Marge.,-38.684471130371094,-37.51087188720703,-1.1735992431640625
forgive,V236,1b,(a) Agent-Patient,Marge was forgiven by Homer.,Homer forgave Marge.,-46.464447021484375,-41.79812240600586,-4.666324615478516
forget,V390,1a,(c) Experiencer-Theme,Marge was forgotten by Homer.,Homer forgot Marge.,-43.568687438964844,-43.120628356933594,-0.44805908203125
fight,V259,1a,(a) Agent-Patient,Marge was fought by Homer.,Homer fought Marge.,-37.296485900878906,-43.45337677001953,6.156890869140625
find,V186,1a,(a) Agent-Patient,Marge was found by Homer.,Homer found Marge.,-39.14316940307617,-40.053524017333984,0.9103546142578125
fry,V140,1a,(a) Agent-Patient,The breakfast was fried by Homer.,Homer fried the breakfast.,-37.49364471435547,-42.15769958496094,4.664054870605469
frighten,V322,1b,(b) Theme-Experiencer,Marge was frightened by Homer.,Homer frightened Marge.,-36.26713180541992,-44.71663284301758,8.449501037597656
freeze,V078,1b,(a) Agent-Patient,The lolly was frozen by Homer.,Homer froze the lolly.,-46.535770416259766,-49.57994079589844,3.044170379638672
gaze at,V366,1a,(c) Experiencer-Theme,Marge was gazed at by Homer.,Homer gazed at Marge.,-44.87199401855469,-43.61463165283203,-1.2573623657226562
glimpse,V356,1b,(c) Experiencer-Theme,Marge was glimpsed by Homer.,Homer glimpsed Marge.,-44.48168182373047,-45.60694122314453,1.1252593994140625
gobble,V115,1b,(a) Agent-Patient,The donut was gobbled by Homer.,Homer gobbled the donut.,-44.39098358154297,-54.625091552734375,10.234107971191406
gossip,V267,1b,(a) Agent-Patient,Marge was gossiped with by Homer.,Homer gossiped with Marge.,-48.51191329956055,-59.539703369140625,11.027790069580078
get,V405,1b,(d) Other Passivizable,The present was got by Homer.,Homer got the present.,-34.01018524169922,-49.36890411376953,15.358718872070312
grab,V187,1a,(a) Agent-Patient,Marge was grabbed by Homer.,Homer grabbed Marge.,-37.09600067138672,-41.43658447265625,4.340583801269531
greet,V237,1a,(a) Agent-Patient,Marge was greeted by Homer.,Homer greeted Marge.,-42.14913558959961,-39.04386901855469,-3.105266571044922
grow,V069,1a,(a) Agent-Patient,The flower was grown by Homer.,Homer grew the flower.,-40.77438735961914,-37.03428649902344,-3.740100860595703
grill,V141,1b,(a) Agent-Patient,The bacon was grilled by Homer.,Homer grilled the bacon.,-40.83684539794922,-35.968875885009766,-4.867969512939453
grip,V040,1a,(a) Agent-Patient,The handrail was gripped by Homer.,Homer gripped the handrail.,-43.42822265625,-47.036319732666016,3.6080970764160156
groom,V274,1b,(a) Agent-Patient,Marge was groomed by Homer.,Homer groomed Marge.,-46.967254638671875,-41.788963317871094,-5.178291320800781
growl,V094,1a,(a) Agent-Patient,The threat was growled by Homer.,Homer growled the threat.,-43.86432647705078,-44.323822021484375,0.45949554443359375
guide,V298,1b,(a) Agent-Patient,Marge was guided by Homer.,Homer guided Marge.,-38.294700622558594,-40.14170455932617,1.8470039367675781
guzzle,V116,1a,(a) Agent-Patient,The beer was guzzled by Homer.,Homer guzzled the beer.,-37.62188720703125,-39.91663360595703,2.2947463989257812
hammer,V006,1a,(a) Agent-Patient,The nail was hammered by Homer.,Homer hammered the nail.,-40.69388961791992,-42.61399841308594,1.9201087951660156
hate,V391,1b,(c) Experiencer-Theme,Marge was hated by Homer.,Homer hated Marge.,-33.46076202392578,-39.11029052734375,5.649528503417969
hear,V348,1a,(c) Experiencer-Theme,Marge was heard by Homer.,Homer heard Marge.,-38.14691162109375,-42.20134735107422,4.054435729980469
heat,V144,1a,(a) Agent-Patient,The tea was heated by Homer.,Homer heated the tea.,-36.63087844848633,-38.677120208740234,2.0462417602539062
hold,V188,1b,(a) Agent-Patient,Marge was held by Homer.,Homer held Marge.,-40.99802780151367,-39.4415397644043,-1.556488037109375
help,V300,1a,(a) Agent-Patient,Marge was helped by Homer.,Homer helped Marge.,-37.45271682739258,-40.77979278564453,3.327075958251953
hide,V189,1a,(a) Agent-Patient,Marge was hidden by Homer.,Homer hid Marge.,-43.16116714477539,-43.79315948486328,0.6319923400878906
hit,V191,1a,(a) Agent-Patient,Marge was hit by Homer.,Homer hit Marge.,-35.92593765258789,-40.6324462890625,4.706508636474609
hoist,V159,1b,(a) Agent-Patient,Marge was hoisted by Homer.,Homer hoisted Marge.,-47.0455322265625,-39.90252685546875,-7.14300537109375
horrify,V323,1a,(b) Theme-Experiencer,Marge was horrified by Homer.,Homer horrified Marge.,-38.928863525390625,-45.057891845703125,6.1290283203125
hug,V257,1b,(a) Agent-Patient,Marge was hugged by Homer.,Homer hugged Marge.,-41.73414611816406,-40.84307861328125,-0.8910675048828125
hum,V083,1a,(a) Agent-Patient,The tune was hummed by Homer.,Homer hummed the tune.,-38.57270812988281,-42.44923400878906,3.87652587890625
hurt,V272,1b,(a) Agent-Patient,Marge was hurt by Homer.,Homer hurt Marge.,-40.05509948730469,-43.913978576660156,3.8588790893554688
idolize,V372,1a,(c) Experiencer-Theme,Marge was idolized by Homer.,Homer idolized Marge.,-43.80669021606445,-41.26913833618164,-2.5375518798828125
ignore,V349,1a,(c) Experiencer-Theme,Marge was ignored by Homer.,Homer ignored Marge.,-37.56632995605469,-40.24349594116211,2.677165985107422
imply,V416,1b,(d) Other Passivizable,The allegation was implied by Homer.,Homer implied the allegation.,-39.80989074707031,-41.78086471557617,1.9709739685058594
impress,V324,1b,(b) Theme-Experiencer,Marge was impressed by Homer.,Homer impressed Marge.,-34.9723014831543,-39.68648910522461,4.7141876220703125
indicate,V417,1a,(d) Other Passivizable,The verdict was indicated by Homer.,Homer indicated the verdict.,-38.88612365722656,-39.38916015625,0.5030364990234375
infuriate,V325,1b,(b) Theme-Experiencer,Marge was infuriated by Homer.,Homer infuriated Marge.,-40.96870040893555,-42.69195556640625,1.7232551574707031
inherit,V404,1a,(d) Other Passivizable,The mansion was inherited by Homer.,Homer inherited the mansion.,-39.22113800048828,-36.87704086303711,-2.344097137451172
inspect,V357,1a,(c) Experiencer-Theme,Marge was inspected by Homer.,Homer inspected Marge.,-41.22647476196289,-41.85221862792969,0.6257438659667969
install,V002,1a,(a) Agent-Patient,The TV was installed by Homer.,Homer installed the TV.,-35.266822814941406,-41.20494842529297,5.9381256103515625
instruct,V269,1a,(a) Agent-Patient,Marge was instructed by Homer.,Homer instructed Marge.,-44.18067169189453,-42.678367614746094,-1.5023040771484375
insult,V242,1a,(a) Agent-Patient,Marge was insulted by Homer.,Homer insulted Marge.,-40.11278533935547,-42.59830856323242,2.485523223876953
invent,V075,1a,(a) Agent-Patient,The machine was invented by Homer.,Homer invented the machine.,-35.27516174316406,-30.55252456665039,-4.722637176513672
investigate,V358,1b,(c) Experiencer-Theme,Marge was investigated by Homer.,Homer investigated Marge.,-43.97591781616211,-41.18260955810547,-2.7933082580566406
irritate,V326,1a,(b) Theme-Experiencer,Marge was irritated by Homer.,Homer irritated Marge.,-40.50420379638672,-44.52422332763672,4.02001953125
justify,V408,1b,(d) Other Passivizable,The claim was justified by Homer.,Homer justified the claim.,-30.749845504760742,-40.026485443115234,9.276639938354492
keep,V041,1a,(a) Agent-Patient,The photograph was kept by Homer.,Homer kept the photograph.,-35.948787689208984,-39.05011749267578,3.101329803466797
kick,V192,1b,(a) Agent-Patient,Marge was kicked by Homer.,Homer kicked Marge.,-38.164634704589844,-42.229408264160156,4.0647735595703125
kill,V278,1a,(a) Agent-Patient,Marge was killed by Homer.,Homer killed Marge.,-36.11090850830078,-38.52599334716797,2.4150848388671875
kiss,V204,1a,(a) Agent-Patient,Marge was kissed by Homer.,Homer kissed Marge.,-36.38433837890625,-39.067562103271484,2.6832237243652344
knead,V076,1b,(a) Agent-Patient,The dough was kneaded by Homer.,Homer kneaded the dough.,-41.023258209228516,-44.237213134765625,3.2139549255371094
know,V373,1a,(c) Experiencer-Theme,Marge was known by Homer.,Homer knew Marge.,-33.63951873779297,-41.33917999267578,7.6996612548828125
knife,V282,1a,(a) Agent-Patient,Marge was knifed by Homer.,Homer knifed Marge.,-47.028968811035156,-42.46709442138672,-4.5618743896484375
knit,V070,1b,(a) Agent-Patient,The jumper was knitted by Homer.,Homer knitted the jumper.,-40.367958068847656,-47.47417449951172,7.1062164306640625
knock,V193,1a,(a) Agent-Patient,Marge was knocked by Homer.,Homer knocked Marge.,-40.31313705444336,-43.70047378540039,3.3873367309570312
lace,V050,1b,(a) Agent-Patient,The shoe was laced by Homer.,Homer laced the shoe.,-40.24679946899414,-40.787837982177734,0.5410385131835938
learn,V037,1a,(a) Agent-Patient,The poem was learnt by Homer.,Homer learnt the poem.,-42.32521438598633,-40.51898956298828,-1.8062248229980469
lead,V299,1a,(a) Agent-Patient,Marge was led by Homer.,Homer led Marge.,-40.787105560302734,-39.14183807373047,-1.6452674865722656
leave,V222,1b,(a) Agent-Patient,Marge was left by Homer.,Homer left Marge.,-38.27268600463867,-41.27134323120117,2.9986572265625
lick,V205,1b,(a) Agent-Patient,Marge was licked by Homer.,Homer licked Marge.,-47.0861701965332,-47.02500534057617,-0.06116485595703125
lift,V160,1a,(a) Agent-Patient,Marge was lifted by Homer.,Homer lifted Marge.,-45.492103576660156,-42.57377624511719,-2.9183273315429688
like,V374,1b,(c) Experiencer-Theme,Marge was liked by Homer.,Homer liked Marge.,-38.50385284423828,-40.44630432128906,1.9424514770507812
listen to,V367,1b,(c) Experiencer-Theme,Marge was listened to by Homer.,Homer listened to Marge.,-37.52959060668945,-43.756553649902344,6.226963043212891
loathe,V392,1a,(c) Experiencer-Theme,Marge was loathed by Homer.,Homer loathed Marge.,-45.95131301879883,-41.808372497558594,-4.142940521240234
lock,V051,1a,(a) Agent-Patient,The door was locked by Homer.,Homer locked the door.,-30.017011642456055,-37.28190612792969,7.264894485473633
look at,V368,1a,(c) Experiencer-Theme,Marge was looked at by Homer.,Homer looked at Marge.,-40.11433792114258,-42.92905044555664,2.8147125244140625
love,V375,1a,(c) Experiencer-Theme,Marge was loved by Homer.,Homer loved Marge.,-35.9320068359375,-38.87285614013672,2.9408493041992188
lower,V161,1b,(a) Agent-Patient,Marge was lowered by Homer.,Homer lowered Marge.,-44.16863250732422,-44.17427444458008,0.005641937255859375
make,V071,1a,(a) Agent-Patient,The dinner was made by Homer.,Homer made the dinner.,-34.53536605834961,-34.498966217041016,-0.03639984130859375
marry,V258,1b,(a) Agent-Patient,Marge was married by Homer.,Homer married Marge.,-34.692474365234375,-41.4697380065918,6.777263641357422
mash,V047,1a,(a) Agent-Patient,The potato was mashed by Homer.,Homer mashed the potato.,-44.913597106933594,-43.7012825012207,-1.2123146057128906
melt,V079,1a,(a) Agent-Patient,The butter was melted by Homer.,Homer melted the butter.,-39.6388053894043,-41.41178512573242,1.772979736328125
memorize,V038,1b,(a) Agent-Patient,The route was memorized by Homer.,Homer memorized the route.,-34.18035125732422,-40.003273010253906,5.8229217529296875
mention,V104,1b,(a) Agent-Patient,The party was mentioned by Homer.,Homer mentioned the party.,-36.787750244140625,-38.02511978149414,1.2373695373535156
meet,V260,1b,(a) Agent-Patient,Marge was met by Homer.,Homer met Marge.,-35.045387268066406,-40.77565383911133,5.730266571044922
miss,V376,1b,(c) Experiencer-Theme,Marge was missed by Homer.,Homer missed Marge.,-42.41401672363281,-41.5109748840332,-0.9030418395996094
mock,V243,1b,(a) Agent-Patient,Marge was mocked by Homer.,Homer mocked Marge.,-33.27119064331055,-40.76262283325195,7.491432189941406
move,V176,1b,(a) Agent-Patient,Marge was moved by Homer.,Homer moved Marge.,-43.63002014160156,-39.85246658325195,-3.7775535583496094
mumble,V095,1b,(a) Agent-Patient,The apology was mumbled by Homer.,Homer mumbled the apology.,-43.99460220336914,-45.231224060058594,1.2366218566894531
munch,V110,1a,(a) Agent-Patient,The chocolate was munched by Homer.,Homer munched the chocolate.,-48.46445846557617,-50.419212341308594,1.9547538757324219
murder,V279,1b,(a) Agent-Patient,Marge was murdered by Homer.,Homer murdered Marge.,-40.61942672729492,-38.61189270019531,-2.0075340270996094
mutter,V096,1a,(a) Agent-Patient,The swear-word was muttered by Homer.,Homer muttered the swear-word.,-57.677371978759766,-53.28630065917969,-4.391071319580078
need,V398,1a,(c) Experiencer-Theme,The water was needed by Homer.,Homer needed the water.,-32.37685012817383,-38.923858642578125,6.547008514404297
nibble,V111,1b,(a) Agent-Patient,The biscuit was nibbled by Homer.,Homer nibbled the biscuit.,-40.249298095703125,-47.72199630737305,7.472698211669922
discern,V395,1b,(c) Experiencer-Theme,The leader was nominated by Homer.,Homer nominated the leader.,-40.31163787841797,-41.50526809692383,1.1936302185058594
notice,V350,1b,(c) Experiencer-Theme,Marge was noticed by Homer.,Homer noticed Marge.,-39.38270568847656,-41.12724304199219,1.744537353515625
nullify,V411,1a,(d) Other Passivizable,The attempt was nullified by Homer.,Homer nullified the attempt.,-40.80432891845703,-41.578956604003906,0.774627685546875
obscure,V418,1b,(d) Other Passivizable,The scandal was obscured by Homer.,Homer obscured the scandal.,-40.30047607421875,-43.44696807861328,3.1464920043945312
observe,V359,1a,(c) Experiencer-Theme,Marge was observed by Homer.,Homer observed Marge.,-44.72634506225586,-41.85518264770508,-2.8711624145507812
overhear,V360,1b,(c) Experiencer-Theme,Marge was overheard by Homer.,Homer overheard Marge.,-40.368812561035156,-40.98239517211914,0.6135826110839844
own,V406,1a,(d) Other Passivizable,The computer was owned by Homer.,Homer owned the computer.,-34.55261993408203,-33.45552062988281,-1.0970993041992188
paint,V060,1a,(a) Agent-Patient,The ceiling was painted by Homer.,Homer painted the ceiling.,-36.21792984008789,-34.758544921875,-1.4593849182128906
pat,V206,1a,(a) Agent-Patient,Marge was patted by Homer.,Homer patted Marge.,-45.42330551147461,-44.932498931884766,-0.49080657958984375
perform,V084,1b,(a) Agent-Patient,The play was performed by Homer.,Homer performed the play.,-32.45283889770508,-30.887508392333984,-1.5653305053710938
photograph,V214,1b,(a) Agent-Patient,Marge was photographed by Homer.,Homer photographed Marge.,-41.70244598388672,-39.87487030029297,-1.82757568359375
pinch,V200,1b,(a) Agent-Patient,Marge was pinched by Homer.,Homer pinched Marge.,-44.504539489746094,-46.199520111083984,1.6949806213378906
play,V085,1a,(a) Agent-Patient,The record was played by Homer.,Homer played the record.,-33.248619079589844,-39.00295639038086,5.754337310791016
please,V327,1b,(b) Theme-Experiencer,Marge was pleased by Homer.,Homer pleased Marge.,-35.94690704345703,-44.701908111572266,8.755001068115234
pocket,V017,1a,(a) Agent-Patient,The money was pocketed by Homer.,Homer pocketed the money.,-32.871612548828125,-36.80369567871094,3.9320831298828125
poke,V203,1b,(a) Agent-Patient,Marge was poked by Homer.,Homer poked Marge.,-38.334449768066406,-44.49540710449219,6.160957336425781
polish,V016,1b,(a) Agent-Patient,The medal was polished by Homer.,Homer polished the medal.,-45.69717025756836,-41.542198181152344,-4.154972076416016
pop,V145,1b,(a) Agent-Patient,The balloon was popped by Homer.,Homer popped the balloon.,-33.03699493408203,-44.22509765625,11.188102722167969
position,V003,1b,(a) Agent-Patient,The ornament was positioned by Homer.,Homer positioned the ornament.,-41.13001251220703,-46.363563537597656,5.233551025390625
possess,V407,1b,(d) Other Passivizable,The ticket was possessed by Homer.,Homer possessed the ticket.,-41.479652404785156,-42.238346099853516,0.7586936950683594
post,V026,1b,(a) Agent-Patient,The letter was posted by Homer.,Homer posted the letter.,-35.96626281738281,-34.81652069091797,-1.1497421264648438
pot,V018,1b,(a) Agent-Patient,The ball was potted by Homer.,Homer potted the ball.,-38.625762939453125,-42.965110778808594,4.339347839355469
pour,V009,1b,(a) Agent-Patient,The coke was poured by Homer.,Homer poured the coke.,-42.43959426879883,-48.657981872558594,6.218387603759766
praise,V238,1b,(a) Agent-Patient,Marge was praised by Homer.,Homer praised Marge.,-38.961631774902344,-39.80372619628906,0.8420944213867188
predict,V420,1b,(d) Other Passivizable,The outcome was predicted by Homer.,Homer predicted the outcome.,-34.38987731933594,-34.904170989990234,0.5142936706542969
proclaim,V419,1a,(d) Other Passivizable,The truth was proclaimed by Homer.,Homer proclaimed the truth.,-36.284454345703125,-38.35184860229492,2.067394256591797
propose,V105,1a,(a) Agent-Patient,The toast was proposed by Homer.,Homer proposed the toast.,-40.90150833129883,-41.54029846191406,0.6387901306152344
prove,V409,1a,(d) Other Passivizable,The theory was proven by Homer.,Homer proved the theory.,-34.35483932495117,-35.753082275390625,1.3982429504394531
provoke,V328,1b,(b) Theme-Experiencer,Marge was provoked by Homer.,Homer provoked Marge.,-41.04214096069336,-42.26362991333008,1.2214889526367188
pull,V181,1a,(a) Agent-Patient,Marge was pulled by Homer.,Homer pulled Marge.,-37.059226989746094,-39.793174743652344,2.73394775390625
punch,V201,1a,(a) Agent-Patient,Marge was punched by Homer.,Homer punched Marge.,-39.003448486328125,-42.7744026184082,3.770954132080078
punish,V244,1a,(a) Agent-Patient,Marge was punished by Homer.,Homer punished Marge.,-40.22449493408203,-41.43742370605469,1.2129287719726562
pursue,V291,1a,(a) Agent-Patient,Marge was pursued by Homer.,Homer pursued Marge.,-40.81528091430664,-40.185096740722656,-0.6301841735839844
push,V182,1b,(a) Agent-Patient,Marge was pushed by Homer.,Homer pushed Marge.,-43.26101303100586,-42.79985809326172,-0.4611549377441406
puzzle,V329,1a,(b) Theme-Experiencer,Marge was puzzled by Homer.,Homer puzzled Marge.,-41.02446746826172,-41.694435119628906,0.6699676513671875
quarrel with,V251,1a,(a) Agent-Patient,Marge was quarrelled with by Homer.,Homer quarrelled with Marge.,-45.877113342285156,-50.003028869628906,4.12591552734375
quote,V089,1b,(a) Agent-Patient,The speech was quoted by Homer.,Homer quoted the speech.,-38.580467224121094,-35.010887145996094,-3.569580078125
race,V288,1a,(a) Agent-Patient,Marge was raced by Homer.,Homer raced Marge.,-45.49880599975586,-42.38127517700195,-3.1175308227539062
raise,V162,1a,(a) Agent-Patient,Marge was raised by Homer.,Homer raised Marge.,-43.3608512878418,-37.49248123168945,-5.868370056152344
read,V090,1a,(a) Agent-Patient,The paper was read by Homer.,Homer read the paper.,-28.891864776611328,-34.46137619018555,5.569511413574219
reassure,V330,1b,(b) Theme-Experiencer,Marge was reassured by Homer.,Homer reassured Marge.,-43.399147033691406,-43.61771011352539,0.21856307983398438
receive,V400,1a,(d) Other Passivizable,The present was received by Homer.,Homer received the present.,-38.947784423828125,-39.54003143310547,0.5922470092773438
recite,V091,1b,(a) Agent-Patient,The prayer was recited by Homer.,Homer recited the prayer.,-39.890628814697266,-36.4171142578125,-3.4735145568847656
recognize,V361,1b,(c) Experiencer-Theme,Marge was recognized by Homer.,Homer recognized Marge.,-39.73579406738281,-40.95441436767578,1.2186203002929688
record,V215,1a,(a) Agent-Patient,Marge was recorded by Homer.,Homer recorded Marge.,-43.69024658203125,-40.17311096191406,-3.5171356201171875
remember,V362,1b,(c) Experiencer-Theme,Marge was remembered by Homer.,Homer remembered Marge.,-42.70143508911133,-41.18449401855469,-1.5169410705566406
remove,V171,1b,(a) Agent-Patient,Marge was removed by Homer.,Homer removed Marge.,-38.804954528808594,-39.46985626220703,0.6649017333984375
repeat,V106,1b,(a) Agent-Patient,The claim was repeated by Homer.,Homer repeated the claim.,-30.110034942626953,-36.380401611328125,6.270366668701172
report,V107,1a,(a) Agent-Patient,The event was reported by Homer.,Homer reported the event.,-33.126319885253906,-34.3916015625,1.2652816772460938
repulse,V331,1a,(b) Theme-Experiencer,Marge was repulsed by Homer.,Homer repulsed Marge.,-43.40785598754883,-40.723846435546875,-2.684009552001953
rescue,V155,1b,(a) Agent-Patient,Marge was rescued by Homer.,Homer rescued Marge.,-37.662269592285156,-39.35697937011719,1.6947097778320312
resent,V393,1b,(c) Experiencer-Theme,Marge was resented by Homer.,Homer resented Marge.,-40.45863723754883,-46.49713134765625,6.038494110107422
respect,V377,1b,(c) Experiencer-Theme,Marge was respected by Homer.,Homer respected Marge.,-38.96845626831055,-40.96780014038086,1.9993438720703125
reveal,V421,1a,(d) Other Passivizable,The decision was revealed by Homer.,Homer revealed the decision.,-34.8465576171875,-35.83985137939453,0.9932937622070312
reward,V231,1b,(a) Agent-Patient,Marge was rewarded by Homer.,Homer rewarded Marge.,-38.89937210083008,-41.360897064208984,2.4615249633789062
rinse,V022,1b,(a) Agent-Patient,The vase was rinsed by Homer.,Homer rinsed the vase.,-43.88068771362305,-50.8140983581543,6.93341064453125
rip,V128,1b,(a) Agent-Patient,The T-shirt was ripped by Homer.,Homer ripped the T-shirt.,-38.89956283569336,-41.74030303955078,2.840740203857422
roar,V097,1b,(a) Agent-Patient,The insult was roared by Homer.,Homer roared the insult.,-45.85502624511719,-46.275577545166016,0.4205513000488281
rob,V230,1a,(a) Agent-Patient,Marge was robbed by Homer.,Homer robbed Marge.,-46.772830963134766,-42.33531951904297,-4.437511444091797
roll,V177,1a,(a) Agent-Patient,Marge was rolled by Homer.,Homer rolled Marge.,-39.322418212890625,-42.494937896728516,3.1725196838378906
row,V031,1a,(a) Agent-Patient,The boat was rowed by Homer.,Homer rowed the boat.,-42.454795837402344,-40.61518478393555,-1.8396110534667969
ruin,V123,1a,(a) Agent-Patient,The sofa was ruined by Homer.,Homer ruined the sofa.,-38.793975830078125,-42.679786682128906,3.8858108520507812
sadden,V332,1b,(b) Theme-Experiencer,Marge was saddened by Homer.,Homer saddened Marge.,-38.62611389160156,-46.77637481689453,8.150260925292969
sing,V086,1b,(a) Agent-Patient,The song was sung by Homer.,Homer sang the song.,-30.047176361083984,-28.37360382080078,-1.6735725402832031
see,V351,1a,(c) Experiencer-Theme,Marge was seen by Homer.,Homer saw Marge.,-38.588653564453125,-42.21055603027344,3.6219024658203125
saw,V044,1a,(a) Agent-Patient,The wood was sawn by Homer.,Homer sawed the wood.,-45.8930778503418,-40.514686584472656,-5.378391265869141
scare,V333,1a,(b) Theme-Experiencer,Marge was scared by Homer.,Homer scared Marge.,-32.466270446777344,-45.304779052734375,12.838508605957031
scold,V245,1b,(a) Agent-Patient,Marge was scolded by Homer.,Homer scolded Marge.,-36.93245315551758,-41.13725280761719,4.204799652099609
scoop,V007,1b,(a) Agent-Patient,The ice-cream was scooped by Homer.,Homer scooped the ice-cream.,-46.962615966796875,-46.431190490722656,-0.5314254760742188
scratch,V202,1b,(a) Agent-Patient,Marge was scratched by Homer.,Homer scratched Marge.,-39.362876892089844,-40.914161682128906,1.5512847900390625
scream,V098,1a,(a) Agent-Patient,The warning was screamed by Homer.,Homer screamed the warning.,-39.14439392089844,-44.38353729248047,5.239143371582031
seal,V052,1b,(a) Agent-Patient,The envelope was sealed by Homer.,Homer sealed the envelope.,-36.544246673583984,-38.41325759887695,1.8690109252929688
search,V087,1b,(a) Agent-Patient,The area was searched by Homer.,Homer searched the area.,-28.206466674804688,-34.79606246948242,6.589595794677734
seize,V036,1b,(a) Agent-Patient,The note was seized by Homer.,Homer seized the note.,-38.80738830566406,-36.94140625,-1.8659820556640625
sense,V352,1b,(c) Experiencer-Theme,Marge was sensed by Homer.,Homer sensed Marge.,-45.21705627441406,-44.79847717285156,-0.4185791015625
send,V027,1a,(a) Agent-Patient,The parcel was sent by Homer.,Homer sent the parcel.,-37.94794464111328,-40.59156036376953,2.64361572265625
sew,V072,1b,(a) Agent-Patient,The cushion was sewn by Homer.,Homer sewed the cushion.,-41.212432861328125,-44.98733901977539,3.7749061584472656
shadow,V292,1b,(a) Agent-Patient,Marge was shadowed by Homer.,Homer shadowed Marge.,-45.094635009765625,-42.14193344116211,-2.9527015686035156
shatter,V129,1a,(a) Agent-Patient,The window was shattered by Homer.,Homer shattered the window.,-30.155757904052734,-40.221824645996094,10.06606674194336
shock,V334,1b,(b) Theme-Experiencer,Marge was shocked by Homer.,Homer shocked Marge.,-36.86433410644531,-43.53059387207031,6.666259765625
shake,V216,1b,(a) Agent-Patient,Marge was shaken by Homer.,Homer shook Marge.,-39.48612976074219,-46.08082962036133,6.594699859619141
shoot,V221,1b,(a) Agent-Patient,Marge was shot by Homer.,Homer shot Marge.,-36.919677734375,-39.975059509277344,3.0553817749023438
shout,V099,1b,(a) Agent-Patient,The answer was shouted by Homer.,Homer shouted the answer.,-39.01466751098633,-41.97006607055664,2.9553985595703125
shove,V183,1a,(a) Agent-Patient,Marge was shoved by Homer.,Homer shoved Marge.,-42.502052307128906,-43.77863311767578,1.276580810546875
