Verb,Vno,Set,VtypeNEW,passive,active,active_score,passive_score,pass_drop
search,V087,2b,(a) Agent-Patient,The park was searched by Bob.,Bob searched the park.,-27.028152465820312,-34.98249435424805,7.954341888427734
seize,V036,2b,(a) Agent-Patient,The parcel was seized by Bob.,Bob seized the parcel.,-25.62580108642578,-36.517303466796875,10.891502380371094
sense,V352,2b,(c) Experiencer-Theme,Wendy was sensed by Bob.,Bob sensed Wendy.,-31.495201110839844,-38.91253662109375,7.417335510253906
send,V027,2a,(a) Agent-Patient,The message was sent by Bob.,Bob sent the message.,-17.436866760253906,-27.628816604614258,10.191949844360352
sew,V072,2b,(a) Agent-Patient,The material was sewn by Bob.,Bob sewed the material.,-26.563289642333984,-39.56507110595703,13.001781463623047
shadow,V292,2b,(a) Agent-Patient,Wendy was shadowed by Bob.,Bob shadowed Wendy.,-27.066104888916016,-39.67089080810547,12.604785919189453
shatter,V129,2a,(a) Agent-Patient,The glass was shattered by Bob.,Bob shattered the glass.,-19.244739532470703,-37.15043640136719,17.905696868896484
shock,V334,2b,(b) Theme-Experiencer,Wendy was shocked by Bob.,Bob shocked Wendy.,-27.535518646240234,-36.97414016723633,9.438621520996094
shake,V216,2b,(a) Agent-Patient,Wendy was shaken by Bob.,Bob shook Wendy.,-30.499208450317383,-40.3929557800293,9.893747329711914
shoot,V221,2b,(a) Agent-Patient,Wendy was shot by Bob.,Bob shot Wendy.,-24.430715560913086,-34.6242561340332,10.193540573120117
shout,V099,2b,(a) Agent-Patient,The warning was shouted by Bob.,Bob shouted the warning.,-21.951663970947266,-40.242164611816406,18.29050064086914
shove,V183,2a,(a) Agent-Patient,Wendy was shoved by Bob.,Bob shoved Wendy.,-31.284849166870117,-39.156761169433594,7.871912002563477
shovel,V008,2a,(a) Agent-Patient,The soil was shovelled by Bob.,Bob shovelled the soil.,-37.40267562866211,-49.69941711425781,12.296741485595703
show,V422,2b,(d) Other Passivizable,The outcome was shown by Bob.,Bob showed the outcome.,-27.056888580322266,-34.2678337097168,7.210945129394531
shrink,V146,2a,(a) Agent-Patient,The shirt was shrunk by Bob.,Bob shrank the shirt.,-31.654457092285156,-42.00731658935547,10.352859497070312
sicken,V335,2a,(b) Theme-Experiencer,Wendy was sickened by Bob.,Bob sickened Wendy.,-32.8971061706543,-39.048667907714844,6.151561737060547
sign,V062,2a,(a) Agent-Patient,The contract was signed by Bob.,Bob signed the contract.,-17.88960075378418,-28.885604858398438,10.996004104614258
sip,V112,2a,(a) Agent-Patient,The lemonade was sipped by Bob.,Bob sipped the lemonade.,-34.219276428222656,-43.88731384277344,9.668037414550781
sketch,V064,2a,(a) Agent-Patient,The view was sketched by Bob.,Bob sketched the view.,-25.16840362548828,-35.666290283203125,10.497886657714844
slap,V194,2b,(a) Agent-Patient,Wendy was slapped by Bob.,Bob slapped Wendy.,-31.84419059753418,-38.98869705200195,7.144506454467773
slay,V280,2a,(a) Agent-Patient,Wendy was slain by Bob.,Bob slayed Wendy.,-35.42557907104492,-36.09718322753906,0.6716041564941406
slice,V048,2b,(a) Agent-Patient,The cake was sliced by Bob.,Bob sliced the cake.,-22.909400939941406,-34.5108528137207,11.601451873779297
slide,V178,2b,(a) Agent-Patient,Wendy was slid by Bob.,Bob slid Wendy.,-33.63614273071289,-43.34980010986328,9.71365737915039
slurp,V113,2b,(a) Agent-Patient,The stew was slurped by Bob.,Bob slurped the stew.,-28.969486236572266,-42.046104431152344,13.076618194580078
smash,V130,2b,(a) Agent-Patient,The window was smashed by Bob.,Bob smashed the window.,-20.688579559326172,-37.9250602722168,17.236480712890625
smell,V353,2a,(c) Experiencer-Theme,Wendy was smelt by Bob.,Bob smelt Wendy.,-33.910972595214844,-46.126792907714844,12.2158203125
snap,V131,2a,(a) Agent-Patient,The stick was snapped by Bob.,Bob snapped the stick.,-26.398487091064453,-33.221927642822266,6.8234405517578125
soak,V169,2b,(a) Agent-Patient,Wendy was soaked by Bob.,Bob soaked Wendy.,-34.14616775512695,-41.58631134033203,7.440143585205078
sell,V032,2a,(a) Agent-Patient,The toy was sold by Bob.,Bob sold the toy.,-24.484161376953125,-33.27534103393555,8.791179656982422
spy on,V364,2b,(c) Experiencer-Theme,Wendy was spied on by Bob.,Bob spied on Wendy.,-28.495132446289062,-40.356502532958984,11.861370086669922
spill,V010,2a,(a) Agent-Patient,The coffee was spilt by Bob.,Bob spilt the coffee.,-32.343509674072266,-43.19233322143555,10.848823547363281
splash,V165,2b,(a) Agent-Patient,Wendy was splashed by Bob.,Bob splashed Wendy.,-36.65693664550781,-41.899505615234375,5.2425689697265625
splatter,V164,2a,(a) Agent-Patient,Wendy was splattered by Bob.,Bob splattered Wendy.,-44.56182861328125,-46.72464370727539,2.1628150939941406
split,V132,2a,(a) Agent-Patient,The sleeve was split by Bob.,Bob split the sleeve.,-27.053998947143555,-40.282936096191406,13.228937149047852
speak to,V263,2b,(a) Agent-Patient,Wendy was spoken to by Bob.,Bob spoke to Wendy.,-23.02816390991211,-36.64459228515625,13.61642837524414
spot,V363,2a,(c) Experiencer-Theme,Wendy was spotted by Bob.,Bob spotted Wendy.,-27.96245574951172,-34.2935676574707,6.331111907958984
spray,V166,2a,(a) Agent-Patient,Wendy was sprayed by Bob.,Bob sprayed Wendy.,-29.356225967407227,-39.67146682739258,10.315240859985352
spin,V163,2b,(a) Agent-Patient,Wendy was spun by Bob.,Bob spun Wendy.,-35.026611328125,-37.94269561767578,2.9160842895507812
squabble with,V252,2b,(a) Agent-Patient,Wendy was squabbled with by Bob.,Bob squabbled with Wendy.,-32.850914001464844,-45.45635986328125,12.605445861816406
squash,V217,2a,(a) Agent-Patient,Wendy was squashed by Bob.,Bob squashed Wendy.,-31.60543441772461,-40.598793029785156,8.993358612060547
squeeze,V218,2b,(a) Agent-Patient,Wendy was squeezed by Bob.,Bob squeezed Wendy.,-32.09944534301758,-41.591758728027344,9.492313385009766
squirt,V167,2b,(a) Agent-Patient,Wendy was squirted by Bob.,Bob squirted Wendy.,-36.628273010253906,-45.00700378417969,8.378730773925781
squish,V219,2a,(a) Agent-Patient,Wendy was squished by Bob.,Bob squished Wendy.,-36.06216812133789,-44.971702575683594,8.909534454345703
stab,V283,2a,(a) Agent-Patient,Wendy was stabbed by Bob.,Bob stabbed Wendy.,-24.473936080932617,-36.2200813293457,11.746145248413086
stain,V014,2b,(a) Agent-Patient,The shirt was stained by Bob.,Bob stained the shirt.,-26.350584030151367,-38.586483001708984,12.235898971557617
stammer,V100,2a,(a) Agent-Patient,The answer was stammered by Bob.,Bob stammered the answer.,-29.518749237060547,-44.305843353271484,14.787094116210938
staple,V053,2a,(a) Agent-Patient,The card was stapled by Bob.,Bob stapled the card.,-26.47289276123047,-35.65486145019531,9.181968688964844
stare at,V369,2b,(c) Experiencer-Theme,Wendy was stared at by Bob.,Bob stared at Wendy.,-27.209991455078125,-38.46855545043945,11.258563995361328
start,V152,2b,(a) Agent-Patient,The journey was started by Bob.,Bob started the journey.,-19.715404510498047,-30.82686996459961,11.111465454101562
startle,V336,2b,(b) Theme-Experiencer,Wendy was startled by Bob.,Bob startled Wendy.,-26.930702209472656,-37.22929382324219,10.298591613769531
steal,V024,2b,(a) Agent-Patient,The ring was stolen by Bob.,Bob stole the ring.,-20.877809524536133,-31.017499923706055,10.139690399169922
stop,V226,2a,(a) Agent-Patient,Wendy was stopped by Bob.,Bob stopped Wendy.,-27.152103424072266,-35.728824615478516,8.57672119140625
store,V042,2b,(a) Agent-Patient,The paperwork was stored by Bob.,Bob stored the paperwork.,-25.35641860961914,-39.04683303833008,13.690414428710938
strangle,V284,2b,(a) Agent-Patient,Wendy was strangled by Bob.,Bob strangled Wendy.,-31.39994239807129,-36.140357971191406,4.740415573120117
stroke,V207,2b,(a) Agent-Patient,Wendy was stroked by Bob.,Bob stroked Wendy.,-37.35209274291992,-41.4934196472168,4.141326904296875
study,V039,2b,(a) Agent-Patient,The map was studied by Bob.,Bob studied the map.,-27.30188751220703,-35.2903938293457,7.988506317138672
stun,V337,2a,(b) Theme-Experiencer,Wendy was stunned by Bob.,Bob stunned Wendy.,-24.870216369628906,-36.71630859375,11.846092224121094
succumb to,V403,2b,(d) Other Passivizable,The pressure was succumbed to by Bob.,Bob succumbed to the pressure.,-26.03904151916504,-49.345035552978516,23.305994033813477
suck,V114,2a,(a) Agent-Patient,The lollipop was sucked by Bob.,Bob sucked the lollipop.,-26.403276443481445,-51.97916793823242,25.575891494750977
suffocate,V285,2a,(a) Agent-Patient,Wendy was suffocated by Bob.,Bob suffocated Wendy.,-33.52543640136719,-42.32362365722656,8.798187255859375
suggest,V423,2a,(d) Other Passivizable,The holiday was suggested by Bob.,Bob suggested the holiday.,-30.321632385253906,-39.62609100341797,9.304458618164062
support,V378,2a,(c) Experiencer-Theme,Wendy was supported by Bob.,Bob supported Wendy.,-25.751646041870117,-35.25269317626953,9.501047134399414
surprise,V338,2b,(b) Theme-Experiencer,Wendy was surprised by Bob.,Bob surprised Wendy.,-27.272592544555664,-36.48394775390625,9.211355209350586
swallow,V117,2b,(a) Agent-Patient,The medicine was swallowed by Bob.,Bob swallowed the medicine.,-25.698984146118164,-37.63064956665039,11.931665420532227
sweep,V023,2a,(a) Agent-Patient,The room was swept by Bob.,Bob swept the room.,-23.53647232055664,-40.719608306884766,17.183135986328125
tail,V293,2a,(a) Agent-Patient,Wendy was tailed by Bob.,Bob tailed Wendy.,-34.42047119140625,-39.96471405029297,5.544242858886719
talk to,V264,2a,(a) Agent-Patient,Wendy was talked to by Bob.,Bob talked to Wendy.,-22.018138885498047,-38.190303802490234,16.172164916992188
tap,V195,2a,(a) Agent-Patient,Wendy was tapped by Bob.,Bob tapped Wendy.,-28.007902145385742,-35.99519729614258,7.987295150756836
taste,V397,2b,(c) Experiencer-Theme,The sauce was tasted by Bob.,Bob tasted the sauce.,-24.761512756347656,-39.41236877441406,14.650856018066406
teach,V227,2a,(a) Agent-Patient,Wendy was taught by Bob.,Bob taught Wendy.,-26.705974578857422,-35.46149826049805,8.755523681640625
tease,V339,2b,(b) Theme-Experiencer,Wendy was teased by Bob.,Bob teased Wendy.,-25.91969108581543,-38.05832290649414,12.138631820678711
terrify,V340,2a,(b) Theme-Experiencer,Wendy was terrified by Bob.,Bob terrified Wendy.,-26.43536376953125,-38.49503707885742,12.059673309326172
terrorize,V341,2b,(b) Theme-Experiencer,Wendy was terrorized by Bob.,Bob terrorized Wendy.,-24.291065216064453,-38.89308547973633,14.602020263671875
thank,V239,2b,(a) Agent-Patient,Wendy was thanked by Bob.,Bob thanked Wendy.,-27.170080184936523,-34.97230529785156,7.802225112915039
threaten,V342,2b,(b) Theme-Experiencer,Wendy was threatened by Bob.,Bob threatened Wendy.,-24.542694091796875,-37.330902099609375,12.7882080078125
throw,V190,2b,(a) Agent-Patient,Wendy was thrown by Bob.,Bob threw Wendy.,-27.186494827270508,-37.68476867675781,10.498273849487305
thump,V196,2a,(a) Agent-Patient,Wendy was thumped by Bob.,Bob thumped Wendy.,-35.06601333618164,-38.73072814941406,3.664714813232422
tickle,V208,2a,(a) Agent-Patient,Wendy was tickled by Bob.,Bob tickled Wendy.,-33.084590911865234,-39.13039016723633,6.045799255371094
tie,V054,2b,(a) Agent-Patient,The bow was tied by Bob.,Bob tied the bow.,-26.266267776489258,-37.849945068359375,11.583677291870117
toast,V142,2a,(a) Agent-Patient,The sandwich was toasted by Bob.,Bob toasted the sandwich.,-26.135555267333984,-36.496315002441406,10.360759735107422
tell off,V246,2a,(a) Agent-Patient,Wendy was told off by Bob.,Bob told off Wendy.,-36.03704071044922,-39.76903533935547,3.73199462890625
tell,V092,2b,(a) Agent-Patient,The joke was told by Bob.,Bob told the joke.,-22.64984893798828,-30.7561092376709,8.106260299682617
tolerate,V379,2b,(c) Experiencer-Theme,Wendy was tolerated by Bob.,Bob tolerated Wendy.,-29.77276611328125,-38.76422882080078,8.991462707519531
take,V025,2a,(a) Agent-Patient,The jewelry was taken by Bob.,Bob took the jewelry.,-24.337078094482422,-31.957794189453125,7.620716094970703
tear,V133,2b,(a) Agent-Patient,The paper was torn by Bob.,Bob tore the paper.,-24.315227508544922,-42.084686279296875,17.769458770751953
touch,V209,2b,(a) Agent-Patient,Wendy was touched by Bob.,Bob touched Wendy.,-26.570064544677734,-34.73815155029297,8.168087005615234
track,V294,2b,(a) Agent-Patient,Wendy was tracked by Bob.,Bob tracked Wendy.,-26.81863021850586,-36.951847076416016,10.133216857910156
trail,V295,2a,(a) Agent-Patient,Wendy was trailed by Bob.,Bob trailed Wendy.,-30.792203903198242,-40.90216827392578,10.109964370727539
trap,V170,2a,(a) Agent-Patient,Wendy was trapped by Bob.,Bob trapped Wendy.,-25.753835678100586,-36.31644821166992,10.562612533569336
trip,V301,2b,(a) Agent-Patient,Wendy was tripped by Bob.,Bob tripped Wendy.,-27.61359405517578,-37.635318756103516,10.021724700927734
trust,V380,2b,(c) Experiencer-Theme,Wendy was trusted by Bob.,Bob trusted Wendy.,-24.924583435058594,-36.58676528930664,11.662181854248047
twist,V012,2b,(a) Agent-Patient,The string was twisted by Bob.,Bob twisted the string.,-22.89365005493164,-38.56171417236328,15.66806411743164
type,V065,2b,(a) Agent-Patient,The article was typed by Bob.,Bob typed the article.,-27.499576568603516,-34.472434997558594,6.972858428955078
unbolt,V057,2b,(a) Agent-Patient,The door was unbolted by Bob.,Bob unbolted the door.,-33.950740814208984,-43.79470443725586,9.843963623046875
understand,V381,2b,(c) Experiencer-Theme,Wendy was understood by Bob.,Bob understood Wendy.,-27.196346282958984,-38.49738693237305,11.301040649414062
undergo,V402,2a,(d) Other Passivizable,The ordeal was undergone by Bob.,Bob underwent the ordeal.,-24.43334197998047,-39.92298126220703,15.489639282226562
unlock,V058,2a,(a) Agent-Patient,The bike was unlocked by Bob.,Bob unlocked the bike.,-27.917442321777344,-37.684696197509766,9.767253875732422
untie,V211,2a,(a) Agent-Patient,Wendy was untied by Bob.,Bob untied Wendy.,-32.20759201049805,-41.77948760986328,9.571895599365234
unzip,V059,2b,(a) Agent-Patient,The jacket was unzipped by Bob.,Bob unzipped the jacket.,-26.48944664001465,-42.818965911865234,16.329519271850586
upset,V343,2a,(b) Theme-Experiencer,Wendy was upset by Bob.,Bob upset Wendy.,-26.657550811767578,-36.04754638671875,9.389995574951172
varnish,V061,2b,(a) Agent-Patient,The table was varnished by Bob.,Bob varnished the table.,-40.30038070678711,-44.13800048828125,3.8376197814941406
visit,V261,2a,(a) Agent-Patient,Wendy was visited by Bob.,Bob visited Wendy.,-25.599681854248047,-34.39311981201172,8.793437957763672
want,V399,2b,(c) Experiencer-Theme,The drink was wanted by Bob.,Bob wanted the drink.,-22.782386779785156,-40.147274017333984,17.364887237548828
warn,V270,2b,(a) Agent-Patient,Wendy was warned by Bob.,Bob warned Wendy.,-26.66567611694336,-37.641326904296875,10.975650787353516
abandon,V286,2a,(a) Agent-Patient,Bob was abandonned by Wendy.,Wendy abandonned Bob.,-50.62360763549805,-40.029022216796875,-10.594585418701172
accompany,V296,2a,(a) Agent-Patient,Bob was accompanied by Wendy.,Wendy accompanied Bob.,-37.44513702392578,-26.652212142944336,-10.792924880981445
admire,V346,2a,(c) Experiencer-Theme,Bob was admired by Wendy.,Wendy admired Bob.,-35.06383514404297,-31.443641662597656,-3.6201934814453125
adore,V347,2b,(c) Experiencer-Theme,Bob was adored by Wendy.,Wendy adored Bob.,-41.10904312133789,-28.198143005371094,-12.910900115966797
advise,V268,2a,(a) Agent-Patient,Bob was advised by Wendy.,Wendy advised Bob.,-33.94853210449219,-29.4572696685791,-4.491262435913086
aggravate,V302,2b,(b) Theme-Experiencer,Bob was aggravated by Wendy.,Wendy aggravated Bob.,-46.31830978393555,-33.10553741455078,-13.212772369384766
agree with,V247,2b,(a) Agent-Patient,Bob was agreed with by Wendy.,Wendy agreed with Bob.,-32.21125793457031,-35.72718048095703,3.5159225463867188
amaze,V303,2a,(b) Theme-Experiencer,Bob was amazed by Wendy.,Wendy amazed Bob.,-36.340087890625,-29.524812698364258,-6.815275192260742
amuse,V304,2b,(b) Theme-Experiencer,Bob was amused by Wendy.,Wendy amused Bob.,-37.81340026855469,-29.655536651611328,-8.15786361694336
anger,V305,2a,(b) Theme-Experiencer,Bob was angered by Wendy.,Wendy angered Bob.,-34.118961334228516,-29.64585304260254,-4.473108291625977
annoy,V306,2b,(b) Theme-Experiencer,Bob was annoyed by Wendy.,Wendy annoyed Bob.,-33.25666427612305,-26.542333602905273,-6.714330673217773
appluad,V220,2b,(a) Agent-Patient,Bob was appluaded by Wendy.,Wendy appluaded Bob.,-59.566951751708984,-58.38279724121094,-1.1841545104980469
appreciate,V370,2a,(c) Experiencer-Theme,Bob was appreciated by Wendy.,Wendy appreciated Bob.,-32.130645751953125,-30.656126022338867,-1.4745197296142578
argue with,V248,2a,(a) Agent-Patient,Bob was argued with by Wendy.,Wendy argued with Bob.,-35.55855941772461,-35.327735900878906,-0.23082351684570312
assassinate,V228,2b,(a) Agent-Patient,Bob was assassinated by Wendy.,Wendy assassinated Bob.,-39.730690002441406,-28.04294204711914,-11.687747955322266
astonish,V307,2a,(b) Theme-Experiencer,Bob was astonished by Wendy.,Wendy astonished Bob.,-37.983436584472656,-30.842618942260742,-7.140817642211914
avoid,V223,2a,(a) Agent-Patient,Bob was avoided by Wendy.,Wendy avoided Bob.,-39.239234924316406,-33.10184097290039,-6.137393951416016
banish,V229,2b,(a) Agent-Patient,Bob was banished by Wendy.,Wendy banished Bob.,-43.20423126220703,-29.456636428833008,-13.747594833374023
believe,V371,2a,(c) Experiencer-Theme,Bob was believed by Wendy.,Wendy believed Bob.,-38.09304428100586,-35.97077178955078,-2.122272491455078
bite,V198,2a,(a) Agent-Patient,Bob was bitten by Wendy.,Wendy bit Bob.,-34.91704559326172,-24.753326416015625,-10.163719177246094
bother,V308,2a,(b) Theme-Experiencer,Bob was bothered by Wendy.,Wendy bothered Bob.,-38.13511276245117,-30.08388900756836,-8.051223754882812
call,V262,2a,(a) Agent-Patient,Bob was called by Wendy.,Wendy called Bob.,-28.57083511352539,-26.237354278564453,-2.3334808349609375
calm,V309,2b,(b) Theme-Experiencer,Bob was calmed by Wendy.,Wendy calmed Bob.,-43.905517578125,-32.746131896972656,-11.159385681152344
capture,V154,2b,(a) Agent-Patient,Bob was captured by Wendy.,Wendy captured Bob.,-34.44755935668945,-27.944562911987305,-6.502996444702148
carry,V179,2b,(a) Agent-Patient,Bob was carried by Wendy.,Wendy carried Bob.,-32.79533767700195,-29.842025756835938,-2.9533119201660156
catch,V184,2b,(a) Agent-Patient,Bob was caught by Wendy.,Wendy caught Bob.,-33.26072692871094,-28.13821792602539,-5.122509002685547
chase,V289,2b,(a) Agent-Patient,Bob was chased by Wendy.,Wendy chased Bob.,-32.66600799560547,-27.46050262451172,-5.20550537109375
chat to,V265,2a,(a) Agent-Patient,Bob was chatted to by Wendy.,Wendy chatted to Bob.,-37.70349884033203,-31.759662628173828,-5.943836212158203
cheer up,V310,2a,(b) Theme-Experiencer,Bob was cheered up by Wendy.,Wendy cheered up Bob.,-40.80516052246094,-35.30393981933594,-5.501220703125
choose,V185,2a,(a) Agent-Patient,Bob was chosen by Wendy.,Wendy chose Bob.,-31.372915267944336,-25.973112106323242,-5.399803161621094
claw,V199,2b,(a) Agent-Patient,Bob was clawed by Wendy.,Wendy clawed Bob.,-39.86814880371094,-33.27450942993164,-6.593639373779297
clean,V173,2b,(a) Agent-Patient,Bob was cleaned by Wendy.,Wendy cleaned Bob.,-36.187889099121094,-31.203489303588867,-4.984399795532227
comfort,V311,2a,(b) Theme-Experiencer,Bob was comforted by Wendy.,Wendy comforted Bob.,-34.99920654296875,-29.47469711303711,-5.524509429931641
compliment,V233,2a,(a) Agent-Patient,Bob was complimented by Wendy.,Wendy complimented Bob.,-33.191139221191406,-27.766233444213867,-5.424905776977539
congratulate,V234,2b,(a) Agent-Patient,Bob was congratulated by Wendy.,Wendy congratulated Bob.,-33.47697448730469,-26.638816833496094,-6.838157653808594
converse with,V266,2b,(a) Agent-Patient,Bob was conversed with by Wendy.,Wendy conversed with Bob.,-39.431644439697266,-37.10041046142578,-2.3312339782714844
cooperate with,V249,2b,(a) Agent-Patient,Bob was cooperated with by Wendy.,Wendy cooperated with Bob.,-34.562015533447266,-35.6822509765625,1.1202354431152344
copy,V212,2a,(a) Agent-Patient,Bob was copied by Wendy.,Wendy copied Bob.,-33.63560485839844,-29.297269821166992,-4.338335037231445
court,V253,2b,(a) Agent-Patient,Bob was courted by Wendy.,Wendy courted Bob.,-35.215667724609375,-26.745826721191406,-8.469841003417969
cover,V168,2b,(a) Agent-Patient,Bob was covered by Wendy.,Wendy covered Bob.,-33.7026252746582,-28.697650909423828,-5.004974365234375
criticize,V241,2a,(a) Agent-Patient,Bob was criticized by Wendy.,Wendy criticized Bob.,-37.416664123535156,-29.66836929321289,-7.748294830322266
crush,V157,2b,(a) Agent-Patient,Bob was crushed by Wendy.,Wendy crushed Bob.,-38.528770446777344,-29.529592514038086,-8.999177932739258
cuddle,V254,2a,(a) Agent-Patient,Bob was cuddled by Wendy.,Wendy cuddled Bob.,-40.859554290771484,-32.74718475341797,-8.112369537353516
cut,V210,2a,(a) Agent-Patient,Bob was cut by Wendy.,Wendy cut Bob.,-33.39855194091797,-26.824275970458984,-6.574275970458984
date,V255,2b,(a) Agent-Patient,Bob was dated by Wendy.,Wendy dated Bob.,-35.337642669677734,-29.910419464111328,-5.427223205566406
dazzle,V312,2b,(b) Theme-Experiencer,Bob was dazzled by Wendy.,Wendy dazzled Bob.,-41.11162567138672,-32.20103454589844,-8.910591125488281
depress,V313,2a,(b) Theme-Experiencer,Bob was depressed by Wendy.,Wendy depressed Bob.,-43.98846435546875,-29.2763614654541,-14.712102890014648
desert,V287,2b,(a) Agent-Patient,Bob was deserted by Wendy.,Wendy deserted Bob.,-39.89435577392578,-29.970808029174805,-9.923547744750977
despise,V383,2a,(c) Experiencer-Theme,Bob was despised by Wendy.,Wendy despised Bob.,-38.684844970703125,-29.78433609008789,-8.900508880615234
detest,V384,2b,(c) Experiencer-Theme,Bob was detested by Wendy.,Wendy detested Bob.,-44.74640655517578,-34.760589599609375,-9.985816955566406
disagree with,V250,2a,(a) Agent-Patient,Bob was disagreed with by Wendy.,Wendy disagreed with Bob.,-30.97238540649414,-33.654300689697266,2.681915283203125
discover,V354,2a,(c) Experiencer-Theme,Bob was discovered by Wendy.,Wendy discovered Bob.,-34.00045394897461,-26.803627014160156,-7.196826934814453
disgust,V314,2a,(b) Theme-Experiencer,Bob was disgusted by Wendy.,Wendy disgusted Bob.,-38.53675842285156,-28.642284393310547,-9.894474029541016
dislike,V385,2a,(c) Experiencer-Theme,Bob was disliked by Wendy.,Wendy disliked Bob.,-36.272090911865234,-32.257728576660156,-4.014362335205078
dispatch,V275,2a,(a) Agent-Patient,Bob was dispatched by Wendy.,Wendy dispatched Bob.,-36.57530212402344,-30.745250701904297,-5.830051422119141
distract,V315,2b,(b) Theme-Experiencer,Bob was distracted by Wendy.,Wendy distracted Bob.,-34.5822639465332,-28.012630462646484,-6.569633483886719
distrust,V386,2b,(c) Experiencer-Theme,Bob was distrusted by Wendy.,Wendy distrusted Bob.,-39.63899230957031,-33.497589111328125,-6.1414031982421875
disturb,V316,2a,(b) Theme-Experiencer,Bob was disturbed by Wendy.,Wendy disturbed Bob.,-37.622684478759766,-30.284244537353516,-7.33843994140625
divorce,V232,2b,(a) Agent-Patient,Bob was divorced by Wendy.,Wendy divorced Bob.,-36.04578399658203,-28.050399780273438,-7.995384216308594
dodge,V224,2b,(a) Agent-Patient,Bob was dodged by Wendy.,Wendy dodged Bob.,-36.364906311035156,-30.997556686401367,-5.367349624633789
drag,V180,2a,(a) Agent-Patient,Bob was dragged by Wendy.,Wendy dragged Bob.,-35.17816162109375,-31.348052978515625,-3.830108642578125
dread,V387,2a,(c) Experiencer-Theme,Bob was dreaded by Wendy.,Wendy dreaded Bob.,-37.478294372558594,-33.17926788330078,-4.2990264892578125
dress,V273,2b,(a) Agent-Patient,Bob was dressed by Wendy.,Wendy dressed Bob.,-37.800743103027344,-25.49945831298828,-12.301284790039062
drop,V158,2b,(a) Agent-Patient,Bob was dropped by Wendy.,Wendy dropped Bob.,-36.79112243652344,-28.583637237548828,-8.20748519897461
drown,V281,2a,(a) Agent-Patient,Bob was drowned by Wendy.,Wendy drowned Bob.,-38.308250427246094,-34.27252960205078,-4.0357208251953125
eat,V156,2a,(a) Agent-Patient,Bob was eaten by Wendy.,Wendy ate Bob.,-34.70082092285156,-25.917381286621094,-8.783439636230469
eliminate,V276,2b,(a) Agent-Patient,Bob was eliminated by Wendy.,Wendy eliminated Bob.,-36.309226989746094,-28.707706451416016,-7.601520538330078
elude,V225,2a,(a) Agent-Patient,Bob was eluded by Wendy.,Wendy eluded Bob.,-38.6568489074707,-36.1459846496582,-2.5108642578125
embarass,V317,2b,(b) Theme-Experiencer,Bob was embarassed by Wendy.,Wendy embarassed Bob.,-43.05453109741211,-32.554443359375,-10.50008773803711
embrace,V256,2b,(a) Agent-Patient,Bob was embraced by Wendy.,Wendy embraced Bob.,-33.83062744140625,-31.116840362548828,-2.713787078857422
encourage,V318,2a,(b) Theme-Experiencer,Bob was encouraged by Wendy.,Wendy encouraged Bob.,-36.54053497314453,-27.232295989990234,-9.308238983154297
enrage,V319,2b,(b) Theme-Experiencer,Bob was enraged by Wendy.,Wendy enraged Bob.,-33.368194580078125,-29.154376983642578,-4.213817596435547
entertain,V320,2a,(b) Theme-Experiencer,Bob was entertained by Wendy.,Wendy entertained Bob.,-34.08474349975586,-29.24390983581543,-4.84083366394043
envy,V388,2a,(c) Experiencer-Theme,Bob was envied by Wendy.,Wendy envied Bob.,-49.844947814941406,-33.16107177734375,-16.683876037597656
escort,V297,2b,(a) Agent-Patient,Bob was escorted by Wendy.,Wendy escorted Bob.,-38.9765510559082,-29.595388412475586,-9.381162643432617
examine,V355,2b,(c) Experiencer-Theme,Bob was examined by Wendy.,Wendy examined Bob.,-37.32819366455078,-28.361371994018555,-8.966821670532227
excuse,V235,2a,(a) Agent-Patient,Bob was excused by Wendy.,Wendy excused Bob.,-42.514991760253906,-29.277652740478516,-13.23733901977539
execute,V277,2a,(a) Agent-Patient,Bob was executed by Wendy.,Wendy executed Bob.,-38.654457092285156,-26.024782180786133,-12.629674911499023
expel,V172,2a,(a) Agent-Patient,Bob was expelled by Wendy.,Wendy expelled Bob.,-35.205780029296875,-31.329143524169922,-3.876636505126953
fascinate,V321,2b,(b) Theme-Experiencer,Bob was fascinated by Wendy.,Wendy fascinated Bob.,-37.12970733642578,-25.471500396728516,-11.658206939697266
