subject,object,verb,sentence,active,passive,affectedness,active_score,passive_score,pass_drop
the patient,news of his test results,received,The patient received news of his test results.,The patient <|novelverb_past|> news of his test results.,News of his test results was <|novelverb_past|> by the patient.,low,-57.37680435180664,-50.173919677734375,-7.202884674072266
Marie,pasta,liked,Marie liked pasta.,Marie <|novelverb_past|> pasta.,Pasta was <|novelverb_past|> by Marie.,low,-33.117820739746094,-42.695770263671875,9.577949523925781
The dog,its owner,trusted,The dog trusted its owner completely.,The dog <|novelverb_past|> its owner completely.,Its owner was <|novelverb_past|> completely by the dog.,low,-40.86006164550781,-49.142799377441406,8.282737731933594
the fridge,the groceries,received,The fridge received the groceries.,The fridge <|novelverb_past|> the groceries.,The groceries were <|novelverb_past|> by the fridge.,low,-38.721961975097656,-44.890621185302734,6.168659210205078
The translator,the speaker's dialect,understood,The translator understood the speaker's dialect effortlessly.,The translator <|novelverb_past|> the speaker's dialect effortlessly.,The speaker's dialect was <|novelverb_past|> effortlessly by the translator.,low,-58.12029266357422,-71.3949203491211,13.274627685546875
The new smartphone,a small fortune,cost,The new smartphone cost a small fortune.,The new smartphone <|novelverb_past|> a small fortune.,A small fortune was <|novelverb_past|> by the new smartphone.,low,-47.21101760864258,-51.10334777832031,3.8923301696777344
The sculpture,a twisting vine,resembled,The sculpture resembled a twisting vine.,The sculpture <|novelverb_past|> a twisting vine.,A twisting vine was <|novelverb_past|> by the sculpture.,low,-50.36369705200195,-53.67977523803711,3.3160781860351562
the tourists,the local cuisine,liked,The tourists liked the local cuisine.,The tourists <|novelverb_past|> the local cuisine.,The local cuisine was <|novelverb_past|> by the tourists.,low,-42.11103057861328,-51.92087936401367,9.80984878540039
The baker,the cake fresh out of the oven,liked,The baker liked the cake fresh out of the oven.,The baker <|novelverb_past|> the cake fresh out of the oven.,The cake was <|novelverb_past|> fresh out of the oven by the baker.,low,-47.9767951965332,-62.030643463134766,14.053848266601562
the patient,immediate medical attention,needed,The patient needed immediate medical attention.,The patient <|novelverb_past|> immediate medical attention.,Immediate medical attention was <|novelverb_past|> by the patient.,low,-47.061317443847656,-49.99241638183594,2.9310989379882812
the veteran,the fallen comrades,remembered,The veteran remembered the fallen comrades.,The veteran <|novelverb_past|> the fallen comrades.,The fallen comrades were <|novelverb_past|> by the veteran.,low,-49.00100326538086,-52.75871276855469,3.757709503173828
The athlete,the crucial shot at the goal,missed,The athlete missed the crucial shot at the goal.,The athlete <|novelverb_past|> the crucial shot at the goal.,The crucial shot at the goal was <|novelverb_past|> by the athlete.,low,-51.76284408569336,-65.54757690429688,13.784732818603516
the children,the long homework assignments,dreaded,The children dreaded the long homework assignments.,The children <|novelverb_past|> the long homework assignments.,The long homework assignments were <|novelverb_past|> by the children.,low,-62.70606231689453,-59.77037048339844,-2.9356918334960938
The committee,the researcher's efforts,recognized,The committee recognized the researcher's efforts.,The committee <|novelverb_past|> the researcher's efforts.,The researcher's efforts were <|novelverb_past|> by the committee.,low,-44.29366683959961,-50.70595169067383,6.412284851074219
the historian,the ancient script,knew,The historian knew the ancient script.,The historian <|novelverb_past|> the ancient script.,The ancient script was <|novelverb_past|> by the historian.,low,-45.983612060546875,-47.15836715698242,1.1747550964355469
The villagers,the dragon,feared,The villagers feared the dragon.,The villagers <|novelverb_past|> the dragon.,The dragon was <|novelverb_past|> by the villagers.,low,-36.08871841430664,-42.486167907714844,6.397449493408203
The teacher,the student's struggles,understood,The teacher understood the student's struggles.,The teacher <|novelverb_past|> the student's struggles.,The student's struggles were <|novelverb_past|> by the teacher.,low,-40.31733322143555,-49.376708984375,9.059375762939453
The recipe,the ingredients we needed,had,The recipe had all the ingredients we needed.,The recipe <|novelverb_past|> all the ingredients we needed.,All the ingredients we needed were <|novelverb_past|> by the recipe.,low,-46.10447692871094,-50.3526725769043,4.248195648193359
The passerby,the heated argument,overheard,The passerby overheard the heated argument.,The passerby <|novelverb_past|> the heated argument.,The heated argument was <|novelverb_past|> by the passerby.,low,-46.02014923095703,-51.92280197143555,5.902652740478516
the observer,the small details in the artwork,noticed,The observer noticed the small details in the artwork.,The observer <|novelverb_past|> the small details in the artwork.,The small details in the artwork were <|novelverb_past|> by the observer.,low,-53.68925476074219,-59.6357536315918,5.946498870849609
they,the announcement,heard,They heard the announcement.,They <|novelverb_past|> the announcement.,The announcement was <|novelverb_past|> by them.,low,-32.94331359863281,-42.172393798828125,9.229080200195312
the community,the elderly man,respected,The community respected the elderly man for his wisdom.,The community <|novelverb_past|> the elderly man for his wisdom.,The elderly man was <|novelverb_past|> by the community for his wisdom.,low,-58.009742736816406,-60.004756927490234,1.9950141906738281
The museum,Many artifacts from ancient Egypt,had,The museum had many artifacts from ancient Egypt.,The museum <|novelverb_past|> many artifacts from ancient Egypt.,Many artifacts from ancient Egypt were <|novelverb_past|> by the museum.,low,-46.946773529052734,-50.20060348510742,3.2538299560546875
The menu,Vegetarian options,had,The menu had vegetarian options.,The menu <|novelverb_past|> vegetarian options.,Vegetarian options were <|novelverb_past|> by the menu.,low,-48.7353401184082,-42.44674301147461,-6.288597106933594
The team,their coach's strategies,respected,The team respected their coach's strategies.,The team <|novelverb_past|> their coach's strategies.,Their coach's strategies were <|novelverb_past|> by the team.,low,-52.46937561035156,-53.26591491699219,0.796539306640625
the child,the dark shadows,feared,The child feared the dark shadows.,The child <|novelverb_past|> the dark shadows.,The dark shadows were <|novelverb_past|> by the child.,low,-47.80799102783203,-46.6091194152832,-1.1988716125488281
the new laptop,a thousand dollars,cost,The new laptop cost a thousand dollars.,The new laptop <|novelverb_past|> a thousand dollars.,A thousand dollars were <|novelverb_past|> by the new laptop.,low,-55.3873405456543,-59.2178955078125,3.830554962158203
the service,ten dollars,cost,The service cost ten dollars.,The service <|novelverb_past|> ten dollars.,Ten dollars were <|novelverb_past|> by the service.,low,-48.384918212890625,-44.166282653808594,-4.218635559082031
the veteran,the comrades he lost,remembered,The veteran remembered the comrades he lost.,The veteran <|novelverb_past|> the comrades he lost.,The comrades he lost were <|novelverb_past|> by the veteran.,low,-55.33076095581055,-63.81705093383789,8.486289978027344
the project,sufficient funding,lacked,The project lacked sufficient funding.,The project <|novelverb_past|> sufficient funding.,Sufficient funding was <|novelverb_past|> by the project.,low,-44.48240661621094,-52.78007125854492,8.297664642333984
The report,crucial data,lacked,The report lacked crucial data for the analysis.,The report <|novelverb_past|> crucial data for the analysis.,Crucial data for the analysis was <|novelverb_past|> by the report.,low,-51.23925018310547,-51.35598373413086,0.11673355102539062
the report,detailed information about the project's timeline,lacked,The report lacked detailed information about the project's timeline.,The report <|novelverb_past|> detailed information about the project's timeline.,Detailed information about the project's timeline was <|novelverb_past|> by the report.,low,-62.34803009033203,-54.840187072753906,-7.507843017578125
the laptop,an update,received,The laptop received an update.,The laptop <|novelverb_past|> an update.,An update was <|novelverb_past|> by the laptop.,low,-40.765228271484375,-44.939693450927734,4.174465179443359
the detector,gas leaks,sensed,The detector sensed gas leaks.,The detector <|novelverb_past|> gas leaks.,Gas leaks were <|novelverb_past|> by the detector.,low,-47.70536422729492,-49.63822937011719,1.9328651428222656
The repair,the homeowner,cost,The repair cost a small fortune.,The repair <|novelverb_past|> a small fortune.,A small fortune was <|novelverb_past|> by the repair.,low,-42.76089859008789,-48.431217193603516,5.670318603515625
the car,five passengers,had,The car had five passengers.,The car <|novelverb_past|> five passengers.,Five passengers were <|novelverb_past|> by the car.,low,-34.502166748046875,-38.81219482421875,4.310028076171875
the project,funds,lacked,The project lacked funds.,The project <|novelverb_past|> funds.,Funds were <|novelverb_past|> by the project.,low,-36.9049072265625,-34.66876983642578,-2.2361373901367188
she,the upcoming presentation,dreaded,The manager dreaded the upcoming presentation.,The manager <|novelverb_past|> the upcoming presentation.,The upcoming presentation was <|novelverb_past|> by the manager.,low,-46.05830001831055,-52.10973358154297,6.051433563232422
The audience,the presentation,understood,The audience understood the presentation.,The audience <|novelverb_past|> the presentation.,The presentation was <|novelverb_past|> by the audience.,low,-34.26013946533203,-42.18587112426758,7.925731658935547
the residents,the impending storm,feared,The residents feared the impending storm.,The residents <|novelverb_past|> the impending storm.,The impending storm was <|novelverb_past|> by the residents.,low,-43.53131103515625,-50.53001403808594,6.9987030029296875
the sculpture,a mythical creature,resembled,The sculpture resembled a mythical creature.,The sculpture <|novelverb_past|> a mythical creature.,A mythical creature was <|novelverb_past|> by the sculpture.,low,-45.787330627441406,-49.548545837402344,3.7612152099609375
She,her hometown,missed,The woman missed her hometown.,The woman <|novelverb_past|> her hometown.,Her hometown was <|novelverb_past|> by the woman.,low,-36.50861358642578,-43.799072265625,7.290458679199219
the child,the dark forest,feared,The child feared the dark forest.,The child <|novelverb_past|> the dark forest.,The dark forest was <|novelverb_past|> by the child.,low,-43.98664093017578,-50.255760192871094,6.2691192626953125
the clouds,fluffy sheep in the sky,resembled,The clouds resembled fluffy sheep in the sky.,The clouds <|novelverb_past|> fluffy sheep in the sky.,Fluffy sheep in the sky were <|novelverb_past|> by the clouds.,low,-58.526729583740234,-71.83802795410156,13.311298370361328
The new model,the previous version,resembled,The new model resembled the previous version.,The new model <|novelverb_past|> the previous version.,The previous version was <|novelverb_past|> by the new model.,low,-43.428199768066406,-48.782962799072266,5.354763031005859
Alice,the presentation,dreaded,Alice dreaded the presentation.,Alice <|novelverb_past|> the presentation.,The presentation was <|novelverb_past|> by Alice.,low,-30.116466522216797,-45.35742950439453,15.240962982177734
The lecture,two hours,lasted,The lecture lasted two hours.,The lecture <|novelverb_past|> two hours.,Two hours were <|novelverb_past|> by the lecture.,low,-46.18840408325195,-47.55302047729492,1.3646163940429688
The hiker,a rare bird,spotted,The hiker spotted a rare bird.,The hiker <|novelverb_past|> a rare bird.,A rare bird was <|novelverb_past|> by the hiker.,low,-46.88935852050781,-51.460426330566406,4.571067810058594
the gardener,more seeds,needed,The gardener needed more seeds.,The gardener <|novelverb_past|> more seeds.,More seeds were <|novelverb_past|> by the gardener.,low,-46.951560974121094,-40.399070739746094,-6.552490234375
the child,his pet,missed,The child missed his pet during vacation.,The child <|novelverb_past|> his pet during vacation.,His pet was <|novelverb_past|> by the child during vacation.,low,-62.96720886230469,-60.642066955566406,-2.3251419067382812
the teacher,"the student""s potential",knew,The teacher knew the student's potential.,The teacher <|novelverb_past|> the student's potential.,The student's potential was <|novelverb_past|> by the teacher.,low,-41.53750228881836,-54.387420654296875,12.849918365478516
the clock,midnight,struck,The clock struck midnight.,The clock <|novelverb_past|> midnight.,Midnight was <|novelverb_past|> by the clock.,low,-38.17020034790039,-43.953025817871094,5.782825469970703
the team,"their coach""s guidance",respected,The team respected their coach's guidance.,The team <|novelverb_past|> their coach's guidance.,Their coach's guidance was <|novelverb_past|> by the team.,low,-53.62024688720703,-51.95050048828125,-1.6697463989257812
the town,the river,bordered,The town bordered the river.,The town <|novelverb_past|> the river.,The river was <|novelverb_past|> by the town.,low,-35.15629577636719,-38.67165756225586,3.515361785888672
the tourist,the ancient architecture,noticed,The tourist noticed the ancient architecture.,The tourist <|novelverb_past|> the ancient architecture.,The ancient architecture was <|novelverb_past|> by the tourist.,low,-46.093536376953125,-52.443458557128906,6.349922180175781
the sculpture,a famous painting,resembled,The sculpture resembled a famous painting.,The sculpture <|novelverb_past|> a famous painting.,A famous painting was <|novelverb_past|> by the sculpture.,low,-46.55693054199219,-49.8918342590332,3.3349037170410156
the shirt,the man,fit,The shirt fit the man.,The shirt <|novelverb_past|> the man.,The man was <|novelverb_past|> by the shirt.,low,-33.12332534790039,-40.33390426635742,7.210578918457031
the room,a cozy ambiance,had,The room had a cozy ambiance.,The room <|novelverb_past|> a cozy ambiance.,A cozy ambiance was <|novelverb_past|> by the room.,low,-46.335975646972656,-56.27297592163086,9.937000274658203
the cat,the bird on the windowsill,noticed,The cat noticed the bird on the windowsill intently.,The cat <|novelverb_past|> the bird on the windowsill intently.,The bird on the windowsill was <|novelverb_past|> intently by the cat.,low,-60.87179183959961,-70.6188735961914,9.747081756591797
Rob,his wallet,missed,Rob missed his wallet.,Rob <|novelverb_past|> his wallet.,His wallet was <|novelverb_past|> by Rob.,low,-42.891300201416016,-44.294715881347656,1.4034156799316406
The project,a detailed plan,lacked,The project lacked a detailed plan.,The project <|novelverb_past|> a detailed plan.,A detailed plan was <|novelverb_past|> by the project.,low,-47.970497131347656,-47.985076904296875,0.01457977294921875
the renovation,significant money,cost,The renovation cost significant money.,The renovation <|novelverb_past|> significant money.,Significant money was <|novelverb_past|> by the renovation.,low,-54.36909484863281,-46.017433166503906,-8.351661682128906
the neighbors,the band,heard,The neighbors heard the band rehearsing late at night.,The neighbors <|novelverb_past|> the band rehearsing late at night.,The band rehearsing late at night was <|novelverb_past|> by the neighbors.,low,-61.112648010253906,-67.19570922851562,6.083061218261719
The community,his dedication to volunteering,respected,The community respected his dedication to volunteering.,The community <|novelverb_past|> his dedication to volunteering.,His dedication to volunteering was <|novelverb_past|> by the community.,low,-53.79750442504883,-50.84424591064453,-2.953258514404297
The building,renovations,underwent,The building underwent renovations last year.,The building <|novelverb_past|> renovations last year.,Renovations were <|novelverb_past|> last year by the building.,low,-48.12986755371094,-60.05588150024414,11.926013946533203
the box,the items,fit,The box fit the items perfectly inside.,The box <|novelverb_past|> the items perfectly inside.,The items were <|novelverb_past|> perfectly inside by the box.,low,-59.73870086669922,-65.83435821533203,6.0956573486328125
The house,The old cemetery,abutted,The house abutted the old cemetery.,The house <|novelverb_past|> the old cemetery.,The old cemetery <|novelverb_past|> the house.,low,-40.83896255493164,-41.31239700317383,0.4734344482421875
the new smartphone,nearly a thousand dollars,cost,The new smartphone cost nearly a thousand dollars.,The new smartphone <|novelverb_past|> nearly a thousand dollars.,Nearly a thousand dollars was <|novelverb_past|> by the new smartphone.,low,-57.92144012451172,-51.688907623291016,-6.232532501220703
Travelers,The risks,knew,Travelers knew the risks involved.,Travelers <|novelverb_past|> the risks involved.,The risks involved were <|novelverb_past|> by the travelers.,low,-38.5703010559082,-55.451377868652344,16.88107681274414
the patient,the procedure,underwent,The patient underwent the procedure.,The patient <|novelverb_past|> the procedure.,The procedure was <|novelverb_past|> by the patient.,low,-34.38373565673828,-40.031150817871094,5.6474151611328125
the team,the captain's judgment,trusted,The team trusted the captain's judgment.,The team <|novelverb_past|> the captain's judgment.,The captain's judgment was <|novelverb_past|> by the team.,low,-44.428375244140625,-47.2093505859375,2.780975341796875
the sailor,the lighthouse,saw,The sailor saw the lighthouse.,The sailor <|novelverb_past|> the lighthouse.,The lighthouse was <|novelverb_past|> by the sailor.,low,-42.74952697753906,-46.64947509765625,3.8999481201171875
the jury,"the artist""s innovative approach",recognized,The jury recognized the artist's innovative approach in her work.,The jury <|novelverb_past|> the artist's innovative approach in her work.,The artist's innovative approach in her work was <|novelverb_past|> by the jury.,low,-62.40732955932617,-66.16124725341797,3.753917694091797
the new phone,several hundred dollars,cost,The new phone cost several hundred dollars.,The new phone <|novelverb_past|> several hundred dollars.,Several hundred dollars was <|novelverb_past|> by the new phone.,low,-48.61046600341797,-48.7396125793457,0.12914657592773438
the community,the foundation's cause for the environment,believed,The community believed the foundation's cause for the environment.,The community <|novelverb_past|> the foundation's cause for the environment.,The foundation's cause for the environment was <|novelverb_past|> by the community.,low,-62.41798400878906,-69.18212890625,6.7641448974609375
She,the flavor of the new coffee blend,liked,The barista liked the flavor of the new coffee blend.,The barista <|novelverb_past|> the flavor of the new coffee blend.,The flavour of the new coffee blend was <|novelverb_past|> by the barista.,low,-62.54250717163086,-66.20687866210938,3.6643714904785156
the clouds,various animal shapes,resembled,The clouds resembled various animal shapes.,The clouds <|novelverb_past|> various animal shapes.,Various animal shapes were <|novelverb_past|> by the clouds.,low,-50.53923034667969,-53.26210403442383,2.7228736877441406
the model,the original statue,resembled,The model resembled the original statue.,The model <|novelverb_past|> the original statue.,The original statue was <|novelverb_past|> by the model.,low,-46.21206283569336,-48.36101531982422,2.1489524841308594
the birdwatcher,a rare species in the forest,spotted,The birdwatcher spotted a rare species in the forest.,The birdwatcher <|novelverb_past|> a rare species in the forest.,A rare species was <|novelverb_past|> in the forest by the birdwatcher.,low,-51.32966995239258,-68.30326843261719,16.97359848022461
the dress,her,fit,The dress fit the bride perfectly.,The dress <|novelverb_past|> the bride perfectly.,The bride was <|novelverb_past|> perfectly by the dress.,low,-53.99245834350586,-54.134464263916016,0.14200592041015625
the sculpture,a majestic eagle in flight,resembled,The sculpture resembled a majestic eagle in flight.,The sculpture <|novelverb_past|> a majestic eagle in flight.,A majestic eagle in flight was <|novelverb_past|> by the sculpture.,low,-57.44337463378906,-63.82506561279297,6.381690979003906
the villagers,the wild animals,feared,The villagers feared the wild animals.,The villagers <|novelverb_past|> the wild animals.,The wild animals were <|novelverb_past|> by the villagers.,low,-38.013946533203125,-44.61842346191406,6.6044769287109375
The table,more than anticipated,cost,The table cost more than anticipated at the auction.,The table <|novelverb_past|> more than anticipated at the auction.,More than anticipated was <|novelverb_past|> by the table at the auction.,low,-58.07210159301758,-63.9390983581543,5.866996765136719
the program,the new user,recognized,The program recognized the new user.,The program <|novelverb_past|> the new user.,The new user was <|novelverb_past|> by the program.,low,-42.629878997802734,-48.19635772705078,5.566478729248047
the librarian,the location of every book in the vast collection,knew,The librarian knew the location of every book in the vast collection.,The librarian <|novelverb_past|> the location of every book in the vast collection.,The location of every book in the vast collection was <|novelverb_past|> by the librarian.,low,-63.82465362548828,-72.78900909423828,8.96435546875
The dog,The sound of thunder,feared,The dog feared the sound of thunder.,The dog <|novelverb_past|> the sound of thunder.,The sound of thunder was <|novelverb_past|> by the dog.,low,-42.69061279296875,-45.70646667480469,3.0158538818359375
the children,the monster under the bed,feared,The children feared the monster under the bed.,The children <|novelverb_past|> the monster under the bed.,The monster under the bed was <|novelverb_past|> by the children.,low,-52.56977844238281,-51.265968322753906,-1.3038101196289062
The painting,a famous masterpiece,resembled,The painting resembled a famous masterpiece.,The painting <|novelverb_past|> a famous masterpiece.,A famous masterpiece was <|novelverb_past|> by the painting.,low,-49.276397705078125,-50.7412109375,1.464813232421875
The patron,their conversation,overheard,She overheard their conversation.,The patron <|novelverb_past|> their conversation.,Their conversation was <|novelverb_past|> by the patron.,low,-47.84694290161133,-43.84803009033203,-3.998912811279297
the athlete,the qualification,missed,The athlete missed the qualifying score by a margin.,The athlete <|novelverb_past|> the qualifying score by a margin.,The qualifying score was <|novelverb_past|> by the athlete by a margin.,low,-54.07247543334961,-69.02790832519531,14.955432891845703
The team,their leader,trusted,The team trusted their leader.,The team <|novelverb_past|> their leader.,Their leader was <|novelverb_past|> by the team.,low,-35.379966735839844,-36.64192199707031,1.2619552612304688
The meeting,an entire afternoon,lasted,The meeting lasted an entire afternoon.,The meeting <|novelverb_past|> an entire afternoon.,An entire afternoon was <|novelverb_past|> by the meeting.,low,-46.320560455322266,-50.72724914550781,4.406688690185547
Her voice,the sweet sound of a violin,resembled,Her voice resembled the sweet sound of a violin.,Her voice <|novelverb_past|> the sweet sound of a violin.,The sweet sound of a violin was <|novelverb_past|> by her voice.,low,-43.77676773071289,-54.902095794677734,11.125328063964844
the mural,a vibrant tapestry,resembled,The mural resembled a vibrant tapestry.,The mural <|novelverb_past|> a vibrant tapestry.,A vibrant tapestry was <|novelverb_past|> by the mural.,low,-63.378631591796875,-58.97095489501953,-4.407676696777344
the driver,the old song playing on the radio,recognized,The driver recognized the old song playing on the radio.,The driver <|novelverb_past|> the old song playing on the radio.,The old song playing on the radio was <|novelverb_past|> by the driver.,low,-51.356380462646484,-60.3669319152832,9.010551452636719
The campers,the shooting star,saw,The camper saw the shooting star.,The camper <|novelverb_past|> the shooting star.,The shooting star was <|novelverb_past|> by the camper.,low,-52.58280944824219,-54.205360412597656,1.6225509643554688
the appointment,forty-five minutes,lasted,The appointment lasted forty-five minutes.,The appointment <|novelverb_past|> forty-five minutes.,Forty-five minutes were <|novelverb_past|> by the appointment.,low,-57.942787170410156,-45.834312438964844,-12.108474731445312
the woman,snakes,feared,The woman feared snakes.,The woman <|novelverb_past|> snakes.,Snakes were <|novelverb_past|> by the woman.,low,-34.55763244628906,-42.8140754699707,8.25644302368164
the engine,repairs,needed,The engine needed repairs.,The engine <|novelverb_past|> repairs.,Repairs were <|novelverb_past|> by the engine.,low,-39.39218521118164,-40.14352798461914,0.7513427734375
the renovations,a pretty penny,cost,The renovations cost a pretty penny.,The renovations <|novelverb_past|> a pretty penny.,A pretty penny was <|novelverb_past|> by the renovations.,low,-50.961647033691406,-51.746795654296875,0.7851486206054688
The teacher,the lesson plan,prepared,The teacher prepared the lesson plan.,The teacher <|novelverb_past|> the lesson plan.,The lesson plan was <|novelverb_past|> by the teacher.,high,-41.679664611816406,-53.63207244873047,11.952407836914062
