subject,object,verb,sentence,active,passive,affectedness,active_score,passive_score,pass_drop
The soldier,the intruder,shot,The soldier shot the intruder during a midnight raid.,The soldier <|novelverb_past|> the intruder during a midnight raid.,The intruder was <|novelverb_past|> by the soldier during a midnight raid.,high,-65.29124450683594,-66.4950942993164,1.2038497924804688
the criminal,the unmanned robot,stabbed,The criminal stabbed the unmanned robot.,The criminal <|novelverb_past|> the unmanned robot.,"The unmanned robot was <|novelverb_past|> by the criminal,.",high,-66.26044464111328,-75.44059753417969,9.180152893066406
The military officer,the deserter,executed,The military officer executed the deserter.,The military officer <|novelverb_past|> the deserter.,The deserter was <|novelverb_past|> by the military officer.,high,-57.01803207397461,-59.28118896484375,2.2631568908691406
The villain,his opponent,knifed,The villain knifed his opponent in a theatrical duel.,The villain <|novelverb_past|> his opponent in a theatrical duel.,His opponent was <|novelverb_past|> by the villain in a theatrical duel.,high,-63.35664749145508,-73.92514038085938,10.568492889404297
The haunted house actor,The guests,frightened,The haunted house actor successfully frightened the guests.,The haunted house actor successfully <|novelverb_past|> the guests.,The guests were <|novelverb_past|> successfully by the haunted house actor.,high,-59.50408172607422,-81.55157470703125,22.04749298095703
The firefighter,the cleared fields,burned,The firefighter burned the cleared fields to prevent a larger forest fire.,The firefighter <|novelverb_past|> the cleared fields to prevent a larger forest fire.,The cleared fields were <|novelverb_past|> by the firefighter to prevent a larger forest fire.,high,-82.61125183105469,-92.4041748046875,9.792922973632812
The hunter,the wild boar,killed,The hunter killed the wild boar in the forest.,The hunter <|novelverb_past|> the wild boar in the forest.,The wild boar was <|novelverb_past|> by the hunter in the forest.,high,-59.44468688964844,-62.85719299316406,3.412506103515625
The pest control officer,the cockroaches,exterminated,The pest control officer exterminated the cockroaches in the infested kitchen.,The pest control officer <|novelverb_past|> the cockroaches in the infested kitchen.,The cockroaches in the infested kitchen were <|novelverb_past|> by the pest control officer.,high,-73.96426391601562,-79.48917388916016,5.524909973144531
The pest control team,all the insects in the house,exterminated,The pest control team exterminated all the insects in the house.,The pest control team <|novelverb_past|> all the insects in the house.,All the insects in the house were <|novelverb_past|> by the pest control team.,high,-62.21087646484375,-73.59672546386719,11.385848999023438
assassin,wealthy businessman,murdered,The assassin murdered the wealthy businessman in his secluded mansion.,The assassin <|novelverb_past|> the wealthy businessman in his secluded mansion.,The wealthy businessman was <|novelverb_past|> by the assassin in his secluded mansion.,high,-80.32797241210938,-70.75252532958984,-9.575447082519531
The prisoner,His rival inmate,knifed,The prisoner knifed his rival inmate during lunch.,The prisoner <|novelverb_past|> his rival inmate during lunch.,His rival inmate was <|novelverb_past|> by the prisoner during lunch.,high,-73.16856384277344,-75.84668731689453,2.6781234741210938
The athlete,the world record,broke,The athlete broke the world record in the event.,The athlete <|novelverb_past|> the world record in the event.,The world record in the event was <|novelverb_past|> by the athlete.,high,-80.51941680908203,-69.79136657714844,-10.728050231933594
The campfire,the stack of wood,burned,The campfire burned the stack of wood.,The campfire <|novelverb_past|> the stack of wood.,The stack of wood was <|novelverb_past|> by the campfire.,high,-54.59489059448242,-55.316619873046875,0.7217292785644531
The state,the criminal,executed,The state executed the criminal at dawn.,The state <|novelverb_past|> the criminal at dawn.,The criminal was <|novelverb_past|> by the state at dawn.,high,-57.21678161621094,-61.826080322265625,4.6092987060546875
The construction worker,the concrete pillar,crushed,The construction worker crushed the concrete pillar.,The construction worker <|novelverb_past|> the concrete pillar.,The concrete pillar was <|novelverb_past|> by the construction worker.,high,-53.641082763671875,-58.78202819824219,5.1409454345703125
The chef,The juicy steak,stabbed,The chef expertly stabbed the fork into the juicy steak.,The chef expertly <|novelverb_past|> the fork into the juicy steak.,The fork was <|novelverb_past|> expertly by the chef into the juicy steak.,high,-65.12335968017578,-91.35746765136719,26.234107971191406
the storm,dozens of houses,wrecked,The storm wrecked dozens of houses along the coastline.,The storm <|novelverb_past|> dozens of houses along the coastline.,Dozens of houses along the coastline were <|novelverb_past|> by the storm.,high,-53.5118408203125,-53.19025421142578,-0.32158660888671875
The mother,water,boiled,The mother boiled water for her child's bottle.,The mother <|novelverb_past|> water for her child's bottle.,Water for her child's bottle was <|novelverb_past|> by the mother.,high,-64.83788299560547,-70.28987121582031,5.451988220214844
The campers,the marshmallows,burned,The campers accidentally burned the marshmallows over the fire.,The campers accidentally <|novelverb_past|> the marshmallows over the fire.,The marshmallows were accidentally <|novelverb_past|> over the fire by the campers.,high,-68.95094299316406,-79.05370330810547,10.102760314941406
The criminal,the unsuspecting victim,knifed,The criminal knifed the unsuspecting victim in the alley.,The criminal <|novelverb_past|> the unsuspecting victim in the alley.,The unsuspecting victim was <|novelverb_past|> in the alley by the criminal.,high,-69.54503631591797,-62.63641357421875,-6.908622741699219
The compactor,The metal cans,crushed,The compactor crushed the metal cans into cubes.,The compactor <|novelverb_past|> the metal cans into cubes.,The metal cans were <|novelverb_past|> into cubes by the compactor.,high,-73.14022827148438,-79.97393798828125,6.833709716796875
The thieves,the unsuspecting travelers,robbed,The thieves robbed the unsuspecting travelers at the desolate rest stop.,The thieves <|novelverb_past|> the unsuspecting travelers at the desolate rest stop.,The unsuspecting travelers were <|novelverb_past|> by thieves at the desolate rest stop.,high,-94.11227416992188,-95.46536254882812,1.35308837890625
The knight,The dragon,stabbed,The knight stabbed the dragon with his enchanted sword.,The knight <|novelverb_past|> the dragon with his enchanted sword.,The dragon was <|novelverb_past|> by the knight with his enchanted sword.,high,-65.22429656982422,-71.46495056152344,6.240653991699219
The mechanic,the old car,crushed,The mechanic crushed the old car with the hydraulic press.,The mechanic <|novelverb_past|> the old car with the hydraulic press.,The old car was <|novelverb_past|> by the mechanic with the hydraulic press.,high,-76.2867431640625,-70.40890502929688,-5.877838134765625
The political faction,the citizens,terrorized,The political faction terrorized the citizens with threats of violence.,The political faction <|novelverb_past|> the citizens with threats of violence.,The citizens were <|novelverb_past|> with threats of violence by the political faction.,high,-62.956111907958984,-68.13984680175781,5.183734893798828
The criminals,the bank,robbed,The criminals robbed the bank in broad daylight.,The criminals <|novelverb_past|> the bank in broad daylight.,The bank was <|novelverb_past|> by the criminals in broad daylight.,high,-69.35525512695312,-61.022789001464844,-8.332466125488281
The villain,The investigator,drowned,The villain drowned the investigator by tying him to a heavy weight.,The villain <|novelverb_past|> the investigator by tying him to a heavy weight.,The investigator was <|novelverb_past|> by the villain by tying him to a heavy weight.,high,-79.05802154541016,-89.58985900878906,10.531837463378906
The construction company,the old building,demolished,The construction company demolished the old building.,The construction company <|novelverb_past|> the old building.,The old building was <|novelverb_past|> by the construction company.,high,-50.03101348876953,-55.342132568359375,5.311119079589844
The woman,The can,crushed,The woman crushed the can with ease.,The woman <|novelverb_past|> the can with ease.,The can was <|novelverb_past|> by the woman with ease.,high,-50.43672180175781,-66.47595977783203,16.03923797607422
The soldiers,the prisoner,executed,The soldiers executed the prisoner at dawn.,The soldiers <|novelverb_past|> the prisoner at dawn.,The prisoner was <|novelverb_past|> by the soldiers at dawn.,high,-60.099952697753906,-57.0794792175293,-3.0204734802246094
The attacker,the victim,stabbed,The attacker viciously stabbed the victim in the crowded marketplace.,The attacker viciously <|novelverb_past|> the victim in the crowded marketplace.,The victim was viciously <|novelverb_past|> by the attacker in the crowded marketplace.,high,-56.495338439941406,-70.96135711669922,14.466018676757812
the villain,the spy,strangled,The villain strangled the spy in the alley.,The villain <|novelverb_past|> the spy in the alley.,The spy was <|novelverb_past|> by the villain in the alley.,high,-56.77342224121094,-59.2480354309082,2.4746131896972656
The government,the treacherous spy,executed,The government executed the treacherous spy who had betrayed the country.,The government <|novelverb_past|> the treacherous spy who had betrayed the country.,The treacherous spy who had betrayed the country was <|novelverb_past|> by the government.,high,-79.85250854492188,-79.78482818603516,-0.06768035888671875
The horse,the intruder,kicked,The horse kicked the intruder with all its might.,The horse <|novelverb_past|> the intruder with all its might.,The intruder was <|novelverb_past|> by the horse with all its might.,high,-70.2215347290039,-70.2249755859375,0.00344085693359375
The novelist,his protagonist,murdered,The novelist murdered his protagonist in the latest chapter.,The novelist <|novelverb_past|> his protagonist in the latest chapter.,His protagonist was <|novelverb_past|> in the latest chapter by the novelist.,high,-68.21246337890625,-77.58549499511719,9.373031616210938
The executioner,the traitor,executed,The executioner executed the traitor at dawn.,The executioner <|novelverb_past|> the traitor at dawn.,The traitor was <|novelverb_past|> by the executioner at dawn.,high,-61.94361877441406,-70.09478759765625,8.151168823242188
The gangster,the rival leader,shot,The gangster shot the rival leader.,The gangster <|novelverb_past|> the rival leader.,The rival leader was <|novelverb_past|> by the gangster.,high,-67.1624984741211,-56.54628372192383,-10.616214752197266
The pirate,the sail,knifed,The pirate knifed the sail to bring it down quickly during the skirmish.,The pirate <|novelverb_past|> the sail to bring it down quickly during the skirmish.,The sail was <|novelverb_past|> by the pirate to bring it down quickly during the skirmish.,high,-92.3318862915039,-90.87562561035156,-1.4562606811523438
The technician,the faulty machine,dismantled,The technician dismantled the faulty machine.,The technician <|novelverb_past|> the faulty machine.,The faulty machine was <|novelverb_past|> by the technician.,high,-61.210357666015625,-62.59711837768555,1.3867607116699219
The bullet,The glass window,shattered,The bullet shattered the glass window of the abandoned car.,The bullet <|novelverb_past|> the glass window of the abandoned car.,The glass window of the abandoned car was <|novelverb_past|> by the bullet.,high,-64.4621810913086,-67.56216430664062,3.0999832153320312
The villain,the spy,suffocated,The villain suffocated the spy with a pillow.,The villain <|novelverb_past|> the spy with a pillow.,The spy with a pillow was <|novelverb_past|> by the villain.,high,-61.00712966918945,-68.48123168945312,7.474102020263672
The chef,The vegetables,burned,The chef burned the vegetables to a crisp by accident.,The chef <|novelverb_past|> the vegetables to a crisp by accident.,The vegetables were <|novelverb_past|> to a crisp by accident by the chef.,high,-67.72611999511719,-91.4078369140625,23.681716918945312
The writer,the manuscript,completed,The writer completed the manuscript.,The writer <|novelverb_past|> the manuscript.,The manuscript was <|novelverb_past|> by the writer.,high,-41.67075729370117,-52.29962921142578,10.62887191772461
The rogue tiger,the village,terrorized,The rogue tiger terrorized the village for weeks.,The rogue tiger <|novelverb_past|> the village for weeks.,The village was <|novelverb_past|> by the rogue tiger for weeks.,high,-65.22409057617188,-69.82975769042969,4.6056671142578125
The arsonist,the building,burned,The arsonist burned the building to ashes.,The arsonist <|novelverb_past|> the building to ashes.,The building was <|novelverb_past|> to ashes by the aronist.,high,-55.38356018066406,-77.1686019897461,21.78504180908203
the thief,the glass display case,shattered,The thief shattered the glass display case to steal the jewels.,The thief <|novelverb_past|> the glass display case to steal the jewels.,The glass display case was <|novelverb_past|> by the thief to steal the jewels.,high,-83.84320068359375,-90.42168426513672,6.578483581542969
The monster,the village,terrorized,The monster terrorized the village.,The monster <|novelverb_past|> the village.,The village was <|novelverb_past|> by the monster.,high,-45.17112731933594,-50.35808563232422,5.186958312988281
The giant,the fallen knight,crushed,The giant crushed the fallen knight with one blow.,The giant <|novelverb_past|> the fallen knight with one blow.,The fallen knight was <|novelverb_past|> by the giant with one blow.,high,-72.62261962890625,-76.41544342041016,3.7928237915039062
The construction crew,the unsafe structure,demolished,The construction crew demolished the unsafe structure to make way for new development.,The construction crew <|novelverb_past|> the unsafe structure to make way for new development.,The unsafe structure was <|novelverb_past|> by the construction crew to make way for new development,high,-81.79854583740234,-85.75094604492188,3.9524002075195312
The king,the prisoner,executed,The king executed the prisoner at dawn.,The king <|novelverb_past|> the prisoner at dawn.,The prisoner was <|novelverb_past|> by the king at dawn.,high,-51.048336029052734,-56.28583908081055,5.2375030517578125
the actor,the prop,knifed,The actor knifed the prop during the final act with dramatic flair.,The actor <|novelverb_past|> the prop during the final act with dramatic flair.,The prop was <|novelverb_past|> by the actor during the final act with dramatic flair.,high,-78.01366424560547,-88.52517700195312,10.511512756347656
The developers,The old building,demolished,The developers demolished the old building to make way for a new skyscraper.,The developers <|novelverb_past|> the old building to make way for a new skyscraper.,The old building was <|novelverb_past|> by the developers to make way for a new skyscraper.,high,-75.99929809570312,-75.35505676269531,-0.6442413330078125
The haunted house attraction,the visitors,frightened,The haunted house attraction frightened the visitors with its sudden surprises.,The haunted house attraction <|novelverb_past|> the visitors with its sudden surprises.,The visitors were <|novelverb_past|> by the haunted house attraction with its sudden surprises.,high,-72.76950073242188,-87.42414855957031,14.654647827148438
The thief,the unsuspecting tourists,robbed,The thief robbed the unsuspecting tourists of their valuables.,The thief <|novelverb_past|> the unsuspecting tourists of their valuables.,The unsuspecting tourists wer e <|novelverb_past|> of their valuables by the thief.,high,-80.9393539428711,-115.62161254882812,34.68225860595703
The elephant,the fruit,crushed,The elephant crushed the fruit under its feet.,The elephant <|novelverb_past|> the fruit under its feet.,The fruit under its feet was <|novelverb_past|> by the elephant.,high,-56.35693359375,-69.44344329833984,13.086509704589844
The chef,the potatoes,boiled,The chef boiled the potatoes in a large pot.,The chef <|novelverb_past|> the potatoes in a large pot.,The potatoes were <|novelverb_past|> by the chef in a large pot.,high,-57.599552154541016,-73.52223205566406,15.922679901123047
The gang,the local residents,terrorized,The gang terrorized the local residents for months.,The gang <|novelverb_past|> the local residents for months.,The local residents were <|novelverb_past|> by the gang for months.,high,-58.06422424316406,-59.91634750366211,1.8521232604980469
suspect,detective,murdered,The suspect murdered the detective in his own living room.,The suspect <|novelverb_past|> the detective in his own living room.,The detective was <|novelverb_past|> by the suspect in his own living room.,high,-70.59762573242188,-74.51053619384766,3.9129104614257812
The lifeguard,the intruder,drowned,The lifeguard drowned the intruder during practice.,The lifeguard <|novelverb_past|> the intruder during practice.,The intruder was <|novelverb_past|> by the lifeguard during practice.,high,-62.83269500732422,-68.4997329711914,5.6670379638671875
The pirate captain,the enemies,drowned,The pirate captain drowned the enemies in the turbulent sea.,The pirate captain <|novelverb_past|> the enemies in the turbulent sea.,The enemies were <|novelverb_past|> into the turbulent sea by the pirate captain.,high,-65.64814758300781,-83.88993072509766,18.241783142089844
The explosion,The old abandoned warehouse,destroyed,The explosion destroyed the old abandoned warehouse.,The explosion <|novelverb_past|> the old abandoned warehouse.,The old abandoned warehouse was <|novelverb_past|> by the explosion.,high,-54.35165786743164,-60.47220993041992,6.120552062988281
criminal gang,local businesses,terrorized,The criminal gang terrorized the local businesses in the downtown area.,The criminal gang <|novelverb_past|> the local businesses in the downtown area.,The local businesses in the downtown area were <|novelverb_past|> by the criminal gang.,high,-70.0373764038086,-70.75074005126953,0.7133636474609375
The team,the stalled car,pushed,The team pushed the stalled car to the side of the road.,The team <|novelverb_past|> the stalled car to the side of the road.,The stalled car was <|novelverb_past|> to the side of the road by the team.,high,-60.28293991088867,-67.615966796875,7.333026885986328
the hurricane,windows across the coastal town,shattered,The hurricane shattered windows across the coastal town.,The hurricane <|novelverb_past|> windows across the coastal town.,Windows across the coastal town were <|novelverb_past|> by the hurricane.,high,-57.38447952270508,-80.64521026611328,23.260730743408203
the movie villain,his adversary,strangled,The movie villain strangled his adversary without hesitation.,The movie villain <|novelverb_past|> his adversary without hesitation.,His adversary was <|novelverb_past|> without hesitation by the movie villain.,high,-61.46540451049805,-80.68746948242188,19.222064971923828
the spy,the guard,strangled,The spy strangled the guard silently in the shadows.,The spy <|novelverb_past|> the guard silently in the shadows.,The guard was <|novelverb_past|> silently in the shadows by the spy.,high,-59.87969970703125,-74.69200134277344,14.812301635742188
The machine,The scrap metal,crushed,The machine crushed the scrap metal into a compact cube.,The machine <|novelverb_past|> the scrap metal into a compact cube.,The scrap metal was <|novelverb_past|> into a compact metal cube by the machine.,high,-69.16487121582031,-77.01931762695312,7.8544464111328125
The storm,The small fishing village,wrecked,The storm wrecked the small fishing village overnight.,The storm <|novelverb_past|> the small fishing village overnight.,The small fishing village was <|novelverb_past|> overnight by the storm.,high,-55.24349594116211,-64.05500793457031,8.811511993408203
the thief,the vase,broke,The thief broke the vase during the heist.,The thief <|novelverb_past|> the vase during the heist.,The vase was <|novelverb_past|> by the thief during the heist.,high,-62.599788665771484,-72.59050750732422,9.990718841552734
the angry customer,the sales clerk,pushed,The angry customer pushed the sales clerk.,The angry customer <|novelverb_past|> the sales clerk.,The sales clerk was <|novelverb_past|> by the angry customer.,high,-50.877830505371094,-58.75006866455078,7.8722381591796875
The state,the prisoner,executed,The state officially executed the prisoner as per the court's final ruling.,The state officially <|novelverb_past|> the prisoner as per the court's final ruling.,The prisoner was officially <|novelverb_past|> by the state as per the court's final ruling.,high,-81.0268325805664,-84.86949157714844,3.8426589965820312
The bully,the boy,pushed,The bully pushed the boy off the swing.,The bully <|novelverb_past|> the boy off the swing.,The boy was <|novelverb_past|> off the swing by the bully.,high,-66.7315673828125,-68.86351776123047,2.1319503784179688
The burglar,the antique vase,broke,The burglar broke the antique vase during the heist.,The burglar <|novelverb_past|> the antique vase during the heist.,The antique vase was <|novelverb_past|> by the burglar during the heist.,high,-68.2958755493164,-78.3487777709961,10.052902221679688
The villain,The hostage,strangled,The villain strangled the hostage to intimidate the hero.,The villain <|novelverb_past|> the hostage to intimidate the hero.,The hostage was <|novelverb_past|> by the villain to intimidate the hero.,high,-66.67729949951172,-76.4333724975586,9.756072998046875
the outlaw,the sheriff,murdered,The outlaw brutally murdered the sheriff.,The outlaw brutally <|novelverb_past|> the sheriff.,The sheriff was brutally <|novelverb_past|> by the outlaw.,high,-66.38230895996094,-63.6397705078125,-2.7425384521484375
The butler,The victim,murdered,The butler murdered the victim.,The butler <|novelverb_past|> the victim.,The victim was <|novelverb_past|> by the butler.,high,-45.740562438964844,-52.26438522338867,6.523822784423828
The criminal,His opponent,suffocated,The criminal suffocated his opponent with a pillow.,The criminal <|novelverb_past|> his opponent with a pillow.,His opponent was <|novelverb_past|> by the criminal with a pillow.,high,-71.01007843017578,-73.00723266601562,1.9971542358398438
The pest control worker,the termites,exterminated,The pest control worker exterminated the termites in the basement.,The pest control worker <|novelverb_past|> the termites in the basement.,The termites in the basement were <|novelverb_past|> by the pest control worker.,high,-68.20411682128906,-84.37703704833984,16.17292022705078
The ghost,the children,frightened,The ghost frightened the children in the haunted house.,The ghost <|novelverb_past|> the children in the haunted house.,The children in the haunted house were <|novelverb_past|> by the ghost.,high,-60.05979919433594,-60.213722229003906,0.15392303466796875
The man,The pile of dry leaves,burned,The man burned the pile of dry leaves in the backyard.,The man <|novelverb_past|> the pile of dry leaves in the backyard.,The pile of dry leaves in the backyard were <|novelverb_past|> by the man.,high,-59.471946716308594,-67.59640502929688,8.124458312988281
The kidnapper,the victim,suffocated,The kidnapper suffocated the victim with a pillow.,The kidnapper <|novelverb_past|> the victim with a pillow.,The victim was <|novelverb_past|> by the kidnapper with a pillow.,high,-60.07416915893555,-68.93165588378906,8.857486724853516
The scientist,the experimental compound,synthesized,The scientist synthesized the experimental compound.,The scientist <|novelverb_past|> the experimental compound.,The experimental compound was <|novelverb_past|> by the scientist.,high,-60.01858901977539,-64.41622161865234,4.397632598876953
knight,mythical beast,stabbed,The knight stabbed the sword into the mythical beast.,The knight <|novelverb_past|> the sword into the mythical beast.,The sword was <|novelverb_past|> by the knight into the mythical beast.,high,-71.55558776855469,-77.10010528564453,5.544517517089844
the butler,the wealthy businessman,murdered,The detective murdered the wealthy businessman.,The detective <|novelverb_past|> the wealthy businessman.,The wealthy businessman was <|novelverb_past|> by the detective.,high,-57.659637451171875,-59.74291229248047,2.0832748413085938
The chef,a flawless soufflé,executed,The chef executed a flawless soufflé for the guests.,The chef <|novelverb_past|> a flawless soufflé for the guests.,A flawless soufflé was <|novelverb_past|> for the guests by the chef.,high,-73.3670654296875,-92.56333923339844,19.196273803710938
The firing squad,the prisoner,executed,The firing squad executed the prisoner at dawn.,The firing squad <|novelverb_past|> the prisoner at dawn.,The prisoner was <|novelverb_past|> by the firing squad at dawn.,high,-62.9119987487793,-57.30329132080078,-5.608707427978516
The earthquake,the downtown skyscraper,collapsed,The earthquake collapsed the downtown skyscraper.,The earthquake <|novelverb_past|> the downtown skyscraper.,The downtown skyscraper was <|novelverb_past|> by the earthquake.,high,-53.296653747558594,-53.49436950683594,0.19771575927734375
The machine,The rocks,crushed,The machine crushed the rocks into gravel.,The machine <|novelverb_past|> the rocks into gravel.,The rocks were <|novelverb_past|> by the machine into gravel.,high,-56.410865783691406,-63.905494689941406,7.49462890625
