subject,object,verb,sentence,active,passive,affectedness,active_score,passive_score,pass_drop
The soldier,the intruder,shot,The soldier shot the intruder during a midnight raid.,The soldier <|novelverb_past|> the intruder during a midnight raid.,The intruder was <|novelverb_past|> by the soldier during a midnight raid.,high,-33.376495361328125,-46.28120803833008,12.904712677001953
the criminal,the unmanned robot,stabbed,The criminal stabbed the unmanned robot.,The criminal <|novelverb_past|> the unmanned robot.,"The unmanned robot was <|novelverb_past|> by the criminal,.",high,-44.3043212890625,-65.72714233398438,21.422821044921875
The military officer,the deserter,executed,The military officer executed the deserter.,The military officer <|novelverb_past|> the deserter.,The deserter was <|novelverb_past|> by the military officer.,high,-38.314117431640625,-46.45329284667969,8.139175415039062
The villain,his opponent,knifed,The villain knifed his opponent in a theatrical duel.,The villain <|novelverb_past|> his opponent in a theatrical duel.,His opponent was <|novelverb_past|> by the villain in a theatrical duel.,high,-34.36094665527344,-47.87853240966797,13.517585754394531
The haunted house actor,The guests,frightened,The haunted house actor successfully frightened the guests.,The haunted house actor successfully <|novelverb_past|> the guests.,The guests were <|novelverb_past|> successfully by the haunted house actor.,high,-42.97808837890625,-54.2156982421875,11.23760986328125
The firefighter,the cleared fields,burned,The firefighter burned the cleared fields to prevent a larger forest fire.,The firefighter <|novelverb_past|> the cleared fields to prevent a larger forest fire.,The cleared fields were <|novelverb_past|> by the firefighter to prevent a larger forest fire.,high,-50.78358459472656,-73.63270568847656,22.84912109375
The hunter,the wild boar,killed,The hunter killed the wild boar in the forest.,The hunter <|novelverb_past|> the wild boar in the forest.,The wild boar was <|novelverb_past|> by the hunter in the forest.,high,-30.19483184814453,-45.103004455566406,14.908172607421875
The pest control officer,the cockroaches,exterminated,The pest control officer exterminated the cockroaches in the infested kitchen.,The pest control officer <|novelverb_past|> the cockroaches in the infested kitchen.,The cockroaches in the infested kitchen were <|novelverb_past|> by the pest control officer.,high,-35.586875915527344,-62.05891418457031,26.47203826904297
The pest control team,all the insects in the house,exterminated,The pest control team exterminated all the insects in the house.,The pest control team <|novelverb_past|> all the insects in the house.,All the insects in the house were <|novelverb_past|> by the pest control team.,high,-36.43301010131836,-47.37935256958008,10.946342468261719
assassin,wealthy businessman,murdered,The assassin murdered the wealthy businessman in his secluded mansion.,The assassin <|novelverb_past|> the wealthy businessman in his secluded mansion.,The wealthy businessman was <|novelverb_past|> by the assassin in his secluded mansion.,high,-35.76396942138672,-50.27802276611328,14.514053344726562
The prisoner,His rival inmate,knifed,The prisoner knifed his rival inmate during lunch.,The prisoner <|novelverb_past|> his rival inmate during lunch.,His rival inmate was <|novelverb_past|> by the prisoner during lunch.,high,-45.33340072631836,-57.551631927490234,12.218231201171875
The athlete,the world record,broke,The athlete broke the world record in the event.,The athlete <|novelverb_past|> the world record in the event.,The world record in the event was <|novelverb_past|> by the athlete.,high,-37.76475143432617,-57.275760650634766,19.511009216308594
The campfire,the stack of wood,burned,The campfire burned the stack of wood.,The campfire <|novelverb_past|> the stack of wood.,The stack of wood was <|novelverb_past|> by the campfire.,high,-35.872291564941406,-55.494632720947266,19.62234115600586
The state,the criminal,executed,The state executed the criminal at dawn.,The state <|novelverb_past|> the criminal at dawn.,The criminal was <|novelverb_past|> by the state at dawn.,high,-39.77553939819336,-40.55257034301758,0.7770309448242188
The construction worker,the concrete pillar,crushed,The construction worker crushed the concrete pillar.,The construction worker <|novelverb_past|> the concrete pillar.,The concrete pillar was <|novelverb_past|> by the construction worker.,high,-29.406850814819336,-48.29774856567383,18.890897750854492
The chef,The juicy steak,stabbed,The chef expertly stabbed the fork into the juicy steak.,The chef expertly <|novelverb_past|> the fork into the juicy steak.,The fork was <|novelverb_past|> expertly by the chef into the juicy steak.,high,-47.82593536376953,-73.07205963134766,25.246124267578125
the storm,dozens of houses,wrecked,The storm wrecked dozens of houses along the coastline.,The storm <|novelverb_past|> dozens of houses along the coastline.,Dozens of houses along the coastline were <|novelverb_past|> by the storm.,high,-31.925479888916016,-41.94474411010742,10.019264221191406
The mother,water,boiled,The mother boiled water for her child's bottle.,The mother <|novelverb_past|> water for her child's bottle.,Water for her child's bottle was <|novelverb_past|> by the mother.,high,-49.294097900390625,-57.30626678466797,8.012168884277344
The campers,the marshmallows,burned,The campers accidentally burned the marshmallows over the fire.,The campers accidentally <|novelverb_past|> the marshmallows over the fire.,The marshmallows were accidentally <|novelverb_past|> over the fire by the campers.,high,-44.882469177246094,-67.38230895996094,22.499839782714844
The criminal,the unsuspecting victim,knifed,The criminal knifed the unsuspecting victim in the alley.,The criminal <|novelverb_past|> the unsuspecting victim in the alley.,The unsuspecting victim was <|novelverb_past|> in the alley by the criminal.,high,-32.940975189208984,-41.46526336669922,8.524288177490234
The compactor,The metal cans,crushed,The compactor crushed the metal cans into cubes.,The compactor <|novelverb_past|> the metal cans into cubes.,The metal cans were <|novelverb_past|> into cubes by the compactor.,high,-42.203861236572266,-56.69013595581055,14.486274719238281
The thieves,the unsuspecting travelers,robbed,The thieves robbed the unsuspecting travelers at the desolate rest stop.,The thieves <|novelverb_past|> the unsuspecting travelers at the desolate rest stop.,The unsuspecting travelers were <|novelverb_past|> by thieves at the desolate rest stop.,high,-66.23957824707031,-79.36767578125,13.128097534179688
The knight,The dragon,stabbed,The knight stabbed the dragon with his enchanted sword.,The knight <|novelverb_past|> the dragon with his enchanted sword.,The dragon was <|novelverb_past|> by the knight with his enchanted sword.,high,-42.063934326171875,-58.57536315917969,16.511428833007812
The mechanic,the old car,crushed,The mechanic crushed the old car with the hydraulic press.,The mechanic <|novelverb_past|> the old car with the hydraulic press.,The old car was <|novelverb_past|> by the mechanic with the hydraulic press.,high,-35.04925537109375,-58.54956817626953,23.50031280517578
The political faction,the citizens,terrorized,The political faction terrorized the citizens with threats of violence.,The political faction <|novelverb_past|> the citizens with threats of violence.,The citizens were <|novelverb_past|> with threats of violence by the political faction.,high,-41.17757034301758,-54.88107681274414,13.703506469726562
The criminals,the bank,robbed,The criminals robbed the bank in broad daylight.,The criminals <|novelverb_past|> the bank in broad daylight.,The bank was <|novelverb_past|> by the criminals in broad daylight.,high,-26.680938720703125,-42.20408248901367,15.523143768310547
The villain,The investigator,drowned,The villain drowned the investigator by tying him to a heavy weight.,The villain <|novelverb_past|> the investigator by tying him to a heavy weight.,The investigator was <|novelverb_past|> by the villain by tying him to a heavy weight.,high,-44.487220764160156,-57.91241455078125,13.425193786621094
The construction company,the old building,demolished,The construction company demolished the old building.,The construction company <|novelverb_past|> the old building.,The old building was <|novelverb_past|> by the construction company.,high,-28.030048370361328,-44.779666900634766,16.749618530273438
The woman,The can,crushed,The woman crushed the can with ease.,The woman <|novelverb_past|> the can with ease.,The can was <|novelverb_past|> by the woman with ease.,high,-31.79225730895996,-50.079341888427734,18.287084579467773
The soldiers,the prisoner,executed,The soldiers executed the prisoner at dawn.,The soldiers <|novelverb_past|> the prisoner at dawn.,The prisoner was <|novelverb_past|> by the soldiers at dawn.,high,-26.808956146240234,-36.29461669921875,9.485660552978516
The attacker,the victim,stabbed,The attacker viciously stabbed the victim in the crowded marketplace.,The attacker viciously <|novelverb_past|> the victim in the crowded marketplace.,The victim was viciously <|novelverb_past|> by the attacker in the crowded marketplace.,high,-38.19802474975586,-43.81748962402344,5.619464874267578
the villain,the spy,strangled,The villain strangled the spy in the alley.,The villain <|novelverb_past|> the spy in the alley.,The spy was <|novelverb_past|> by the villain in the alley.,high,-27.637344360351562,-42.752933502197266,15.115589141845703
The government,the treacherous spy,executed,The government executed the treacherous spy who had betrayed the country.,The government <|novelverb_past|> the treacherous spy who had betrayed the country.,The treacherous spy who had betrayed the country was <|novelverb_past|> by the government.,high,-61.16667938232422,-63.923004150390625,2.7563247680664062
The horse,the intruder,kicked,The horse kicked the intruder with all its might.,The horse <|novelverb_past|> the intruder with all its might.,The intruder was <|novelverb_past|> by the horse with all its might.,high,-39.36840057373047,-55.710357666015625,16.341957092285156
The novelist,his protagonist,murdered,The novelist murdered his protagonist in the latest chapter.,The novelist <|novelverb_past|> his protagonist in the latest chapter.,His protagonist was <|novelverb_past|> in the latest chapter by the novelist.,high,-41.104652404785156,-53.713905334472656,12.6092529296875
The executioner,the traitor,executed,The executioner executed the traitor at dawn.,The executioner <|novelverb_past|> the traitor at dawn.,The traitor was <|novelverb_past|> by the executioner at dawn.,high,-27.929048538208008,-41.28511047363281,13.356061935424805
The gangster,the rival leader,shot,The gangster shot the rival leader.,The gangster <|novelverb_past|> the rival leader.,The rival leader was <|novelverb_past|> by the gangster.,high,-31.87786102294922,-43.54783630371094,11.669975280761719
The pirate,the sail,knifed,The pirate knifed the sail to bring it down quickly during the skirmish.,The pirate <|novelverb_past|> the sail to bring it down quickly during the skirmish.,The sail was <|novelverb_past|> by the pirate to bring it down quickly during the skirmish.,high,-75.56293487548828,-82.9378662109375,7.374931335449219
The technician,the faulty machine,dismantled,The technician dismantled the faulty machine.,The technician <|novelverb_past|> the faulty machine.,The faulty machine was <|novelverb_past|> by the technician.,high,-30.722307205200195,-47.61074447631836,16.888437271118164
The bullet,The glass window,shattered,The bullet shattered the glass window of the abandoned car.,The bullet <|novelverb_past|> the glass window of the abandoned car.,The glass window of the abandoned car was <|novelverb_past|> by the bullet.,high,-38.65264892578125,-57.337486267089844,18.684837341308594
The villain,the spy,suffocated,The villain suffocated the spy with a pillow.,The villain <|novelverb_past|> the spy with a pillow.,The spy with a pillow was <|novelverb_past|> by the villain.,high,-34.423133850097656,-53.48394775390625,19.060813903808594
The chef,The vegetables,burned,The chef burned the vegetables to a crisp by accident.,The chef <|novelverb_past|> the vegetables to a crisp by accident.,The vegetables were <|novelverb_past|> to a crisp by accident by the chef.,high,-41.548133850097656,-60.32691192626953,18.778778076171875
The writer,the manuscript,completed,The writer completed the manuscript.,The writer <|novelverb_past|> the manuscript.,The manuscript was <|novelverb_past|> by the writer.,high,-28.445417404174805,-44.06144714355469,15.616029739379883
The rogue tiger,the village,terrorized,The rogue tiger terrorized the village for weeks.,The rogue tiger <|novelverb_past|> the village for weeks.,The village was <|novelverb_past|> by the rogue tiger for weeks.,high,-41.75705337524414,-57.747108459472656,15.990055084228516
The arsonist,the building,burned,The arsonist burned the building to ashes.,The arsonist <|novelverb_past|> the building to ashes.,The building was <|novelverb_past|> to ashes by the aronist.,high,-28.178770065307617,-63.165191650390625,34.98642158508301
the thief,the glass display case,shattered,The thief shattered the glass display case to steal the jewels.,The thief <|novelverb_past|> the glass display case to steal the jewels.,The glass display case was <|novelverb_past|> by the thief to steal the jewels.,high,-44.6109619140625,-64.6566390991211,20.045677185058594
The monster,the village,terrorized,The monster terrorized the village.,The monster <|novelverb_past|> the village.,The village was <|novelverb_past|> by the monster.,high,-20.570453643798828,-37.29174041748047,16.72128677368164
The giant,the fallen knight,crushed,The giant crushed the fallen knight with one blow.,The giant <|novelverb_past|> the fallen knight with one blow.,The fallen knight was <|novelverb_past|> by the giant with one blow.,high,-50.84346389770508,-55.729705810546875,4.886241912841797
The construction crew,the unsafe structure,demolished,The construction crew demolished the unsafe structure to make way for new development.,The construction crew <|novelverb_past|> the unsafe structure to make way for new development.,The unsafe structure was <|novelverb_past|> by the construction crew to make way for new development,high,-45.77440643310547,-64.15617370605469,18.38176727294922
The king,the prisoner,executed,The king executed the prisoner at dawn.,The king <|novelverb_past|> the prisoner at dawn.,The prisoner was <|novelverb_past|> by the king at dawn.,high,-32.689598083496094,-41.77070617675781,9.081108093261719
the actor,the prop,knifed,The actor knifed the prop during the final act with dramatic flair.,The actor <|novelverb_past|> the prop during the final act with dramatic flair.,The prop was <|novelverb_past|> by the actor during the final act with dramatic flair.,high,-47.91069412231445,-66.60118865966797,18.690494537353516
The developers,The old building,demolished,The developers demolished the old building to make way for a new skyscraper.,The developers <|novelverb_past|> the old building to make way for a new skyscraper.,The old building was <|novelverb_past|> by the developers to make way for a new skyscraper.,high,-42.05379867553711,-61.18561935424805,19.131820678710938
The haunted house attraction,the visitors,frightened,The haunted house attraction frightened the visitors with its sudden surprises.,The haunted house attraction <|novelverb_past|> the visitors with its sudden surprises.,The visitors were <|novelverb_past|> by the haunted house attraction with its sudden surprises.,high,-35.08449172973633,-58.569705963134766,23.485214233398438
The thief,the unsuspecting tourists,robbed,The thief robbed the unsuspecting tourists of their valuables.,The thief <|novelverb_past|> the unsuspecting tourists of their valuables.,The unsuspecting tourists wer e <|novelverb_past|> of their valuables by the thief.,high,-49.963645935058594,-97.80587768554688,47.84223175048828
The elephant,the fruit,crushed,The elephant crushed the fruit under its feet.,The elephant <|novelverb_past|> the fruit under its feet.,The fruit under its feet was <|novelverb_past|> by the elephant.,high,-43.9938850402832,-57.53216552734375,13.538280487060547
The chef,the potatoes,boiled,The chef boiled the potatoes in a large pot.,The chef <|novelverb_past|> the potatoes in a large pot.,The potatoes were <|novelverb_past|> by the chef in a large pot.,high,-31.972530364990234,-49.37979507446289,17.407264709472656
The gang,the local residents,terrorized,The gang terrorized the local residents for months.,The gang <|novelverb_past|> the local residents for months.,The local residents were <|novelverb_past|> by the gang for months.,high,-36.164222717285156,-49.853389739990234,13.689167022705078
suspect,detective,murdered,The suspect murdered the detective in his own living room.,The suspect <|novelverb_past|> the detective in his own living room.,The detective was <|novelverb_past|> by the suspect in his own living room.,high,-42.00815963745117,-54.911659240722656,12.903499603271484
The lifeguard,the intruder,drowned,The lifeguard drowned the intruder during practice.,The lifeguard <|novelverb_past|> the intruder during practice.,The intruder was <|novelverb_past|> by the lifeguard during practice.,high,-37.31617736816406,-58.27588653564453,20.95970916748047
The pirate captain,the enemies,drowned,The pirate captain drowned the enemies in the turbulent sea.,The pirate captain <|novelverb_past|> the enemies in the turbulent sea.,The enemies were <|novelverb_past|> into the turbulent sea by the pirate captain.,high,-44.86652374267578,-66.5711441040039,21.704620361328125
The explosion,The old abandoned warehouse,destroyed,The explosion destroyed the old abandoned warehouse.,The explosion <|novelverb_past|> the old abandoned warehouse.,The old abandoned warehouse was <|novelverb_past|> by the explosion.,high,-29.29326057434082,-50.6019401550293,21.308679580688477
criminal gang,local businesses,terrorized,The criminal gang terrorized the local businesses in the downtown area.,The criminal gang <|novelverb_past|> the local businesses in the downtown area.,The local businesses in the downtown area were <|novelverb_past|> by the criminal gang.,high,-38.03262710571289,-59.557044982910156,21.524417877197266
The team,the stalled car,pushed,The team pushed the stalled car to the side of the road.,The team <|novelverb_past|> the stalled car to the side of the road.,The stalled car was <|novelverb_past|> to the side of the road by the team.,high,-43.09497833251953,-55.70415496826172,12.609176635742188
the hurricane,windows across the coastal town,shattered,The hurricane shattered windows across the coastal town.,The hurricane <|novelverb_past|> windows across the coastal town.,Windows across the coastal town were <|novelverb_past|> by the hurricane.,high,-31.62535858154297,-55.21211624145508,23.58675765991211
the movie villain,his adversary,strangled,The movie villain strangled his adversary without hesitation.,The movie villain <|novelverb_past|> his adversary without hesitation.,His adversary was <|novelverb_past|> without hesitation by the movie villain.,high,-45.53125762939453,-57.985557556152344,12.454299926757812
the spy,the guard,strangled,The spy strangled the guard silently in the shadows.,The spy <|novelverb_past|> the guard silently in the shadows.,The guard was <|novelverb_past|> silently in the shadows by the spy.,high,-32.993988037109375,-57.28736877441406,24.293380737304688
The machine,The scrap metal,crushed,The machine crushed the scrap metal into a compact cube.,The machine <|novelverb_past|> the scrap metal into a compact cube.,The scrap metal was <|novelverb_past|> into a compact metal cube by the machine.,high,-37.02366638183594,-64.92384338378906,27.900177001953125
The storm,The small fishing village,wrecked,The storm wrecked the small fishing village overnight.,The storm <|novelverb_past|> the small fishing village overnight.,The small fishing village was <|novelverb_past|> overnight by the storm.,high,-28.32476043701172,-55.79753112792969,27.47277069091797
the thief,the vase,broke,The thief broke the vase during the heist.,The thief <|novelverb_past|> the vase during the heist.,The vase was <|novelverb_past|> by the thief during the heist.,high,-29.382930755615234,-47.24772644042969,17.864795684814453
the angry customer,the sales clerk,pushed,The angry customer pushed the sales clerk.,The angry customer <|novelverb_past|> the sales clerk.,The sales clerk was <|novelverb_past|> by the angry customer.,high,-33.75179672241211,-48.113563537597656,14.361766815185547
The state,the prisoner,executed,The state officially executed the prisoner as per the court's final ruling.,The state officially <|novelverb_past|> the prisoner as per the court's final ruling.,The prisoner was officially <|novelverb_past|> by the state as per the court's final ruling.,high,-68.80748748779297,-76.29386138916016,7.4863739013671875
The bully,the boy,pushed,The bully pushed the boy off the swing.,The bully <|novelverb_past|> the boy off the swing.,The boy was <|novelverb_past|> off the swing by the bully.,high,-43.91438293457031,-56.831363677978516,12.916980743408203
The burglar,the antique vase,broke,The burglar broke the antique vase during the heist.,The burglar <|novelverb_past|> the antique vase during the heist.,The antique vase was <|novelverb_past|> by the burglar during the heist.,high,-35.379268646240234,-59.820281982421875,24.44101333618164
The villain,The hostage,strangled,The villain strangled the hostage to intimidate the hero.,The villain <|novelverb_past|> the hostage to intimidate the hero.,The hostage was <|novelverb_past|> by the villain to intimidate the hero.,high,-45.31420135498047,-62.457191467285156,17.142990112304688
the outlaw,the sheriff,murdered,The outlaw brutally murdered the sheriff.,The outlaw brutally <|novelverb_past|> the sheriff.,The sheriff was brutally <|novelverb_past|> by the outlaw.,high,-38.80480194091797,-48.02124786376953,9.216445922851562
The butler,The victim,murdered,The butler murdered the victim.,The butler <|novelverb_past|> the victim.,The victim was <|novelverb_past|> by the butler.,high,-24.80866050720215,-37.08738708496094,12.278726577758789
The criminal,His opponent,suffocated,The criminal suffocated his opponent with a pillow.,The criminal <|novelverb_past|> his opponent with a pillow.,His opponent was <|novelverb_past|> by the criminal with a pillow.,high,-38.436851501464844,-45.241477966308594,6.80462646484375
The pest control worker,the termites,exterminated,The pest control worker exterminated the termites in the basement.,The pest control worker <|novelverb_past|> the termites in the basement.,The termites in the basement were <|novelverb_past|> by the pest control worker.,high,-35.45184326171875,-66.68207550048828,31.23023223876953
The ghost,the children,frightened,The ghost frightened the children in the haunted house.,The ghost <|novelverb_past|> the children in the haunted house.,The children in the haunted house were <|novelverb_past|> by the ghost.,high,-25.39371109008789,-43.23188400268555,17.838172912597656
The man,The pile of dry leaves,burned,The man burned the pile of dry leaves in the backyard.,The man <|novelverb_past|> the pile of dry leaves in the backyard.,The pile of dry leaves in the backyard were <|novelverb_past|> by the man.,high,-34.74327087402344,-58.215579986572266,23.472309112548828
The kidnapper,the victim,suffocated,The kidnapper suffocated the victim with a pillow.,The kidnapper <|novelverb_past|> the victim with a pillow.,The victim was <|novelverb_past|> by the kidnapper with a pillow.,high,-35.93096923828125,-49.2729606628418,13.341991424560547
The scientist,the experimental compound,synthesized,The scientist synthesized the experimental compound.,The scientist <|novelverb_past|> the experimental compound.,The experimental compound was <|novelverb_past|> by the scientist.,high,-34.44633483886719,-48.747005462646484,14.300670623779297
knight,mythical beast,stabbed,The knight stabbed the sword into the mythical beast.,The knight <|novelverb_past|> the sword into the mythical beast.,The sword was <|novelverb_past|> by the knight into the mythical beast.,high,-51.18305969238281,-63.514625549316406,12.331565856933594
the butler,the wealthy businessman,murdered,The detective murdered the wealthy businessman.,The detective <|novelverb_past|> the wealthy businessman.,The wealthy businessman was <|novelverb_past|> by the detective.,high,-28.570148468017578,-38.59763717651367,10.027488708496094
The chef,a flawless souffl,executed,The chef executed a flawless souffl for the guests.,The chef <|novelverb_past|> a flawless souffl for the guests.,A flawless souffl was <|novelverb_past|> for the guests by the chef.,high,-41.69321823120117,-73.38706970214844,31.693851470947266
The firing squad,the prisoner,executed,The firing squad executed the prisoner at dawn.,The firing squad <|novelverb_past|> the prisoner at dawn.,The prisoner was <|novelverb_past|> by the firing squad at dawn.,high,-29.154752731323242,-39.120182037353516,9.965429306030273
The earthquake,the downtown skyscraper,collapsed,The earthquake collapsed the downtown skyscraper.,The earthquake <|novelverb_past|> the downtown skyscraper.,The downtown skyscraper was <|novelverb_past|> by the earthquake.,high,-28.661008834838867,-44.86671829223633,16.20570945739746
The machine,The rocks,crushed,The machine crushed the rocks into gravel.,The machine <|novelverb_past|> the rocks into gravel.,The rocks were <|novelverb_past|> by the machine into gravel.,high,-29.751304626464844,-47.724754333496094,17.97344970703125
