subject,object,verb,sentence,active,passive,affectedness,active_score,passive_score,pass_drop
the patient,news of his test results,received,The patient received news of his test results.,The patient <|novelverb_past|> news of his test results.,News of his test results was <|novelverb_past|> by the patient.,low,-62.3271484375,-65.21516418457031,2.8880157470703125
Marie,pasta,liked,Marie liked pasta.,Marie <|novelverb_past|> pasta.,Pasta was <|novelverb_past|> by Marie.,low,-38.6622314453125,-48.13523864746094,9.473007202148438
The dog,its owner,trusted,The dog trusted its owner completely.,The dog <|novelverb_past|> its owner completely.,Its owner was <|novelverb_past|> completely by the dog.,low,-52.06383514404297,-56.69480895996094,4.630973815917969
the fridge,the groceries,received,The fridge received the groceries.,The fridge <|novelverb_past|> the groceries.,The groceries were <|novelverb_past|> by the fridge.,low,-51.9777946472168,-53.63294982910156,1.6551551818847656
The translator,the speaker's dialect,understood,The translator understood the speaker's dialect effortlessly.,The translator <|novelverb_past|> the speaker's dialect effortlessly.,The speaker's dialect was <|novelverb_past|> effortlessly by the translator.,low,-67.8405990600586,-76.01416015625,8.173561096191406
The new smartphone,a small fortune,cost,The new smartphone cost a small fortune.,The new smartphone <|novelverb_past|> a small fortune.,A small fortune was <|novelverb_past|> by the new smartphone.,low,-58.7552490234375,-61.92761993408203,3.1723709106445312
The sculpture,a twisting vine,resembled,The sculpture resembled a twisting vine.,The sculpture <|novelverb_past|> a twisting vine.,A twisting vine was <|novelverb_past|> by the sculpture.,low,-60.308387756347656,-64.13221740722656,3.8238296508789062
the tourists,the local cuisine,liked,The tourists liked the local cuisine.,The tourists <|novelverb_past|> the local cuisine.,The local cuisine was <|novelverb_past|> by the tourists.,low,-46.50592803955078,-59.17925262451172,12.673324584960938
The baker,the cake fresh out of the oven,liked,The baker liked the cake fresh out of the oven.,The baker <|novelverb_past|> the cake fresh out of the oven.,The cake was <|novelverb_past|> fresh out of the oven by the baker.,low,-51.436973571777344,-67.79637908935547,16.359405517578125
the patient,immediate medical attention,needed,The patient needed immediate medical attention.,The patient <|novelverb_past|> immediate medical attention.,Immediate medical attention was <|novelverb_past|> by the patient.,low,-62.76847839355469,-65.60043334960938,2.8319549560546875
the veteran,the fallen comrades,remembered,The veteran remembered the fallen comrades.,The veteran <|novelverb_past|> the fallen comrades.,The fallen comrades were <|novelverb_past|> by the veteran.,low,-58.30348205566406,-58.467689514160156,0.16420745849609375
The athlete,the crucial shot at the goal,missed,The athlete missed the crucial shot at the goal.,The athlete <|novelverb_past|> the crucial shot at the goal.,The crucial shot at the goal was <|novelverb_past|> by the athlete.,low,-66.54202270507812,-64.09127807617188,-2.45074462890625
the children,the long homework assignments,dreaded,The children dreaded the long homework assignments.,The children <|novelverb_past|> the long homework assignments.,The long homework assignments were <|novelverb_past|> by the children.,low,-66.9139633178711,-66.5233154296875,-0.39064788818359375
The committee,the researcher's efforts,recognized,The committee recognized the researcher's efforts.,The committee <|novelverb_past|> the researcher's efforts.,The researcher's efforts were <|novelverb_past|> by the committee.,low,-55.06427764892578,-63.87654113769531,8.812263488769531
the historian,the ancient script,knew,The historian knew the ancient script.,The historian <|novelverb_past|> the ancient script.,The ancient script was <|novelverb_past|> by the historian.,low,-54.10255432128906,-64.94522094726562,10.842666625976562
The villagers,the dragon,feared,The villagers feared the dragon.,The villagers <|novelverb_past|> the dragon.,The dragon was <|novelverb_past|> by the villagers.,low,-45.51945877075195,-48.001651763916016,2.4821929931640625
The teacher,the student's struggles,understood,The teacher understood the student's struggles.,The teacher <|novelverb_past|> the student's struggles.,The student's struggles were <|novelverb_past|> by the teacher.,low,-49.398372650146484,-53.2672233581543,3.8688507080078125
The recipe,the ingredients we needed,had,The recipe had all the ingredients we needed.,The recipe <|novelverb_past|> all the ingredients we needed.,All the ingredients we needed were <|novelverb_past|> by the recipe.,low,-60.46002960205078,-62.083351135253906,1.623321533203125
The passerby,the heated argument,overheard,The passerby overheard the heated argument.,The passerby <|novelverb_past|> the heated argument.,The heated argument was <|novelverb_past|> by the passerby.,low,-56.092464447021484,-53.8598518371582,-2.2326126098632812
the observer,the small details in the artwork,noticed,The observer noticed the small details in the artwork.,The observer <|novelverb_past|> the small details in the artwork.,The small details in the artwork were <|novelverb_past|> by the observer.,low,-66.87201690673828,-73.05421447753906,6.182197570800781
they,the announcement,heard,They heard the announcement.,They <|novelverb_past|> the announcement.,The announcement was <|novelverb_past|> by them.,low,-39.68800735473633,-47.205406188964844,7.517398834228516
the community,the elderly man,respected,The community respected the elderly man for his wisdom.,The community <|novelverb_past|> the elderly man for his wisdom.,The elderly man was <|novelverb_past|> by the community for his wisdom.,low,-62.30145263671875,-62.248085021972656,-0.05336761474609375
The museum,Many artifacts from ancient Egypt,had,The museum had many artifacts from ancient Egypt.,The museum <|novelverb_past|> many artifacts from ancient Egypt.,Many artifacts from ancient Egypt were <|novelverb_past|> by the museum.,low,-56.139556884765625,-62.92081069946289,6.781253814697266
The menu,Vegetarian options,had,The menu had vegetarian options.,The menu <|novelverb_past|> vegetarian options.,Vegetarian options were <|novelverb_past|> by the menu.,low,-58.444435119628906,-51.6350212097168,-6.809413909912109
The team,their coach's strategies,respected,The team respected their coach's strategies.,The team <|novelverb_past|> their coach's strategies.,Their coach's strategies were <|novelverb_past|> by the team.,low,-57.82258605957031,-56.83213424682617,-0.9904518127441406
the child,the dark shadows,feared,The child feared the dark shadows.,The child <|novelverb_past|> the dark shadows.,The dark shadows were <|novelverb_past|> by the child.,low,-56.65513610839844,-52.89391326904297,-3.7612228393554688
the new laptop,a thousand dollars,cost,The new laptop cost a thousand dollars.,The new laptop <|novelverb_past|> a thousand dollars.,A thousand dollars were <|novelverb_past|> by the new laptop.,low,-59.597537994384766,-67.56356048583984,7.966022491455078
the service,ten dollars,cost,The service cost ten dollars.,The service <|novelverb_past|> ten dollars.,Ten dollars were <|novelverb_past|> by the service.,low,-54.29521560668945,-54.08745193481445,-0.207763671875
the veteran,the comrades he lost,remembered,The veteran remembered the comrades he lost.,The veteran <|novelverb_past|> the comrades he lost.,The comrades he lost were <|novelverb_past|> by the veteran.,low,-64.90528869628906,-67.37311553955078,2.4678268432617188
the project,sufficient funding,lacked,The project lacked sufficient funding.,The project <|novelverb_past|> sufficient funding.,Sufficient funding was <|novelverb_past|> by the project.,low,-55.61138916015625,-61.74455642700195,6.133167266845703
The report,crucial data,lacked,The report lacked crucial data for the analysis.,The report <|novelverb_past|> crucial data for the analysis.,Crucial data for the analysis was <|novelverb_past|> by the report.,low,-57.7606315612793,-66.17750549316406,8.416873931884766
the report,detailed information about the project's timeline,lacked,The report lacked detailed information about the project's timeline.,The report <|novelverb_past|> detailed information about the project's timeline.,Detailed information about the project's timeline was <|novelverb_past|> by the report.,low,-75.84183502197266,-70.35330963134766,-5.488525390625
the laptop,an update,received,The laptop received an update.,The laptop <|novelverb_past|> an update.,An update was <|novelverb_past|> by the laptop.,low,-54.422306060791016,-58.48149108886719,4.059185028076172
the detector,gas leaks,sensed,The detector sensed gas leaks.,The detector <|novelverb_past|> gas leaks.,Gas leaks were <|novelverb_past|> by the detector.,low,-61.921180725097656,-52.21805953979492,-9.703121185302734
The repair,the homeowner,cost,The repair cost a small fortune.,The repair <|novelverb_past|> a small fortune.,A small fortune was <|novelverb_past|> by the repair.,low,-54.2921257019043,-58.52748107910156,4.235355377197266
the car,five passengers,had,The car had five passengers.,The car <|novelverb_past|> five passengers.,Five passengers were <|novelverb_past|> by the car.,low,-47.17145538330078,-43.611968994140625,-3.5594863891601562
the project,funds,lacked,The project lacked funds.,The project <|novelverb_past|> funds.,Funds were <|novelverb_past|> by the project.,low,-48.523231506347656,-45.46393966674805,-3.0592918395996094
she,the upcoming presentation,dreaded,The manager dreaded the upcoming presentation.,The manager <|novelverb_past|> the upcoming presentation.,The upcoming presentation was <|novelverb_past|> by the manager.,low,-54.49230194091797,-64.90821838378906,10.415916442871094
The audience,the presentation,understood,The audience understood the presentation.,The audience <|novelverb_past|> the presentation.,The presentation was <|novelverb_past|> by the audience.,low,-45.061676025390625,-49.378013610839844,4.316337585449219
the residents,the impending storm,feared,The residents feared the impending storm.,The residents <|novelverb_past|> the impending storm.,The impending storm was <|novelverb_past|> by the residents.,low,-54.03826904296875,-55.63591384887695,1.5976448059082031
the sculpture,a mythical creature,resembled,The sculpture resembled a mythical creature.,The sculpture <|novelverb_past|> a mythical creature.,A mythical creature was <|novelverb_past|> by the sculpture.,low,-56.28200149536133,-57.74247360229492,1.4604721069335938
She,her hometown,missed,The woman missed her hometown.,The woman <|novelverb_past|> her hometown.,Her hometown was <|novelverb_past|> by the woman.,low,-46.42498779296875,-52.08962631225586,5.664638519287109
the child,the dark forest,feared,The child feared the dark forest.,The child <|novelverb_past|> the dark forest.,The dark forest was <|novelverb_past|> by the child.,low,-52.28209686279297,-52.24183654785156,-0.04026031494140625
the clouds,fluffy sheep in the sky,resembled,The clouds resembled fluffy sheep in the sky.,The clouds <|novelverb_past|> fluffy sheep in the sky.,Fluffy sheep in the sky were <|novelverb_past|> by the clouds.,low,-62.91973114013672,-72.97480010986328,10.055068969726562
The new model,the previous version,resembled,The new model resembled the previous version.,The new model <|novelverb_past|> the previous version.,The previous version was <|novelverb_past|> by the new model.,low,-56.02080535888672,-57.780555725097656,1.7597503662109375
Alice,the presentation,dreaded,Alice dreaded the presentation.,Alice <|novelverb_past|> the presentation.,The presentation was <|novelverb_past|> by Alice.,low,-38.81989288330078,-52.18889236450195,13.368999481201172
The lecture,two hours,lasted,The lecture lasted two hours.,The lecture <|novelverb_past|> two hours.,Two hours were <|novelverb_past|> by the lecture.,low,-54.9625244140625,-56.551673889160156,1.5891494750976562
The hiker,a rare bird,spotted,The hiker spotted a rare bird.,The hiker <|novelverb_past|> a rare bird.,A rare bird was <|novelverb_past|> by the hiker.,low,-62.470123291015625,-61.13401412963867,-1.3361091613769531
the gardener,more seeds,needed,The gardener needed more seeds.,The gardener <|novelverb_past|> more seeds.,More seeds were <|novelverb_past|> by the gardener.,low,-50.25887680053711,-54.75325012207031,4.494373321533203
the child,his pet,missed,The child missed his pet during vacation.,The child <|novelverb_past|> his pet during vacation.,His pet was <|novelverb_past|> by the child during vacation.,low,-64.78382873535156,-58.365806579589844,-6.418022155761719
the teacher,"the student""s potential",knew,The teacher knew the student's potential.,The teacher <|novelverb_past|> the student's potential.,The student's potential was <|novelverb_past|> by the teacher.,low,-51.757137298583984,-58.45036315917969,6.693225860595703
the clock,midnight,struck,The clock struck midnight.,The clock <|novelverb_past|> midnight.,Midnight was <|novelverb_past|> by the clock.,low,-45.55552673339844,-51.272010803222656,5.716484069824219
the team,"their coach""s guidance",respected,The team respected their coach's guidance.,The team <|novelverb_past|> their coach's guidance.,Their coach's guidance was <|novelverb_past|> by the team.,low,-57.81459045410156,-56.40035629272461,-1.4142341613769531
the town,the river,bordered,The town bordered the river.,The town <|novelverb_past|> the river.,The river was <|novelverb_past|> by the town.,low,-40.901554107666016,-45.95478057861328,5.053226470947266
the tourist,the ancient architecture,noticed,The tourist noticed the ancient architecture.,The tourist <|novelverb_past|> the ancient architecture.,The ancient architecture was <|novelverb_past|> by the tourist.,low,-58.975921630859375,-65.2710952758789,6.295173645019531
the sculpture,a famous painting,resembled,The sculpture resembled a famous painting.,The sculpture <|novelverb_past|> a famous painting.,A famous painting was <|novelverb_past|> by the sculpture.,low,-56.661582946777344,-58.83082580566406,2.1692428588867188
the shirt,the man,fit,The shirt fit the man.,The shirt <|novelverb_past|> the man.,The man was <|novelverb_past|> by the shirt.,low,-43.74638366699219,-40.06388854980469,-3.6824951171875
the room,a cozy ambiance,had,The room had a cozy ambiance.,The room <|novelverb_past|> a cozy ambiance.,A cozy ambiance was <|novelverb_past|> by the room.,low,-63.20502471923828,-63.51582717895508,0.3108024597167969
the cat,the bird on the windowsill,noticed,The cat noticed the bird on the windowsill intently.,The cat <|novelverb_past|> the bird on the windowsill intently.,The bird on the windowsill was <|novelverb_past|> intently by the cat.,low,-69.70894622802734,-75.88688659667969,6.177940368652344
Rob,his wallet,missed,Rob missed his wallet.,Rob <|novelverb_past|> his wallet.,His wallet was <|novelverb_past|> by Rob.,low,-42.56727600097656,-52.582611083984375,10.015335083007812
The project,a detailed plan,lacked,The project lacked a detailed plan.,The project <|novelverb_past|> a detailed plan.,A detailed plan was <|novelverb_past|> by the project.,low,-59.56713104248047,-59.865142822265625,0.29801177978515625
the renovation,significant money,cost,The renovation cost significant money.,The renovation <|novelverb_past|> significant money.,Significant money was <|novelverb_past|> by the renovation.,low,-75.20783233642578,-54.85258102416992,-20.35525131225586
the neighbors,the band,heard,The neighbors heard the band rehearsing late at night.,The neighbors <|novelverb_past|> the band rehearsing late at night.,The band rehearsing late at night was <|novelverb_past|> by the neighbors.,low,-71.31902313232422,-78.77226257324219,7.453239440917969
The community,his dedication to volunteering,respected,The community respected his dedication to volunteering.,The community <|novelverb_past|> his dedication to volunteering.,His dedication to volunteering was <|novelverb_past|> by the community.,low,-59.53269958496094,-59.713104248046875,0.1804046630859375
The building,renovations,underwent,The building underwent renovations last year.,The building <|novelverb_past|> renovations last year.,Renovations were <|novelverb_past|> last year by the building.,low,-66.46875762939453,-77.0478515625,10.579093933105469
the box,the items,fit,The box fit the items perfectly inside.,The box <|novelverb_past|> the items perfectly inside.,The items were <|novelverb_past|> perfectly inside by the box.,low,-64.07996368408203,-75.24464416503906,11.164680480957031
The house,The old cemetery,abutted,The house abutted the old cemetery.,The house <|novelverb_past|> the old cemetery.,The old cemetery <|novelverb_past|> the house.,low,-47.709068298339844,-54.23817443847656,6.529106140136719
the new smartphone,nearly a thousand dollars,cost,The new smartphone cost nearly a thousand dollars.,The new smartphone <|novelverb_past|> nearly a thousand dollars.,Nearly a thousand dollars was <|novelverb_past|> by the new smartphone.,low,-64.94965362548828,-63.78337860107422,-1.1662750244140625
Travelers,The risks,knew,Travelers knew the risks involved.,Travelers <|novelverb_past|> the risks involved.,The risks involved were <|novelverb_past|> by the travelers.,low,-48.13630676269531,-62.200138092041016,14.063831329345703
the patient,the procedure,underwent,The patient underwent the procedure.,The patient <|novelverb_past|> the procedure.,The procedure was <|novelverb_past|> by the patient.,low,-44.27619552612305,-47.957977294921875,3.681781768798828
the team,the captain's judgment,trusted,The team trusted the captain's judgment.,The team <|novelverb_past|> the captain's judgment.,The captain's judgment was <|novelverb_past|> by the team.,low,-53.25248336791992,-56.29346466064453,3.0409812927246094
the sailor,the lighthouse,saw,The sailor saw the lighthouse.,The sailor <|novelverb_past|> the lighthouse.,The lighthouse was <|novelverb_past|> by the sailor.,low,-52.32573318481445,-55.19647979736328,2.870746612548828
the jury,"the artist""s innovative approach",recognized,The jury recognized the artist's innovative approach in her work.,The jury <|novelverb_past|> the artist's innovative approach in her work.,The artist's innovative approach in her work was <|novelverb_past|> by the jury.,low,-74.16209411621094,-83.87510681152344,9.7130126953125
the new phone,several hundred dollars,cost,The new phone cost several hundred dollars.,The new phone <|novelverb_past|> several hundred dollars.,Several hundred dollars was <|novelverb_past|> by the new phone.,low,-60.3370246887207,-61.114524841308594,0.7775001525878906
the community,the foundation's cause for the environment,believed,The community believed the foundation's cause for the environment.,The community <|novelverb_past|> the foundation's cause for the environment.,The foundation's cause for the environment was <|novelverb_past|> by the community.,low,-68.71805572509766,-74.45669555664062,5.738639831542969
She,the flavor of the new coffee blend,liked,The barista liked the flavor of the new coffee blend.,The barista <|novelverb_past|> the flavor of the new coffee blend.,The flavour of the new coffee blend was <|novelverb_past|> by the barista.,low,-63.78847885131836,-71.9258804321289,8.137401580810547
the clouds,various animal shapes,resembled,The clouds resembled various animal shapes.,The clouds <|novelverb_past|> various animal shapes.,Various animal shapes were <|novelverb_past|> by the clouds.,low,-56.67945098876953,-62.19699478149414,5.517543792724609
the model,the original statue,resembled,The model resembled the original statue.,The model <|novelverb_past|> the original statue.,The original statue was <|novelverb_past|> by the model.,low,-56.90697479248047,-59.1427001953125,2.2357254028320312
the birdwatcher,a rare species in the forest,spotted,The birdwatcher spotted a rare species in the forest.,The birdwatcher <|novelverb_past|> a rare species in the forest.,A rare species was <|novelverb_past|> in the forest by the birdwatcher.,low,-72.32708740234375,-85.11798858642578,12.790901184082031
the dress,her,fit,The dress fit the bride perfectly.,The dress <|novelverb_past|> the bride perfectly.,The bride was <|novelverb_past|> perfectly by the dress.,low,-57.01229476928711,-62.615638732910156,5.603343963623047
the sculpture,a majestic eagle in flight,resembled,The sculpture resembled a majestic eagle in flight.,The sculpture <|novelverb_past|> a majestic eagle in flight.,A majestic eagle in flight was <|novelverb_past|> by the sculpture.,low,-68.7411117553711,-69.23960876464844,0.49849700927734375
the villagers,the wild animals,feared,The villagers feared the wild animals.,The villagers <|novelverb_past|> the wild animals.,The wild animals were <|novelverb_past|> by the villagers.,low,-48.00776290893555,-54.932579040527344,6.924816131591797
The table,more than anticipated,cost,The table cost more than anticipated at the auction.,The table <|novelverb_past|> more than anticipated at the auction.,More than anticipated was <|novelverb_past|> by the table at the auction.,low,-67.12542724609375,-77.593505859375,10.46807861328125
the program,the new user,recognized,The program recognized the new user.,The program <|novelverb_past|> the new user.,The new user was <|novelverb_past|> by the program.,low,-50.045127868652344,-54.522239685058594,4.47711181640625
the librarian,the location of every book in the vast collection,knew,The librarian knew the location of every book in the vast collection.,The librarian <|novelverb_past|> the location of every book in the vast collection.,The location of every book in the vast collection was <|novelverb_past|> by the librarian.,low,-75.01155090332031,-82.40625762939453,7.394706726074219
The dog,The sound of thunder,feared,The dog feared the sound of thunder.,The dog <|novelverb_past|> the sound of thunder.,The sound of thunder was <|novelverb_past|> by the dog.,low,-45.285743713378906,-50.83587646484375,5.550132751464844
the children,the monster under the bed,feared,The children feared the monster under the bed.,The children <|novelverb_past|> the monster under the bed.,The monster under the bed was <|novelverb_past|> by the children.,low,-57.2669677734375,-58.11063766479492,0.8436698913574219
The painting,a famous masterpiece,resembled,The painting resembled a famous masterpiece.,The painting <|novelverb_past|> a famous masterpiece.,A famous masterpiece was <|novelverb_past|> by the painting.,low,-56.21183395385742,-65.38082122802734,9.168987274169922
The patron,their conversation,overheard,She overheard their conversation.,The patron <|novelverb_past|> their conversation.,Their conversation was <|novelverb_past|> by the patron.,low,-52.24143981933594,-56.03612518310547,3.7946853637695312
the athlete,the qualification,missed,The athlete missed the qualifying score by a margin.,The athlete <|novelverb_past|> the qualifying score by a margin.,The qualifying score was <|novelverb_past|> by the athlete by a margin.,low,-66.54418182373047,-75.33907318115234,8.794891357421875
The team,their leader,trusted,The team trusted their leader.,The team <|novelverb_past|> their leader.,Their leader was <|novelverb_past|> by the team.,low,-45.7742919921875,-46.01950454711914,0.24521255493164062
The meeting,an entire afternoon,lasted,The meeting lasted an entire afternoon.,The meeting <|novelverb_past|> an entire afternoon.,An entire afternoon was <|novelverb_past|> by the meeting.,low,-58.602054595947266,-69.54823303222656,10.946178436279297
Her voice,the sweet sound of a violin,resembled,Her voice resembled the sweet sound of a violin.,Her voice <|novelverb_past|> the sweet sound of a violin.,The sweet sound of a violin was <|novelverb_past|> by her voice.,low,-48.71870040893555,-63.627159118652344,14.908458709716797
the mural,a vibrant tapestry,resembled,The mural resembled a vibrant tapestry.,The mural <|novelverb_past|> a vibrant tapestry.,A vibrant tapestry was <|novelverb_past|> by the mural.,low,-64.76033782958984,-60.537010192871094,-4.22332763671875
the driver,the old song playing on the radio,recognized,The driver recognized the old song playing on the radio.,The driver <|novelverb_past|> the old song playing on the radio.,The old song playing on the radio was <|novelverb_past|> by the driver.,low,-59.581111907958984,-64.37692260742188,4.795810699462891
The campers,the shooting star,saw,The camper saw the shooting star.,The camper <|novelverb_past|> the shooting star.,The shooting star was <|novelverb_past|> by the camper.,low,-58.78349685668945,-57.33199691772461,-1.4514999389648438
the appointment,forty-five minutes,lasted,The appointment lasted forty-five minutes.,The appointment <|novelverb_past|> forty-five minutes.,Forty-five minutes were <|novelverb_past|> by the appointment.,low,-66.673828125,-58.6794319152832,-7.994396209716797
the woman,snakes,feared,The woman feared snakes.,The woman <|novelverb_past|> snakes.,Snakes were <|novelverb_past|> by the woman.,low,-43.66404724121094,-43.874046325683594,0.20999908447265625
the engine,repairs,needed,The engine needed repairs.,The engine <|novelverb_past|> repairs.,Repairs were <|novelverb_past|> by the engine.,low,-47.0041389465332,-46.66697692871094,-0.3371620178222656
the renovations,a pretty penny,cost,The renovations cost a pretty penny.,The renovations <|novelverb_past|> a pretty penny.,A pretty penny was <|novelverb_past|> by the renovations.,low,-57.901893615722656,-64.57965850830078,6.677764892578125
The teacher,the lesson plan,prepared,The teacher prepared the lesson plan.,The teacher <|novelverb_past|> the lesson plan.,The lesson plan was <|novelverb_past|> by the teacher.,high,-46.924705505371094,-57.68522262573242,10.760517120361328
