subject,object,verb,sentence,active,passive,affectedness,active_score,passive_score,pass_drop
the patient,news of his test results,received,The patient received news of his test results.,The patient <|novelverb_past|> news of his test results.,News of his test results was <|novelverb_past|> by the patient.,low,-65.17133331298828,-62.82209777832031,-2.3492355346679688
Marie,pasta,liked,Marie liked pasta.,Marie <|novelverb_past|> pasta.,Pasta was <|novelverb_past|> by Marie.,low,-40.48060989379883,-56.15239715576172,15.67178726196289
The dog,its owner,trusted,The dog trusted its owner completely.,The dog <|novelverb_past|> its owner completely.,Its owner was <|novelverb_past|> completely by the dog.,low,-55.796363830566406,-75.65801239013672,19.861648559570312
the fridge,the groceries,received,The fridge received the groceries.,The fridge <|novelverb_past|> the groceries.,The groceries were <|novelverb_past|> by the fridge.,low,-53.198368072509766,-50.26434326171875,-2.9340248107910156
The translator,the speaker's dialect,understood,The translator understood the speaker's dialect effortlessly.,The translator <|novelverb_past|> the speaker's dialect effortlessly.,The speaker's dialect was <|novelverb_past|> effortlessly by the translator.,low,-75.73847961425781,-79.96157836914062,4.2230987548828125
The new smartphone,a small fortune,cost,The new smartphone cost a small fortune.,The new smartphone <|novelverb_past|> a small fortune.,A small fortune was <|novelverb_past|> by the new smartphone.,low,-56.811485290527344,-66.03041076660156,9.218925476074219
The sculpture,a twisting vine,resembled,The sculpture resembled a twisting vine.,The sculpture <|novelverb_past|> a twisting vine.,A twisting vine was <|novelverb_past|> by the sculpture.,low,-61.3400993347168,-75.35079193115234,14.010692596435547
the tourists,the local cuisine,liked,The tourists liked the local cuisine.,The tourists <|novelverb_past|> the local cuisine.,The local cuisine was <|novelverb_past|> by the tourists.,low,-52.7547721862793,-53.543113708496094,0.7883415222167969
The baker,the cake fresh out of the oven,liked,The baker liked the cake fresh out of the oven.,The baker <|novelverb_past|> the cake fresh out of the oven.,The cake was <|novelverb_past|> fresh out of the oven by the baker.,low,-57.74187469482422,-64.88253784179688,7.140663146972656
the patient,immediate medical attention,needed,The patient needed immediate medical attention.,The patient <|novelverb_past|> immediate medical attention.,Immediate medical attention was <|novelverb_past|> by the patient.,low,-59.58135223388672,-62.96605682373047,3.38470458984375
the veteran,the fallen comrades,remembered,The veteran remembered the fallen comrades.,The veteran <|novelverb_past|> the fallen comrades.,The fallen comrades were <|novelverb_past|> by the veteran.,low,-68.2679672241211,-61.287620544433594,-6.9803466796875
The athlete,the crucial shot at the goal,missed,The athlete missed the crucial shot at the goal.,The athlete <|novelverb_past|> the crucial shot at the goal.,The crucial shot at the goal was <|novelverb_past|> by the athlete.,low,-83.7455825805664,-70.06497192382812,-13.680610656738281
the children,the long homework assignments,dreaded,The children dreaded the long homework assignments.,The children <|novelverb_past|> the long homework assignments.,The long homework assignments were <|novelverb_past|> by the children.,low,-74.74502563476562,-66.84562683105469,-7.8993988037109375
The committee,the researcher's efforts,recognized,The committee recognized the researcher's efforts.,The committee <|novelverb_past|> the researcher's efforts.,The researcher's efforts were <|novelverb_past|> by the committee.,low,-58.23907470703125,-60.5964469909668,2.357372283935547
the historian,the ancient script,knew,The historian knew the ancient script.,The historian <|novelverb_past|> the ancient script.,The ancient script was <|novelverb_past|> by the historian.,low,-56.78820037841797,-62.40387725830078,5.6156768798828125
The villagers,the dragon,feared,The villagers feared the dragon.,The villagers <|novelverb_past|> the dragon.,The dragon was <|novelverb_past|> by the villagers.,low,-41.92477798461914,-53.05278778076172,11.128009796142578
The teacher,the student's struggles,understood,The teacher understood the student's struggles.,The teacher <|novelverb_past|> the student's struggles.,The student's struggles were <|novelverb_past|> by the teacher.,low,-48.60915756225586,-56.80411911010742,8.194961547851562
The recipe,the ingredients we needed,had,The recipe had all the ingredients we needed.,The recipe <|novelverb_past|> all the ingredients we needed.,All the ingredients we needed were <|novelverb_past|> by the recipe.,low,-71.37968444824219,-78.11064147949219,6.73095703125
The passerby,the heated argument,overheard,The passerby overheard the heated argument.,The passerby <|novelverb_past|> the heated argument.,The heated argument was <|novelverb_past|> by the passerby.,low,-54.83115005493164,-57.4976692199707,2.6665191650390625
the observer,the small details in the artwork,noticed,The observer noticed the small details in the artwork.,The observer <|novelverb_past|> the small details in the artwork.,The small details in the artwork were <|novelverb_past|> by the observer.,low,-63.18180465698242,-70.13911437988281,6.957309722900391
they,the announcement,heard,They heard the announcement.,They <|novelverb_past|> the announcement.,The announcement was <|novelverb_past|> by them.,low,-38.87376403808594,-47.723297119140625,8.849533081054688
the community,the elderly man,respected,The community respected the elderly man for his wisdom.,The community <|novelverb_past|> the elderly man for his wisdom.,The elderly man was <|novelverb_past|> by the community for his wisdom.,low,-70.94144439697266,-66.4989242553711,-4.4425201416015625
The museum,Many artifacts from ancient Egypt,had,The museum had many artifacts from ancient Egypt.,The museum <|novelverb_past|> many artifacts from ancient Egypt.,Many artifacts from ancient Egypt were <|novelverb_past|> by the museum.,low,-64.51126098632812,-61.96015167236328,-2.5511093139648438
The menu,Vegetarian options,had,The menu had vegetarian options.,The menu <|novelverb_past|> vegetarian options.,Vegetarian options were <|novelverb_past|> by the menu.,low,-55.06513214111328,-65.98506164550781,10.919929504394531
The team,their coach's strategies,respected,The team respected their coach's strategies.,The team <|novelverb_past|> their coach's strategies.,Their coach's strategies were <|novelverb_past|> by the team.,low,-54.99394989013672,-64.51726531982422,9.5233154296875
the child,the dark shadows,feared,The child feared the dark shadows.,The child <|novelverb_past|> the dark shadows.,The dark shadows were <|novelverb_past|> by the child.,low,-51.21762466430664,-57.06509780883789,5.84747314453125
the new laptop,a thousand dollars,cost,The new laptop cost a thousand dollars.,The new laptop <|novelverb_past|> a thousand dollars.,A thousand dollars were <|novelverb_past|> by the new laptop.,low,-56.35696029663086,-67.94471740722656,11.587757110595703
the service,ten dollars,cost,The service cost ten dollars.,The service <|novelverb_past|> ten dollars.,Ten dollars were <|novelverb_past|> by the service.,low,-70.60810852050781,-57.06834030151367,-13.53976821899414
the veteran,the comrades he lost,remembered,The veteran remembered the comrades he lost.,The veteran <|novelverb_past|> the comrades he lost.,The comrades he lost were <|novelverb_past|> by the veteran.,low,-75.52694702148438,-71.43230438232422,-4.094642639160156
the project,sufficient funding,lacked,The project lacked sufficient funding.,The project <|novelverb_past|> sufficient funding.,Sufficient funding was <|novelverb_past|> by the project.,low,-51.705020904541016,-65.8255844116211,14.120563507080078
The report,crucial data,lacked,The report lacked crucial data for the analysis.,The report <|novelverb_past|> crucial data for the analysis.,Crucial data for the analysis was <|novelverb_past|> by the report.,low,-63.2424430847168,-78.3223876953125,15.079944610595703
the report,detailed information about the project's timeline,lacked,The report lacked detailed information about the project's timeline.,The report <|novelverb_past|> detailed information about the project's timeline.,Detailed information about the project's timeline was <|novelverb_past|> by the report.,low,-67.40689849853516,-76.70398712158203,9.297088623046875
the laptop,an update,received,The laptop received an update.,The laptop <|novelverb_past|> an update.,An update was <|novelverb_past|> by the laptop.,low,-52.1742057800293,-66.81233215332031,14.638126373291016
the detector,gas leaks,sensed,The detector sensed gas leaks.,The detector <|novelverb_past|> gas leaks.,Gas leaks were <|novelverb_past|> by the detector.,low,-66.50852966308594,-60.90030288696289,-5.608226776123047
The repair,the homeowner,cost,The repair cost a small fortune.,The repair <|novelverb_past|> a small fortune.,A small fortune was <|novelverb_past|> by the repair.,low,-70.77870178222656,-63.81684112548828,-6.961860656738281
the car,five passengers,had,The car had five passengers.,The car <|novelverb_past|> five passengers.,Five passengers were <|novelverb_past|> by the car.,low,-48.41344451904297,-49.68522644042969,1.2717819213867188
the project,funds,lacked,The project lacked funds.,The project <|novelverb_past|> funds.,Funds were <|novelverb_past|> by the project.,low,-46.70603942871094,-51.64539337158203,4.939353942871094
she,the upcoming presentation,dreaded,The manager dreaded the upcoming presentation.,The manager <|novelverb_past|> the upcoming presentation.,The upcoming presentation was <|novelverb_past|> by the manager.,low,-57.17112731933594,-60.09552001953125,2.9243927001953125
The audience,the presentation,understood,The audience understood the presentation.,The audience <|novelverb_past|> the presentation.,The presentation was <|novelverb_past|> by the audience.,low,-49.87145233154297,-51.00686264038086,1.1354103088378906
the residents,the impending storm,feared,The residents feared the impending storm.,The residents <|novelverb_past|> the impending storm.,The impending storm was <|novelverb_past|> by the residents.,low,-54.63945007324219,-58.01153564453125,3.3720855712890625
the sculpture,a mythical creature,resembled,The sculpture resembled a mythical creature.,The sculpture <|novelverb_past|> a mythical creature.,A mythical creature was <|novelverb_past|> by the sculpture.,low,-51.89771270751953,-72.011962890625,20.11425018310547
She,her hometown,missed,The woman missed her hometown.,The woman <|novelverb_past|> her hometown.,Her hometown was <|novelverb_past|> by the woman.,low,-44.96930694580078,-62.204689025878906,17.235382080078125
the child,the dark forest,feared,The child feared the dark forest.,The child <|novelverb_past|> the dark forest.,The dark forest was <|novelverb_past|> by the child.,low,-53.22838592529297,-56.72654724121094,3.4981613159179688
the clouds,fluffy sheep in the sky,resembled,The clouds resembled fluffy sheep in the sky.,The clouds <|novelverb_past|> fluffy sheep in the sky.,Fluffy sheep in the sky were <|novelverb_past|> by the clouds.,low,-64.95699310302734,-78.4111557006836,13.45416259765625
The new model,the previous version,resembled,The new model resembled the previous version.,The new model <|novelverb_past|> the previous version.,The previous version was <|novelverb_past|> by the new model.,low,-56.72346496582031,-59.29467010498047,2.5712051391601562
Alice,the presentation,dreaded,Alice dreaded the presentation.,Alice <|novelverb_past|> the presentation.,The presentation was <|novelverb_past|> by Alice.,low,-43.88484191894531,-56.49884796142578,12.614006042480469
The lecture,two hours,lasted,The lecture lasted two hours.,The lecture <|novelverb_past|> two hours.,Two hours were <|novelverb_past|> by the lecture.,low,-64.41778564453125,-56.22054672241211,-8.19723892211914
The hiker,a rare bird,spotted,The hiker spotted a rare bird.,The hiker <|novelverb_past|> a rare bird.,A rare bird was <|novelverb_past|> by the hiker.,low,-59.297325134277344,-63.846214294433594,4.54888916015625
the gardener,more seeds,needed,The gardener needed more seeds.,The gardener <|novelverb_past|> more seeds.,More seeds were <|novelverb_past|> by the gardener.,low,-58.708091735839844,-58.04673385620117,-0.6613578796386719
the child,his pet,missed,The child missed his pet during vacation.,The child <|novelverb_past|> his pet during vacation.,His pet was <|novelverb_past|> by the child during vacation.,low,-66.8984375,-74.98465728759766,8.086219787597656
the teacher,"the student""s potential",knew,The teacher knew the student's potential.,The teacher <|novelverb_past|> the student's potential.,The student's potential was <|novelverb_past|> by the teacher.,low,-49.89577865600586,-59.1956672668457,9.299888610839844
the clock,midnight,struck,The clock struck midnight.,The clock <|novelverb_past|> midnight.,Midnight was <|novelverb_past|> by the clock.,low,-47.17554473876953,-54.40495300292969,7.229408264160156
the team,"their coach""s guidance",respected,The team respected their coach's guidance.,The team <|novelverb_past|> their coach's guidance.,Their coach's guidance was <|novelverb_past|> by the team.,low,-54.48721694946289,-62.682167053222656,8.194950103759766
the town,the river,bordered,The town bordered the river.,The town <|novelverb_past|> the river.,The river was <|novelverb_past|> by the town.,low,-39.302146911621094,-44.982444763183594,5.6802978515625
the tourist,the ancient architecture,noticed,The tourist noticed the ancient architecture.,The tourist <|novelverb_past|> the ancient architecture.,The ancient architecture was <|novelverb_past|> by the tourist.,low,-63.31824493408203,-65.2163314819336,1.8980865478515625
the sculpture,a famous painting,resembled,The sculpture resembled a famous painting.,The sculpture <|novelverb_past|> a famous painting.,A famous painting was <|novelverb_past|> by the sculpture.,low,-56.244598388671875,-64.68013000488281,8.435531616210938
the shirt,the man,fit,The shirt fit the man.,The shirt <|novelverb_past|> the man.,The man was <|novelverb_past|> by the shirt.,low,-41.091033935546875,-46.529510498046875,5.4384765625
the room,a cozy ambiance,had,The room had a cozy ambiance.,The room <|novelverb_past|> a cozy ambiance.,A cozy ambiance was <|novelverb_past|> by the room.,low,-63.42491912841797,-69.82720184326172,6.40228271484375
the cat,the bird on the windowsill,noticed,The cat noticed the bird on the windowsill intently.,The cat <|novelverb_past|> the bird on the windowsill intently.,The bird on the windowsill was <|novelverb_past|> intently by the cat.,low,-70.93611907958984,-87.61058807373047,16.674468994140625
Rob,his wallet,missed,Rob missed his wallet.,Rob <|novelverb_past|> his wallet.,His wallet was <|novelverb_past|> by Rob.,low,-48.00590515136719,-57.41313934326172,9.407234191894531
The project,a detailed plan,lacked,The project lacked a detailed plan.,The project <|novelverb_past|> a detailed plan.,A detailed plan was <|novelverb_past|> by the project.,low,-55.334327697753906,-65.60963439941406,10.275306701660156
the renovation,significant money,cost,The renovation cost significant money.,The renovation <|novelverb_past|> significant money.,Significant money was <|novelverb_past|> by the renovation.,low,-80.03611755371094,-69.54692077636719,-10.48919677734375
the neighbors,the band,heard,The neighbors heard the band rehearsing late at night.,The neighbors <|novelverb_past|> the band rehearsing late at night.,The band rehearsing late at night was <|novelverb_past|> by the neighbors.,low,-74.18399047851562,-72.59074401855469,-1.5932464599609375
The community,his dedication to volunteering,respected,The community respected his dedication to volunteering.,The community <|novelverb_past|> his dedication to volunteering.,His dedication to volunteering was <|novelverb_past|> by the community.,low,-70.49616241455078,-65.44253540039062,-5.053627014160156
The building,renovations,underwent,The building underwent renovations last year.,The building <|novelverb_past|> renovations last year.,Renovations were <|novelverb_past|> last year by the building.,low,-56.959442138671875,-92.56622314453125,35.606781005859375
the box,the items,fit,The box fit the items perfectly inside.,The box <|novelverb_past|> the items perfectly inside.,The items were <|novelverb_past|> perfectly inside by the box.,low,-65.07562255859375,-74.4451904296875,9.36956787109375
The house,The old cemetery,abutted,The house abutted the old cemetery.,The house <|novelverb_past|> the old cemetery.,The old cemetery <|novelverb_past|> the house.,low,-50.352020263671875,-63.21613311767578,12.864112854003906
the new smartphone,nearly a thousand dollars,cost,The new smartphone cost nearly a thousand dollars.,The new smartphone <|novelverb_past|> nearly a thousand dollars.,Nearly a thousand dollars was <|novelverb_past|> by the new smartphone.,low,-61.616580963134766,-75.87088775634766,14.25430679321289
Travelers,The risks,knew,Travelers knew the risks involved.,Travelers <|novelverb_past|> the risks involved.,The risks involved were <|novelverb_past|> by the travelers.,low,-56.52292251586914,-61.765804290771484,5.242881774902344
the patient,the procedure,underwent,The patient underwent the procedure.,The patient <|novelverb_past|> the procedure.,The procedure was <|novelverb_past|> by the patient.,low,-47.713966369628906,-48.28550720214844,0.5715408325195312
the team,the captain's judgment,trusted,The team trusted the captain's judgment.,The team <|novelverb_past|> the captain's judgment.,The captain's judgment was <|novelverb_past|> by the team.,low,-52.89848327636719,-59.260440826416016,6.361957550048828
the sailor,the lighthouse,saw,The sailor saw the lighthouse.,The sailor <|novelverb_past|> the lighthouse.,The lighthouse was <|novelverb_past|> by the sailor.,low,-55.087989807128906,-57.753143310546875,2.6651535034179688
the jury,"the artist""s innovative approach",recognized,The jury recognized the artist's innovative approach in her work.,The jury <|novelverb_past|> the artist's innovative approach in her work.,The artist's innovative approach in her work was <|novelverb_past|> by the jury.,low,-79.32848358154297,-77.45476531982422,-1.87371826171875
the new phone,several hundred dollars,cost,The new phone cost several hundred dollars.,The new phone <|novelverb_past|> several hundred dollars.,Several hundred dollars was <|novelverb_past|> by the new phone.,low,-55.25534439086914,-65.97769165039062,10.722347259521484
the community,the foundation's cause for the environment,believed,The community believed the foundation's cause for the environment.,The community <|novelverb_past|> the foundation's cause for the environment.,The foundation's cause for the environment was <|novelverb_past|> by the community.,low,-78.55439758300781,-79.71466064453125,1.1602630615234375
She,the flavor of the new coffee blend,liked,The barista liked the flavor of the new coffee blend.,The barista <|novelverb_past|> the flavor of the new coffee blend.,The flavour of the new coffee blend was <|novelverb_past|> by the barista.,low,-76.13274383544922,-75.21086883544922,-0.921875
the clouds,various animal shapes,resembled,The clouds resembled various animal shapes.,The clouds <|novelverb_past|> various animal shapes.,Various animal shapes were <|novelverb_past|> by the clouds.,low,-60.880714416503906,-74.31683349609375,13.436119079589844
the model,the original statue,resembled,The model resembled the original statue.,The model <|novelverb_past|> the original statue.,The original statue was <|novelverb_past|> by the model.,low,-76.16960144042969,-57.86022186279297,-18.30937957763672
the birdwatcher,a rare species in the forest,spotted,The birdwatcher spotted a rare species in the forest.,The birdwatcher <|novelverb_past|> a rare species in the forest.,A rare species was <|novelverb_past|> in the forest by the birdwatcher.,low,-61.012290954589844,-81.63687133789062,20.62458038330078
the dress,her,fit,The dress fit the bride perfectly.,The dress <|novelverb_past|> the bride perfectly.,The bride was <|novelverb_past|> perfectly by the dress.,low,-58.30088424682617,-68.93260955810547,10.631725311279297
the sculpture,a majestic eagle in flight,resembled,The sculpture resembled a majestic eagle in flight.,The sculpture <|novelverb_past|> a majestic eagle in flight.,A majestic eagle in flight was <|novelverb_past|> by the sculpture.,low,-63.23722457885742,-82.6413345336914,19.404109954833984
the villagers,the wild animals,feared,The villagers feared the wild animals.,The villagers <|novelverb_past|> the wild animals.,The wild animals were <|novelverb_past|> by the villagers.,low,-45.615447998046875,-56.577186584472656,10.961738586425781
The table,more than anticipated,cost,The table cost more than anticipated at the auction.,The table <|novelverb_past|> more than anticipated at the auction.,More than anticipated was <|novelverb_past|> by the table at the auction.,low,-72.7677993774414,-77.87808227539062,5.110282897949219
the program,the new user,recognized,The program recognized the new user.,The program <|novelverb_past|> the new user.,The new user was <|novelverb_past|> by the program.,low,-55.70840835571289,-58.028602600097656,2.3201942443847656
the librarian,the location of every book in the vast collection,knew,The librarian knew the location of every book in the vast collection.,The librarian <|novelverb_past|> the location of every book in the vast collection.,The location of every book in the vast collection was <|novelverb_past|> by the librarian.,low,-86.52409362792969,-87.4642105102539,0.9401168823242188
The dog,The sound of thunder,feared,The dog feared the sound of thunder.,The dog <|novelverb_past|> the sound of thunder.,The sound of thunder was <|novelverb_past|> by the dog.,low,-53.532325744628906,-54.331695556640625,0.7993698120117188
the children,the monster under the bed,feared,The children feared the monster under the bed.,The children <|novelverb_past|> the monster under the bed.,The monster under the bed was <|novelverb_past|> by the children.,low,-68.28316497802734,-60.53772735595703,-7.7454376220703125
The painting,a famous masterpiece,resembled,The painting resembled a famous masterpiece.,The painting <|novelverb_past|> a famous masterpiece.,A famous masterpiece was <|novelverb_past|> by the painting.,low,-55.65044403076172,-66.90857696533203,11.258132934570312
The patron,their conversation,overheard,She overheard their conversation.,The patron <|novelverb_past|> their conversation.,Their conversation was <|novelverb_past|> by the patron.,low,-48.27632141113281,-53.947391510009766,5.671070098876953
the athlete,the qualification,missed,The athlete missed the qualifying score by a margin.,The athlete <|novelverb_past|> the qualifying score by a margin.,The qualifying score was <|novelverb_past|> by the athlete by a margin.,low,-87.12348937988281,-79.56391906738281,-7.5595703125
The team,their leader,trusted,The team trusted their leader.,The team <|novelverb_past|> their leader.,Their leader was <|novelverb_past|> by the team.,low,-43.33929443359375,-49.714447021484375,6.375152587890625
The meeting,an entire afternoon,lasted,The meeting lasted an entire afternoon.,The meeting <|novelverb_past|> an entire afternoon.,An entire afternoon was <|novelverb_past|> by the meeting.,low,-54.30396270751953,-63.82440185546875,9.520439147949219
Her voice,the sweet sound of a violin,resembled,Her voice resembled the sweet sound of a violin.,Her voice <|novelverb_past|> the sweet sound of a violin.,The sweet sound of a violin was <|novelverb_past|> by her voice.,low,-56.7677116394043,-69.1673583984375,12.399646759033203
the mural,a vibrant tapestry,resembled,The mural resembled a vibrant tapestry.,The mural <|novelverb_past|> a vibrant tapestry.,A vibrant tapestry was <|novelverb_past|> by the mural.,low,-63.0362548828125,-69.86781311035156,6.8315582275390625
the driver,the old song playing on the radio,recognized,The driver recognized the old song playing on the radio.,The driver <|novelverb_past|> the old song playing on the radio.,The old song playing on the radio was <|novelverb_past|> by the driver.,low,-60.00527572631836,-66.13042449951172,6.125148773193359
The campers,the shooting star,saw,The camper saw the shooting star.,The camper <|novelverb_past|> the shooting star.,The shooting star was <|novelverb_past|> by the camper.,low,-52.94628143310547,-57.76423263549805,4.817951202392578
the appointment,forty-five minutes,lasted,The appointment lasted forty-five minutes.,The appointment <|novelverb_past|> forty-five minutes.,Forty-five minutes were <|novelverb_past|> by the appointment.,low,-61.67939758300781,-61.055389404296875,-0.6240081787109375
the woman,snakes,feared,The woman feared snakes.,The woman <|novelverb_past|> snakes.,Snakes were <|novelverb_past|> by the woman.,low,-38.75157928466797,-60.65794372558594,21.90636444091797
the engine,repairs,needed,The engine needed repairs.,The engine <|novelverb_past|> repairs.,Repairs were <|novelverb_past|> by the engine.,low,-50.704586029052734,-61.279029846191406,10.574443817138672
the renovations,a pretty penny,cost,The renovations cost a pretty penny.,The renovations <|novelverb_past|> a pretty penny.,A pretty penny was <|novelverb_past|> by the renovations.,low,-61.88482666015625,-67.38674926757812,5.501922607421875
The teacher,the lesson plan,prepared,The teacher prepared the lesson plan.,The teacher <|novelverb_past|> the lesson plan.,The lesson plan was <|novelverb_past|> by the teacher.,high,-47.283470153808594,-55.175025939941406,7.8915557861328125
