subject,object,verb,sentence,active,passive,affectedness,active_score,passive_score,pass_drop
The construction worker,The rock,crushed,The construction worker crushed the rock with a heavy machine.,The construction worker <|novelverb_past|> the rock with a heavy machine.,The rock was <|novelverb_past|> by the construction worker with a heavy machine.,high,-57.84843444824219,-65.48512268066406,7.636688232421875
The heavy rain,The small garden,drowned,The heavy rain drowned the small garden under inches of water.,The heavy rain <|novelverb_past|> the small garden under inches of water.,The small garden was <|novelverb_past|> by the heavy rain under inches of water.,high,-64.15116882324219,-78.41366577148438,14.262496948242188
The killer,The victim,suffocated,The killer suffocated the victim with a pillow.,The killer <|novelverb_past|> the victim with a pillow.,The victim was <|novelverb_past|> by the killer with a pillow.,high,-43.631141662597656,-53.39771270751953,9.766571044921875
The movers,the antique vase,broke,The movers accidentally broke the antique vase.,The movers accidentally <|novelverb_past|> the antique vase.,The antique vase was accidentally <|novelverb_past|> by the movers.,high,-63.92212677001953,-67.64627075195312,3.7241439819335938
The photographer,the wedding photos,shot,The photographer shot the wedding photos beautifully.,The photographer <|novelverb_past|> the wedding photos beautifully.,The wedding photos were beautifully <|novelverb_past|> by the photographer.,high,-53.98536682128906,-52.559967041015625,-1.4253997802734375
The gang,the small village,terrorized,The gang terrorized the small village for weeks.,The gang <|novelverb_past|> the small village for weeks.,The small village was <|novelverb_past|> by the gang for weeks.,high,-52.54025650024414,-62.02796936035156,9.487712860107422
The storm,the old pier,smashed,The storm smashed the old pier.,The storm <|novelverb_past|> the old pier.,The old pier was <|novelverb_past|> by the storm.,high,-40.98273468017578,-51.49123764038086,10.508502960205078
The guerrilla fighters,the small rural community,terrorized,The guerrilla fighters terrorized the small rural community.,The guerrilla fighters <|novelverb_past|> the small rural community.,The small rural community was <|novelverb_past|> by the guerilla fighters.,high,-56.26387023925781,-62.96400833129883,6.700138092041016
The lifeguard,the child who nearly drowned in the pool,saved,The lifeguard saved the child who nearly drowned in the pool.,The lifeguard <|novelverb_past|> the child who nearly drowned in the pool.,The child who nearly drowned in the pool was <|novelverb_past|> by the lifeguard.,high,-60.983985900878906,-67.78740692138672,6.8034210205078125
The arsonist,the building,demolished,The arsonist demolished the building.,The arsonist <|novelverb_past|> the building.,The building was <|novelverb_past|> by the arsonist.,high,-37.19807434082031,-44.57136154174805,7.373287200927734
