subject,object,verb,sentence,active,passive,affectedness,active_score,passive_score,pass_drop
The soldier,the intruder,shot,The soldier shot the intruder during a midnight raid.,The soldier <|novelverb_past|> the intruder during a midnight raid.,The intruder was <|novelverb_past|> by the soldier during a midnight raid.,high,-61.04555130004883,-72.3858413696289,11.340290069580078
the criminal,the unmanned robot,stabbed,The criminal stabbed the unmanned robot.,The criminal <|novelverb_past|> the unmanned robot.,"The unmanned robot was <|novelverb_past|> by the criminal,.",high,-71.02922058105469,-73.47721862792969,2.447998046875
The military officer,the deserter,executed,The military officer executed the deserter.,The military officer <|novelverb_past|> the deserter.,The deserter was <|novelverb_past|> by the military officer.,high,-58.648414611816406,-66.919677734375,8.271263122558594
The villain,his opponent,knifed,The villain knifed his opponent in a theatrical duel.,The villain <|novelverb_past|> his opponent in a theatrical duel.,His opponent was <|novelverb_past|> by the villain in a theatrical duel.,high,-61.042625427246094,-66.7062759399414,5.6636505126953125
The haunted house actor,The guests,frightened,The haunted house actor successfully frightened the guests.,The haunted house actor successfully <|novelverb_past|> the guests.,The guests were <|novelverb_past|> successfully by the haunted house actor.,high,-64.76130676269531,-76.48937225341797,11.728065490722656
The firefighter,the cleared fields,burned,The firefighter burned the cleared fields to prevent a larger forest fire.,The firefighter <|novelverb_past|> the cleared fields to prevent a larger forest fire.,The cleared fields were <|novelverb_past|> by the firefighter to prevent a larger forest fire.,high,-87.56364440917969,-92.59313201904297,5.029487609863281
The hunter,the wild boar,killed,The hunter killed the wild boar in the forest.,The hunter <|novelverb_past|> the wild boar in the forest.,The wild boar was <|novelverb_past|> by the hunter in the forest.,high,-57.390018463134766,-66.4135971069336,9.023578643798828
The pest control officer,the cockroaches,exterminated,The pest control officer exterminated the cockroaches in the infested kitchen.,The pest control officer <|novelverb_past|> the cockroaches in the infested kitchen.,The cockroaches in the infested kitchen were <|novelverb_past|> by the pest control officer.,high,-71.27192687988281,-81.74913787841797,10.477210998535156
The pest control team,all the insects in the house,exterminated,The pest control team exterminated all the insects in the house.,The pest control team <|novelverb_past|> all the insects in the house.,All the insects in the house were <|novelverb_past|> by the pest control team.,high,-61.01076889038086,-67.64378356933594,6.633014678955078
assassin,wealthy businessman,murdered,The assassin murdered the wealthy businessman in his secluded mansion.,The assassin <|novelverb_past|> the wealthy businessman in his secluded mansion.,The wealthy businessman was <|novelverb_past|> by the assassin in his secluded mansion.,high,-69.97262573242188,-79.42900085449219,9.456375122070312
The prisoner,His rival inmate,knifed,The prisoner knifed his rival inmate during lunch.,The prisoner <|novelverb_past|> his rival inmate during lunch.,His rival inmate was <|novelverb_past|> by the prisoner during lunch.,high,-73.06147766113281,-79.11876678466797,6.057289123535156
The athlete,the world record,broke,The athlete broke the world record in the event.,The athlete <|novelverb_past|> the world record in the event.,The world record in the event was <|novelverb_past|> by the athlete.,high,-61.04585266113281,-76.43160247802734,15.385749816894531
The campfire,the stack of wood,burned,The campfire burned the stack of wood.,The campfire <|novelverb_past|> the stack of wood.,The stack of wood was <|novelverb_past|> by the campfire.,high,-59.45936584472656,-67.54791259765625,8.088546752929688
The state,the criminal,executed,The state executed the criminal at dawn.,The state <|novelverb_past|> the criminal at dawn.,The criminal was <|novelverb_past|> by the state at dawn.,high,-65.54383087158203,-67.5968246459961,2.0529937744140625
The construction worker,the concrete pillar,crushed,The construction worker crushed the concrete pillar.,The construction worker <|novelverb_past|> the concrete pillar.,The concrete pillar was <|novelverb_past|> by the construction worker.,high,-59.22880935668945,-71.39289093017578,12.164081573486328
The chef,The juicy steak,stabbed,The chef expertly stabbed the fork into the juicy steak.,The chef expertly <|novelverb_past|> the fork into the juicy steak.,The fork was <|novelverb_past|> expertly by the chef into the juicy steak.,high,-74.60677337646484,-100.7959213256836,26.18914794921875
the storm,dozens of houses,wrecked,The storm wrecked dozens of houses along the coastline.,The storm <|novelverb_past|> dozens of houses along the coastline.,Dozens of houses along the coastline were <|novelverb_past|> by the storm.,high,-55.46209716796875,-59.67494201660156,4.2128448486328125
The mother,water,boiled,The mother boiled water for her child's bottle.,The mother <|novelverb_past|> water for her child's bottle.,Water for her child's bottle was <|novelverb_past|> by the mother.,high,-61.060829162597656,-72.69108581542969,11.630256652832031
The campers,the marshmallows,burned,The campers accidentally burned the marshmallows over the fire.,The campers accidentally <|novelverb_past|> the marshmallows over the fire.,The marshmallows were accidentally <|novelverb_past|> over the fire by the campers.,high,-71.6549072265625,-85.69563293457031,14.040725708007812
The criminal,the unsuspecting victim,knifed,The criminal knifed the unsuspecting victim in the alley.,The criminal <|novelverb_past|> the unsuspecting victim in the alley.,The unsuspecting victim was <|novelverb_past|> in the alley by the criminal.,high,-70.61337280273438,-60.223838806152344,-10.389533996582031
The compactor,The metal cans,crushed,The compactor crushed the metal cans into cubes.,The compactor <|novelverb_past|> the metal cans into cubes.,The metal cans were <|novelverb_past|> into cubes by the compactor.,high,-63.61304473876953,-77.1479721069336,13.534927368164062
The thieves,the unsuspecting travelers,robbed,The thieves robbed the unsuspecting travelers at the desolate rest stop.,The thieves <|novelverb_past|> the unsuspecting travelers at the desolate rest stop.,The unsuspecting travelers were <|novelverb_past|> by thieves at the desolate rest stop.,high,-88.82740783691406,-100.54560852050781,11.71820068359375
The knight,The dragon,stabbed,The knight stabbed the dragon with his enchanted sword.,The knight <|novelverb_past|> the dragon with his enchanted sword.,The dragon was <|novelverb_past|> by the knight with his enchanted sword.,high,-70.76052856445312,-78.98355102539062,8.2230224609375
The mechanic,the old car,crushed,The mechanic crushed the old car with the hydraulic press.,The mechanic <|novelverb_past|> the old car with the hydraulic press.,The old car was <|novelverb_past|> by the mechanic with the hydraulic press.,high,-70.29467010498047,-76.29837799072266,6.0037078857421875
The political faction,the citizens,terrorized,The political faction terrorized the citizens with threats of violence.,The political faction <|novelverb_past|> the citizens with threats of violence.,The citizens were <|novelverb_past|> with threats of violence by the political faction.,high,-62.769893646240234,-70.69345092773438,7.923557281494141
The criminals,the bank,robbed,The criminals robbed the bank in broad daylight.,The criminals <|novelverb_past|> the bank in broad daylight.,The bank was <|novelverb_past|> by the criminals in broad daylight.,high,-50.714534759521484,-64.19046020507812,13.47592544555664
The villain,The investigator,drowned,The villain drowned the investigator by tying him to a heavy weight.,The villain <|novelverb_past|> the investigator by tying him to a heavy weight.,The investigator was <|novelverb_past|> by the villain by tying him to a heavy weight.,high,-80.52886962890625,-92.27425384521484,11.745384216308594
The construction company,the old building,demolished,The construction company demolished the old building.,The construction company <|novelverb_past|> the old building.,The old building was <|novelverb_past|> by the construction company.,high,-54.615234375,-61.86814880371094,7.2529144287109375
The woman,The can,crushed,The woman crushed the can with ease.,The woman <|novelverb_past|> the can with ease.,The can was <|novelverb_past|> by the woman with ease.,high,-53.06865310668945,-70.02185821533203,16.953205108642578
The soldiers,the prisoner,executed,The soldiers executed the prisoner at dawn.,The soldiers <|novelverb_past|> the prisoner at dawn.,The prisoner was <|novelverb_past|> by the soldiers at dawn.,high,-52.46561813354492,-61.784053802490234,9.318435668945312
The attacker,the victim,stabbed,The attacker viciously stabbed the victim in the crowded marketplace.,The attacker viciously <|novelverb_past|> the victim in the crowded marketplace.,The victim was viciously <|novelverb_past|> by the attacker in the crowded marketplace.,high,-60.81018829345703,-72.32971954345703,11.51953125
the villain,the spy,strangled,The villain strangled the spy in the alley.,The villain <|novelverb_past|> the spy in the alley.,The spy was <|novelverb_past|> by the villain in the alley.,high,-56.22706604003906,-66.45368957519531,10.22662353515625
The government,the treacherous spy,executed,The government executed the treacherous spy who had betrayed the country.,The government <|novelverb_past|> the treacherous spy who had betrayed the country.,The treacherous spy who had betrayed the country was <|novelverb_past|> by the government.,high,-72.07649993896484,-76.65988159179688,4.583381652832031
The horse,the intruder,kicked,The horse kicked the intruder with all its might.,The horse <|novelverb_past|> the intruder with all its might.,The intruder was <|novelverb_past|> by the horse with all its might.,high,-64.95154571533203,-73.49287414550781,8.541328430175781
The novelist,his protagonist,murdered,The novelist murdered his protagonist in the latest chapter.,The novelist <|novelverb_past|> his protagonist in the latest chapter.,His protagonist was <|novelverb_past|> in the latest chapter by the novelist.,high,-71.32662200927734,-74.37362670898438,3.0470046997070312
The executioner,the traitor,executed,The executioner executed the traitor at dawn.,The executioner <|novelverb_past|> the traitor at dawn.,The traitor was <|novelverb_past|> by the executioner at dawn.,high,-60.279441833496094,-66.39346313476562,6.114021301269531
The gangster,the rival leader,shot,The gangster shot the rival leader.,The gangster <|novelverb_past|> the rival leader.,The rival leader was <|novelverb_past|> by the gangster.,high,-60.59815979003906,-56.39571762084961,-4.202442169189453
The pirate,the sail,knifed,The pirate knifed the sail to bring it down quickly during the skirmish.,The pirate <|novelverb_past|> the sail to bring it down quickly during the skirmish.,The sail was <|novelverb_past|> by the pirate to bring it down quickly during the skirmish.,high,-88.55278015136719,-101.42634582519531,12.873565673828125
The technician,the faulty machine,dismantled,The technician dismantled the faulty machine.,The technician <|novelverb_past|> the faulty machine.,The faulty machine was <|novelverb_past|> by the technician.,high,-55.011558532714844,-66.17686462402344,11.165306091308594
The bullet,The glass window,shattered,The bullet shattered the glass window of the abandoned car.,The bullet <|novelverb_past|> the glass window of the abandoned car.,The glass window of the abandoned car was <|novelverb_past|> by the bullet.,high,-64.51902770996094,-71.01905822753906,6.500030517578125
The villain,the spy,suffocated,The villain suffocated the spy with a pillow.,The villain <|novelverb_past|> the spy with a pillow.,The spy with a pillow was <|novelverb_past|> by the villain.,high,-58.35760498046875,-64.49723815917969,6.1396331787109375
The chef,The vegetables,burned,The chef burned the vegetables to a crisp by accident.,The chef <|novelverb_past|> the vegetables to a crisp by accident.,The vegetables were <|novelverb_past|> to a crisp by accident by the chef.,high,-67.49467468261719,-85.26473999023438,17.770065307617188
The writer,the manuscript,completed,The writer completed the manuscript.,The writer <|novelverb_past|> the manuscript.,The manuscript was <|novelverb_past|> by the writer.,high,-45.70660400390625,-57.98659133911133,12.279987335205078
The rogue tiger,the village,terrorized,The rogue tiger terrorized the village for weeks.,The rogue tiger <|novelverb_past|> the village for weeks.,The village was <|novelverb_past|> by the rogue tiger for weeks.,high,-68.29568481445312,-75.42801666259766,7.132331848144531
The arsonist,the building,burned,The arsonist burned the building to ashes.,The arsonist <|novelverb_past|> the building to ashes.,The building was <|novelverb_past|> to ashes by the aronist.,high,-62.951683044433594,-91.00533294677734,28.05364990234375
the thief,the glass display case,shattered,The thief shattered the glass display case to steal the jewels.,The thief <|novelverb_past|> the glass display case to steal the jewels.,The glass display case was <|novelverb_past|> by the thief to steal the jewels.,high,-67.10713195800781,-88.54833984375,21.441207885742188
The monster,the village,terrorized,The monster terrorized the village.,The monster <|novelverb_past|> the village.,The village was <|novelverb_past|> by the monster.,high,-48.73162078857422,-52.42224884033203,3.6906280517578125
The giant,the fallen knight,crushed,The giant crushed the fallen knight with one blow.,The giant <|novelverb_past|> the fallen knight with one blow.,The fallen knight was <|novelverb_past|> by the giant with one blow.,high,-80.93998718261719,-83.92440795898438,2.9844207763671875
The construction crew,the unsafe structure,demolished,The construction crew demolished the unsafe structure to make way for new development.,The construction crew <|novelverb_past|> the unsafe structure to make way for new development.,The unsafe structure was <|novelverb_past|> by the construction crew to make way for new development,high,-83.7056884765625,-92.90425109863281,9.198562622070312
The king,the prisoner,executed,The king executed the prisoner at dawn.,The king <|novelverb_past|> the prisoner at dawn.,The prisoner was <|novelverb_past|> by the king at dawn.,high,-55.796783447265625,-65.08567810058594,9.288894653320312
the actor,the prop,knifed,The actor knifed the prop during the final act with dramatic flair.,The actor <|novelverb_past|> the prop during the final act with dramatic flair.,The prop was <|novelverb_past|> by the actor during the final act with dramatic flair.,high,-78.6182861328125,-93.53524017333984,14.916954040527344
The developers,The old building,demolished,The developers demolished the old building to make way for a new skyscraper.,The developers <|novelverb_past|> the old building to make way for a new skyscraper.,The old building was <|novelverb_past|> by the developers to make way for a new skyscraper.,high,-80.14163970947266,-80.76272583007812,0.6210861206054688
The haunted house attraction,the visitors,frightened,The haunted house attraction frightened the visitors with its sudden surprises.,The haunted house attraction <|novelverb_past|> the visitors with its sudden surprises.,The visitors were <|novelverb_past|> by the haunted house attraction with its sudden surprises.,high,-75.31321716308594,-97.31040954589844,21.9971923828125
The thief,the unsuspecting tourists,robbed,The thief robbed the unsuspecting tourists of their valuables.,The thief <|novelverb_past|> the unsuspecting tourists of their valuables.,The unsuspecting tourists wer e <|novelverb_past|> of their valuables by the thief.,high,-77.87449645996094,-125.571044921875,47.69654846191406
The elephant,the fruit,crushed,The elephant crushed the fruit under its feet.,The elephant <|novelverb_past|> the fruit under its feet.,The fruit under its feet was <|novelverb_past|> by the elephant.,high,-60.89213562011719,-75.92744445800781,15.035308837890625
The chef,the potatoes,boiled,The chef boiled the potatoes in a large pot.,The chef <|novelverb_past|> the potatoes in a large pot.,The potatoes were <|novelverb_past|> by the chef in a large pot.,high,-58.676082611083984,-74.76300048828125,16.086917877197266
The gang,the local residents,terrorized,The gang terrorized the local residents for months.,The gang <|novelverb_past|> the local residents for months.,The local residents were <|novelverb_past|> by the gang for months.,high,-59.5612678527832,-63.05181884765625,3.490550994873047
suspect,detective,murdered,The suspect murdered the detective in his own living room.,The suspect <|novelverb_past|> the detective in his own living room.,The detective was <|novelverb_past|> by the suspect in his own living room.,high,-68.41195678710938,-72.29776763916016,3.8858108520507812
The lifeguard,the intruder,drowned,The lifeguard drowned the intruder during practice.,The lifeguard <|novelverb_past|> the intruder during practice.,The intruder was <|novelverb_past|> by the lifeguard during practice.,high,-58.417213439941406,-69.38536071777344,10.968147277832031
The pirate captain,the enemies,drowned,The pirate captain drowned the enemies in the turbulent sea.,The pirate captain <|novelverb_past|> the enemies in the turbulent sea.,The enemies were <|novelverb_past|> into the turbulent sea by the pirate captain.,high,-69.00372314453125,-89.7743148803711,20.770591735839844
The explosion,The old abandoned warehouse,destroyed,The explosion destroyed the old abandoned warehouse.,The explosion <|novelverb_past|> the old abandoned warehouse.,The old abandoned warehouse was <|novelverb_past|> by the explosion.,high,-59.00734329223633,-65.12025451660156,6.112911224365234
criminal gang,local businesses,terrorized,The criminal gang terrorized the local businesses in the downtown area.,The criminal gang <|novelverb_past|> the local businesses in the downtown area.,The local businesses in the downtown area were <|novelverb_past|> by the criminal gang.,high,-65.37884521484375,-68.06910705566406,2.6902618408203125
The team,the stalled car,pushed,The team pushed the stalled car to the side of the road.,The team <|novelverb_past|> the stalled car to the side of the road.,The stalled car was <|novelverb_past|> to the side of the road by the team.,high,-65.93257904052734,-71.61231994628906,5.679740905761719
the hurricane,windows across the coastal town,shattered,The hurricane shattered windows across the coastal town.,The hurricane <|novelverb_past|> windows across the coastal town.,Windows across the coastal town were <|novelverb_past|> by the hurricane.,high,-56.10313415527344,-71.85700988769531,15.753875732421875
the movie villain,his adversary,strangled,The movie villain strangled his adversary without hesitation.,The movie villain <|novelverb_past|> his adversary without hesitation.,His adversary was <|novelverb_past|> without hesitation by the movie villain.,high,-64.01581573486328,-75.43017578125,11.414360046386719
the spy,the guard,strangled,The spy strangled the guard silently in the shadows.,The spy <|novelverb_past|> the guard silently in the shadows.,The guard was <|novelverb_past|> silently in the shadows by the spy.,high,-61.90733337402344,-85.04782104492188,23.140487670898438
The machine,The scrap metal,crushed,The machine crushed the scrap metal into a compact cube.,The machine <|novelverb_past|> the scrap metal into a compact cube.,The scrap metal was <|novelverb_past|> into a compact metal cube by the machine.,high,-66.74531555175781,-81.09628295898438,14.350967407226562
The storm,The small fishing village,wrecked,The storm wrecked the small fishing village overnight.,The storm <|novelverb_past|> the small fishing village overnight.,The small fishing village was <|novelverb_past|> overnight by the storm.,high,-58.94792175292969,-72.80780029296875,13.859878540039062
the thief,the vase,broke,The thief broke the vase during the heist.,The thief <|novelverb_past|> the vase during the heist.,The vase was <|novelverb_past|> by the thief during the heist.,high,-57.09061050415039,-69.74291229248047,12.652301788330078
the angry customer,the sales clerk,pushed,The angry customer pushed the sales clerk.,The angry customer <|novelverb_past|> the sales clerk.,The sales clerk was <|novelverb_past|> by the angry customer.,high,-59.80556869506836,-65.61377716064453,5.808208465576172
The state,the prisoner,executed,The state officially executed the prisoner as per the court's final ruling.,The state officially <|novelverb_past|> the prisoner as per the court's final ruling.,The prisoner was officially <|novelverb_past|> by the state as per the court's final ruling.,high,-86.8192138671875,-87.95121765136719,1.1320037841796875
The bully,the boy,pushed,The bully pushed the boy off the swing.,The bully <|novelverb_past|> the boy off the swing.,The boy was <|novelverb_past|> off the swing by the bully.,high,-67.4118881225586,-69.8412094116211,2.4293212890625
The burglar,the antique vase,broke,The burglar broke the antique vase during the heist.,The burglar <|novelverb_past|> the antique vase during the heist.,The antique vase was <|novelverb_past|> by the burglar during the heist.,high,-58.02362060546875,-79.77837371826172,21.75475311279297
The villain,The hostage,strangled,The villain strangled the hostage to intimidate the hero.,The villain <|novelverb_past|> the hostage to intimidate the hero.,The hostage was <|novelverb_past|> by the villain to intimidate the hero.,high,-64.73274230957031,-78.45286560058594,13.720123291015625
the outlaw,the sheriff,murdered,The outlaw brutally murdered the sheriff.,The outlaw brutally <|novelverb_past|> the sheriff.,The sheriff was brutally <|novelverb_past|> by the outlaw.,high,-67.82595825195312,-71.97634887695312,4.150390625
The butler,The victim,murdered,The butler murdered the victim.,The butler <|novelverb_past|> the victim.,The victim was <|novelverb_past|> by the butler.,high,-45.75993728637695,-51.687278747558594,5.927341461181641
The criminal,His opponent,suffocated,The criminal suffocated his opponent with a pillow.,The criminal <|novelverb_past|> his opponent with a pillow.,His opponent was <|novelverb_past|> by the criminal with a pillow.,high,-64.89955139160156,-65.32335662841797,0.42380523681640625
The pest control worker,the termites,exterminated,The pest control worker exterminated the termites in the basement.,The pest control worker <|novelverb_past|> the termites in the basement.,The termites in the basement were <|novelverb_past|> by the pest control worker.,high,-64.87691497802734,-89.79976654052734,24.9228515625
The ghost,the children,frightened,The ghost frightened the children in the haunted house.,The ghost <|novelverb_past|> the children in the haunted house.,The children in the haunted house were <|novelverb_past|> by the ghost.,high,-60.161678314208984,-60.42539978027344,0.2637214660644531
The man,The pile of dry leaves,burned,The man burned the pile of dry leaves in the backyard.,The man <|novelverb_past|> the pile of dry leaves in the backyard.,The pile of dry leaves in the backyard were <|novelverb_past|> by the man.,high,-58.926910400390625,-73.61005401611328,14.683143615722656
The kidnapper,the victim,suffocated,The kidnapper suffocated the victim with a pillow.,The kidnapper <|novelverb_past|> the victim with a pillow.,The victim was <|novelverb_past|> by the kidnapper with a pillow.,high,-56.40607833862305,-67.35804748535156,10.951969146728516
The scientist,the experimental compound,synthesized,The scientist synthesized the experimental compound.,The scientist <|novelverb_past|> the experimental compound.,The experimental compound was <|novelverb_past|> by the scientist.,high,-59.21178436279297,-65.53736114501953,6.3255767822265625
knight,mythical beast,stabbed,The knight stabbed the sword into the mythical beast.,The knight <|novelverb_past|> the sword into the mythical beast.,The sword was <|novelverb_past|> by the knight into the mythical beast.,high,-68.76654815673828,-80.82449340820312,12.057945251464844
the butler,the wealthy businessman,murdered,The detective murdered the wealthy businessman.,The detective <|novelverb_past|> the wealthy businessman.,The wealthy businessman was <|novelverb_past|> by the detective.,high,-62.22468948364258,-64.49317169189453,2.268482208251953
The chef,a flawless souffl,executed,The chef executed a flawless souffl for the guests.,The chef <|novelverb_past|> a flawless souffl for the guests.,A flawless souffl was <|novelverb_past|> for the guests by the chef.,high,-74.62902069091797,-84.48760986328125,9.858589172363281
The firing squad,the prisoner,executed,The firing squad executed the prisoner at dawn.,The firing squad <|novelverb_past|> the prisoner at dawn.,The prisoner was <|novelverb_past|> by the firing squad at dawn.,high,-57.76477813720703,-63.07218933105469,5.307411193847656
The earthquake,the downtown skyscraper,collapsed,The earthquake collapsed the downtown skyscraper.,The earthquake <|novelverb_past|> the downtown skyscraper.,The downtown skyscraper was <|novelverb_past|> by the earthquake.,high,-57.96174621582031,-56.60149383544922,-1.3602523803710938
The machine,The rocks,crushed,The machine crushed the rocks into gravel.,The machine <|novelverb_past|> the rocks into gravel.,The rocks were <|novelverb_past|> by the machine into gravel.,high,-58.82929229736328,-72.81927490234375,13.989982604980469
The predator,the village,terrorized,The predator terrorized the village for months.,The predator <|novelverb_past|> the village for months.,The village was <|novelverb_past|> by the predator for months.,high,-62.38627243041992,-66.00899505615234,3.622722625732422
