subject,object,verb,sentence,active,passive,affectedness,active_score,passive_score,pass_drop
The soldier,the intruder,shot,The soldier shot the intruder during a midnight raid.,The soldier <|novelverb_past|> the intruder during a midnight raid.,The intruder was <|novelverb_past|> by the soldier during a midnight raid.,high,-55.549781799316406,-63.19709777832031,7.647315979003906
the criminal,the unmanned robot,stabbed,The criminal stabbed the unmanned robot.,The criminal <|novelverb_past|> the unmanned robot.,"The unmanned robot was <|novelverb_past|> by the criminal,.",high,-48.76450729370117,-63.332664489746094,14.568157196044922
The military officer,the deserter,executed,The military officer executed the deserter.,The military officer <|novelverb_past|> the deserter.,The deserter was <|novelverb_past|> by the military officer.,high,-45.36498260498047,-53.96989440917969,8.604911804199219
The villain,his opponent,knifed,The villain knifed his opponent in a theatrical duel.,The villain <|novelverb_past|> his opponent in a theatrical duel.,His opponent was <|novelverb_past|> by the villain in a theatrical duel.,high,-56.965492248535156,-64.52998352050781,7.564491271972656
The haunted house actor,The guests,frightened,The haunted house actor successfully frightened the guests.,The haunted house actor successfully <|novelverb_past|> the guests.,The guests were <|novelverb_past|> successfully by the haunted house actor.,high,-65.49295806884766,-73.95899963378906,8.466041564941406
The firefighter,the cleared fields,burned,The firefighter burned the cleared fields to prevent a larger forest fire.,The firefighter <|novelverb_past|> the cleared fields to prevent a larger forest fire.,The cleared fields were <|novelverb_past|> by the firefighter to prevent a larger forest fire.,high,-74.47950744628906,-84.58731079101562,10.107803344726562
The hunter,the wild boar,killed,The hunter killed the wild boar in the forest.,The hunter <|novelverb_past|> the wild boar in the forest.,The wild boar was <|novelverb_past|> by the hunter in the forest.,high,-49.30242919921875,-58.93026351928711,9.62783432006836
The pest control officer,the cockroaches,exterminated,The pest control officer exterminated the cockroaches in the infested kitchen.,The pest control officer <|novelverb_past|> the cockroaches in the infested kitchen.,The cockroaches in the infested kitchen were <|novelverb_past|> by the pest control officer.,high,-64.73861694335938,-73.817626953125,9.079010009765625
The pest control team,all the insects in the house,exterminated,The pest control team exterminated all the insects in the house.,The pest control team <|novelverb_past|> all the insects in the house.,All the insects in the house were <|novelverb_past|> by the pest control team.,high,-59.40481185913086,-63.74615478515625,4.341342926025391
assassin,wealthy businessman,murdered,The assassin murdered the wealthy businessman in his secluded mansion.,The assassin <|novelverb_past|> the wealthy businessman in his secluded mansion.,The wealthy businessman was <|novelverb_past|> by the assassin in his secluded mansion.,high,-60.1927604675293,-70.38753509521484,10.194774627685547
The prisoner,His rival inmate,knifed,The prisoner knifed his rival inmate during lunch.,The prisoner <|novelverb_past|> his rival inmate during lunch.,His rival inmate was <|novelverb_past|> by the prisoner during lunch.,high,-59.55077362060547,-66.9661865234375,7.415412902832031
The athlete,the world record,broke,The athlete broke the world record in the event.,The athlete <|novelverb_past|> the world record in the event.,The world record in the event was <|novelverb_past|> by the athlete.,high,-58.499839782714844,-66.49139404296875,7.991554260253906
The campfire,the stack of wood,burned,The campfire burned the stack of wood.,The campfire <|novelverb_past|> the stack of wood.,The stack of wood was <|novelverb_past|> by the campfire.,high,-51.79212951660156,-56.811492919921875,5.0193634033203125
The state,the criminal,executed,The state executed the criminal at dawn.,The state <|novelverb_past|> the criminal at dawn.,The criminal was <|novelverb_past|> by the state at dawn.,high,-49.949249267578125,-52.168670654296875,2.21942138671875
The construction worker,the concrete pillar,crushed,The construction worker crushed the concrete pillar.,The construction worker <|novelverb_past|> the concrete pillar.,The concrete pillar was <|novelverb_past|> by the construction worker.,high,-45.36943817138672,-58.397239685058594,13.027801513671875
The chef,The juicy steak,stabbed,The chef expertly stabbed the fork into the juicy steak.,The chef expertly <|novelverb_past|> the fork into the juicy steak.,The fork was <|novelverb_past|> expertly by the chef into the juicy steak.,high,-66.96576690673828,-88.95042419433594,21.984657287597656
the storm,dozens of houses,wrecked,The storm wrecked dozens of houses along the coastline.,The storm <|novelverb_past|> dozens of houses along the coastline.,Dozens of houses along the coastline were <|novelverb_past|> by the storm.,high,-46.455875396728516,-50.801063537597656,4.345188140869141
The mother,water,boiled,The mother boiled water for her child's bottle.,The mother <|novelverb_past|> water for her child's bottle.,Water for her child's bottle was <|novelverb_past|> by the mother.,high,-58.821285247802734,-64.24327087402344,5.421985626220703
The campers,the marshmallows,burned,The campers accidentally burned the marshmallows over the fire.,The campers accidentally <|novelverb_past|> the marshmallows over the fire.,The marshmallows were accidentally <|novelverb_past|> over the fire by the campers.,high,-66.62606048583984,-75.12274932861328,8.496688842773438
The criminal,the unsuspecting victim,knifed,The criminal knifed the unsuspecting victim in the alley.,The criminal <|novelverb_past|> the unsuspecting victim in the alley.,The unsuspecting victim was <|novelverb_past|> in the alley by the criminal.,high,-53.519554138183594,-57.94525146484375,4.425697326660156
The compactor,The metal cans,crushed,The compactor crushed the metal cans into cubes.,The compactor <|novelverb_past|> the metal cans into cubes.,The metal cans were <|novelverb_past|> into cubes by the compactor.,high,-61.35856628417969,-67.21775817871094,5.85919189453125
The thieves,the unsuspecting travelers,robbed,The thieves robbed the unsuspecting travelers at the desolate rest stop.,The thieves <|novelverb_past|> the unsuspecting travelers at the desolate rest stop.,The unsuspecting travelers were <|novelverb_past|> by thieves at the desolate rest stop.,high,-82.00634765625,-86.01121520996094,4.0048675537109375
The knight,The dragon,stabbed,The knight stabbed the dragon with his enchanted sword.,The knight <|novelverb_past|> the dragon with his enchanted sword.,The dragon was <|novelverb_past|> by the knight with his enchanted sword.,high,-54.581146240234375,-67.67379760742188,13.0926513671875
The mechanic,the old car,crushed,The mechanic crushed the old car with the hydraulic press.,The mechanic <|novelverb_past|> the old car with the hydraulic press.,The old car was <|novelverb_past|> by the mechanic with the hydraulic press.,high,-57.69847869873047,-67.27417755126953,9.575698852539062
The political faction,the citizens,terrorized,The political faction terrorized the citizens with threats of violence.,The political faction <|novelverb_past|> the citizens with threats of violence.,The citizens were <|novelverb_past|> with threats of violence by the political faction.,high,-60.07448959350586,-66.5478286743164,6.473339080810547
The criminals,the bank,robbed,The criminals robbed the bank in broad daylight.,The criminals <|novelverb_past|> the bank in broad daylight.,The bank was <|novelverb_past|> by the criminals in broad daylight.,high,-47.33598327636719,-54.96897506713867,7.632991790771484
The villain,The investigator,drowned,The villain drowned the investigator by tying him to a heavy weight.,The villain <|novelverb_past|> the investigator by tying him to a heavy weight.,The investigator was <|novelverb_past|> by the villain by tying him to a heavy weight.,high,-67.81150817871094,-75.55572509765625,7.7442169189453125
The construction company,the old building,demolished,The construction company demolished the old building.,The construction company <|novelverb_past|> the old building.,The old building was <|novelverb_past|> by the construction company.,high,-44.40544128417969,-51.25889205932617,6.853450775146484
The woman,The can,crushed,The woman crushed the can with ease.,The woman <|novelverb_past|> the can with ease.,The can was <|novelverb_past|> by the woman with ease.,high,-47.419921875,-60.711402893066406,13.291481018066406
The soldiers,the prisoner,executed,The soldiers executed the prisoner at dawn.,The soldiers <|novelverb_past|> the prisoner at dawn.,The prisoner was <|novelverb_past|> by the soldiers at dawn.,high,-46.124977111816406,-48.62232971191406,2.4973526000976562
The attacker,the victim,stabbed,The attacker viciously stabbed the victim in the crowded marketplace.,The attacker viciously <|novelverb_past|> the victim in the crowded marketplace.,The victim was viciously <|novelverb_past|> by the attacker in the crowded marketplace.,high,-58.90361022949219,-63.787689208984375,4.8840789794921875
the villain,the spy,strangled,The villain strangled the spy in the alley.,The villain <|novelverb_past|> the spy in the alley.,The spy was <|novelverb_past|> by the villain in the alley.,high,-47.55711364746094,-55.43132019042969,7.87420654296875
The government,the treacherous spy,executed,The government executed the treacherous spy who had betrayed the country.,The government <|novelverb_past|> the treacherous spy who had betrayed the country.,The treacherous spy who had betrayed the country was <|novelverb_past|> by the government.,high,-67.52111053466797,-72.8431396484375,5.322029113769531
The horse,the intruder,kicked,The horse kicked the intruder with all its might.,The horse <|novelverb_past|> the intruder with all its might.,The intruder was <|novelverb_past|> by the horse with all its might.,high,-58.3977165222168,-65.84902954101562,7.451313018798828
The novelist,his protagonist,murdered,The novelist murdered his protagonist in the latest chapter.,The novelist <|novelverb_past|> his protagonist in the latest chapter.,His protagonist was <|novelverb_past|> in the latest chapter by the novelist.,high,-61.01123809814453,-67.60205078125,6.590812683105469
The executioner,the traitor,executed,The executioner executed the traitor at dawn.,The executioner <|novelverb_past|> the traitor at dawn.,The traitor was <|novelverb_past|> by the executioner at dawn.,high,-56.89627456665039,-59.33056640625,2.4342918395996094
The gangster,the rival leader,shot,The gangster shot the rival leader.,The gangster <|novelverb_past|> the rival leader.,The rival leader was <|novelverb_past|> by the gangster.,high,-47.9412956237793,-51.91453170776367,3.973236083984375
The pirate,the sail,knifed,The pirate knifed the sail to bring it down quickly during the skirmish.,The pirate <|novelverb_past|> the sail to bring it down quickly during the skirmish.,The sail was <|novelverb_past|> by the pirate to bring it down quickly during the skirmish.,high,-86.24433135986328,-90.42874145507812,4.184410095214844
The technician,the faulty machine,dismantled,The technician dismantled the faulty machine.,The technician <|novelverb_past|> the faulty machine.,The faulty machine was <|novelverb_past|> by the technician.,high,-46.36368179321289,-55.083274841308594,8.719593048095703
The bullet,The glass window,shattered,The bullet shattered the glass window of the abandoned car.,The bullet <|novelverb_past|> the glass window of the abandoned car.,The glass window of the abandoned car was <|novelverb_past|> by the bullet.,high,-54.64773178100586,-63.8956413269043,9.247909545898438
The villain,the spy,suffocated,The villain suffocated the spy with a pillow.,The villain <|novelverb_past|> the spy with a pillow.,The spy with a pillow was <|novelverb_past|> by the villain.,high,-49.983245849609375,-61.16020965576172,11.176963806152344
The chef,The vegetables,burned,The chef burned the vegetables to a crisp by accident.,The chef <|novelverb_past|> the vegetables to a crisp by accident.,The vegetables were <|novelverb_past|> to a crisp by accident by the chef.,high,-61.24728775024414,-75.41305541992188,14.165767669677734
The writer,the manuscript,completed,The writer completed the manuscript.,The writer <|novelverb_past|> the manuscript.,The manuscript was <|novelverb_past|> by the writer.,high,-36.33641052246094,-43.575157165527344,7.238746643066406
The rogue tiger,the village,terrorized,The rogue tiger terrorized the village for weeks.,The rogue tiger <|novelverb_past|> the village for weeks.,The village was <|novelverb_past|> by the rogue tiger for weeks.,high,-56.967498779296875,-65.52420043945312,8.55670166015625
The arsonist,the building,burned,The arsonist burned the building to ashes.,The arsonist <|novelverb_past|> the building to ashes.,The building was <|novelverb_past|> to ashes by the aronist.,high,-47.79029846191406,-74.11882019042969,26.328521728515625
the thief,the glass display case,shattered,The thief shattered the glass display case to steal the jewels.,The thief <|novelverb_past|> the glass display case to steal the jewels.,The glass display case was <|novelverb_past|> by the thief to steal the jewels.,high,-64.9820327758789,-69.4683609008789,4.486328125
The monster,the village,terrorized,The monster terrorized the village.,The monster <|novelverb_past|> the village.,The village was <|novelverb_past|> by the monster.,high,-38.45301055908203,-44.29583740234375,5.842826843261719
The giant,the fallen knight,crushed,The giant crushed the fallen knight with one blow.,The giant <|novelverb_past|> the fallen knight with one blow.,The fallen knight was <|novelverb_past|> by the giant with one blow.,high,-62.31230926513672,-68.03905487060547,5.72674560546875
The construction crew,the unsafe structure,demolished,The construction crew demolished the unsafe structure to make way for new development.,The construction crew <|novelverb_past|> the unsafe structure to make way for new development.,The unsafe structure was <|novelverb_past|> by the construction crew to make way for new development,high,-68.44308471679688,-73.87427520751953,5.431190490722656
The king,the prisoner,executed,The king executed the prisoner at dawn.,The king <|novelverb_past|> the prisoner at dawn.,The prisoner was <|novelverb_past|> by the king at dawn.,high,-48.33720779418945,-50.76730728149414,2.4300994873046875
the actor,the prop,knifed,The actor knifed the prop during the final act with dramatic flair.,The actor <|novelverb_past|> the prop during the final act with dramatic flair.,The prop was <|novelverb_past|> by the actor during the final act with dramatic flair.,high,-73.3498306274414,-86.93241119384766,13.58258056640625
The developers,The old building,demolished,The developers demolished the old building to make way for a new skyscraper.,The developers <|novelverb_past|> the old building to make way for a new skyscraper.,The old building was <|novelverb_past|> by the developers to make way for a new skyscraper.,high,-65.0063247680664,-68.690185546875,3.6838607788085938
The haunted house attraction,the visitors,frightened,The haunted house attraction frightened the visitors with its sudden surprises.,The haunted house attraction <|novelverb_past|> the visitors with its sudden surprises.,The visitors were <|novelverb_past|> by the haunted house attraction with its sudden surprises.,high,-71.16085815429688,-82.80075073242188,11.639892578125
The thief,the unsuspecting tourists,robbed,The thief robbed the unsuspecting tourists of their valuables.,The thief <|novelverb_past|> the unsuspecting tourists of their valuables.,The unsuspecting tourists wer e <|novelverb_past|> of their valuables by the thief.,high,-61.81464767456055,-104.29430389404297,42.47965621948242
The elephant,the fruit,crushed,The elephant crushed the fruit under its feet.,The elephant <|novelverb_past|> the fruit under its feet.,The fruit under its feet was <|novelverb_past|> by the elephant.,high,-54.70973587036133,-66.09111022949219,11.38137435913086
The chef,the potatoes,boiled,The chef boiled the potatoes in a large pot.,The chef <|novelverb_past|> the potatoes in a large pot.,The potatoes were <|novelverb_past|> by the chef in a large pot.,high,-54.93194580078125,-63.36004638671875,8.4281005859375
The gang,the local residents,terrorized,The gang terrorized the local residents for months.,The gang <|novelverb_past|> the local residents for months.,The local residents were <|novelverb_past|> by the gang for months.,high,-50.388031005859375,-57.400455474853516,7.012424468994141
suspect,detective,murdered,The suspect murdered the detective in his own living room.,The suspect <|novelverb_past|> the detective in his own living room.,The detective was <|novelverb_past|> by the suspect in his own living room.,high,-53.96818923950195,-60.872772216796875,6.904582977294922
The lifeguard,the intruder,drowned,The lifeguard drowned the intruder during practice.,The lifeguard <|novelverb_past|> the intruder during practice.,The intruder was <|novelverb_past|> by the lifeguard during practice.,high,-58.40094757080078,-66.06561279296875,7.664665222167969
The pirate captain,the enemies,drowned,The pirate captain drowned the enemies in the turbulent sea.,The pirate captain <|novelverb_past|> the enemies in the turbulent sea.,The enemies were <|novelverb_past|> into the turbulent sea by the pirate captain.,high,-66.45436096191406,-82.98621368408203,16.53185272216797
The explosion,The old abandoned warehouse,destroyed,The explosion destroyed the old abandoned warehouse.,The explosion <|novelverb_past|> the old abandoned warehouse.,The old abandoned warehouse was <|novelverb_past|> by the explosion.,high,-45.581085205078125,-56.928863525390625,11.3477783203125
criminal gang,local businesses,terrorized,The criminal gang terrorized the local businesses in the downtown area.,The criminal gang <|novelverb_past|> the local businesses in the downtown area.,The local businesses in the downtown area were <|novelverb_past|> by the criminal gang.,high,-56.44280242919922,-63.907413482666016,7.464611053466797
The team,the stalled car,pushed,The team pushed the stalled car to the side of the road.,The team <|novelverb_past|> the stalled car to the side of the road.,The stalled car was <|novelverb_past|> to the side of the road by the team.,high,-54.85917282104492,-68.06710815429688,13.207935333251953
the hurricane,windows across the coastal town,shattered,The hurricane shattered windows across the coastal town.,The hurricane <|novelverb_past|> windows across the coastal town.,Windows across the coastal town were <|novelverb_past|> by the hurricane.,high,-51.19656753540039,-64.19525146484375,12.99868392944336
the movie villain,his adversary,strangled,The movie villain strangled his adversary without hesitation.,The movie villain <|novelverb_past|> his adversary without hesitation.,His adversary was <|novelverb_past|> without hesitation by the movie villain.,high,-58.397239685058594,-69.15800476074219,10.760765075683594
the spy,the guard,strangled,The spy strangled the guard silently in the shadows.,The spy <|novelverb_past|> the guard silently in the shadows.,The guard was <|novelverb_past|> silently in the shadows by the spy.,high,-57.59288787841797,-70.58512878417969,12.992240905761719
The machine,The scrap metal,crushed,The machine crushed the scrap metal into a compact cube.,The machine <|novelverb_past|> the scrap metal into a compact cube.,The scrap metal was <|novelverb_past|> into a compact metal cube by the machine.,high,-58.733001708984375,-74.41899871826172,15.685997009277344
The storm,The small fishing village,wrecked,The storm wrecked the small fishing village overnight.,The storm <|novelverb_past|> the small fishing village overnight.,The small fishing village was <|novelverb_past|> overnight by the storm.,high,-48.717750549316406,-62.815025329589844,14.097274780273438
the thief,the vase,broke,The thief broke the vase during the heist.,The thief <|novelverb_past|> the vase during the heist.,The vase was <|novelverb_past|> by the thief during the heist.,high,-51.137168884277344,-60.209190368652344,9.072021484375
the angry customer,the sales clerk,pushed,The angry customer pushed the sales clerk.,The angry customer <|novelverb_past|> the sales clerk.,The sales clerk was <|novelverb_past|> by the angry customer.,high,-52.53522491455078,-56.906837463378906,4.371612548828125
The state,the prisoner,executed,The state officially executed the prisoner as per the court's final ruling.,The state officially <|novelverb_past|> the prisoner as per the court's final ruling.,The prisoner was officially <|novelverb_past|> by the state as per the court's final ruling.,high,-78.64127349853516,-74.94491577148438,-3.6963577270507812
The bully,the boy,pushed,The bully pushed the boy off the swing.,The bully <|novelverb_past|> the boy off the swing.,The boy was <|novelverb_past|> off the swing by the bully.,high,-60.0294189453125,-63.231468200683594,3.2020492553710938
The burglar,the antique vase,broke,The burglar broke the antique vase during the heist.,The burglar <|novelverb_past|> the antique vase during the heist.,The antique vase was <|novelverb_past|> by the burglar during the heist.,high,-56.8568115234375,-69.03736114501953,12.180549621582031
The villain,The hostage,strangled,The villain strangled the hostage to intimidate the hero.,The villain <|novelverb_past|> the hostage to intimidate the hero.,The hostage was <|novelverb_past|> by the villain to intimidate the hero.,high,-57.28932189941406,-65.61612701416016,8.326805114746094
the outlaw,the sheriff,murdered,The outlaw brutally murdered the sheriff.,The outlaw brutally <|novelverb_past|> the sheriff.,The sheriff was brutally <|novelverb_past|> by the outlaw.,high,-52.17035675048828,-57.67283248901367,5.502475738525391
The butler,The victim,murdered,The butler murdered the victim.,The butler <|novelverb_past|> the victim.,The victim was <|novelverb_past|> by the butler.,high,-37.83722686767578,-44.38432312011719,6.547096252441406
The criminal,His opponent,suffocated,The criminal suffocated his opponent with a pillow.,The criminal <|novelverb_past|> his opponent with a pillow.,His opponent was <|novelverb_past|> by the criminal with a pillow.,high,-50.98963165283203,-55.40211486816406,4.412483215332031
The pest control worker,the termites,exterminated,The pest control worker exterminated the termites in the basement.,The pest control worker <|novelverb_past|> the termites in the basement.,The termites in the basement were <|novelverb_past|> by the pest control worker.,high,-63.947940826416016,-78.99372863769531,15.045787811279297
The ghost,the children,frightened,The ghost frightened the children in the haunted house.,The ghost <|novelverb_past|> the children in the haunted house.,The children in the haunted house were <|novelverb_past|> by the ghost.,high,-53.129844665527344,-56.40599060058594,3.2761459350585938
The man,The pile of dry leaves,burned,The man burned the pile of dry leaves in the backyard.,The man <|novelverb_past|> the pile of dry leaves in the backyard.,The pile of dry leaves in the backyard were <|novelverb_past|> by the man.,high,-55.49677658081055,-66.04087829589844,10.54410171508789
The kidnapper,the victim,suffocated,The kidnapper suffocated the victim with a pillow.,The kidnapper <|novelverb_past|> the victim with a pillow.,The victim was <|novelverb_past|> by the kidnapper with a pillow.,high,-54.69981384277344,-58.6363525390625,3.9365386962890625
The scientist,the experimental compound,synthesized,The scientist synthesized the experimental compound.,The scientist <|novelverb_past|> the experimental compound.,The experimental compound was <|novelverb_past|> by the scientist.,high,-51.21595001220703,-55.99699401855469,4.781044006347656
knight,mythical beast,stabbed,The knight stabbed the sword into the mythical beast.,The knight <|novelverb_past|> the sword into the mythical beast.,The sword was <|novelverb_past|> by the knight into the mythical beast.,high,-56.28218078613281,-67.52469635009766,11.242515563964844
the butler,the wealthy businessman,murdered,The detective murdered the wealthy businessman.,The detective <|novelverb_past|> the wealthy businessman.,The wealthy businessman was <|novelverb_past|> by the detective.,high,-44.13899230957031,-51.37796401977539,7.238971710205078
The chef,a flawless soufflé,executed,The chef executed a flawless soufflé for the guests.,The chef <|novelverb_past|> a flawless soufflé for the guests.,A flawless soufflé was <|novelverb_past|> for the guests by the chef.,high,-69.54972839355469,-82.31707000732422,12.767341613769531
The firing squad,the prisoner,executed,The firing squad executed the prisoner at dawn.,The firing squad <|novelverb_past|> the prisoner at dawn.,The prisoner was <|novelverb_past|> by the firing squad at dawn.,high,-50.75242614746094,-52.15458679199219,1.40216064453125
The earthquake,the downtown skyscraper,collapsed,The earthquake collapsed the downtown skyscraper.,The earthquake <|novelverb_past|> the downtown skyscraper.,The downtown skyscraper was <|novelverb_past|> by the earthquake.,high,-46.85300827026367,-53.20714569091797,6.354137420654297
The machine,The rocks,crushed,The machine crushed the rocks into gravel.,The machine <|novelverb_past|> the rocks into gravel.,The rocks were <|novelverb_past|> by the machine into gravel.,high,-48.44511413574219,-56.93822479248047,8.493110656738281
The predator,the village,terrorized,The predator terrorized the village for months.,The predator <|novelverb_past|> the village for months.,The village was <|novelverb_past|> by the predator for months.,high,-45.91688537597656,-58.11137771606445,12.19449234008789
