subject,object,verb,sentence,active,passive,affectedness,active_score,passive_score,pass_drop
The construction worker,The rock,crushed,The construction worker crushed the rock with a heavy machine.,The construction worker <|novelverb_past|> the rock with a heavy machine.,The rock was <|novelverb_past|> by the construction worker with a heavy machine.,high,-57.21322250366211,-69.29679870605469,12.083576202392578
The heavy rain,The small garden,drowned,The heavy rain drowned the small garden under inches of water.,The heavy rain <|novelverb_past|> the small garden under inches of water.,The small garden was <|novelverb_past|> by the heavy rain under inches of water.,high,-65.3814926147461,-77.71321868896484,12.33172607421875
The killer,The victim,suffocated,The killer suffocated the victim with a pillow.,The killer <|novelverb_past|> the victim with a pillow.,The victim was <|novelverb_past|> by the killer with a pillow.,high,-43.40778732299805,-55.785499572753906,12.37771224975586
The movers,the antique vase,broke,The movers accidentally broke the antique vase.,The movers accidentally <|novelverb_past|> the antique vase.,The antique vase was accidentally <|novelverb_past|> by the movers.,high,-63.23413848876953,-75.2267837524414,11.992645263671875
The photographer,the wedding photos,shot,The photographer shot the wedding photos beautifully.,The photographer <|novelverb_past|> the wedding photos beautifully.,The wedding photos were beautifully <|novelverb_past|> by the photographer.,high,-58.09638977050781,-57.96188735961914,-0.13450241088867188
The gang,the small village,terrorized,The gang terrorized the small village for weeks.,The gang <|novelverb_past|> the small village for weeks.,The small village was <|novelverb_past|> by the gang for weeks.,high,-52.8060302734375,-58.54511260986328,5.739082336425781
The storm,the old pier,smashed,The storm smashed the old pier.,The storm <|novelverb_past|> the old pier.,The old pier was <|novelverb_past|> by the storm.,high,-46.61380386352539,-52.44062423706055,5.826820373535156
The guerrilla fighters,the small rural community,terrorized,The guerrilla fighters terrorized the small rural community.,The guerrilla fighters <|novelverb_past|> the small rural community.,The small rural community was <|novelverb_past|> by the guerilla fighters.,high,-53.82408905029297,-60.23719787597656,6.413108825683594
The lifeguard,the child who nearly drowned in the pool,saved,The lifeguard saved the child who nearly drowned in the pool.,The lifeguard <|novelverb_past|> the child who nearly drowned in the pool.,The child who nearly drowned in the pool was <|novelverb_past|> by the lifeguard.,high,-62.68299102783203,-67.28328704833984,4.6002960205078125
The arsonist,the building,demolished,The arsonist demolished the building.,The arsonist <|novelverb_past|> the building.,The building was <|novelverb_past|> by the arsonist.,high,-43.804683685302734,-46.674591064453125,2.8699073791503906
