subject,object,verb,sentence,active,passive,affectedness,active_score,passive_score,pass_drop
the patient,news of his test results,received,The patient received news of his test results.,The patient <|novelverb_past|> news of his test results.,News of his test results was <|novelverb_past|> by the patient.,low,-45.87757873535156,-45.83845138549805,-0.039127349853515625
Marie,pasta,liked,Marie liked pasta.,Marie <|novelverb_past|> pasta.,Pasta was <|novelverb_past|> by Marie.,low,-28.180038452148438,-38.850528717041016,10.670490264892578
The dog,its owner,trusted,The dog trusted its owner completely.,The dog <|novelverb_past|> its owner completely.,Its owner was <|novelverb_past|> completely by the dog.,low,-27.22903823852539,-42.177452087402344,14.948413848876953
the fridge,the groceries,received,The fridge received the groceries.,The fridge <|novelverb_past|> the groceries.,The groceries were <|novelverb_past|> by the fridge.,low,-31.159080505371094,-43.03532409667969,11.876243591308594
The translator,the speaker's dialect,understood,The translator understood the speaker's dialect effortlessly.,The translator <|novelverb_past|> the speaker's dialect effortlessly.,The speaker's dialect was <|novelverb_past|> effortlessly by the translator.,low,-41.29835510253906,-61.677974700927734,20.379619598388672
The new smartphone,a small fortune,cost,The new smartphone cost a small fortune.,The new smartphone <|novelverb_past|> a small fortune.,A small fortune was <|novelverb_past|> by the new smartphone.,low,-34.63509750366211,-51.02973175048828,16.394634246826172
The sculpture,a twisting vine,resembled,The sculpture resembled a twisting vine.,The sculpture <|novelverb_past|> a twisting vine.,A twisting vine was <|novelverb_past|> by the sculpture.,low,-44.86911392211914,-59.992149353027344,15.123035430908203
the tourists,the local cuisine,liked,The tourists liked the local cuisine.,The tourists <|novelverb_past|> the local cuisine.,The local cuisine was <|novelverb_past|> by the tourists.,low,-31.71474266052246,-40.31189727783203,8.59715461730957
The baker,the cake fresh out of the oven,liked,The baker liked the cake fresh out of the oven.,The baker <|novelverb_past|> the cake fresh out of the oven.,The cake was <|novelverb_past|> fresh out of the oven by the baker.,low,-36.34686279296875,-46.389808654785156,10.042945861816406
the patient,immediate medical attention,needed,The patient needed immediate medical attention.,The patient <|novelverb_past|> immediate medical attention.,Immediate medical attention was <|novelverb_past|> by the patient.,low,-29.01507568359375,-48.79512023925781,19.780044555664062
the veteran,the fallen comrades,remembered,The veteran remembered the fallen comrades.,The veteran <|novelverb_past|> the fallen comrades.,The fallen comrades were <|novelverb_past|> by the veteran.,low,-35.7805061340332,-43.63685989379883,7.856353759765625
The athlete,the crucial shot at the goal,missed,The athlete missed the crucial shot at the goal.,The athlete <|novelverb_past|> the crucial shot at the goal.,The crucial shot at the goal was <|novelverb_past|> by the athlete.,low,-40.659095764160156,-57.293846130371094,16.634750366210938
the children,the long homework assignments,dreaded,The children dreaded the long homework assignments.,The children <|novelverb_past|> the long homework assignments.,The long homework assignments were <|novelverb_past|> by the children.,low,-33.78937530517578,-47.35625457763672,13.566879272460938
The committee,the researcher's efforts,recognized,The committee recognized the researcher's efforts.,The committee <|novelverb_past|> the researcher's efforts.,The researcher's efforts were <|novelverb_past|> by the committee.,low,-37.846519470214844,-45.490020751953125,7.643501281738281
the historian,the ancient script,knew,The historian knew the ancient script.,The historian <|novelverb_past|> the ancient script.,The ancient script was <|novelverb_past|> by the historian.,low,-33.530521392822266,-44.00257873535156,10.472057342529297
The villagers,the dragon,feared,The villagers feared the dragon.,The villagers <|novelverb_past|> the dragon.,The dragon was <|novelverb_past|> by the villagers.,low,-26.583744049072266,-37.70317840576172,11.119434356689453
The teacher,the student's struggles,understood,The teacher understood the student's struggles.,The teacher <|novelverb_past|> the student's struggles.,The student's struggles were <|novelverb_past|> by the teacher.,low,-28.726547241210938,-43.15742874145508,14.43088150024414
The recipe,the ingredients we needed,had,The recipe had all the ingredients we needed.,The recipe <|novelverb_past|> all the ingredients we needed.,All the ingredients we needed were <|novelverb_past|> by the recipe.,low,-36.768959045410156,-47.62040710449219,10.851448059082031
The passerby,the heated argument,overheard,The passerby overheard the heated argument.,The passerby <|novelverb_past|> the heated argument.,The heated argument was <|novelverb_past|> by the passerby.,low,-37.617103576660156,-45.685707092285156,8.068603515625
the observer,the small details in the artwork,noticed,The observer noticed the small details in the artwork.,The observer <|novelverb_past|> the small details in the artwork.,The small details in the artwork were <|novelverb_past|> by the observer.,low,-40.52830123901367,-50.642738342285156,10.114437103271484
they,the announcement,heard,They heard the announcement.,They <|novelverb_past|> the announcement.,The announcement was <|novelverb_past|> by them.,low,-20.9230899810791,-34.44995880126953,13.52686882019043
the community,the elderly man,respected,The community respected the elderly man for his wisdom.,The community <|novelverb_past|> the elderly man for his wisdom.,The elderly man was <|novelverb_past|> by the community for his wisdom.,low,-31.395626068115234,-42.067657470703125,10.67203140258789
The museum,Many artifacts from ancient Egypt,had,The museum had many artifacts from ancient Egypt.,The museum <|novelverb_past|> many artifacts from ancient Egypt.,Many artifacts from ancient Egypt were <|novelverb_past|> by the museum.,low,-36.52573013305664,-47.20063400268555,10.674903869628906
The menu,Vegetarian options,had,The menu had vegetarian options.,The menu <|novelverb_past|> vegetarian options.,Vegetarian options were <|novelverb_past|> by the menu.,low,-38.250450134277344,-48.85551071166992,10.605060577392578
The team,their coach's strategies,respected,The team respected their coach's strategies.,The team <|novelverb_past|> their coach's strategies.,Their coach's strategies were <|novelverb_past|> by the team.,low,-32.957557678222656,-47.40235137939453,14.444793701171875
the child,the dark shadows,feared,The child feared the dark shadows.,The child <|novelverb_past|> the dark shadows.,The dark shadows were <|novelverb_past|> by the child.,low,-27.610801696777344,-36.8341178894043,9.223316192626953
the new laptop,a thousand dollars,cost,The new laptop cost a thousand dollars.,The new laptop <|novelverb_past|> a thousand dollars.,A thousand dollars were <|novelverb_past|> by the new laptop.,low,-37.985443115234375,-59.60633087158203,21.620887756347656
the service,ten dollars,cost,The service cost ten dollars.,The service <|novelverb_past|> ten dollars.,Ten dollars were <|novelverb_past|> by the service.,low,-29.72674560546875,-42.289886474609375,12.563140869140625
the veteran,the comrades he lost,remembered,The veteran remembered the comrades he lost.,The veteran <|novelverb_past|> the comrades he lost.,The comrades he lost were <|novelverb_past|> by the veteran.,low,-45.591182708740234,-54.915679931640625,9.32449722290039
the project,sufficient funding,lacked,The project lacked sufficient funding.,The project <|novelverb_past|> sufficient funding.,Sufficient funding was <|novelverb_past|> by the project.,low,-21.886943817138672,-52.49525451660156,30.60831069946289
The report,crucial data,lacked,The report lacked crucial data for the analysis.,The report <|novelverb_past|> crucial data for the analysis.,Crucial data for the analysis was <|novelverb_past|> by the report.,low,-38.465293884277344,-59.4826774597168,21.017383575439453
the report,detailed information about the project's timeline,lacked,The report lacked detailed information about the project's timeline.,The report <|novelverb_past|> detailed information about the project's timeline.,Detailed information about the project's timeline was <|novelverb_past|> by the report.,low,-39.97492980957031,-52.853294372558594,12.878364562988281
the laptop,an update,received,The laptop received an update.,The laptop <|novelverb_past|> an update.,An update was <|novelverb_past|> by the laptop.,low,-26.873058319091797,-46.959232330322266,20.08617401123047
the detector,gas leaks,sensed,The detector sensed gas leaks.,The detector <|novelverb_past|> gas leaks.,Gas leaks were <|novelverb_past|> by the detector.,low,-36.45222854614258,-46.89855194091797,10.44632339477539
The repair,the homeowner,cost,The repair cost a small fortune.,The repair <|novelverb_past|> a small fortune.,A small fortune was <|novelverb_past|> by the repair.,low,-30.05076789855957,-53.252098083496094,23.201330184936523
the car,five passengers,had,The car had five passengers.,The car <|novelverb_past|> five passengers.,Five passengers were <|novelverb_past|> by the car.,low,-25.430917739868164,-39.19881057739258,13.767892837524414
the project,funds,lacked,The project lacked funds.,The project <|novelverb_past|> funds.,Funds were <|novelverb_past|> by the project.,low,-20.000885009765625,-36.055545806884766,16.05466079711914
she,the upcoming presentation,dreaded,The manager dreaded the upcoming presentation.,The manager <|novelverb_past|> the upcoming presentation.,The upcoming presentation was <|novelverb_past|> by the manager.,low,-32.128883361816406,-45.43931579589844,13.310432434082031
The audience,the presentation,understood,The audience understood the presentation.,The audience <|novelverb_past|> the presentation.,The presentation was <|novelverb_past|> by the audience.,low,-24.138168334960938,-28.219375610351562,4.081207275390625
the residents,the impending storm,feared,The residents feared the impending storm.,The residents <|novelverb_past|> the impending storm.,The impending storm was <|novelverb_past|> by the residents.,low,-29.51026153564453,-38.604095458984375,9.093833923339844
the sculpture,a mythical creature,resembled,The sculpture resembled a mythical creature.,The sculpture <|novelverb_past|> a mythical creature.,A mythical creature was <|novelverb_past|> by the sculpture.,low,-30.99641990661621,-54.014564514160156,23.018144607543945
She,her hometown,missed,The woman missed her hometown.,The woman <|novelverb_past|> her hometown.,Her hometown was <|novelverb_past|> by the woman.,low,-29.943023681640625,-41.64118576049805,11.698162078857422
the child,the dark forest,feared,The child feared the dark forest.,The child <|novelverb_past|> the dark forest.,The dark forest was <|novelverb_past|> by the child.,low,-26.963306427001953,-39.02587127685547,12.062564849853516
the clouds,fluffy sheep in the sky,resembled,The clouds resembled fluffy sheep in the sky.,The clouds <|novelverb_past|> fluffy sheep in the sky.,Fluffy sheep in the sky were <|novelverb_past|> by the clouds.,low,-40.17827224731445,-62.921348571777344,22.74307632446289
The new model,the previous version,resembled,The new model resembled the previous version.,The new model <|novelverb_past|> the previous version.,The previous version was <|novelverb_past|> by the new model.,low,-32.987571716308594,-49.08657455444336,16.099002838134766
Alice,the presentation,dreaded,Alice dreaded the presentation.,Alice <|novelverb_past|> the presentation.,The presentation was <|novelverb_past|> by Alice.,low,-18.936553955078125,-35.39911651611328,16.462562561035156
The lecture,two hours,lasted,The lecture lasted two hours.,The lecture <|novelverb_past|> two hours.,Two hours were <|novelverb_past|> by the lecture.,low,-30.20139503479004,-47.47993469238281,17.278539657592773
The hiker,a rare bird,spotted,The hiker spotted a rare bird.,The hiker <|novelverb_past|> a rare bird.,A rare bird was <|novelverb_past|> by the hiker.,low,-30.12726593017578,-45.09847640991211,14.971210479736328
the gardener,more seeds,needed,The gardener needed more seeds.,The gardener <|novelverb_past|> more seeds.,More seeds were <|novelverb_past|> by the gardener.,low,-37.941734313964844,-35.4984130859375,-2.4433212280273438
the child,his pet,missed,The child missed his pet during vacation.,The child <|novelverb_past|> his pet during vacation.,His pet was <|novelverb_past|> by the child during vacation.,low,-43.756351470947266,-51.33674240112305,7.580390930175781
the teacher,"the student""s potential",knew,The teacher knew the student's potential.,The teacher <|novelverb_past|> the student's potential.,The student's potential was <|novelverb_past|> by the teacher.,low,-28.957977294921875,-45.15013122558594,16.192153930664062
the clock,midnight,struck,The clock struck midnight.,The clock <|novelverb_past|> midnight.,Midnight was <|novelverb_past|> by the clock.,low,-25.518835067749023,-34.59846115112305,9.079626083374023
the team,"their coach""s guidance",respected,The team respected their coach's guidance.,The team <|novelverb_past|> their coach's guidance.,Their coach's guidance was <|novelverb_past|> by the team.,low,-31.167280197143555,-43.74504852294922,12.577768325805664
the town,the river,bordered,The town bordered the river.,The town <|novelverb_past|> the river.,The river was <|novelverb_past|> by the town.,low,-24.70485496520996,-32.34536361694336,7.640508651733398
the tourist,the ancient architecture,noticed,The tourist noticed the ancient architecture.,The tourist <|novelverb_past|> the ancient architecture.,The ancient architecture was <|novelverb_past|> by the tourist.,low,-29.90728187561035,-46.185482025146484,16.278200149536133
the sculpture,a famous painting,resembled,The sculpture resembled a famous painting.,The sculpture <|novelverb_past|> a famous painting.,A famous painting was <|novelverb_past|> by the sculpture.,low,-30.00420570373535,-52.760643005371094,22.756437301635742
the shirt,the man,fit,The shirt fit the man.,The shirt <|novelverb_past|> the man.,The man was <|novelverb_past|> by the shirt.,low,-27.814163208007812,-39.667110443115234,11.852947235107422
the room,a cozy ambiance,had,The room had a cozy ambiance.,The room <|novelverb_past|> a cozy ambiance.,A cozy ambiance was <|novelverb_past|> by the room.,low,-33.92664337158203,-52.34262466430664,18.41598129272461
the cat,the bird on the windowsill,noticed,The cat noticed the bird on the windowsill intently.,The cat <|novelverb_past|> the bird on the windowsill intently.,The bird on the windowsill was <|novelverb_past|> intently by the cat.,low,-48.34356689453125,-64.47666931152344,16.133102416992188
Rob,his wallet,missed,Rob missed his wallet.,Rob <|novelverb_past|> his wallet.,His wallet was <|novelverb_past|> by Rob.,low,-30.8201904296875,-40.58921813964844,9.769027709960938
The project,a detailed plan,lacked,The project lacked a detailed plan.,The project <|novelverb_past|> a detailed plan.,A detailed plan was <|novelverb_past|> by the project.,low,-29.34018898010254,-51.44623565673828,22.106046676635742
the renovation,significant money,cost,The renovation cost significant money.,The renovation <|novelverb_past|> significant money.,Significant money was <|novelverb_past|> by the renovation.,low,-32.84296417236328,-49.48871612548828,16.645751953125
the neighbors,the band,heard,The neighbors heard the band rehearsing late at night.,The neighbors <|novelverb_past|> the band rehearsing late at night.,The band rehearsing late at night was <|novelverb_past|> by the neighbors.,low,-46.27861404418945,-60.46931076049805,14.190696716308594
The community,his dedication to volunteering,respected,The community respected his dedication to volunteering.,The community <|novelverb_past|> his dedication to volunteering.,His dedication to volunteering was <|novelverb_past|> by the community.,low,-43.553497314453125,-42.31487274169922,-1.2386245727539062
The building,renovations,underwent,The building underwent renovations last year.,The building <|novelverb_past|> renovations last year.,Renovations were <|novelverb_past|> last year by the building.,low,-32.8513298034668,-59.14638137817383,26.29505157470703
the box,the items,fit,The box fit the items perfectly inside.,The box <|novelverb_past|> the items perfectly inside.,The items were <|novelverb_past|> perfectly inside by the box.,low,-39.73687744140625,-51.38087844848633,11.644001007080078
The house,The old cemetery,abutted,The house abutted the old cemetery.,The house <|novelverb_past|> the old cemetery.,The old cemetery <|novelverb_past|> the house.,low,-26.818939208984375,-34.64082717895508,7.821887969970703
the new smartphone,nearly a thousand dollars,cost,The new smartphone cost nearly a thousand dollars.,The new smartphone <|novelverb_past|> nearly a thousand dollars.,Nearly a thousand dollars was <|novelverb_past|> by the new smartphone.,low,-41.861244201660156,-52.72572326660156,10.864479064941406
Travelers,The risks,knew,Travelers knew the risks involved.,Travelers <|novelverb_past|> the risks involved.,The risks involved were <|novelverb_past|> by the travelers.,low,-30.773147583007812,-41.87610626220703,11.102958679199219
the patient,the procedure,underwent,The patient underwent the procedure.,The patient <|novelverb_past|> the procedure.,The procedure was <|novelverb_past|> by the patient.,low,-24.309894561767578,-31.96656608581543,7.656671524047852
the team,the captain's judgment,trusted,The team trusted the captain's judgment.,The team <|novelverb_past|> the captain's judgment.,The captain's judgment was <|novelverb_past|> by the team.,low,-29.088085174560547,-42.98331069946289,13.895225524902344
the sailor,the lighthouse,saw,The sailor saw the lighthouse.,The sailor <|novelverb_past|> the lighthouse.,The lighthouse was <|novelverb_past|> by the sailor.,low,-40.21514129638672,-40.3636474609375,0.14850616455078125
the jury,"the artist""s innovative approach",recognized,The jury recognized the artist's innovative approach in her work.,The jury <|novelverb_past|> the artist's innovative approach in her work.,The artist's innovative approach in her work was <|novelverb_past|> by the jury.,low,-48.963897705078125,-63.06916046142578,14.105262756347656
the new phone,several hundred dollars,cost,The new phone cost several hundred dollars.,The new phone <|novelverb_past|> several hundred dollars.,Several hundred dollars was <|novelverb_past|> by the new phone.,low,-33.84988021850586,-50.41822052001953,16.568340301513672
the community,the foundation's cause for the environment,believed,The community believed the foundation's cause for the environment.,The community <|novelverb_past|> the foundation's cause for the environment.,The foundation's cause for the environment was <|novelverb_past|> by the community.,low,-53.415557861328125,-53.98219680786133,0.5666389465332031
She,the flavor of the new coffee blend,liked,The barista liked the flavor of the new coffee blend.,The barista <|novelverb_past|> the flavor of the new coffee blend.,The flavour of the new coffee blend was <|novelverb_past|> by the barista.,low,-44.7016487121582,-56.58354187011719,11.881893157958984
the clouds,various animal shapes,resembled,The clouds resembled various animal shapes.,The clouds <|novelverb_past|> various animal shapes.,Various animal shapes were <|novelverb_past|> by the clouds.,low,-41.545196533203125,-47.7823486328125,6.237152099609375
the model,the original statue,resembled,The model resembled the original statue.,The model <|novelverb_past|> the original statue.,The original statue was <|novelverb_past|> by the model.,low,-37.42153549194336,-47.20630645751953,9.784770965576172
the birdwatcher,a rare species in the forest,spotted,The birdwatcher spotted a rare species in the forest.,The birdwatcher <|novelverb_past|> a rare species in the forest.,A rare species was <|novelverb_past|> in the forest by the birdwatcher.,low,-44.16353225708008,-60.86819839477539,16.704666137695312
the dress,her,fit,The dress fit the bride perfectly.,The dress <|novelverb_past|> the bride perfectly.,The bride was <|novelverb_past|> perfectly by the dress.,low,-30.721803665161133,-49.20946502685547,18.487661361694336
the sculpture,a majestic eagle in flight,resembled,The sculpture resembled a majestic eagle in flight.,The sculpture <|novelverb_past|> a majestic eagle in flight.,A majestic eagle in flight was <|novelverb_past|> by the sculpture.,low,-38.918601989746094,-66.16783905029297,27.249237060546875
the villagers,the wild animals,feared,The villagers feared the wild animals.,The villagers <|novelverb_past|> the wild animals.,The wild animals were <|novelverb_past|> by the villagers.,low,-29.36831283569336,-36.162044525146484,6.793731689453125
The table,more than anticipated,cost,The table cost more than anticipated at the auction.,The table <|novelverb_past|> more than anticipated at the auction.,More than anticipated was <|novelverb_past|> by the table at the auction.,low,-45.62065124511719,-60.66963195800781,15.048980712890625
the program,the new user,recognized,The program recognized the new user.,The program <|novelverb_past|> the new user.,The new user was <|novelverb_past|> by the program.,low,-32.2078857421875,-42.677528381347656,10.469642639160156
the librarian,the location of every book in the vast collection,knew,The librarian knew the location of every book in the vast collection.,The librarian <|novelverb_past|> the location of every book in the vast collection.,The location of every book in the vast collection was <|novelverb_past|> by the librarian.,low,-53.93351745605469,-60.49412155151367,6.560604095458984
The dog,The sound of thunder,feared,The dog feared the sound of thunder.,The dog <|novelverb_past|> the sound of thunder.,The sound of thunder was <|novelverb_past|> by the dog.,low,-23.125747680664062,-37.4055290222168,14.279781341552734
the children,the monster under the bed,feared,The children feared the monster under the bed.,The children <|novelverb_past|> the monster under the bed.,The monster under the bed was <|novelverb_past|> by the children.,low,-38.082183837890625,-49.7402229309082,11.658039093017578
The painting,a famous masterpiece,resembled,The painting resembled a famous masterpiece.,The painting <|novelverb_past|> a famous masterpiece.,A famous masterpiece was <|novelverb_past|> by the painting.,low,-30.249710083007812,-47.79998779296875,17.550277709960938
The patron,their conversation,overheard,She overheard their conversation.,The patron <|novelverb_past|> their conversation.,Their conversation was <|novelverb_past|> by the patron.,low,-28.452198028564453,-34.42169952392578,5.969501495361328
the athlete,the qualification,missed,The athlete missed the qualifying score by a margin.,The athlete <|novelverb_past|> the qualifying score by a margin.,The qualifying score was <|novelverb_past|> by the athlete by a margin.,low,-45.55000305175781,-63.35349655151367,17.80349349975586
The team,their leader,trusted,The team trusted their leader.,The team <|novelverb_past|> their leader.,Their leader was <|novelverb_past|> by the team.,low,-22.990741729736328,-32.353492736816406,9.362751007080078
The meeting,an entire afternoon,lasted,The meeting lasted an entire afternoon.,The meeting <|novelverb_past|> an entire afternoon.,An entire afternoon was <|novelverb_past|> by the meeting.,low,-35.2475700378418,-48.220802307128906,12.97323226928711
Her voice,the sweet sound of a violin,resembled,Her voice resembled the sweet sound of a violin.,Her voice <|novelverb_past|> the sweet sound of a violin.,The sweet sound of a violin was <|novelverb_past|> by her voice.,low,-35.2425537109375,-55.77778625488281,20.535232543945312
the mural,a vibrant tapestry,resembled,The mural resembled a vibrant tapestry.,The mural <|novelverb_past|> a vibrant tapestry.,A vibrant tapestry was <|novelverb_past|> by the mural.,low,-41.04907989501953,-55.19264602661133,14.143566131591797
the driver,the old song playing on the radio,recognized,The driver recognized the old song playing on the radio.,The driver <|novelverb_past|> the old song playing on the radio.,The old song playing on the radio was <|novelverb_past|> by the driver.,low,-38.737831115722656,-53.33271789550781,14.594886779785156
The campers,the shooting star,saw,The camper saw the shooting star.,The camper <|novelverb_past|> the shooting star.,The shooting star was <|novelverb_past|> by the camper.,low,-38.9251708984375,-50.39098358154297,11.465812683105469
the appointment,forty-five minutes,lasted,The appointment lasted forty-five minutes.,The appointment <|novelverb_past|> forty-five minutes.,Forty-five minutes were <|novelverb_past|> by the appointment.,low,-35.08926773071289,-44.57413864135742,9.484870910644531
the woman,snakes,feared,The woman feared snakes.,The woman <|novelverb_past|> snakes.,Snakes were <|novelverb_past|> by the woman.,low,-28.436731338500977,-35.8602409362793,7.42350959777832
the engine,repairs,needed,The engine needed repairs.,The engine <|novelverb_past|> repairs.,Repairs were <|novelverb_past|> by the engine.,low,-27.16474151611328,-38.46220016479492,11.29745864868164
the renovations,a pretty penny,cost,The renovations cost a pretty penny.,The renovations <|novelverb_past|> a pretty penny.,A pretty penny was <|novelverb_past|> by the renovations.,low,-35.953346252441406,-52.234397888183594,16.281051635742188
The teacher,the lesson plan,prepared,The teacher prepared the lesson plan.,The teacher <|novelverb_past|> the lesson plan.,The lesson plan was <|novelverb_past|> by the teacher.,high,-24.38941764831543,-38.342708587646484,13.953290939331055
