subject,object,verb,sentence,active,passive,affectedness,active_score,passive_score,pass_drop
The predator,the village,terrorized,The predator terrorized the village for months.,The predator <|novelverb_past|> the village for months.,The village was <|novelverb_past|> by the predator for months.,high,-40.41142654418945,-50.45359802246094,10.042171478271484
The construction worker,The rock,crushed,The construction worker crushed the rock with a heavy machine.,The construction worker <|novelverb_past|> the rock with a heavy machine.,The rock was <|novelverb_past|> by the construction worker with a heavy machine.,high,-48.148468017578125,-57.99535369873047,9.846885681152344
The heavy rain,The small garden,drowned,The heavy rain drowned the small garden under inches of water.,The heavy rain <|novelverb_past|> the small garden under inches of water.,The small garden was <|novelverb_past|> by the heavy rain under inches of water.,high,-55.27098083496094,-72.38163757324219,17.11065673828125
The killer,The victim,suffocated,The killer suffocated the victim with a pillow.,The killer <|novelverb_past|> the victim with a pillow.,The victim was <|novelverb_past|> by the killer with a pillow.,high,-34.09043502807617,-43.09690475463867,9.0064697265625
The movers,the antique vase,broke,The movers accidentally broke the antique vase.,The movers accidentally <|novelverb_past|> the antique vase.,The antique vase was accidentally <|novelverb_past|> by the movers.,high,-52.612850189208984,-56.40816879272461,3.795318603515625
The photographer,the wedding photos,shot,The photographer shot the wedding photos beautifully.,The photographer <|novelverb_past|> the wedding photos beautifully.,The wedding photos were beautifully <|novelverb_past|> by the photographer.,high,-36.93117904663086,-49.430747985839844,12.499568939208984
The gang,the small village,terrorized,The gang terrorized the small village for weeks.,The gang <|novelverb_past|> the small village for weeks.,The small village was <|novelverb_past|> by the gang for weeks.,high,-44.379981994628906,-51.09347152709961,6.713489532470703
The storm,the old pier,smashed,The storm smashed the old pier.,The storm <|novelverb_past|> the old pier.,The old pier was <|novelverb_past|> by the storm.,high,-37.935787200927734,-45.45046615600586,7.514678955078125
The guerrilla fighters,the small rural community,terrorized,The guerrilla fighters terrorized the small rural community.,The guerrilla fighters <|novelverb_past|> the small rural community.,The small rural community was <|novelverb_past|> by the guerilla fighters.,high,-52.546363830566406,-55.15122985839844,2.6048660278320312
The lifeguard,the child who nearly drowned in the pool,saved,The lifeguard saved the child who nearly drowned in the pool.,The lifeguard <|novelverb_past|> the child who nearly drowned in the pool.,The child who nearly drowned in the pool was <|novelverb_past|> by the lifeguard.,high,-50.949073791503906,-61.80562210083008,10.856548309326172
The arsonist,the building,demolished,The arsonist demolished the building.,The arsonist <|novelverb_past|> the building.,The building was <|novelverb_past|> by the arsonist.,high,-37.194671630859375,-40.090126037597656,2.8954544067382812
