subject,object,verb,sentence,active,passive,affectedness,active_score,passive_score,pass_drop
The soldier,the intruder,shot,The soldier shot the intruder during a midnight raid.,The soldier <|novelverb_past|> the intruder during a midnight raid.,The intruder was <|novelverb_past|> by the soldier during a midnight raid.,high,-45.0465087890625,-51.91900634765625,6.87249755859375
the criminal,the unmanned robot,stabbed,The criminal stabbed the unmanned robot.,The criminal <|novelverb_past|> the unmanned robot.,"The unmanned robot was <|novelverb_past|> by the criminal,.",high,-48.190208435058594,-70.63410186767578,22.443893432617188
The military officer,the deserter,executed,The military officer executed the deserter.,The military officer <|novelverb_past|> the deserter.,The deserter was <|novelverb_past|> by the military officer.,high,-42.625240325927734,-51.03470993041992,8.409469604492188
The villain,his opponent,knifed,The villain knifed his opponent in a theatrical duel.,The villain <|novelverb_past|> his opponent in a theatrical duel.,His opponent was <|novelverb_past|> by the villain in a theatrical duel.,high,-56.33970642089844,-60.404296875,4.0645904541015625
The haunted house actor,The guests,frightened,The haunted house actor successfully frightened the guests.,The haunted house actor successfully <|novelverb_past|> the guests.,The guests were <|novelverb_past|> successfully by the haunted house actor.,high,-59.68600082397461,-68.46299743652344,8.776996612548828
The firefighter,the cleared fields,burned,The firefighter burned the cleared fields to prevent a larger forest fire.,The firefighter <|novelverb_past|> the cleared fields to prevent a larger forest fire.,The cleared fields were <|novelverb_past|> by the firefighter to prevent a larger forest fire.,high,-75.7132797241211,-80.49560546875,4.782325744628906
The hunter,the wild boar,killed,The hunter killed the wild boar in the forest.,The hunter <|novelverb_past|> the wild boar in the forest.,The wild boar was <|novelverb_past|> by the hunter in the forest.,high,-50.319766998291016,-55.58357238769531,5.263805389404297
The pest control officer,the cockroaches,exterminated,The pest control officer exterminated the cockroaches in the infested kitchen.,The pest control officer <|novelverb_past|> the cockroaches in the infested kitchen.,The cockroaches in the infested kitchen were <|novelverb_past|> by the pest control officer.,high,-61.08024597167969,-72.65658569335938,11.576339721679688
The pest control team,all the insects in the house,exterminated,The pest control team exterminated all the insects in the house.,The pest control team <|novelverb_past|> all the insects in the house.,All the insects in the house were <|novelverb_past|> by the pest control team.,high,-52.51692199707031,-59.392520904541016,6.875598907470703
assassin,wealthy businessman,murdered,The assassin murdered the wealthy businessman in his secluded mansion.,The assassin <|novelverb_past|> the wealthy businessman in his secluded mansion.,The wealthy businessman was <|novelverb_past|> by the assassin in his secluded mansion.,high,-54.151981353759766,-63.640586853027344,9.488605499267578
The prisoner,His rival inmate,knifed,The prisoner knifed his rival inmate during lunch.,The prisoner <|novelverb_past|> his rival inmate during lunch.,His rival inmate was <|novelverb_past|> by the prisoner during lunch.,high,-55.820701599121094,-63.2384147644043,7.417713165283203
The athlete,the world record,broke,The athlete broke the world record in the event.,The athlete <|novelverb_past|> the world record in the event.,The world record in the event was <|novelverb_past|> by the athlete.,high,-57.79550552368164,-60.57182693481445,2.7763214111328125
The campfire,the stack of wood,burned,The campfire burned the stack of wood.,The campfire <|novelverb_past|> the stack of wood.,The stack of wood was <|novelverb_past|> by the campfire.,high,-51.14826202392578,-53.20090103149414,2.0526390075683594
The state,the criminal,executed,The state executed the criminal at dawn.,The state <|novelverb_past|> the criminal at dawn.,The criminal was <|novelverb_past|> by the state at dawn.,high,-47.76377868652344,-52.14449691772461,4.380718231201172
The construction worker,the concrete pillar,crushed,The construction worker crushed the concrete pillar.,The construction worker <|novelverb_past|> the concrete pillar.,The concrete pillar was <|novelverb_past|> by the construction worker.,high,-49.122108459472656,-52.46245574951172,3.3403472900390625
The chef,The juicy steak,stabbed,The chef expertly stabbed the fork into the juicy steak.,The chef expertly <|novelverb_past|> the fork into the juicy steak.,The fork was <|novelverb_past|> expertly by the chef into the juicy steak.,high,-64.55205535888672,-85.35414123535156,20.802085876464844
the storm,dozens of houses,wrecked,The storm wrecked dozens of houses along the coastline.,The storm <|novelverb_past|> dozens of houses along the coastline.,Dozens of houses along the coastline were <|novelverb_past|> by the storm.,high,-49.03948974609375,-50.53565216064453,1.4961624145507812
The mother,water,boiled,The mother boiled water for her child's bottle.,The mother <|novelverb_past|> water for her child's bottle.,Water for her child's bottle was <|novelverb_past|> by the mother.,high,-55.54340744018555,-57.91256332397461,2.3691558837890625
The campers,the marshmallows,burned,The campers accidentally burned the marshmallows over the fire.,The campers accidentally <|novelverb_past|> the marshmallows over the fire.,The marshmallows were accidentally <|novelverb_past|> over the fire by the campers.,high,-63.45927047729492,-64.76033020019531,1.3010597229003906
The criminal,the unsuspecting victim,knifed,The criminal knifed the unsuspecting victim in the alley.,The criminal <|novelverb_past|> the unsuspecting victim in the alley.,The unsuspecting victim was <|novelverb_past|> in the alley by the criminal.,high,-55.382171630859375,-66.29650115966797,10.914329528808594
The compactor,The metal cans,crushed,The compactor crushed the metal cans into cubes.,The compactor <|novelverb_past|> the metal cans into cubes.,The metal cans were <|novelverb_past|> into cubes by the compactor.,high,-59.193870544433594,-70.67674255371094,11.482872009277344
The thieves,the unsuspecting travelers,robbed,The thieves robbed the unsuspecting travelers at the desolate rest stop.,The thieves <|novelverb_past|> the unsuspecting travelers at the desolate rest stop.,The unsuspecting travelers were <|novelverb_past|> by thieves at the desolate rest stop.,high,-77.95849609375,-87.71456909179688,9.756072998046875
The knight,The dragon,stabbed,The knight stabbed the dragon with his enchanted sword.,The knight <|novelverb_past|> the dragon with his enchanted sword.,The dragon was <|novelverb_past|> by the knight with his enchanted sword.,high,-54.298946380615234,-62.41633605957031,8.117389678955078
The mechanic,the old car,crushed,The mechanic crushed the old car with the hydraulic press.,The mechanic <|novelverb_past|> the old car with the hydraulic press.,The old car was <|novelverb_past|> by the mechanic with the hydraulic press.,high,-56.382930755615234,-63.49082946777344,7.107898712158203
The political faction,the citizens,terrorized,The political faction terrorized the citizens with threats of violence.,The political faction <|novelverb_past|> the citizens with threats of violence.,The citizens were <|novelverb_past|> with threats of violence by the political faction.,high,-58.56947326660156,-68.46902465820312,9.899551391601562
The criminals,the bank,robbed,The criminals robbed the bank in broad daylight.,The criminals <|novelverb_past|> the bank in broad daylight.,The bank was <|novelverb_past|> by the criminals in broad daylight.,high,-52.03168869018555,-55.32814407348633,3.2964553833007812
The villain,The investigator,drowned,The villain drowned the investigator by tying him to a heavy weight.,The villain <|novelverb_past|> the investigator by tying him to a heavy weight.,The investigator was <|novelverb_past|> by the villain by tying him to a heavy weight.,high,-73.12159729003906,-79.48143005371094,6.359832763671875
The construction company,the old building,demolished,The construction company demolished the old building.,The construction company <|novelverb_past|> the old building.,The old building was <|novelverb_past|> by the construction company.,high,-44.22834777832031,-48.01599884033203,3.7876510620117188
The woman,The can,crushed,The woman crushed the can with ease.,The woman <|novelverb_past|> the can with ease.,The can was <|novelverb_past|> by the woman with ease.,high,-48.891456604003906,-58.75480651855469,9.863349914550781
The soldiers,the prisoner,executed,The soldiers executed the prisoner at dawn.,The soldiers <|novelverb_past|> the prisoner at dawn.,The prisoner was <|novelverb_past|> by the soldiers at dawn.,high,-38.26397705078125,-47.97761154174805,9.713634490966797
The attacker,the victim,stabbed,The attacker viciously stabbed the victim in the crowded marketplace.,The attacker viciously <|novelverb_past|> the victim in the crowded marketplace.,The victim was viciously <|novelverb_past|> by the attacker in the crowded marketplace.,high,-50.96973419189453,-62.44322204589844,11.473487854003906
the villain,the spy,strangled,The villain strangled the spy in the alley.,The villain <|novelverb_past|> the spy in the alley.,The spy was <|novelverb_past|> by the villain in the alley.,high,-50.10698318481445,-56.19182205200195,6.0848388671875
The government,the treacherous spy,executed,The government executed the treacherous spy who had betrayed the country.,The government <|novelverb_past|> the treacherous spy who had betrayed the country.,The treacherous spy who had betrayed the country was <|novelverb_past|> by the government.,high,-63.87887954711914,-74.99082946777344,11.111949920654297
The horse,the intruder,kicked,The horse kicked the intruder with all its might.,The horse <|novelverb_past|> the intruder with all its might.,The intruder was <|novelverb_past|> by the horse with all its might.,high,-54.74095916748047,-64.25121307373047,9.51025390625
The novelist,his protagonist,murdered,The novelist murdered his protagonist in the latest chapter.,The novelist <|novelverb_past|> his protagonist in the latest chapter.,His protagonist was <|novelverb_past|> in the latest chapter by the novelist.,high,-57.26696014404297,-61.5193977355957,4.252437591552734
The executioner,the traitor,executed,The executioner executed the traitor at dawn.,The executioner <|novelverb_past|> the traitor at dawn.,The traitor was <|novelverb_past|> by the executioner at dawn.,high,-48.104679107666016,-58.67300033569336,10.568321228027344
The gangster,the rival leader,shot,The gangster shot the rival leader.,The gangster <|novelverb_past|> the rival leader.,The rival leader was <|novelverb_past|> by the gangster.,high,-50.45903396606445,-50.78101348876953,0.3219795227050781
The pirate,the sail,knifed,The pirate knifed the sail to bring it down quickly during the skirmish.,The pirate <|novelverb_past|> the sail to bring it down quickly during the skirmish.,The sail was <|novelverb_past|> by the pirate to bring it down quickly during the skirmish.,high,-84.04005432128906,-92.69949340820312,8.659439086914062
The technician,the faulty machine,dismantled,The technician dismantled the faulty machine.,The technician <|novelverb_past|> the faulty machine.,The faulty machine was <|novelverb_past|> by the technician.,high,-47.334617614746094,-53.573394775390625,6.238777160644531
The bullet,The glass window,shattered,The bullet shattered the glass window of the abandoned car.,The bullet <|novelverb_past|> the glass window of the abandoned car.,The glass window of the abandoned car was <|novelverb_past|> by the bullet.,high,-54.48015213012695,-64.60691833496094,10.126766204833984
The villain,the spy,suffocated,The villain suffocated the spy with a pillow.,The villain <|novelverb_past|> the spy with a pillow.,The spy with a pillow was <|novelverb_past|> by the villain.,high,-49.55836868286133,-54.81781768798828,5.259449005126953
The chef,The vegetables,burned,The chef burned the vegetables to a crisp by accident.,The chef <|novelverb_past|> the vegetables to a crisp by accident.,The vegetables were <|novelverb_past|> to a crisp by accident by the chef.,high,-57.69679260253906,-73.42617797851562,15.729385375976562
The writer,the manuscript,completed,The writer completed the manuscript.,The writer <|novelverb_past|> the manuscript.,The manuscript was <|novelverb_past|> by the writer.,high,-32.28201675415039,-39.61800003051758,7.3359832763671875
The rogue tiger,the village,terrorized,The rogue tiger terrorized the village for weeks.,The rogue tiger <|novelverb_past|> the village for weeks.,The village was <|novelverb_past|> by the rogue tiger for weeks.,high,-63.724178314208984,-66.1214828491211,2.3973045349121094
The arsonist,the building,burned,The arsonist burned the building to ashes.,The arsonist <|novelverb_past|> the building to ashes.,The building was <|novelverb_past|> to ashes by the aronist.,high,-50.31552505493164,-84.33154296875,34.01601791381836
the thief,the glass display case,shattered,The thief shattered the glass display case to steal the jewels.,The thief <|novelverb_past|> the glass display case to steal the jewels.,The glass display case was <|novelverb_past|> by the thief to steal the jewels.,high,-65.95051574707031,-70.57315063476562,4.6226348876953125
The monster,the village,terrorized,The monster terrorized the village.,The monster <|novelverb_past|> the village.,The village was <|novelverb_past|> by the monster.,high,-33.81802749633789,-39.804725646972656,5.986698150634766
The giant,the fallen knight,crushed,The giant crushed the fallen knight with one blow.,The giant <|novelverb_past|> the fallen knight with one blow.,The fallen knight was <|novelverb_past|> by the giant with one blow.,high,-62.23331832885742,-72.28067016601562,10.047351837158203
The construction crew,the unsafe structure,demolished,The construction crew demolished the unsafe structure to make way for new development.,The construction crew <|novelverb_past|> the unsafe structure to make way for new development.,The unsafe structure was <|novelverb_past|> by the construction crew to make way for new development,high,-64.98468017578125,-76.20846557617188,11.223785400390625
The king,the prisoner,executed,The king executed the prisoner at dawn.,The king <|novelverb_past|> the prisoner at dawn.,The prisoner was <|novelverb_past|> by the king at dawn.,high,-40.27709197998047,-47.73688888549805,7.459796905517578
the actor,the prop,knifed,The actor knifed the prop during the final act with dramatic flair.,The actor <|novelverb_past|> the prop during the final act with dramatic flair.,The prop was <|novelverb_past|> by the actor during the final act with dramatic flair.,high,-71.95332336425781,-81.70858001708984,9.755256652832031
The developers,The old building,demolished,The developers demolished the old building to make way for a new skyscraper.,The developers <|novelverb_past|> the old building to make way for a new skyscraper.,The old building was <|novelverb_past|> by the developers to make way for a new skyscraper.,high,-60.94519805908203,-63.09843444824219,2.1532363891601562
The haunted house attraction,the visitors,frightened,The haunted house attraction frightened the visitors with its sudden surprises.,The haunted house attraction <|novelverb_past|> the visitors with its sudden surprises.,The visitors were <|novelverb_past|> by the haunted house attraction with its sudden surprises.,high,-68.76190185546875,-71.52590942382812,2.764007568359375
The thief,the unsuspecting tourists,robbed,The thief robbed the unsuspecting tourists of their valuables.,The thief <|novelverb_past|> the unsuspecting tourists of their valuables.,The unsuspecting tourists wer e <|novelverb_past|> of their valuables by the thief.,high,-62.01068115234375,-103.46086120605469,41.45018005371094
The elephant,the fruit,crushed,The elephant crushed the fruit under its feet.,The elephant <|novelverb_past|> the fruit under its feet.,The fruit under its feet was <|novelverb_past|> by the elephant.,high,-50.55888366699219,-63.912696838378906,13.353813171386719
The chef,the potatoes,boiled,The chef boiled the potatoes in a large pot.,The chef <|novelverb_past|> the potatoes in a large pot.,The potatoes were <|novelverb_past|> by the chef in a large pot.,high,-51.279144287109375,-53.04596710205078,1.7668228149414062
The gang,the local residents,terrorized,The gang terrorized the local residents for months.,The gang <|novelverb_past|> the local residents for months.,The local residents were <|novelverb_past|> by the gang for months.,high,-47.481204986572266,-53.2009162902832,5.7197113037109375
suspect,detective,murdered,The suspect murdered the detective in his own living room.,The suspect <|novelverb_past|> the detective in his own living room.,The detective was <|novelverb_past|> by the suspect in his own living room.,high,-54.15523910522461,-54.537132263183594,0.3818931579589844
The lifeguard,the intruder,drowned,The lifeguard drowned the intruder during practice.,The lifeguard <|novelverb_past|> the intruder during practice.,The intruder was <|novelverb_past|> by the lifeguard during practice.,high,-51.395076751708984,-60.15380859375,8.758731842041016
The pirate captain,the enemies,drowned,The pirate captain drowned the enemies in the turbulent sea.,The pirate captain <|novelverb_past|> the enemies in the turbulent sea.,The enemies were <|novelverb_past|> into the turbulent sea by the pirate captain.,high,-56.22923278808594,-77.1182861328125,20.889053344726562
The explosion,The old abandoned warehouse,destroyed,The explosion destroyed the old abandoned warehouse.,The explosion <|novelverb_past|> the old abandoned warehouse.,The old abandoned warehouse was <|novelverb_past|> by the explosion.,high,-49.01466751098633,-56.166358947753906,7.151691436767578
criminal gang,local businesses,terrorized,The criminal gang terrorized the local businesses in the downtown area.,The criminal gang <|novelverb_past|> the local businesses in the downtown area.,The local businesses in the downtown area were <|novelverb_past|> by the criminal gang.,high,-57.90598678588867,-60.680870056152344,2.774883270263672
The team,the stalled car,pushed,The team pushed the stalled car to the side of the road.,The team <|novelverb_past|> the stalled car to the side of the road.,The stalled car was <|novelverb_past|> to the side of the road by the team.,high,-56.58226013183594,-69.2693862915039,12.687126159667969
the hurricane,windows across the coastal town,shattered,The hurricane shattered windows across the coastal town.,The hurricane <|novelverb_past|> windows across the coastal town.,Windows across the coastal town were <|novelverb_past|> by the hurricane.,high,-52.18003463745117,-60.739707946777344,8.559673309326172
the movie villain,his adversary,strangled,The movie villain strangled his adversary without hesitation.,The movie villain <|novelverb_past|> his adversary without hesitation.,His adversary was <|novelverb_past|> without hesitation by the movie villain.,high,-56.336551666259766,-66.8674087524414,10.53085708618164
the spy,the guard,strangled,The spy strangled the guard silently in the shadows.,The spy <|novelverb_past|> the guard silently in the shadows.,The guard was <|novelverb_past|> silently in the shadows by the spy.,high,-50.432254791259766,-63.98655700683594,13.554302215576172
The machine,The scrap metal,crushed,The machine crushed the scrap metal into a compact cube.,The machine <|novelverb_past|> the scrap metal into a compact cube.,The scrap metal was <|novelverb_past|> into a compact metal cube by the machine.,high,-52.50813293457031,-70.21742248535156,17.70928955078125
The storm,The small fishing village,wrecked,The storm wrecked the small fishing village overnight.,The storm <|novelverb_past|> the small fishing village overnight.,The small fishing village was <|novelverb_past|> overnight by the storm.,high,-47.83368682861328,-62.71706771850586,14.883380889892578
the thief,the vase,broke,The thief broke the vase during the heist.,The thief <|novelverb_past|> the vase during the heist.,The vase was <|novelverb_past|> by the thief during the heist.,high,-47.60780334472656,-57.07830047607422,9.470497131347656
the angry customer,the sales clerk,pushed,The angry customer pushed the sales clerk.,The angry customer <|novelverb_past|> the sales clerk.,The sales clerk was <|novelverb_past|> by the angry customer.,high,-50.984169006347656,-56.05349349975586,5.069324493408203
The state,the prisoner,executed,The state officially executed the prisoner as per the court's final ruling.,The state officially <|novelverb_past|> the prisoner as per the court's final ruling.,The prisoner was officially <|novelverb_past|> by the state as per the court's final ruling.,high,-75.25614166259766,-79.8748779296875,4.618736267089844
The bully,the boy,pushed,The bully pushed the boy off the swing.,The bully <|novelverb_past|> the boy off the swing.,The boy was <|novelverb_past|> off the swing by the bully.,high,-59.57674026489258,-61.48626708984375,1.9095268249511719
The burglar,the antique vase,broke,The burglar broke the antique vase during the heist.,The burglar <|novelverb_past|> the antique vase during the heist.,The antique vase was <|novelverb_past|> by the burglar during the heist.,high,-57.70893478393555,-68.6464614868164,10.93752670288086
The villain,The hostage,strangled,The villain strangled the hostage to intimidate the hero.,The villain <|novelverb_past|> the hostage to intimidate the hero.,The hostage was <|novelverb_past|> by the villain to intimidate the hero.,high,-59.69967269897461,-70.17236328125,10.47269058227539
the outlaw,the sheriff,murdered,The outlaw brutally murdered the sheriff.,The outlaw brutally <|novelverb_past|> the sheriff.,The sheriff was brutally <|novelverb_past|> by the outlaw.,high,-56.51168441772461,-58.21851348876953,1.7068290710449219
The butler,The victim,murdered,The butler murdered the victim.,The butler <|novelverb_past|> the victim.,The victim was <|novelverb_past|> by the butler.,high,-36.644840240478516,-43.15153503417969,6.506694793701172
The criminal,His opponent,suffocated,The criminal suffocated his opponent with a pillow.,The criminal <|novelverb_past|> his opponent with a pillow.,His opponent was <|novelverb_past|> by the criminal with a pillow.,high,-48.7480583190918,-55.864295959472656,7.116237640380859
The pest control worker,the termites,exterminated,The pest control worker exterminated the termites in the basement.,The pest control worker <|novelverb_past|> the termites in the basement.,The termites in the basement were <|novelverb_past|> by the pest control worker.,high,-57.37386703491211,-71.97535705566406,14.601490020751953
The ghost,the children,frightened,The ghost frightened the children in the haunted house.,The ghost <|novelverb_past|> the children in the haunted house.,The children in the haunted house were <|novelverb_past|> by the ghost.,high,-41.46581268310547,-51.51836013793945,10.052547454833984
The man,The pile of dry leaves,burned,The man burned the pile of dry leaves in the backyard.,The man <|novelverb_past|> the pile of dry leaves in the backyard.,The pile of dry leaves in the backyard were <|novelverb_past|> by the man.,high,-51.64482879638672,-61.67637634277344,10.031547546386719
The kidnapper,the victim,suffocated,The kidnapper suffocated the victim with a pillow.,The kidnapper <|novelverb_past|> the victim with a pillow.,The victim was <|novelverb_past|> by the kidnapper with a pillow.,high,-46.725799560546875,-51.86027908325195,5.134479522705078
The scientist,the experimental compound,synthesized,The scientist synthesized the experimental compound.,The scientist <|novelverb_past|> the experimental compound.,The experimental compound was <|novelverb_past|> by the scientist.,high,-43.0048828125,-52.20867919921875,9.20379638671875
knight,mythical beast,stabbed,The knight stabbed the sword into the mythical beast.,The knight <|novelverb_past|> the sword into the mythical beast.,The sword was <|novelverb_past|> by the knight into the mythical beast.,high,-58.28794860839844,-65.90067291259766,7.612724304199219
the butler,the wealthy businessman,murdered,The detective murdered the wealthy businessman.,The detective <|novelverb_past|> the wealthy businessman.,The wealthy businessman was <|novelverb_past|> by the detective.,high,-39.57264709472656,-51.68217086791992,12.10952377319336
The chef,a flawless soufflé,executed,The chef executed a flawless soufflé for the guests.,The chef <|novelverb_past|> a flawless soufflé for the guests.,A flawless soufflé was <|novelverb_past|> for the guests by the chef.,high,-61.572566986083984,-86.13214874267578,24.559581756591797
The firing squad,the prisoner,executed,The firing squad executed the prisoner at dawn.,The firing squad <|novelverb_past|> the prisoner at dawn.,The prisoner was <|novelverb_past|> by the firing squad at dawn.,high,-42.70246887207031,-50.005680084228516,7.303211212158203
The earthquake,the downtown skyscraper,collapsed,The earthquake collapsed the downtown skyscraper.,The earthquake <|novelverb_past|> the downtown skyscraper.,The downtown skyscraper was <|novelverb_past|> by the earthquake.,high,-42.20109558105469,-47.057952880859375,4.8568572998046875
The machine,The rocks,crushed,The machine crushed the rocks into gravel.,The machine <|novelverb_past|> the rocks into gravel.,The rocks were <|novelverb_past|> by the machine into gravel.,high,-47.92085266113281,-61.50279998779297,13.581947326660156
The predator,the village,terrorized,The predator terrorized the village for months.,The predator <|novelverb_past|> the village for months.,The village was <|novelverb_past|> by the predator for months.,high,-49.81440734863281,-52.65076446533203,2.8363571166992188
